1|1|S|MARIANA DE JESUS|1|100|9999|0.0|||3||3|21|1|12/31/1965|DO|1.0|34799.64|34799.64|1||0.0|0.0|0.0|0.0|0.0|0.0|FOBOS|2004-01-01 00:00:00|
1|2|S|ACERO SUR|1|100|9999|0.0|||3||4|21|1|12/31/1970|DO|1.0|4360.73|4360.73|1||0.0|0.0|0.0|0.0|0.0|0.0|FOBOS|2004-01-01 00:00:00|
1|3|V|CARCELEN|1|100|9999|0.0|||3||3|21|1|12/31/1975|DO|1.0|5744.83|5744.83|1|10/13/2010|0.0|0.0|5744.83|0.0|0.0|0.0|FOBOS|2004-01-01 00:00:00|
1|4|S|PRENSA|1|100|9999|0.0|||3||3|21|1|12/31/1980|DO|1.0|19152.49|19152.49|1||0.0|0.0|0.0|0.0|0.0|0.0|FOBOS|2004-01-01 00:00:00|
1|5|D|EDIFICIO GALPON 10 DE AGOSTO|2|201|20|5.0|||3||3|15|198|12/31/1983|DO|1.0|16051.86|16051.86|1||66.88|0.0|16051.86|0.0|0.0|0.0|FOBOS|2004-01-01 00:00:00|
1|6|D|ACERO SUR|2|201|20|5.0|||3||4|15|1|08/31/1987|DO|1.0|20997.82|20997.82|1||87.49|0.0|20997.82|0.0|0.0|0.0|FOBOS|2004-01-01 00:00:00|
1|7|V|BODEGA CARCELEN|2|202|20|5.0|||3||3|15|1|11/30/1987|DO|1.0|43614.57|43614.57|1|10/13/2010|181.73|0.0|43614.57|0.0|0.0|0.0|FOBOS|2004-01-01 00:00:00|
1|8|E|ETERNIT PRENSA|2|201|20|5.0|||3||3|15|1|06/30/1989|DO|1.0|44926.73|44926.73|1|10/13/2010|187.19|0.0|44926.73|0.0|0.0|0.0|FOBOS|2004-01-01 00:00:00|
1|9|S|OFICINA COMPUTACION|2|205|20|5.0|||3||3|15|1|12/31/1991|DO|1.0|19006.37|19006.37|1||79.19|0.0|18055.75|0.0|0.0|0.0|FOBOS|2004-01-01 00:00:00|
1|10|E|INSTALACION MARIANA DE JESUS|3|304|10|10.0|||3||3|16|198|12/31/1993|DO|1.0|618.66|618.66|1|01/08/2008|5.16|0.0|618.66|0.0|0.0|0.0|FOBOS|2004-01-01 00:00:00|
1|11|E|INSTALACION PRENSA|3|304|10|10.0|||3||3|16|198|12/31/1993|DO|1.0|3530.95|3530.95|1|01/08/2008|29.42|0.0|3530.95|0.0|0.0|0.0|FOBOS|2004-01-01 00:00:00|
1|12|E|INSTALACION LOCAL PRINCIPAL|3|304|10|10.0|||3||3|16|198|12/31/1993|DO|1.0|2097.06|2097.06|1|01/08/2008|17.48|0.0|2097.06|0.0|0.0|0.0|FOBOS|2004-01-01 00:00:00|
1|13|E|INSTALACION SUR|3|304|10|10.0|||3||4|16|198|12/31/1993|DO|1.0|2420.83|2420.83|1|01/08/2008|20.17|0.0|2420.83|0.0|0.0|0.0|FOBOS|2004-01-01 00:00:00|
1|14|S|TALLER MAQUINAS|2|203|20|5.0|||3||3|15|1|12/31/1995|DO|1.0|12646.86|12646.86|1||52.7|0.0|9485.6|0.0|0.0|0.0|FOBOS|2004-01-01 00:00:00|
1|15|D|RED COMPUTACION|3|301|10|10.0|||3||3|16|1|10/31/1997|DO|1.0|6902.95|6902.95|1||57.52|0.0|6902.95|0.0|0.0|0.0|FOBOS|2004-01-01 00:00:00|
1|16|V|CAMION GMC|7|701|5|20.0|||3||3|20|198|12/31/1998|DO|1.0|178.95|178.95|1||2.98|0.0|178.95|0.0|0.0|0.0|FOBOS|2004-01-01 00:00:00|
1|17|D|CAMION G.M.C.|7|701|5|20.0|||3||3|20|198|12/31/1998|DO|1.0|179.82|179.82|1||3.0|0.0|179.82|0.0|0.0|0.0|FOBOS|2004-01-01 00:00:00|
1|18|D|CAMIONETA TOYOTA STOUT|7|701|5|20.0|STOUT||3||3|20|198|12/31/1998|DO|1.0|2421.02|2421.02|1||40.35|0.0|2421.02|0.0|0.0|0.0|FOBOS|2004-01-01 00:00:00|
1|19|D|MITSUBISCHI CANTER AZUL|7|701|5|20.0|HD||3||3|20|198|12/31/1998|DO|1.0|3871.21|3871.21|1||64.52|0.0|3871.21|0.0|0.0|0.0|FOBOS|2004-01-01 00:00:00|
1|20|D|CHASIS HINO|7|701|5|20.0|||3||3|20|198|12/31/1998|DO|1.0|9772.39|9772.39|1||162.87|0.0|9772.39|0.0|0.0|0.0|FOBOS|2004-01-01 00:00:00|
1|21|D|MOTO YAMAHA DT175|7|702|5|20.0|||3||3|20|1|12/31/1998|DO|1.0|3364.93|3364.93|1||56.08|0.0|3364.93|0.0|0.0|0.0|FOBOS|2004-01-01 00:00:00|
1|22|D|MOTONETA VESPA|7|702|5|20.0|||3||3|20|1|12/31/1998|DO|1.0|2076.76|2076.76|1||34.61|0.0|2076.76|0.0|0.0|0.0|FOBOS|2004-01-01 00:00:00|
1|23|D|MOTO YAMAHA 125|7|702|5|20.0|125|TS/ES|3||3|20|198|12/31/1998|DO|1.0|1.34|1.34|1||0.02|0.0|1.34|0.0|0.0|0.0|FOBOS|2004-01-01 00:00:00|
1|24|V|MOTO SUZUKI|7|702|5|20.0|||3||3|20|198|12/31/1998|DO|1.0|2.48|2.48|1||0.04|0.0|2.48|0.0|0.0|0.0|FOBOS|2004-01-01 00:00:00|
1|25|D|MOTO SUSUKI|7|702|5|20.0|||3||3|20|198|12/31/1998|DO|1.0|2.48|2.48|1||0.04|0.0|2.48|0.0|0.0|0.0|FOBOS|2004-01-01 00:00:00|
1|26|D|MITSUBISHI 1987|7|702|5|20.0|||3||3|20|198|12/31/1998|DO|1.0|105.86|105.86|1||1.76|0.0|105.86|0.0|0.0|0.0|FOBOS|2004-01-01 00:00:00|
1|27|D|MITSUBISCHI CANTER BLANCO|7|702|5|20.0|||3||3|20|198|12/31/1998|DO|1.0|3895.25|3895.25|1||64.92|0.0|3895.25|0.0|0.0|0.0|FOBOS|2004-01-01 00:00:00|
1|28|V|CHEVROLET TROOPER|7|704|5|20.0|||3||3|20|1|12/31/1998|DO|1.0|13993.54|13993.54|1|12/13/2011|233.23|0.0|13993.54|0.0|0.0|0.0|FOBOS|2004-01-01 00:00:00|
1|29|D|MERCEDES BENZ|7|704|5|20.0|||3||3|20|198|12/31/1998|DO|1.0|155.67|155.67|1||2.59|0.0|155.67|0.0|0.0|0.0|FOBOS|2004-01-01 00:00:00|
1|30|D|CHEVROLET VITARA|7|704|5|20.0|||3||3|20|198|12/31/1998|DO|1.0|3868.57|3868.57|1||64.48|0.0|3868.57|0.0|0.0|0.0|FOBOS|2004-01-01 00:00:00|
1|31|E|COMPUT. MONITOWES|5|501|5|20.0|||3||3|17|1|02/28/1999|DO|1.0|2546.28|2546.28|1|12/31/2010|42.44|0.0|2546.28|0.0|0.0|0.0|FOBOS|2004-01-01 00:00:00|
1|32|E|IMPRESORA FX1170|5|502|5|20.0|||3||3|17|1|03/31/1999|DO|1.0|572.29|572.29|1|12/31/2010|9.54|0.0|572.29|0.0|0.0|0.0|FOBOS|2004-01-01 00:00:00|
1|33|E|COMPUT. GENERICA|5|501|5|20.0|||3||3|17|1|05/31/1999|DO|1.0|766.2|766.2|1|12/31/2010|12.77|0.0|766.2|0.0|0.0|0.0|FOBOS|2004-01-01 00:00:00|
1|34|E|INTELLISERVER|5|504|5|20.0|||3||3|17|1|05/31/1999|DO|1.0|1276.17|1276.17|1|12/31/2010|21.27|0.0|1276.17|0.0|0.0|0.0|FOBOS|2004-01-01 00:00:00|
1|35|E|2 UPS EXIDE|5|509|5|20.0|||3||3|17|1|05/31/1999|DO|1.0|2436.12|2436.12|1|12/31/2010|40.6|0.0|2436.12|0.0|0.0|0.0|FOBOS|2004-01-01 00:00:00|
1|36|E|IMPRES. HEWLETT|5|502|5|20.0|||3||3|17|1|06/30/1999|DO|1.0|486.3|486.3|1|12/31/2010|8.11|0.0|486.3|0.0|0.0|0.0|FOBOS|2004-01-01 00:00:00|
1|37|E|IMPRESORA HP. DESK|5|502|5|20.0|||3||3|17|1|06/30/1999|DO|1.0|252.56|252.56|1|12/31/2010|4.21|0.0|252.56|0.0|0.0|0.0|FOBOS|2004-01-01 00:00:00|
1|38|E|MONITOR LE ES ASSET|5|503|5|20.0|||3||3|17|1|06/30/1999|DO|1.0|1270.99|1270.99|1|12/31/2010|21.18|0.0|1270.99|0.0|0.0|0.0|FOBOS|2004-01-01 00:00:00|
1|39|E|COMPUT. IBM PC 300GL|5|501|5|20.0|||3||3|17|1|08/31/1999|DO|1.0|1502.32|1502.32|1|01/08/2008|25.04|0.0|1502.32|0.0|0.0|0.0|FOBOS|2004-01-01 00:00:00|
1|40|E|IMPRESORA LEXMARK|5|502|5|20.0|||3||3|17|1|08/31/1999|DO|1.0|504.51|504.51|1|12/31/2010|8.41|0.0|504.51|0.0|0.0|0.0|FOBOS|2004-01-01 00:00:00|
1|41|E|TERMINAL WYSE|5|501|5|20.0|||3||3|17|1|09/30/1999|DO|1.0|240.65|240.65|1|12/31/2010|4.01|0.0|240.65|0.0|0.0|0.0|FOBOS|2004-01-01 00:00:00|
1|42|E|TERMINAL WYSE 150|5|501|5|20.0|||3||3|17|1|09/30/1999|DO|1.0|187.18|187.18|1|01/08/2008|3.12|0.0|187.18|0.0|0.0|0.0|FOBOS|2004-01-01 00:00:00|
1|43|E|INSULATION TESTER|5|510|5|20.0|||3||3|17|1|10/31/1999|DO|1.0|261.11|261.11|1|12/31/2010|4.35|0.0|261.11|0.0|0.0|0.0|FOBOS|2004-01-01 00:00:00|
1|44|E|COMPUTONE INTELINK|5|504|5|20.0|||3||3|17|1|11/30/1999|DO|1.0|598.0|598.0|1|12/31/2010|9.97|0.0|598.0|0.0|0.0|0.0|FOBOS|2004-01-01 00:00:00|
1|45|E|GRAND VITARA|7|704|5|20.0|||3||3|20|1|11/30/1999|DO|1.0|23398.99|23398.99|1|03/31/2010|389.98|0.0|23398.99|0.0|0.0|0.0|FOBOS|2004-01-01 00:00:00|
1|46|E|COMPUTAD.COMPAQ DESK|5|501|5|20.0|||3||3|17|1|01/31/2000|DO|1.0|1425.0|1425.0|1|12/31/2010|23.75|0.0|1425.0|0.0|0.0|0.0|FOBOS|2004-01-01 00:00:00|
1|47|E|IMPRESORA EPSON LQ207|5|502|5|20.0|||3||3|17|1|01/31/2000|DO|1.0|136.6|136.6|1|12/31/2010|2.28|0.0|136.6|0.0|0.0|0.0|FOBOS|2004-01-01 00:00:00|
1|48|E|IMPRESORA EPSON LX-300|5|502|5|20.0|||3||3|17|1|01/31/2000|DO|1.0|44.34|44.34|1|12/31/2010|0.74|0.0|44.34|0.0|0.0|0.0|FOBOS|2004-01-01 00:00:00|
1|49|E|MONITOR VIEW SONIC|5|503|5|20.0|||3||3|17|1|01/31/2000|DO|1.0|219.0|219.0|1|01/08/2008|3.65|0.0|219.0|0.0|0.0|0.0|FOBOS|2004-01-01 00:00:00|
1|50|D|SISTEMA DE ALARMAS|3|308|10|10.0|||3||3|16|1|03/31/2000|DO|1.0|786.25|786.25|1||6.55|0.0|786.25|0.0|0.0|0.0|FOBOS|2004-01-01 00:00:00|
1|51|E|COMPUT. COMPAQ PROLIANT|5|501|5|20.0|||3||3|17|1|05/31/2000|DO|1.0|3308.0|3308.0|1|12/31/2010|55.13|0.0|3308.0|0.0|0.0|0.0|FOBOS|2004-01-01 00:00:00|
1|52|E|MONITOR VIEW|5|503|5|20.0|||3||3|17|1|06/30/2000|DO|1.0|305.0|305.0|1|12/31/2010|5.08|0.0|305.0|0.0|0.0|0.0|FOBOS|2004-01-01 00:00:00|
1|53|E|COMPUT AOPEN PIII 600MHZ|5|501|5|20.0|||3||3|17|1|08/31/2000|DO|1.0|1206.0|1206.0|1|12/31/2010|20.1|0.0|1206.0|0.0|0.0|0.0|FOBOS|2004-01-01 00:00:00|
1|54|E|IMPRESORA EPSON|5|502|5|20.0|||3||3|17|1|09/30/2000|DO|1.0|125.0|125.0|1|01/08/2008|2.08|0.0|125.0|0.0|0.0|0.0|FOBOS|2004-01-01 00:00:00|
1|55|E|MONITOR 15 PULG  VIEW|5|503|5|20.0|||3||3|17|1|09/30/2000|DO|1.0|207.0|207.0|1|12/31/2010|3.45|0.0|207.0|0.0|0.0|0.0|FOBOS|2004-01-01 00:00:00|
1|56|E|SISTEMA ADMINISTRAT.|5|505|5|20.0|||3||3|17|1|09/30/2000|DO|1.0|500.0|500.0|1|12/31/2010|8.33|0.0|500.0|0.0|0.0|0.0|FOBOS|2004-01-01 00:00:00|
1|57|E|UPS TRIPP LITE|5|509|5|20.0|||3||3|17|1|09/30/2000|DO|1.0|589.68|589.68|1|01/08/2008|9.83|0.0|589.68|0.0|0.0|0.0|FOBOS|2004-01-01 00:00:00|
1|58|E|COMPUTADOR COMPAQ|5|501|5|20.0|||3||3|17|1|10/31/2000|DO|1.0|1674.0|1674.0|1|12/31/2010|27.9|0.0|1674.0|0.0|0.0|0.0|FOBOS|2004-01-01 00:00:00|
1|59|E|IMPRESORA EPSON S|5|502|5|20.0|||3||3|17|1|10/31/2000|DO|1.0|75.0|75.0|1|01/08/2008|1.25|0.0|75.0|0.0|0.0|0.0|FOBOS|2004-01-01 00:00:00|
1|60|E|2 HUB 3COM OFFICE|5|504|5|20.0|||3||3|17|1|10/31/2000|DO|1.0|660.0|660.0|1|12/31/2010|11.0|0.0|660.0|0.0|0.0|0.0|FOBOS|2004-01-01 00:00:00|
1|61|E|UPS POWERWARE 912|5|509|5|20.0|||3||3|17|1|10/31/2000|DO|1.0|1224.0|1224.0|1|12/31/2010|20.4|0.0|1224.0|0.0|0.0|0.0|FOBOS|2004-01-01 00:00:00|
1|62|E|INTELLICUSTER 16 PUERTOS|5|504|5|20.0|||3||3|17|1|11/30/2000|DO|1.0|800.0|800.0|1|12/31/2010|13.33|0.0|800.0|0.0|0.0|0.0|FOBOS|2004-01-01 00:00:00|
1|63|E|MESA COMPUT. CPU|4|401|10|10.0|||3||3|19|1|12/31/2000|DO|1.0|24.97|24.97|1|01/08/2008|0.21|0.0|24.97|0.0|0.0|0.0|FOBOS|2004-01-01 00:00:00|
1|64|E|ESTAC. TRABAJO GERENT|4|401|10|10.0|||3||3|19|1|12/31/2000|DO|1.0|141.23|141.23|1|01/08/2008|1.18|0.0|141.23|0.0|0.0|0.0|FOBOS|2004-01-01 00:00:00|
1|65|E|SILLON GERENTE|4|401|10|10.0|||3||3|19|1|12/31/2000|DO|1.0|179.13|179.13|1|01/08/2008|1.49|0.0|179.13|0.0|0.0|0.0|FOBOS|2004-01-01 00:00:00|
1|66|E|7 MUEBLES TELEX|4|401|10|10.0|||3||3|19|1|12/31/2000|DO|1.0|656.82|656.82|1|01/08/2008|5.47|0.0|656.82|0.0|0.0|0.0|FOBOS|2004-01-01 00:00:00|
1|67|E|MUEBLE PARA IMPRESOR|4|401|10|10.0|||3||3|19|1|12/31/2000|DO|1.0|13.08|13.08|1|01/08/2008|0.11|0.0|13.08|0.0|0.0|0.0|FOBOS|2004-01-01 00:00:00|
1|68|E|12 SILLAS HOSPITAL|4|401|10|10.0|||3||3|19|1|12/31/2000|DO|1.0|394.29|394.29|1|01/08/2008|3.29|0.0|394.29|0.0|0.0|0.0|FOBOS|2004-01-01 00:00:00|
1|69|E|SILLA SST JSA No. 24|4|401|10|10.0|||3||3|19|1|12/31/2000|DO|1.0|18.03|18.03|1|01/08/2008|0.15|0.0|18.03|0.0|0.0|0.0|FOBOS|2004-01-01 00:00:00|
1|70|E|ESCRIT.SILLON-SIL|4|401|10|10.0|||3||3|19|1|12/31/2000|DO|1.0|749.0|749.0|1|01/08/2008|6.24|0.0|749.0|0.0|0.0|0.0|FOBOS|2004-01-01 00:00:00|
1|71|E|SILLON GERENTE|4|401|10|10.0|||3||3|19|1|12/31/2000|DO|1.0|408.42|408.42|1|01/08/2008|3.4|0.0|408.42|0.0|0.0|0.0|FOBOS|2004-01-01 00:00:00|
1|72|E|ESCRITORIO GERENTE|4|401|10|10.0|||3||3|19|1|12/31/2000|DO|1.0|272.9|272.9|1|01/08/2008|2.27|0.0|272.9|0.0|0.0|0.0|FOBOS|2004-01-01 00:00:00|
1|73|E|3 ESTAC. TRABAJO SECR.|4|402|10|10.0|||3||3|19|1|12/31/2000|DO|1.0|196.71|196.71|1|01/08/2008|1.64|0.0|196.71|0.0|0.0|0.0|FOBOS|2004-01-01 00:00:00|
1|74|E|4 SILLAS SECRETARIA|4|402|10|10.0|||3||3|19|1|12/31/2000|DO|1.0|496.3|496.3|1|01/08/2008|4.14|0.0|496.3|0.0|0.0|0.0|FOBOS|2004-01-01 00:00:00|
1|75|E|4 SILLAS ESPERA|4|402|10|10.0|||3||3|19|1|12/31/2000|DO|1.0|285.37|285.37|1|01/08/2008|2.38|0.0|285.37|0.0|0.0|0.0|FOBOS|2004-01-01 00:00:00|
1|76|E|2 SILLAS SECRETARIA|4|402|10|10.0|||3||3|19|1|12/31/2000|DO|1.0|23.09|23.09|1|01/08/2008|0.19|0.0|23.09|0.0|0.0|0.0|FOBOS|2004-01-01 00:00:00|
1|77|E|ESCRITORIO EJECT. F1601|4|402|10|10.0|||3||3|19|1|12/31/2000|DO|1.0|30.35|30.35|1|01/08/2008|0.25|0.0|30.35|0.0|0.0|0.0|FOBOS|2004-01-01 00:00:00|
1|78|E|SILLON ARISTA|4|402|10|10.0|||3||3|19|1|12/31/2000|DO|1.0|371.76|371.76|1|01/08/2008|3.1|0.0|371.76|0.0|0.0|0.0|FOBOS|2004-01-01 00:00:00|
1|79|E|CENTRAL TELEF.|4|405|10|10.0|||3||3|19|1|12/31/2000|DO|1.0|13303.1|13303.1|1|12/31/2010|110.86|0.0|13303.1|0.0|0.0|0.0|FOBOS|2004-01-01 00:00:00|
1|80|E|2 LINEAS TELF. CEL|4|405|10|10.0|||3||3|19|1|12/31/2000|DO|1.0|835.36|835.36|1|12/31/2010|6.96|0.0|835.36|0.0|0.0|0.0|FOBOS|2004-01-01 00:00:00|
1|81|E|TELEF. CELULAR|4|405|10|10.0|||3||3|19|1|12/31/2000|DO|1.0|168.59|168.59|1|12/31/2010|1.4|0.0|168.59|0.0|0.0|0.0|FOBOS|2004-01-01 00:00:00|
1|82|E|TELEF. MULTILINEA|4|405|10|10.0|||3||3|19|1|12/31/2000|DO|1.0|172.36|172.36|1|12/31/2010|1.44|0.0|172.36|0.0|0.0|0.0|FOBOS|2004-01-01 00:00:00|
1|83|E|TELF: 562987/563012|4|405|10|10.0|||3||3|19|1|12/31/2000|DO|1.0|529.89|529.89|1|12/31/2010|4.42|0.0|529.89|0.0|0.0|0.0|FOBOS|2004-01-01 00:00:00|
1|84|E|TELEPORT|4|405|10|10.0|||3||3|19|1|12/31/2000|DO|1.0|700.0|700.0|1|12/31/2010|5.83|0.0|700.0|0.0|0.0|0.0|FOBOS|2004-01-01 00:00:00|
1|85|E|FAX PANASONIC|4|405|10|10.0|||3||3|19|1|12/31/2000|DO|1.0|211.0|211.0|1|12/31/2010|1.76|0.0|211.0|0.0|0.0|0.0|FOBOS|2004-01-01 00:00:00|
1|86|E|MAQ. CASIO SFR-107|4|406|10|10.0|||3||3|19|1|12/31/2000|DO|1.0|11.54|11.54|1|01/08/2008|0.1|0.0|11.54|0.0|0.0|0.0|FOBOS|2004-01-01 00:00:00|
1|87|E|MAQ. CASIO 120|4|406|10|10.0|||3||3|19|1|12/31/2000|DO|1.0|15.58|15.58|1|01/08/2008|0.13|0.0|15.58|0.0|0.0|0.0|FOBOS|2004-01-01 00:00:00|
1|88|E|MAQ. MONROE S.289731|4|406|10|10.0|||3||3|19|1|12/31/2000|DO|1.0|21.29|21.29|1|01/08/2008|0.18|0.0|21.29|0.0|0.0|0.0|FOBOS|2004-01-01 00:00:00|
1|89|E|MAQ. MONROE S.289732|4|406|10|10.0|||3||3|19|1|12/31/2000|DO|1.0|21.29|21.29|1|01/08/2008|0.18|0.0|21.29|0.0|0.0|0.0|FOBOS|2004-01-01 00:00:00|
1|90|E|MAQ. MONROE V.191437|4|406|10|10.0|||3||3|19|1|12/31/2000|DO|1.0|20.04|20.04|1|01/08/2008|0.17|0.0|20.04|0.0|0.0|0.0|FOBOS|2004-01-01 00:00:00|
1|91|E|MAQ. MONROE SJ801697|4|406|10|10.0|||3||3|19|1|12/31/2000|DO|1.0|28.38|28.38|1|01/08/2008|0.24|0.0|28.38|0.0|0.0|0.0|FOBOS|2004-01-01 00:00:00|
1|92|E|7 MAQ. CASIO|4|406|10|10.0|||3||3|19|1|12/31/2000|DO|1.0|1204.3|1204.3|1|01/08/2008|10.04|0.0|1204.3|0.0|0.0|0.0|FOBOS|2004-01-01 00:00:00|
1|93|E|MAQ. MONROE V466|4|406|10|10.0|||3||3|19|1|12/31/2000|DO|1.0|18.52|18.52|1|01/08/2008|0.15|0.0|18.52|0.0|0.0|0.0|FOBOS|2004-01-01 00:00:00|
1|94|E|MAQ. FACIT MODC340|4|406|10|10.0|||3||3|19|1|12/31/2000|DO|1.0|34.32|34.32|1|01/08/2008|0.29|0.0|34.32|0.0|0.0|0.0|FOBOS|2004-01-01 00:00:00|
1|95|E|MAQ. ELECTRONICA|4|406|10|10.0|||3||3|19|1|12/31/2000|DO|1.0|707.13|707.13|1|01/08/2008|5.89|0.0|707.13|0.0|0.0|0.0|FOBOS|2004-01-01 00:00:00|
1|96|E|MAQUINA IBM|4|406|10|10.0|||3||3|19|1|12/31/2000|DO|1.0|607.77|607.77|1|01/08/2008|5.06|0.0|607.77|0.0|0.0|0.0|FOBOS|2004-01-01 00:00:00|
1|97|E|MAQUINA CASIO|4|406|10|10.0|||3||3|19|1|12/31/2000|DO|1.0|12.95|12.95|1|01/08/2008|0.11|0.0|12.95|0.0|0.0|0.0|FOBOS|2004-01-01 00:00:00|
1|98|E|MAQUINA COPIADORA|4|406|10|10.0|||3||3|19|1|12/31/2000|DO|1.0|3256.86|3256.86|1|12/31/2010|27.14|0.0|3256.86|0.0|0.0|0.0|FOBOS|2004-01-01 00:00:00|
1|99|E|COPIADORA-RICOH|4|406|10|10.0|||3||3|19|1|12/31/2000|DO|1.0|1617.39|1617.39|1|12/31/2010|13.48|0.0|1617.39|0.0|0.0|0.0|FOBOS|2004-01-01 00:00:00|
1|100|E|VENTILADO. EXTRACT|4|406|10|10.0|||3||3|19|1|12/31/2000|DO|1.0|691.14|691.14|1|12/31/2010|5.76|0.0|691.14|0.0|0.0|0.0|FOBOS|2004-01-01 00:00:00|
1|101|E|CALCULADORA CASIO|4|407|10|10.0|||3||3|19|1|12/31/2000|DO|1.0|14.78|14.78|1|01/08/2008|0.12|0.0|14.78|0.0|0.0|0.0|FOBOS|2004-01-01 00:00:00|
1|102|E|CALCULAD.CASIO DL-22|4|407|10|10.0|||3||3|19|1|12/31/2000|DO|1.0|13.41|13.41|1|01/08/2008|0.11|0.0|13.41|0.0|0.0|0.0|FOBOS|2004-01-01 00:00:00|
1|103|E|CALCULA.CASIO DL-220|4|407|10|10.0|||3||3|19|1|12/31/2000|DO|1.0|11.54|11.54|1|01/08/2008|0.1|0.0|11.54|0.0|0.0|0.0|FOBOS|2004-01-01 00:00:00|
1|104|E|MAR.DETECT.DE DOLARES|4|407|10|10.0|||3||3|19|1|12/31/2000|DO|1.0|215.0|215.0|1|12/31/2010|1.79|0.0|215.0|0.0|0.0|0.0|FOBOS|2004-01-01 00:00:00|
1|105|D|MAQUINA DETECTORA DOLA|4|407|10|10.0|||3||3|19|1|12/31/2000|DO|1.0|205.0|205.0|1||1.71|0.0|205.0|0.0|0.0|0.0|FOBOS|2004-01-01 00:00:00|
1|106|E|COMPRESOR DE 1/1 HP|4|409|10|10.0|||3||3|19|1|12/31/2000|DO|1.0|29.18|29.18|1|01/08/2008|0.24|0.0|29.18|0.0|0.0|0.0|FOBOS|2004-01-01 00:00:00|
1|107|E|BCO. DE PRUEBAS|4|409|10|10.0|||3||3|19|1|12/31/2000|DO|1.0|8590.45|8590.45|1|12/31/2010|71.59|0.0|8590.45|0.0|0.0|0.0|FOBOS|2004-01-01 00:00:00|
1|108|E|MOTOCOMPRESOR|4|409|10|10.0|||3||3|19|1|12/31/2000|DO|1.0|833.87|833.87|1|12/31/2010|6.95|0.0|833.87|0.0|0.0|0.0|FOBOS|2004-01-01 00:00:00|
1|109|E|TECLE MANUAL|4|409|10|10.0|||3||3|19|1|12/31/2000|DO|1.0|275.59|275.59|1|12/31/2010|2.3|0.0|275.59|0.0|0.0|0.0|FOBOS|2004-01-01 00:00:00|
1|110|E|RELOJ NIPPO|4|412|10|10.0|||3||3|19|1|12/31/2000|DO|1.0|263.66|263.66|1|01/08/2008|2.2|0.0|263.66|0.0|0.0|0.0|FOBOS|2004-01-01 00:00:00|
1|111|E|TRANSFORMADOR INATRA|4|412|10|10.0|||3||3|19|1|12/31/2000|DO|1.0|624.68|624.68|1|01/08/2008|5.21|0.0|624.68|0.0|0.0|0.0|FOBOS|2004-01-01 00:00:00|
1|112|E|TELEV. Y VHS|4|412|10|10.0|||3||3|19|1|12/31/2000|DO|1.0|691.89|691.89|1|12/31/2010|5.77|0.0|691.89|0.0|0.0|0.0|FOBOS|2004-01-01 00:00:00|
1|113|E|ACONDIC. DE POTENCIA|4|412|10|10.0|||3||3|19|1|12/31/2000|DO|1.0|59.54|59.54|1|01/08/2008|0.5|0.0|59.54|0.0|0.0|0.0|FOBOS|2004-01-01 00:00:00|
1|114|E|RELOJ CONTROL VER|4|412|10|10.0|||3||3|19|1|12/31/2000|DO|1.0|410.0|410.0|1|12/31/2010|3.42|0.0|410.0|0.0|0.0|0.0|FOBOS|2004-01-01 00:00:00|
1|115|D|TELEVISOR SONY WE|4|412|10|10.0|||3||3|19|1|12/31/2000|DO|1.0|764.8|764.8|1||6.37|0.0|764.8|0.0|0.0|0.0|FOBOS|2004-01-01 00:00:00|
1|116|E|COMPUT. IBM PS-80|5|501|5|20.0|||3||3|17|1|12/31/2000|DO|1.0|1104.29|1104.29|1|12/31/2010|18.4|0.0|1104.29|0.0|0.0|0.0|FOBOS|2004-01-01 00:00:00|
1|117|E|5 TERMINALES WYSE150|5|501|5|20.0|||3||3|17|1|12/31/2000|DO|1.0|561.79|561.79|1|12/31/2010|9.36|0.0|561.79|0.0|0.0|0.0|FOBOS|2004-01-01 00:00:00|
1|118|E|2 TERMINALES LINL-P|5|501|5|20.0|||3||3|17|1|12/31/2000|DO|1.0|211.69|211.69|1|12/31/2010|3.53|0.0|211.69|0.0|0.0|0.0|FOBOS|2004-01-01 00:00:00|
1|119|E|4 TERMINALES IBM|5|501|5|20.0|||3||3|17|1|12/31/2000|DO|1.0|618.61|618.61|1|01/08/2008|10.31|0.0|618.61|0.0|0.0|0.0|FOBOS|2004-01-01 00:00:00|
1|120|E|UNIDAD CTRAL. AS-400 D10|5|501|5|20.0|||3||3|17|1|12/31/2000|DO|1.0|5883.86|5883.86|1|12/31/2010|98.06|0.0|5883.86|0.0|0.0|0.0|FOBOS|2004-01-01 00:00:00|
1|121|E|4 TERMINALES WYSE 15|5|501|5|20.0|||3||3|17|1|12/31/2000|DO|1.0|507.82|507.82|1|12/31/2010|8.46|0.0|507.82|0.0|0.0|0.0|FOBOS|2004-01-01 00:00:00|
1|122|E|17 TERMINALES WYSE|5|501|5|20.0|||3||3|17|1|12/31/2000|DO|1.0|2070.79|2070.79|1|12/31/2010|34.51|0.0|2070.79|0.0|0.0|0.0|FOBOS|2004-01-01 00:00:00|
1|123|E|COMPUTADOR DELL 486-50|5|501|5|20.0|||3||3|17|1|12/31/2000|DO|1.0|2209.38|2209.38|1|12/31/2010|36.82|0.0|2209.38|0.0|0.0|0.0|FOBOS|2004-01-01 00:00:00|
1|124|E|COMPUTAD.4/25-210/W|5|501|5|20.0|||3||3|17|1|12/31/2000|DO|1.0|603.29|603.29|1|12/31/2010|10.05|0.0|603.29|0.0|0.0|0.0|FOBOS|2004-01-01 00:00:00|
1|125|E|COMPUT. PROSIGNIA|5|501|5|20.0|||3||3|17|1|12/31/2000|DO|1.0|10414.8|10414.8|1|12/31/2010|173.58|0.0|10414.8|0.0|0.0|0.0|FOBOS|2004-01-01 00:00:00|
1|126|E|COMPUTADOR PROLINEA|5|501|5|20.0|||3||3|17|1|12/31/2000|DO|1.0|2523.56|2523.56|1|12/31/2010|42.06|0.0|2523.56|0.0|0.0|0.0|FOBOS|2004-01-01 00:00:00|
1|127|E|6 TERMINALES WYSE|5|501|5|20.0|||3||3|17|1|12/31/2000|DO|1.0|1179.87|1179.87|1|12/31/2010|19.66|0.0|1179.87|0.0|0.0|0.0|FOBOS|2004-01-01 00:00:00|
1|128|E|COMPUT-PROLINEA|5|501|5|20.0|||3||3|17|1|12/31/2000|DO|1.0|2628.89|2628.89|1|12/31/2010|43.81|0.0|2628.89|0.0|0.0|0.0|FOBOS|2004-01-01 00:00:00|
1|129|E|COMPUT.PROL.ENHANCER|5|501|5|20.0|||3||3|17|1|12/31/2000|DO|1.0|2898.58|2898.58|1|12/31/2010|48.31|0.0|2898.58|0.0|0.0|0.0|FOBOS|2004-01-01 00:00:00|
1|130|E|COMPUT. PRESARIO|5|501|5|20.0|||3||3|17|1|12/31/2000|DO|1.0|3175.65|3175.65|1|12/31/2010|52.93|0.0|3175.65|0.0|0.0|0.0|FOBOS|2004-01-01 00:00:00|
1|131|E|COMPUT-PRESARIO 715|5|501|5|20.0|||3||3|17|1|12/31/2000|DO|1.0|2526.24|2526.24|1|12/31/2010|42.1|0.0|2526.24|0.0|0.0|0.0|FOBOS|2004-01-01 00:00:00|
1|132|E|10 TERMINALES WYSE|5|501|5|20.0|||3||3|17|1|12/31/2000|DO|1.0|4445.34|4445.34|1|01/08/2008|74.09|0.0|4445.34|0.0|0.0|0.0|FOBOS|2004-01-01 00:00:00|
1|133|E|PINNACLE MICRO|5|501|5|20.0|||3||3|17|1|12/31/2000|DO|1.0|3591.99|3591.99|1|01/08/2008|59.87|0.0|3591.99|0.0|0.0|0.0|FOBOS|2004-01-01 00:00:00|
1|134|E|MICROCOM DESKP|5|501|5|20.0|||3||3|17|1|12/31/2000|DO|1.0|2285.94|2285.94|1|01/08/2008|38.1|0.0|2285.94|0.0|0.0|0.0|FOBOS|2004-01-01 00:00:00|
1|135|E|TERMINAL WYSE|5|501|5|20.0|||3||3|17|1|12/31/2000|DO|1.0|280.84|280.84|1|01/08/2008|4.68|0.0|280.84|0.0|0.0|0.0|FOBOS|2004-01-01 00:00:00|
1|136|E|8 TERMINALES WYSE|5|501|5|20.0|||3||3|17|1|12/31/2000|DO|1.0|4028.87|4028.87|1|01/08/2008|67.15|0.0|4028.87|0.0|0.0|0.0|FOBOS|2004-01-01 00:00:00|
1|137|E|COMPUT. MILLENIA|5|501|5|20.0|||3||3|17|1|12/31/2000|DO|1.0|4129.37|4129.37|1|12/31/2010|68.82|0.0|4129.37|0.0|0.0|0.0|FOBOS|2004-01-01 00:00:00|
1|138|E|TERMINAL WYSE 160|5|501|5|20.0|||3||3|17|1|12/31/2000|DO|1.0|244.45|244.45|1|01/08/2008|4.07|0.0|244.45|0.0|0.0|0.0|FOBOS|2004-01-01 00:00:00|
1|139|E|IMPRESORA  EPSON LX810|5|502|5|20.0|||3||3|17|1|12/31/2000|DO|1.0|66.0|66.0|1|12/31/2010|1.1|0.0|66.0|0.0|0.0|0.0|FOBOS|2004-01-01 00:00:00|
1|140|E|IMPRESORA  EPSON LX810|5|502|5|20.0|||3||3|17|1|12/31/2000|DO|1.0|46.43|46.43|1|12/31/2010|0.77|0.0|46.43|0.0|0.0|0.0|FOBOS|2004-01-01 00:00:00|
1|141|E|IMPRESORA  EPSON LX810|5|502|5|20.0|||3||3|17|1|12/31/2000|DO|1.0|42.6|42.6|1|12/31/2010|0.71|0.0|42.6|0.0|0.0|0.0|FOBOS|2004-01-01 00:00:00|
1|142|E|10 IMPRESORAS EPSON|5|502|5|20.0|||3||3|17|1|12/31/2000|DO|1.0|483.16|483.16|1|12/31/2010|8.05|0.0|483.16|0.0|0.0|0.0|FOBOS|2004-01-01 00:00:00|
1|143|E|6 IMPRES. EPSON LX|5|502|5|20.0|||3||3|17|1|12/31/2000|DO|1.0|1156.67|1156.67|1|12/31/2010|19.28|0.0|1156.67|0.0|0.0|0.0|FOBOS|2004-01-01 00:00:00|
1|144|E|IMPRESORA CANON|5|502|5|20.0|||3||3|17|1|12/31/2000|DO|1.0|269.95|269.95|1|12/31/2010|4.5|0.0|269.95|0.0|0.0|0.0|FOBOS|2004-01-01 00:00:00|
1|145|E|IMPRESORA CANON|5|502|5|20.0|||3||3|17|1|12/31/2000|DO|1.0|424.2|424.2|1|12/31/2010|7.07|0.0|424.2|0.0|0.0|0.0|FOBOS|2004-01-01 00:00:00|
1|146|E|6 IMPRESORAS LX|5|502|5|20.0|||3||3|17|1|12/31/2000|DO|1.0|1180.24|1180.24|1|12/31/2010|19.67|0.0|1180.24|0.0|0.0|0.0|FOBOS|2004-01-01 00:00:00|
1|147|E|2 IMPRESORAS LX|5|502|5|20.0|||3||3|17|1|12/31/2000|DO|1.0|391.58|391.58|1|12/31/2010|6.53|0.0|391.58|0.0|0.0|0.0|FOBOS|2004-01-01 00:00:00|
1|148|E|IMPRESORAS EPSON|5|502|5|20.0|||3||3|17|1|12/31/2000|DO|1.0|467.18|467.18|1|12/31/2010|7.79|0.0|467.18|0.0|0.0|0.0|FOBOS|2004-01-01 00:00:00|
1|149|E|IMPRESORA CANON|5|502|5|20.0|||3||3|17|1|12/31/2000|DO|1.0|209.56|209.56|1|12/31/2010|3.49|0.0|209.56|0.0|0.0|0.0|FOBOS|2004-01-01 00:00:00|
1|150|E|4 IMPRESORAS EPSON|5|502|5|20.0|||3||3|17|1|12/31/2000|DO|1.0|386.94|386.94|1|12/31/2010|6.45|0.0|386.94|0.0|0.0|0.0|FOBOS|2004-01-01 00:00:00|
1|151|E|8 IMPRESORAS EPSON|5|502|5|20.0|||3||3|17|1|12/31/2000|DO|1.0|1482.77|1482.77|1|01/08/2008|24.71|0.0|1482.77|0.0|0.0|0.0|FOBOS|2004-01-01 00:00:00|
1|152|E|2 IMPRESORAS EPSON|5|502|5|20.0|||3||3|17|198|12/31/2000|DO|1.0|200.88|200.88|1|12/31/2010|3.35|0.0|200.88|0.0|0.0|0.0|FOBOS|2004-01-01 00:00:00|
1|153|E|EXPANSION MEMORIA IBM|5|503|5|20.0|||3||3|17|1|12/31/2000|DO|1.0|167.44|167.44|1|12/31/2010|2.79|0.0|167.44|0.0|0.0|0.0|FOBOS|2004-01-01 00:00:00|
1|154|E|MONITOR MICRON 17|5|503|5|20.0|||3||3|17|1|12/31/2000|DO|1.0|904.07|904.07|1|12/13/2010|15.07|0.0|904.07|0.0|0.0|0.0|FOBOS|2004-01-01 00:00:00|
1|155|E|CASE SCSI 2 BAY|5|503|5|20.0|||3||3|17|1|12/31/2000|DO|1.0|336.24|336.24|1|12/31/2010|5.6|0.0|336.24|0.0|0.0|0.0|FOBOS|2004-01-01 00:00:00|
1|156|E|TARJETA STARGETE Y E|5|504|5|20.0|||3||3|17|1|12/31/2000|DO|1.0|298.49|298.49|1|12/31/2010|4.97|0.0|298.49|0.0|0.0|0.0|FOBOS|2004-01-01 00:00:00|
1|157|E|2 MILAN TRANSCEIV|5|504|5|20.0|||3||3|17|1|12/31/2000|DO|1.0|288.78|288.78|1|12/31/2010|4.81|0.0|288.78|0.0|0.0|0.0|FOBOS|2004-01-01 00:00:00|
1|158|E|LINKBUILDER TP/8|5|504|5|20.0|||3||3|17|1|12/31/2000|DO|1.0|443.0|443.0|1|12/31/2010|7.38|0.0|443.0|0.0|0.0|0.0|FOBOS|2004-01-01 00:00:00|
1|159|E|ETHERLINK III TP|5|504|5|20.0|||3||3|17|1|12/31/2000|DO|1.0|395.54|395.54|1|12/31/2010|6.59|0.0|395.54|0.0|0.0|0.0|FOBOS|2004-01-01 00:00:00|
1|160|E|SLIMLINE 16 PORT|5|504|5|20.0|||3||3|17|1|12/31/2000|DO|1.0|895.0|895.0|1|12/31/2010|14.92|0.0|895.0|0.0|0.0|0.0|FOBOS|2004-01-01 00:00:00|
1|161|E|PROGRAMA PCMOS|5|505|5|20.0|||3||3|17|1|12/31/2000|DO|1.0|28.44|28.44|1|12/31/2010|0.47|0.0|28.44|0.0|0.0|0.0|FOBOS|2004-01-01 00:00:00|
1|162|E|SISTEMA OPERATIVO ADT/40|5|505|5|20.0|||3||3|17|1|12/31/2000|DO|1.0|2681.23|2681.23|1|12/31/2010|44.69|0.0|2681.23|0.0|0.0|0.0|FOBOS|2004-01-01 00:00:00|
1|163|E|LENGUAJE DE PROGR. RPG|5|505|5|20.0|||3||3|17|1|12/31/2000|DO|1.0|851.39|851.39|1|12/31/2010|14.19|0.0|851.39|0.0|0.0|0.0|FOBOS|2004-01-01 00:00:00|
1|164|E|LICENC. DE INFORMIX|5|505|5|20.0|||3||3|17|1|12/31/2000|DO|1.0|24493.68|24493.68|1|12/31/2010|408.23|0.0|24493.68|0.0|0.0|0.0|FOBOS|2004-01-01 00:00:00|
1|165|E|1 DOUBLE VISION|5|505|5|20.0|||3||3|17|1|12/31/2000|DO|1.0|477.53|477.53|1|12/31/2010|7.96|0.0|477.53|0.0|0.0|0.0|FOBOS|2004-01-01 00:00:00|
1|166|E|INFORMIX ON LINE RUNTIME|5|505|5|20.0|||3||3|17|1|12/31/2000|DO|1.0|3819.35|3819.35|1|12/31/2010|63.66|0.0|3819.35|0.0|0.0|0.0|FOBOS|2004-01-01 00:00:00|
1|167|E|INFORMIX ONE LINE|5|505|5|20.0|||3||3|17|1|12/31/2000|DO|1.0|4035.37|4035.37|1|12/31/2010|67.26|0.0|4035.37|0.0|0.0|0.0|FOBOS|2004-01-01 00:00:00|
1|168|E|2 SMARTSTAR SCO|5|505|5|20.0|||3||3|17|1|12/31/2000|DO|1.0|463.64|463.64|1|12/31/2010|7.73|0.0|463.64|0.0|0.0|0.0|FOBOS|2004-01-01 00:00:00|
1|169|E|PROGRAMA DE FACT|5|505|5|20.0|||3||3|17|1|12/31/2000|DO|1.0|2166.88|2166.88|1|12/31/2010|36.11|0.0|2166.88|0.0|0.0|0.0|FOBOS|2004-01-01 00:00:00|
1|170|E|PROGRAMA DE INVENTARIO|5|505|5|20.0|||3||3|17|1|12/31/2000|DO|1.0|2166.88|2166.88|1|12/31/2010|36.11|0.0|2166.88|0.0|0.0|0.0|FOBOS|2004-01-01 00:00:00|
1|171|E|PROGRAMA DE COMPR|5|505|5|20.0|||3||3|17|1|12/31/2000|DO|1.0|1465.11|1465.11|1|12/31/2010|24.42|0.0|1465.11|0.0|0.0|0.0|FOBOS|2004-01-01 00:00:00|
1|172|E|PROGR. CTAS. POR COBR|5|505|5|20.0|||3||3|17|1|12/31/2000|DO|1.0|1433.28|1433.28|1|12/31/2010|23.89|0.0|1433.28|0.0|0.0|0.0|FOBOS|2004-01-01 00:00:00|
1|173|E|2 PROGRAM. COMPUT|5|506|5|20.0|||3||3|17|1|12/31/2000|DO|1.0|1323.88|1323.88|1|12/31/2010|22.06|0.0|1323.88|0.0|0.0|0.0|FOBOS|2004-01-01 00:00:00|
1|174|E|UNIDADES DE RESPALDO|5|508|5|20.0|||3||3|17|1|12/31/2000|DO|1.0|1512.7|1512.7|1|12/31/2010|25.21|0.0|1512.7|0.0|0.0|0.0|FOBOS|2004-01-01 00:00:00|
1|175|E|TAPE BACK UP|5|508|5|20.0|||3||3|17|1|12/31/2000|DO|1.0|2157.18|2157.18|1|12/31/2010|35.95|0.0|2157.18|0.0|0.0|0.0|FOBOS|2004-01-01 00:00:00|
1|176|E|REGULADOR TRIPP LITE|5|509|5|20.0|||3||3|17|1|12/31/2000|DO|1.0|71.02|71.02|1|01/08/2008|1.18|0.0|71.02|0.0|0.0|0.0|FOBOS|2004-01-01 00:00:00|
1|177|E|SISTEMA ININTERRUMP|5|509|5|20.0|||3||3|17|1|12/31/2000|DO|1.0|489.13|489.13|1|12/31/2010|8.15|0.0|489.13|0.0|0.0|0.0|FOBOS|2004-01-01 00:00:00|
1|178|E|6 UPS TRIPP LITE|5|509|5|20.0|||3||3|17|1|12/31/2000|DO|1.0|3474.93|3474.93|1|12/31/2010|57.92|0.0|3474.93|0.0|0.0|0.0|FOBOS|2004-01-01 00:00:00|
1|179|E|REGULADOR DE VOLTAJE|5|509|5|20.0|||3||3|17|1|12/31/2000|DO|1.0|190.39|190.39|1|12/31/2010|3.17|0.0|190.39|0.0|0.0|0.0|FOBOS|2004-01-01 00:00:00|
1|180|E|UPS TRIPP LITE|5|509|5|20.0|||3||3|17|1|12/31/2000|DO|1.0|675.49|675.49|1|01/08/2008|11.26|0.0|675.49|0.0|0.0|0.0|FOBOS|2004-01-01 00:00:00|
1|181|E|3 MESAS P.COMPUTADOR|5|510|5|20.0|||3||3|17|1|12/31/2000|DO|1.0|49.8|49.8|1|12/31/2010|0.83|0.0|49.8|0.0|0.0|0.0|FOBOS|2004-01-01 00:00:00|
1|182|S|SISTEMA ELECTRICO|3|301|10|10.0|||3||3|16|1|01/31/2001|DO|1.0|14215.97|14215.97|1||118.47|0.0|14097.56|0.0|0.0|0.0|FOBOS|2004-01-01 00:00:00|
1|183|E|COMPUTADOR AOPEN ATX MIC|5|501|5|20.0|||3||3|17|1|01/31/2001|DO|1.0|1496.0|1496.0|1|12/31/2010|24.93|0.0|1496.0|0.0|0.0|0.0|FOBOS|2004-01-01 00:00:00|
1|184|E|COMPUTADOR ATX INTEL|5|501|5|20.0|||3||3|17|1|03/31/2001|DO|1.0|1025.0|1025.0|1|12/31/2010|17.08|0.0|1025.0|0.0|0.0|0.0|FOBOS|2004-01-01 00:00:00|
1|185|E|TARJETA MULTIPUERTOS|5|504|5|20.0|||3||3|17|1|03/31/2001|DO|1.0|700.0|700.0|1|12/31/2010|11.67|0.0|700.0|0.0|0.0|0.0|FOBOS|2004-01-01 00:00:00|
1|186|E|MONITOR ACER 14PULG SVG|5|503|5|20.0|||3||3|17|1|04/30/2001|DO|1.0|154.0|154.0|1|12/31/2010|2.57|0.0|154.0|0.0|0.0|0.0|FOBOS|2004-01-01 00:00:00|
1|187|E|COMPUTADOR ATX CLON|5|501|5|20.0|||3||3|17|1|05/31/2001|DO|1.0|840.0|840.0|1|12/31/2010|14.0|0.0|840.0|0.0|0.0|0.0|FOBOS|2004-01-01 00:00:00|
1|188|E|MONITOR TIM TECHMEDI|5|503|5|20.0|||3||3|17|1|05/31/2001|DO|1.0|70.0|70.0|1|12/31/2010|1.17|0.0|70.0|0.0|0.0|0.0|FOBOS|2004-01-01 00:00:00|
1|189|E|LICENCIAS UPGRADE INFORMIX|5|505|5|20.0|||3||3|17|1|05/31/2001|DO|1.0|16434.68|16434.68|1|12/31/2010|273.91|0.0|16434.68|0.0|0.0|0.0|FOBOS|2004-01-01 00:00:00|
1|190|E|4 COMPUTADORES MINITOWER|5|501|5|20.0|||3||3|17|1|10/30/2001|DO|1.0|2360.0|2360.0|1|12/31/2010|39.33|0.0|2360.0|0.0|0.0|0.0|FOBOS|2004-01-01 00:00:00|
1|191|E|COMPUTADOR MINITOWER ATX|5|501|5|20.0|||3||3|17|1|10/30/2001|DO|1.0|450.0|450.0|1|12/31/2010|7.5|0.0|450.0|0.0|0.0|0.0|FOBOS|2004-01-01 00:00:00|
1|192|E|IMPRESOSAR LASER HP|5|502|5|20.0|||3||3|17|1|10/30/2001|DO|1.0|540.0|540.0|1|12/31/2010|9.0|0.0|540.0|0.0|0.0|0.0|FOBOS|2004-01-01 00:00:00|
1|193|E|FAX MODEM US-ROBOTICS|5|504|5|20.0|||3||3|17|1|10/30/2001|DO|1.0|190.0|190.0|1|12/31/2010|3.17|0.0|190.0|0.0|0.0|0.0|FOBOS|2004-01-01 00:00:00|
1|194|E|3 TERMINALES SERVER|5|501|5|20.0|||3||3|17|1|11/30/2001|DO|1.0|3585.0|3585.0|1|12/31/2010|59.75|0.0|3585.0|0.0|0.0|0.0|FOBOS|2004-01-01 00:00:00|
1|195|E|LISTA ANTERIOR|4|412|10|10.0|||3||3|19|198|12/31/2001|DO|1.0|3638.14|3638.14|1|01/08/2008|30.32|0.0|3638.14|0.0|0.0|0.0|FOBOS|2004-01-01 00:00:00|
1|196|E|LISTA ANTERIOR 2|4|412|10|10.0|||3||3|19|1|12/31/2001|DO|1.0|409.91|409.91|1|01/08/2008|3.42|0.0|409.91|0.0|0.0|0.0|FOBOS|2004-01-01 00:00:00|
1|197|E|COMPUTAD. MINITOWER ATX CLON|5|501|5|20.0|||3||3|17|1|12/31/2001|DO|1.0|765.0|765.0|1|12/31/2010|12.75|0.0|765.0|0.0|0.0|0.0|FOBOS|2004-01-01 00:00:00|
1|198|D|PROGRAMA PARA VENTAS|6|605|3|33.0|||3||3|18|1|01/31/2002|DO|1.0|2484.8|2484.8|1||68.33|0.0|2484.8|0.0|0.0|0.0|FOBOS|2004-01-01 00:00:00|
1|199|S|SISTEMA DE CABLEADO TELSITE|3|301|10|10.0|||3||3|16|1|02/28/2002|DO|1.0|3652.7|3652.7|1||30.44|0.0|3226.64|0.0|0.0|0.0|FOBOS|2004-01-01 00:00:00|
1|200|S|SISTEMA DE CABLEADO ACERO COMERCIAL|3|301|10|10.0|||3||3|16|1|02/28/2002|DO|1.0|279.7|279.7|1||2.33|0.0|246.98|0.0|0.0|0.0|FOBOS|2004-01-01 00:00:00|
1|201|D|COMPUTADOR PROLIANT|6|601|3|33.0|||3||3|18|1|02/28/2002|DO|1.0|2083.0|2083.0|1||57.28|0.0|2083.0|0.0|0.0|0.0|FOBOS|2004-01-01 00:00:00|
1|202|D|2 IMPRESORAS EPSON LX|6|602|3|33.0|||3||3|18|1|02/28/2002|DO|1.0|410.0|410.0|1||11.28|0.0|410.0|0.0|0.0|0.0|FOBOS|2004-01-01 00:00:00|
1|203|D|POWERMAX LAN UTP|6|604|3|33.0|||3||3|18|1|02/28/2002|DO|1.0|1649.0|1649.0|1||45.35|0.0|1649.0|0.0|0.0|0.0|FOBOS|2004-01-01 00:00:00|
1|204|D|POWERWARE 9170|6|609|3|33.0|||3||3|18|1|03/31/2002|DO|1.0|6700.0|6700.0|1||184.25|0.0|6700.0|0.0|0.0|0.0|FOBOS|2004-01-01 00:00:00|
1|205|S|SUMADORA CASIO DR-86|4|401|10|10.0|||3||3|19|1|04/19/2002|DO|1.0|238.0|238.0|1||1.98|0.0|205.95|0.0|0.0|0.0|FOBOS|2004-01-01 00:00:00|
1|206|S|RELOJ ELECTRONICO (SUR)|4|412|10|10.0|||3||4|19|1|04/25/2002|DO|1.0|410.0|410.0|1||3.42|0.0|355.65|0.0|0.0|0.0|FOBOS|2004-01-01 00:00:00|
1|207|S|SISTEMA DE CABLEADO GLOBALWORKS|3|301|10|10.0|||3||3|16|1|04/30/2002|DO|1.0|1461.08|1461.08|1||12.18|0.0|1266.72|0.0|0.0|0.0|FOBOS|2004-01-01 00:00:00|
1|208|S|BCO. DE PRUEBAS|4|410|10|10.0|||3||3|19|1|04/30/2002|DO|1.0|1073.67|1073.67|1||8.95|0.0|930.78|0.0|0.0|0.0|FOBOS|2004-01-01 00:00:00|
1|209|D|COMPUTADOR GENERICO|6|601|3|33.0|||3||3|18|1|04/30/2002|DO|1.0|1405.0|1405.0|1||38.64|0.0|1405.0|0.0|0.0|0.0|FOBOS|2004-01-01 00:00:00|
1|210|S|ESCRITORIO GERENTE (VENTAS)|4|401|10|10.0|||3||3|19|1|05/20/2002|DO|1.0|246.4|246.4|1||2.05|0.0|211.17|0.0|0.0|0.0|FOBOS|2004-01-01 00:00:00|
1|211|S|SILLON GERENTE|4|401|10|10.0|||3||3|19|1|05/20/2002|DO|1.0|178.5|178.5|1||1.49|0.0|153.45|0.0|0.0|0.0|FOBOS|2004-01-01 00:00:00|
1|212|S|ESCRITORIO AUXILIAR|4|402|10|10.0|||3||3|19|1|05/20/2002|DO|1.0|246.4|246.4|1||2.05|0.0|211.17|0.0|0.0|0.0|FOBOS|2004-01-01 00:00:00|
1|213|S|ARCHIVADOR CEDENSA|4|402|10|10.0|||3||3|19|1|05/20/2002|DO|1.0|813.4|813.4|1||6.78|0.0|698.33|0.0|0.0|0.0|FOBOS|2004-01-01 00:00:00|
1|214|S|ARCHIVADOR AEREO|4|402|10|10.0|||3||3|19|1|05/20/2002|DO|1.0|266.0|266.0|1||2.22|0.0|228.64|0.0|0.0|0.0|FOBOS|2004-01-01 00:00:00|
1|215|S|SILLON GRAFFITTI (VENTAS)|4|402|10|10.0|||3||3|19|1|05/20/2002|DO|1.0|91.0|91.0|1||0.76|0.0|78.27|0.0|0.0|0.0|FOBOS|2004-01-01 00:00:00|
1|216|S|4 SILLAS LITE (VENTAS)|4|402|10|10.0|||3||3|19|1|05/20/2002|DO|1.0|162.4|162.4|1||1.35|0.0|139.07|0.0|0.0|0.0|FOBOS|2004-01-01 00:00:00|
1|217|S|TANDEM GRAFFITTI|4|401|10|10.0|||3||3|19|1|06/14/2002|DO|1.0|189.0|189.0|1||1.58|0.0|161.13|0.0|0.0|0.0|FOBOS|2004-01-01 00:00:00|
1|218|S|ANAQUEL VIVENDI 900|4|402|10|10.0|||3||3|19|1|06/14/2002|DO|1.0|284.2|284.2|1||2.37|0.0|241.73|0.0|0.0|0.0|FOBOS|2004-01-01 00:00:00|
1|219|S|MESA CENTRAL VIDRIO (VENTAS)|4|402|10|10.0|||3||3|19|1|06/14/2002|DO|1.0|116.2|116.2|1||0.97|0.0|98.93|0.0|0.0|0.0|FOBOS|2004-01-01 00:00:00|
1|220|S|SILLON GRAFFITTI (VENTAS)|4|402|10|10.0|||3||3|19|1|06/14/2002|DO|1.0|91.0|91.0|1||0.76|0.0|77.51|0.0|0.0|0.0|FOBOS|2004-01-01 00:00:00|
1|221|S|MOTACARGA MANUAL PT|4|411|10|10.0|||3||3|19|1|06/29/2002|DO|1.0|461.12|461.12|1||3.84|0.0|391.7|0.0|0.0|0.0|FOBOS|2004-01-01 00:00:00|
1|222|S|SISTEMA DE CABLEADO GLOBALWORK|3|301|10|10.0|||3||3|16|1|06/30/2002|DO|1.0|2155.17|2155.17|1||17.96|0.0|1831.92|0.0|0.0|0.0|FOBOS|2004-01-01 00:00:00|
1|223|S|AMPLIACION OFIC.COMPUTACION|3|304|10|10.0|||3||3|16|1|06/30/2002|DO|1.0|12022.06|12022.06|1||100.18|0.0|10218.36|0.0|0.0|0.0|FOBOS|2004-01-01 00:00:00|
1|224|S|BANCO DE PRUEBAS|4|409|10|10.0|||3||3|19|1|07/31/2002|DO|1.0|2647.72|2647.72|1||22.06|0.0|2228.08|0.0|0.0|0.0|FOBOS|2004-01-01 00:00:00|
1|225|D|2 MONITOR SANSUNG 15|6|603|3|33.0|||3||3|18|1|08/31/2002|DO|1.0|216.0|216.0|1||5.94|0.0|216.0|0.0|0.0|0.0|FOBOS|2004-01-01 00:00:00|
1|226|D|2 MONITOR SANSUNG 15 PULG 55|6|603|3|33.0|||3||3|18|1|08/31/2002|DO|1.0|212.0|212.0|1||5.83|0.0|212.0|0.0|0.0|0.0|FOBOS|2004-01-01 00:00:00|
1|227|D|CHEVROLET GRAN-BLAZER|7|704|5|20.0|||3||3|20|1|08/31/2002|DO|1.0|12000.0|12000.0|1||200.0|0.0|12000.0|0.0|0.0|0.0|FOBOS|2004-01-01 00:00:00|
1|228|S|OFICINA DPTO.VENTAS|2|201|20|5.0|||3||3|15|1|09/30/2002|DO|1.0|21874.04|21874.04|1||91.14|0.0|9022.91|0.0|0.0|0.0|FOBOS|2004-01-01 00:00:00|
1|229|D|SOFTWARE PHOBOS|6|605|3|33.0|||3||3|18|1|10/31/2002|DO|1.0|5400.0|5400.0|1||148.5|0.0|5400.0|0.0|0.0|0.0|FOBOS|2004-01-01 00:00:00|
1|230|D|"POWER COMPUTER MONT 15, LICENCIA WIND"|6|601|3|33.0|||3||3|18|1|11/30/2002|DO|1.0|1095.0|1095.0|1||30.11|0.0|1095.0|0.0|0.0|0.0|FOBOS|2004-01-01 00:00:00|
1|231|E|COMPUTADORA HP COMPAQ (SUR)|6|601|3|33.0|||3||3|18|1|11/30/2002|DO|1.0|768.0|768.0|1|01/08/2008|21.12|0.0|768.0|0.0|0.0|0.0|FOBOS|2004-01-01 00:00:00|
1|232|D|IMPRESORA LASER MOD HP 1|6|602|3|33.0|||3||3|18|1|11/30/2002|DO|1.0|440.0|440.0|1||12.1|0.0|440.0|0.0|0.0|0.0|FOBOS|2004-01-01 00:00:00|
1|233|D|4 IMPRESORAS EPSON LX-300|6|602|3|33.0|LX-300|ETUY019201/19894/20320/32|3||3|18|580|01/31/2003|DO|1.0|1000.0|1000.0|1||27.5|0.0|1000.0|0.0|0.0|0.0|FOBOS|2004-01-01 00:00:00|
1|234|D|PC GENERICA PENTIUM IV|6|601|3|33.0|GENERICO|ABLY23967158|3||3|18|616|02/28/2003|DO|1.0|582.0|582.0|1||16.01|0.0|582.0|0.0|0.0|0.0|FOBOS|2004-01-01 00:00:00|
1|235|D|PC GENERICA PENTIUM|6|601|3|33.0|GENERICO|ABLT23966298|3||3|18|616|02/28/2003|DO|1.0|582.0|582.0|1||16.01|0.0|582.0|0.0|0.0|0.0|FOBOS|2004-01-01 00:00:00|
1|236|D|GENERICA PENTIUM IV|6|601|3|33.0|GENERICO|IMLY23702767|3||3|18|616|02/28/2003|DO|1.0|582.0|582.0|1||16.01|0.0|582.0|0.0|0.0|0.0|FOBOS|2004-01-01 00:00:00|
1|237|D|GENERICA PEINTUM IV|6|601|3|33.0|GENERICO|ABLY23970183|3||3|18|616|02/28/2003|DO|1.0|581.98|581.98|1||16.0|0.0|581.98|0.0|0.0|0.0|FOBOS|2004-01-01 00:00:00|
1|238|D|COMPUTADOR ATX COMPATIBLE IV|6|601|3|33.0|ATX|210DIF4886|3||3|18|580|02/28/2003|DO|1.0|816.0|816.0|1||22.44|0.0|816.0|0.0|0.0|0.0|FOBOS|2004-01-01 00:00:00|
1|239|D|COMP.ATX COMPATIBLE IV 1.8GHZ|6|601|3|33.0|ATX|210DIF4680|3||3|18|580|03/31/2003|DO|1.0|1038.0|1038.0|1||28.55|0.0|1038.0|0.0|0.0|0.0|FOBOS|2004-01-01 00:00:00|
1|240|D|COMPUTADOR ATX COMPATIBLE IV 2.4 GHZ|6|601|3|33.0|ATX|AN17HCATB01513|3||3|18|580|03/31/2003|DO|1.0|1291.0|1291.0|1||35.5|0.0|1291.0|0.0|0.0|0.0|FOBOS|2004-01-01 00:00:00|
1|241|D|COMPUTADOR INTEL PENTIUM IV I.8 GHZ|6|601|3|33.0|MAINBOARD INTEL|AN15HCDW1 6279|3||3|18|580|03/31/2003|DO|1.0|816.0|816.0|1||22.44|0.0|816.0|0.0|0.0|0.0|FOBOS|2004-01-01 00:00:00|
1|242|D|COMPUTADOR INTEL PENTIUM IV 2.4 GHZ|6|601|3|33.0|MAINBORD INTEL8|AN17HXATC04768|3||3|18|580|03/31/2003|DO|1.0|1553.0|1553.0|1||42.71|0.0|1553.0|0.0|0.0|0.0|FOBOS|2004-01-01 00:00:00|
1|243|D|MB MEMORY SDRAM DIMM 133 ALL|6|603|3|33.0|HEWLETT PACKARD|128278-B21|3||3|18|640|03/31/2003|DO|1.0|155.0|155.0|1||4.26|0.0|155.0|0.0|0.0|0.0|FOBOS|2004-01-01 00:00:00|
1|244|S|ARCHIVADOR RODANTE|4|401|10|10.0|MODULO||3||3|19|644|04/30/2003|DO|1.0|308.7|308.7|1||2.57|0.0|236.44|0.0|0.0|0.0|FOBOS|2004-01-01 00:00:00|
1|245|S|2 SILLAS GRAFFITTI ESPALDAR LACADO|4|401|10|10.0|GRAFFITTI||3||3|19|644|04/30/2003|DO|1.0|156.8|156.8|1||1.31|0.0|120.52|0.0|0.0|0.0|FOBOS|2004-01-01 00:00:00|
1|246|S|ESCRITORIO ADAGIO CURVO 2480-1820|4|402|10|10.0|ADAGIO|2480-1820|3||3|19|644|04/30/2003|DO|1.0|717.5|717.5|1||5.98|0.0|550.16|0.0|0.0|0.0|FOBOS|2004-01-01 00:00:00|
1|247|S|ANAQUEL-ESPALDA 900 VIVENDI|4|402|10|10.0|VIVENDI||3||3|19|644|04/30/2003|DO|1.0|823.9|823.9|1||6.87|0.0|632.04|0.0|0.0|0.0|FOBOS|2004-01-01 00:00:00|
1|248|S|MOTO PROPULSOR RIDGID|4|410|10|10.0|"MOD-700 1/8"" |115/60/1|3||3|19|198|04/30/2003|DO|1.0|1056.3|1056.3|1||8.8|0.0|809.6|0.0|0.0|0.0|FOBOS|2004-01-01 00:00:00|
1|249|S|ESCRITORIO VIVENDI|4|401|10|10.0|VIVENDI||3||3|19|644|07/31/2003|DO|1.0|490.7|490.7|1||4.09|0.0|364.01|0.0|0.0|0.0|FOBOS|2004-01-01 00:00:00|
1|250|S|2 ARCHIVADORES ARMARIO|4|401|10|10.0|ARMARIO||3||3|19|644|07/31/2003|DO|1.0|515.9|515.9|1||4.3|0.0|382.7|0.0|0.0|0.0|FOBOS|2004-01-01 00:00:00|
1|251|S|1 SILLON GRATTITTI REGULACION GAS|4|401|10|10.0|GRAFFITTI||3||3|19|644|07/31/2003|DO|1.0|106.4|106.4|1||0.89|0.0|79.21|0.0|0.0|0.0|FOBOS|2004-01-01 00:00:00|
1|252|S|2 SILLAS LITE|4|402|10|10.0|LITE||3||3|19|644|07/31/2003|DO|1.0|95.2|95.2|1||0.79|0.0|70.31|0.0|0.0|0.0|FOBOS|2004-01-01 00:00:00|
1|253|S|2 SILLON GRAFFITTI|4|402|10|10.0|GRAFFITTI||3||3|19|644|08/31/2003|DO|1.0|212.8|212.8|1||1.77|0.0|155.76|0.0|0.0|0.0|FOBOS|2004-01-01 00:00:00|
1|254|S|2 ESTACION DE TRABAJO|4|402|10|10.0|PENINSULAR||3||3|19|732|08/31/2003|DO|1.0|450.0|450.0|1||3.75|0.0|330.0|0.0|0.0|0.0|FOBOS|2004-01-01 00:00:00|
1|255|D|GENERICO PENTIUM IV|6|601|3|33.0|GENERICO|023050214972|3||3|18|724|08/31/2003|DO|1.0|776.0|776.0|1||21.34|0.0|776.0|0.0|0.0|0.0|FOBOS|2004-01-01 00:00:00|
1|256|D|IMPRESORA EPSON LX 300|6|602|3|33.0|EPXON LX-300|ETUY065643|3||3|18|724|08/31/2003|DO|1.0|194.0|194.0|1||5.34|0.0|194.0|0.0|0.0|0.0|FOBOS|2004-01-01 00:00:00|
1|257|D|IMPRESORA LASER|6|602|3|33.0|JEY 1300|CNBB086628|3||3|18|724|08/31/2003|DO|1.0|418.0|418.0|1||11.5|0.0|418.0|0.0|0.0|0.0|FOBOS|2004-01-01 00:00:00|
1|258|E|MONITOR SAMSUNG 15 PULG|6|603|3|33.0|"SAMSUNG 15"""|AN15HXBW120689|3||3|18|724|08/31/2003|DO|1.0|96.0|96.0|1|01/08/2008|2.64|0.0|96.0|0.0|0.0|0.0|FOBOS|2004-01-01 00:00:00|
1|259|D|PROCESADOR COMPAQ PEINTIUM III|6|603|3|33.0|OPTION KIT|P1133-512KB|3||3|18|580|08/31/2003|DO|1.0|720.0|720.0|1||19.8|0.0|720.0|0.0|0.0|0.0|FOBOS|2004-01-01 00:00:00|
1|260|D|DIMM 168 PIN|6|603|3|33.0|1GB||3||3|18|580|08/31/2003|DO|1.0|849.0|849.0|1||23.35|0.0|849.0|0.0|0.0|0.0|FOBOS|2004-01-01 00:00:00|
1|261|D|COMPUTADOR PENTIUM IV 2.8 GHZ-533 UIO|6|501|3|33.0|PENTIUM IV 2.8||3|3377|3|18|885|08/27/2004|DO|1.0|780.0|780.0|1||21.45|0.0|780.0|0.0|0.0|0.0|ADMINUIO|2004-08-18 17:37:03|
1|262|D|DISCO DURO HP COMPAQ 36.4 GB 10K FIJO|6|601|3|33.0|HP COMPAQ 36.4G||3|3756|3|18|580|10/06/2004|DO|1.0|270.0|270.0|1||7.43|0.0|270.0|0.0|0.0|0.0|E1MARYER|2004-10-06 16:39:21|
1|263|D|SMART ARRAY CONTROLER HP-641|6|501|3|33.0|UZ61P3400089|291966-B21|3|3756|3|18|580|10/06/2004|DO|1.0|520.0|520.0|1||14.3|0.0|520.0|0.0|0.0|0.0|E1MARYER|2004-10-06 16:43:42|
1|264|D|COMPUTADOR PENTIUM IV 3GHZ,WINXP,OFF2003|6|501|3|33.0|PENTIUM IV 3GHZ||3|3921|3|18|902|10/27/2004|DO|1.0|1116.0|1116.0|1||30.69|0.0|1116.0|0.0|0.0|0.0|ADMINUIO|2004-10-26 16:25:25|
1|265|D|MONITOR SAMSUNG TFT 15" PANTALLA LIQUIDA|6|603|3|33.0|SAMSUNG TFT 15"||3|3921|3|18|902|10/27/2004|DO|1.0|328.0|328.0|||9.02|0.0|328.0|0.0|0.0|0.0|ADMINUIO|2004-10-26 16:28:47|
1|266|D|SWITCH 24 PUERTOS 10/100 3COM|6|604|3|33.0|SWITCH 24 PUERT|VASELINE|3|3937|3|18|677|10/27/2004|DO|1.0|315.0|315.0|1||8.66|0.0|315.0|0.0|0.0|0.0|ADMINUIO|2004-10-27 14:53:34|
1|267|D|SWITCH 24 PUERTOS 10/100 MARCA NEXXT|6|604|3|33.0|SWITCH 24 PUERT|AHW2312001369|3|3937|3|18|677|10/27/2004|DO|1.0|95.0|95.0|1||2.61|0.0|95.0|0.0|0.0|0.0|ADMINUIO|2004-10-27 14:56:02|
1|268|D|MITSUBISHI MONTERO SPORT TM|7|704|5|20.0|MONTERO SPORT T|6G72PS041/JMYONK960340002|3||3|20|814|01/22/2004|DO|1.0|34344.0|34344.0|1||572.4|0.0|34344.0|0.0|0.0|0.0|E1MARYER|2004-11-11 15:44:01|
1|269|D|VIDEOPROJETCOT|6|503|3|33.0|VIDEOPROJETCOR||3||3|18|821|03/03/2004|DO|1.0|1730.0|1730.0|1||47.58|0.0|1730.0|0.0|0.0|0.0|E1MARYER|2004-11-11 15:51:07|
1|270|S|ESTACION DE TRABAJO|4|401|10|10.0|1400X1400 FORMI||3||3|19|732|04/02/2004|DO|1.0|236.7|236.7|1||1.97|0.0|159.44|0.0|0.0|0.0|E1MARYER|2004-11-11 15:55:54|
1|271|S|ARCHIVADOR AERERO CON RIELES TELESCOPIC|4|402|10|10.0|ARCHIVADOR||3||3|19|732|05/28/2004|DO|1.0|85.5|85.5|1||0.71|0.0|56.16|0.0|0.0|0.0|E1MARYER|2004-11-11 16:20:07|
1|272|S|ESTACION DE TRABAJO FORMICA|4|402|10|10.0|ESTACION|1400 X 1400|3||3|19|732|05/28/2004|DO|1.0|236.7|236.7|||1.97|0.0|155.82|0.0|0.0|0.0|E1MARYER|2004-11-11 16:22:18|
1|273|D|CISCO 1751 10/100 MODULAR ROUTER|6|504|3|33.0|WNOICE 32 F/96D|JMX0812T082/JMX0810T0W1|3||3|18|913|06/04/2004|DO|1.0|3528.74|3528.74|1||97.04|0.0|3528.74|0.0|0.0|0.0|E1MARYER|2004-11-11 16:24:21|
1|274|S|DESTRUCTORA DE PAPEL|4|401|10|10.0|CONFETTI GBC|955X9HJS|3||3|19|882|08/06/2004|DO|1.0|485.0|485.0|1||4.04|0.0|310.3|0.0|0.0|0.0|E1MARYER|2004-11-11 16:29:14|
1|275|S|CREDENZA LATERAL MIXTA|4|401|10|10.0|HNELEC|AGF|3||3|19|644|08/09/2004|DO|1.0|558.6|558.6|1||4.66|0.0|357.47|0.0|0.0|0.0|E1MARYER|2004-11-11 16:32:05|
1|276|S|SOLDADORA MIG MONF.|4|202|10|10.0|MILLERMATIC 150||3||3|19|198|08/31/2004|DO|1.0|980.4|980.4|1||8.17|0.0|620.92|0.0|0.0|0.0|E1MARYER|2004-11-11 16:35:09|
1|277|D|COMPUTADOR CLON INTEL PENTIUM IV|6|501|3|33.0|PENTIUM IV||3|2677|3|18|677|05/18/2004|DO|1.0|877.0|877.0|1||24.12|0.0|877.0|0.0|0.0|0.0|E1MARYER|2004-11-11 16:40:54|
1|278|D|MONITOR SAMGUNG 15'|6|603|3|33.0||N/S LE15HCDX812363|3|4386|3|18|677|12/16/2004|DO|1.0|95.0|95.0|1||2.61|0.0|95.0|0.0|0.0|0.0|ADMINUIO|2004-12-16 09:56:14|
1|279|D|ELS-16 TERM.SERVER ENET 16-SER EQUINO(2)|6|604|3|33.0|MODELO 990209|200;201|3|4770|3|18|677|01/28/2005|DO|1.0|1200.0|1200.0|1||33.0|0.0|1200.0|0.0|0.0|0.0|E1EDWMUN|2005-01-28 17:38:48|
1|280|D|MOTO GALARDI GL200GY-2 COLOR ROJO 2005|7|701|5|20.0|2005|163FML51001279|3|5078|3|20|992|02/28/2005|DO|1.0|1782.14|1782.14|1||29.7|0.0|1782.14|0.0|0.0|0.0|ADMINUIO|2005-02-28 12:24:59|
1|281|S|COPIADORA RICOH AF1113|4|401|10|10.0|AF 1113||3|5229|3|19|577|03/14/2005|DO|1.0|1450.0|1450.0|1||12.08|0.0|840.14|0.0|0.0|0.0|ADMINUIO|2005-03-14 14:33:58|
1|282|D|COMPUTADORA PORTATIL|6|501|3|33.0|EVO-NX9040|CNF43825PN|3|5361|3|18|580|03/29/2005|DO|1.0|2075.0|2075.0|1||57.06|0.0|2075.0|0.0|0.0|0.0|E1MARYER|2005-03-29 11:04:58|
1|283|D|SWITCH 3COM 8 PUERTOS RJ45 10/100|6|504|3|33.0||LW2G4E0459401|3|5514|3|18|580|04/14/2005|DO|1.0|70.0|70.0|1||1.93|0.0|70.0|0.0|0.0|0.0|ADMINUIO|2005-04-14 17:29:10|
1|284|D|COMPUTADORA PENTIUM IV 3 GHZ|6|601|3|33.0|P-IV 3 GHZ 80G||3|5940|3|18|1017|05/26/2005|DO|1.0|1060.0|1060.0|1||29.15|0.0|1060.0|0.0|0.0|0.0|ADMINUIO|2005-05-26 16:45:43|
1|285|D|COMPUTADOR ATX INTEL PENTIUM IV 3.0GHZ|6|601|3|33.0|LICENC WINXP OF||3|6363|3|18|580|07/12/2005|DO|1.0|1079.0|1079.0|1||29.67|0.0|1079.0|0.0|0.0|0.0|ADMINUIO|2005-07-12 10:02:39|
1|286|D|UPS POWERWARE 9120 DE 2KVA|6|609|3|33.0|||3|6721|4|18|1088|08/11/2005|DO|1.0|886.5|886.5|1||24.38|0.0|886.5|0.0|0.0|0.0|ADMINUIO|2005-08-11 10:03:45|
1|287|D|SERVIDOR HP COMPAQ PROLIANT ML350G4|6|601|3|33.0|PROLIANT ML350G|BRC52210CC|3|7126|3|18|580|09/15/2005|DO|1.0|4250.0|4250.0|1||116.88|0.0|4250.0|0.0|0.0|0.0|ADMINUIO|2005-09-15 10:28:17|
1|288|D|MONITOR SAMSUNG SVGA 15|6|603|3|33.0|||3|7313|3|18|1048|09/28/2005|DO|1.0|95.0|95.0|1||2.61|0.0|95.0|0.0|0.0|0.0|ADMINUIO|2005-09-28 12:23:26|
1|289|D|MONITOR SAMSUNG SVGA 15 P|6|603|3|33.0|||3|7313|3|18|1048|09/28/2005|DO|1.0|95.0|95.0|1||2.61|0.0|95.0|0.0|0.0|0.0|ADMINUIO|2005-09-28 12:24:15|
1|290|V|CAMIONETA CHEVROLET DOBLE CABINA|7|701|5|20.0|2002|C22NE25065771|3|7789|3|20|1137|10/28/2005|DO|1.0|11920.0|11920.0|1|08/26/2010|198.67|0.0|11920.0|0.0|0.0|0.0|E1MARYER|2005-10-28 11:27:21|
1|291|D|COMPUTADOR INTEL PIV 3GHZ 2 DISCO DURO|6|601|3|33.0|INTEL PIV 3GHZ||3|7854|3|18|580|11/04/2005|DO|1.0|830.0|830.0|1||22.83|0.0|830.0|0.0|0.0|0.0|ADMINUIO|2005-11-04 10:27:53|
1|292|D|COMPUTADOR PIV 3.OGHZ 915 S775|6|601|3|33.0|INTEL 915 S775||3|7855|3|18|1142|11/04/2005|DO|1.0|1142.48|1142.48|1||31.42|0.0|1142.48|0.0|0.0|0.0|ADMINUIO|2005-11-04 10:34:59|
1|293|D|COMPUTADOR AMD K7 MOD 3600 C/LICEN.WINXP|6|601|3|33.0|AMD K7 MOD 3600||3|8079|3|18|1154|11/21/2005|DO|1.0|648.0|648.0|1||17.82|0.0|648.0|0.0|0.0|0.0|ADMINUIO|2005-11-21 10:39:43|
1|294|D|COMPUTADOR AMD-K7 MOD3600 C/LIC.WINXP|6|601|3|33.0|AMD-K7 MOD 3600||3|8079|3|18|1154|11/21/2005|DO|1.0|648.0|648.0|1||17.82|0.0|648.0|0.0|0.0|0.0|ADMINUIO|2005-11-21 10:44:54|
1|295|V|FORD EXPLORED XLT 4X4|7|701|5|20.0|EXPLORES XLT 4X|AJU3VP30263|3|8108|3|20|1155|11/23/2005|DO|1.0|10707.0|10707.0|1||178.45|0.0|10707.0|0.0|0.0|0.0|E1MARYER|2005-11-23 11:22:21|
1|296|D|COMPUTADOR AMD K7 MOD 3600 C/LIC WIN XP|6|601|3|33.0|AMD K7 MOD 3600||3|8331|3|18|1154|12/09/2005|DO|1.0|648.0|648.0|1||17.82|0.0|648.0|0.0|0.0|0.0|ADMINUIO|2005-12-09 11:58:36|
1|297|D|COMPUTADOR AMD-K7 MOD 3600 C/LIC XP|6|601|3|33.0|AMD K7 MOD 3600||3|8331|3|18|1154|12/09/2005|DO|1.0|648.0|648.0|1||17.82|0.0|648.0|0.0|0.0|0.0|ADMINUIO|2005-12-09 12:00:14|
1|298|D|IMPRESORA EPSON FX-890|6|602|3|33.0|EPSON FX-890||3|8331|3|18|1154|12/09/2005|DO|1.0|350.0|350.0|1||9.63|0.0|350.0|0.0|0.0|0.0|ADMINUIO|2005-12-09 12:02:32|
1|299|D|IMPRESORA EPSON FX 890|6|602|3|33.0|EPSON FX-890||3|8331|3|18|1154|12/09/2005|DO|1.0|350.0|350.0|1||9.63|0.0|350.0|0.0|0.0|0.0|ADMINUIO|2005-12-09 12:04:26|
1|300|D|IMPRESORA EPSON  FX-890|6|602|3|33.0|EPSON FX-890||3|8331|3|18|1154|12/09/2005|DO|1.0|350.0|350.0|1||9.63|0.0|350.0|0.0|0.0|0.0|ADMINUIO|2005-12-09 12:06:44|
1|301|S|CHASIS CABINADO HINO 7961CC.EURO 2 BLANC|7|701|5|20.0|GGD1JLUA|MOTOR J08CTW14179|3|8827|3|20|1194|02/06/2006|DO|1.0|42240.0|42240.0|1||704.0|0.0|41385.14|0.0|0.0|0.0|E1MARYER|2006-02-06 09:11:17|
1|302|D|COMPUT.INTEL P4 3GHZ C/CDRW,LIC XP,OFFIC|6|606|3|33.0|||3|8958|3|18|1142|02/15/2006|DO|1.0|1053.87|1053.87|||28.98|0.0|1053.87|0.0|0.0|0.0|ADMINUIO|2006-02-15 14:49:54|
1|303|D|SCANNER HP 4070 C NP:L1920A|6|603|3|33.0|||3|8956|3|18|1142|02/15/2006|DO|1.0|109.0|109.0|||3.0|0.0|109.0|0.0|0.0|0.0|ADMINUIO|2006-02-15 14:56:21|
1|304|S|MUEBLES Y ENSERES PARA AREA ADMINISTRAC.|4|401|10|10.0|||3|9145|3|19|1212|03/06/2006|DO|1.0|5280.0|5280.0|1||44.0|0.0|2543.48|0.0|0.0|0.0|E1MARYER  |2006-03-04 15:26:35|
1|305|S|MUEBLES PARA DEPTO.SISTEMAS E IMPORTAC.|4|401|10|10.0|||3|9150|3|19|1212|03/06/2006|DO|1.0|5170.0|5170.0|1||43.08|0.0|2490.3|0.0|0.0|0.0|E1MARYER  |2006-03-04 15:34:01|
1|306|S|MUEBLES AREA SISTEMAS-IMPORTACIONES|4|401|10|10.0|||3|9153|3|19|1212|03/06/2006|DO|1.0|5000.0|5000.0|||41.67|0.0|2408.79|0.0|0.0|0.0|E1MARYER  |2006-03-04 15:38:05|
1|307|S|MUEBLES PARA AREA TECNICA|4|404|10|10.0|||3|9154|3|19|1212|03/06/2006|DO|1.0|14100.0|14100.0|1||117.5|0.0|6792.26|0.0|0.0|0.0|E1MARYER  |2006-03-04 15:40:08|
1|308|S|MUEBLES,MESAS,SILLAS,AREA TECNICA|4|404|10|10.0|||3|9155|3|19|1212|03/06/2006|DO|1.0|4070.0|4070.0|||33.92|0.0|1960.79|0.0|0.0|0.0|E1MARYER  |2006-03-04 15:43:01|
1|309|S|MUEBLES AREA DE CONTABILIDAD|4|401|10|10.0|||3|9156|3|19|1212|03/06/2006|DO|1.0|5310.0|5310.0|1||44.25|0.0|2557.94|0.0|0.0|0.0|E1MARYER  |2006-03-04 15:44:43|
1|310|S|MUEBLES AREA DE COMEDOR|4|401|10|10.0|||3|9157|3|19|1212|03/06/2006|DO|1.0|2245.0|2245.0|||18.71|0.0|1081.56|0.0|0.0|0.0|E1MARYER  |2006-03-04 15:46:52|
1|311|S|MUEBLES AREA DE VENTAS|4|402|10|10.0|||3|9158|3|19|1212|03/06/2006|DO|1.0|2240.0|2240.0|1||18.67|0.0|1079.25|0.0|0.0|0.0|E1MARYER  |2006-03-04 15:50:08|
1|312|S|MUEBLES AREA CAPACITACION Y KARDEX|4|402|10|10.0|||3|9159|3|19|1212|03/06/2006|DO|1.0|9485.0|9485.0|1||79.04|0.0|4569.02|0.0|0.0|0.0|E1MARYER  |2006-03-04 15:51:53|
1|313|S|DIVISIONES MODULARES (LOCAL PRENSA)|4|412|10|10.0|||3|9160|3|19|1212|03/06/2006|DO|1.0|36159.6|36159.6|1||301.33|0.0|17418.82|0.0|0.0|0.0|E1MARYER  |2006-03-06 15:25:41|
1|314|S|CARROC.MET.TIPO PLATAFORMA (HINO 2006)|7|701|5|20.0|C.S.5-6.20||3|9202|3|20|1213|03/09/2006|DO|1.0|4865.0|4865.0|1||81.08|0.0|4679.1|0.0|0.0|0.0|E1MARYER  |2006-03-09 09:32:11|
1|315|D|COMPUTADOR INTEL PIV 3GHZ C/LIC WIN,OFIC|6|601|3|33.0|||3|9279|3|18|1142|03/17/2006|DO|1.0|1069.0|1069.0|1||29.4|0.0|1069.0|0.0|0.0|0.0|ADMINUIO  |2006-03-17 09:24:34|
1|316|D|UPS POWERWARE 91070 12KVA 12 SLOTS|6|604|3|33.0|||3|9280|3|18|1088|03/17/2006|DO|1.0|9594.0|9594.0|||263.84|0.0|9594.0|0.0|0.0|0.0|ADMINUIO  |2006-03-17 09:43:50|
1|317|S|MONITOR 17" LCD SAMSUNG|6|603|3|33.0|740NW||3|16261|3|18|1322|02/08/2008|DO|1.0|201.6|201.6|1||5.54|0.0|192.37|0.0|0.0|0.0|ADMINUIO  |2006-04-05 09:11:22|
1|318|D|TERMINAL CONTROL ASISTENCIA Y SOFTWARE|6|606|3|33.0||1166178|3|9607|3|18|1227|04/17/2006|DO|1.0|2087.0|2087.0|1||57.39|0.0|2087.0|0.0|0.0|0.0|ADMINUIO  |2006-04-17 10:59:24|
1|319|D|COMPUTADOR INTEL D915PGNL 3.2GHZ C/LICEN|6|601|3|33.0|||3|9900|3|18|1154|05/09/2006|DO|1.0|987.0|987.0|1||27.14|0.0|987.0|0.0|0.0|0.0|ADMINUIO  |2006-05-09 11:50:33|
1|320|D|(8)COMPUTS.INTEL P4 2.66GHZ C/LICENCIA|6|601|3|33.0|||3|10111|3|18|580|05/31/2006|DO|1.0|4983.68|4983.68|1||137.05|0.0|4983.68|0.0|0.0|0.0|ADMINUIO  |2006-05-31 12:35:41|
1|321|D|SWITCH 3COM 10/100|6|604|3|33.0|24 PUERTOS|3C16471|3|10113|3|18|580|09/15/2006|DO|1.0|138.0|138.0|1||3.8|0.0|138.0|0.0|0.0|0.0|ADMINUIO  |2006-05-31 12:44:53|
1|322|D|COMPUTADOR P4 2.66 GHZ C/LIC.WIN XP DVD-|6|601|3|33.0|||3|10196|3|18|580|06/07/2006|DO|1.0|656.0|656.0|1||18.04|0.0|656.0|0.0|0.0|0.0|ADMINUIO  |2006-06-07 16:04:36|
1|323|D|COMPUTADOR P4  2.66 GHZ C/LICEN WIN XP|6|601|3|33.0|||3|10196|3|18|580|06/07/2006|DO|1.0|608.0|608.0|1||16.72|0.0|608.0|0.0|0.0|0.0|ADMINUIO  |2006-06-07 16:18:53|
1|324|D|DISCO DURO HP 72GB 10K ULTRA 320 SCSI|6|603|3|33.0|332751-B21|PHH612JOAG|3|10388|3|18|580|06/23/2006|DO|1.0|408.0|408.0|1||11.22|0.0|408.0|0.0|0.0|0.0|E1EDWMUN  |2006-06-23 11:39:45|
1|325|D|MONITOR DELL FLAT PANEL|6|601|3|33.0|2405FP 24" ULTR||3|10405|3|18|1278|06/26/2006|DO|1.0|1155.0|1155.0|1||31.76|0.0|1155.0|0.0|0.0|0.0|E1EDWMUN  |2006-06-26 14:45:34|
1|326|D|SERVIDOR HP ML150 G2 XEON 3.2 GHZ 2M/512|6|601|3|33.0|380192-001||3|10404|3|18|1278|06/26/2006|DO|1.0|3327.0|3327.0|1||91.49|0.0|3327.0|0.0|0.0|0.0|E1EDWMUN  |2006-06-26 14:53:45|
1|327|D|SCANNER HP 4070|6|603|3|33.0|HP 4070||3|10428|3|18|580|06/27/2006|DO|1.0|110.0|110.0|1||3.03|0.0|110.0|0.0|0.0|0.0|E1EDWMUN  |2006-06-27 15:35:46|
1|328|D|COMPUTADOR INTEL PENTIUM 4 2.66 GHZ|6|601|3|33.0|PIV 2.66 GHZ||3|10433|3|18|580|06/27/2006|DO|1.0|656.0|656.0|1||18.04|0.0|656.0|0.0|0.0|0.0|E1EDWMUN  |2006-06-27 16:23:17|
1|329|D|MONITOR SAMSUNG 19" 910/920 LCD TFT|6|603|3|33.0|MU19HVFL201559||3|10509|3|18|580|07/05/2006|DO|1.0|460.0|460.0|1||12.65|0.0|460.0|0.0|0.0|0.0|ADMINUIO  |2006-07-05 09:22:10|
1|330|S|MUEBLES Y ENSERES AREA ADMINST.2DA.PARTE|4|401|10|10.0|||3|10837|3|19|1212|08/09/2006|DO|1.0|4084.4|4084.4|1||34.04|0.0|1794.24|0.0|0.0|0.0|E1MARYER  |2006-08-09 09:10:51|
1|331|S|MUEBLES AREA SISTEMAS-IMPORTAC.2DA.PARTE|4|401|10|10.0|||3|10838|3|19|1212|08/09/2006|DO|1.0|1878.0|1878.0|1||15.65|0.0|824.91|0.0|0.0|0.0|E1MARYER  |2006-08-09 09:14:37|
1|332|S|ARCHIVADOR,CLOSET,CREDENZA AREA TECNICA|4|401|10|10.0|||3|10839|3|19|1212|08/09/2006|DO|1.0|740.8|740.8|1||6.17|0.0|325.22|0.0|0.0|0.0|E1MARYER  |2006-08-09 09:23:53|
1|333|S|MUEBLES AREA CONTABILIDAD 2DA.PARTE|4|401|10|10.0|||3|10840|3|19|1212|08/09/2006|DO|1.0|777.0|777.0|1||6.48|0.0|341.56|0.0|0.0|0.0|E1MARYER  |2006-08-09 09:27:53|
1|334|S|MUEBLES Y ENSERES AREA BIBLIOTECA|4|401|10|10.0|||3|10841|3|19|1212|08/09/2006|DO|1.0|3264.0|3264.0|1||27.2|0.0|1433.7|0.0|0.0|0.0|E1MARYER  |2006-08-09 09:30:30|
1|335|S|MUEBLE ARCHIVO CONTABILIDAD|4|401|10|10.0|||3|10842|3|19|1212|08/09/2006|DO|1.0|2702.4|2702.4|1||22.52|0.0|1187.02|0.0|0.0|0.0|E1MARYER  |2006-08-09 09:32:08|
1|336|S|MUEBLE RECEPCION|4|401|10|10.0|||3|10843|3|19|1212|08/09/2006|DO|1.0|1982.0|1982.0|1||16.52|0.0|870.76|0.0|0.0|0.0|E1MARYER  |2006-08-09 09:33:59|
1|337|S|ESCRTORIO Y SILLA DEPTO.OPS (J.Y.)|4|401|10|10.0|||3|10844|3|19|1212|08/09/2006|DO|1.0|940.0|940.0|1||7.83|0.0|412.72|0.0|0.0|0.0|E1MARYER  |2006-08-09 09:34:57|
1|338|S|MUEBLES Y ENSERES CAJA (ALMACEN)|4|401|10|10.0|||3|10845|3|19|1212|08/09/2006|DO|1.0|5293.5|5293.5|1||44.11|0.0|2325.02|0.0|0.0|0.0|E1MARYER  |2006-08-09 09:36:45|
1|339|S|MUEBLES BODEGAS Y GARITAS|4|401|10|10.0|||3|10846|3|19|1212|08/09/2006|DO|1.0|1380.0|1380.0|1||11.5|0.0|606.16|0.0|0.0|0.0|E1MARYER  |2006-08-09 09:37:55|
1|340|S|ARCHIVOS,MESA DE REUNIONES ALMACEN|4|401|10|10.0|||3|10847|3|19|1212|08/09/2006|DO|1.0|978.0|978.0|1||8.15|0.0|429.58|0.0|0.0|0.0|E1MARYER  |2006-08-09 09:39:09|
1|341|S|MUEBLES SALA ENFERMERIA|4|401|10|10.0|||3|10848|3|19|1212|08/09/2006|DO|1.0|485.0|485.0|1||4.04|0.0|212.95|0.0|0.0|0.0|E1MARYER  |2006-08-09 09:40:44|
1|342|B|DIVISIONES MODULARES PISO TECHO|3|304|10|10.0|||3|10849|3|16|1212|08/09/2006|DO|1.0|10954.42|10954.42|1||91.29|0.0|0.0|0.0|0.0|0.0|E1MARYER  |2006-08-09 09:41:58|
1|343|V|LOTIZACION PONCIANO,LOTE 171,COTOCOLLAO|1|100|9999|0.0|||3|10895|3|21|1306|08/14/2006|DO|1.0|495000.0|495000.0|1|10/13/2010|0.0|0.0|495000.0|0.0|0.0|0.0|E1ELINEV  |2006-08-14 12:20:03|
1|344|V|LOTIZACION PONCIANO,LOTE 172,COTOCOLLAO|1|100|9999|0.0|||3|10896|3|21|1307|08/14/2006|DO|1.0|385000.0|385000.0|1|10/13/2010|0.0|0.0|385000.0|0.0|0.0|0.0|E1ELINEV  |2006-08-14 12:50:55|
1|345|S|TABLERO DE PRUEBAS DE ARRANQUES Y-A 220V|4|404|10|10.0|Y-A 220V-460V||3|11014|3|19|1002|08/24/2006|DO|1.0|2098.17|2098.17|1||17.48|0.0|912.91|0.0|0.0|0.0|ADMINUIO  |2006-08-24 09:07:40|
1|346|D|ACCESS POINT CISCO 11 MB A/B/G ACCESS|6|604|3|33.0|||3|11242|3|18|913|09/18/2006|DO|1.0|869.0|869.0|1||23.9|0.0|869.0|0.0|0.0|0.0|ADMINUIO  |2006-09-15 16:44:40|
1|347|D|IMPRESORA EPSON LX-300+|6|602|3|33.0|||3|11323|3|18|1154|09/25/2006|DO|1.0|198.0|198.0|1||5.45|0.0|198.0|0.0|0.0|0.0|ADMINUIO  |2006-09-25 15:42:13|
1|348|D|IMPRESORA EPSON LX 300+|6|602|3|33.0|||3|11323|3|18|1154|09/25/2006|DO|1.0|198.0|198.0|1||5.45|0.0|198.0|0.0|0.0|0.0|ADMINUIO  |2006-09-25 15:51:50|
1|349|D|IMPRESORA EPSON FX890|6|602|3|33.0||E8BY197555|3|11378|3|18|1322|09/29/2006|DO|1.0|335.0|335.0|1||9.21|0.0|335.0|0.0|0.0|0.0|ADMINUIO  |2006-09-29 16:13:41|
1|350|S|EDIFICIO AV.DE LA PRENSA N45-14 Y EL TEL|2|201|20|5.0|||3||3|15|198|05/31/2006|DO|1.0|2357687.16|2357687.16|1||9823.7|0.0|540303.5|0.0|0.0|0.0|ADMINUIO  |2006-10-19 10:12:31|
1|351|S|INSTALACION AV.DE LA PRENSA N45-14 Y TEL|3|304|10|10.0|||3||3|16|198|02/28/2007|DO|1.0|531345.6|531345.6|1||4427.88|0.0|203682.48|0.0|0.0|0.0|ADMINUIO  |2006-10-19 10:18:00|
1|352|D|COMPUTADOR CORE 2 2.13GHZ C/WINXP Y OFFI|6|601|3|33.0|CORE 2 2.13GHZ||3|11679|3|18|1322|10/27/2006|DO|1.0|1205.19|1205.19|1||33.14|0.0|1205.19|0.0|0.0|0.0|ADMINUIO  |2006-10-27 11:25:17|
1|353|D|IMPRESORA LASER HP|6|602|3|33.0|HP 3005 DN|CND1S04792|3|12289|3|18|1322|12/28/2006|DO|1.0|987.2|987.2|1||27.15|0.0|987.2|0.0|0.0|0.0|FOBOS     |2006-12-28 10:07:49|
1|354|D|IMPRESORA LASER HP 1022|6|602|3|33.0|HP 1022|CNBKB37334|3|12301|3|18|1322|12/29/2006|DO|1.0|188.0|188.0|1||5.17|0.0|188.0|0.0|0.0|0.0|FOBOS     |2006-12-29 11:32:52|
1|355|D|HP BUSINESS NOTEBOOK|6|601|3|33.0|BUSINESS NX6320|CNU6390FGJ|3|12514|3|18|1322|01/26/2007|DO|1.0|1487.6|1487.6|1||40.91|0.0|1487.6|0.0|0.0|0.0|FOBOS     |2007-01-26 09:53:44|
1|356|D|COMPUTADOR INTERL CORE 2 DUO 1.86 GHZ|6|601|3|33.0|CORE 2 DUO 1.86||3|12580|3|18|1322|01/31/2007|DO|1.0|1161.7|1161.7|1||31.95|0.0|1161.7|0.0|0.0|0.0|FOBOS     |2007-01-31 18:01:47|
1|357|D|COMPUTADOR INTERL CORE 2 DUO 1.86 GH|6|601|3|33.0|CORE 2 DUO 1.86||3|12581|3|18|1322|01/31/2007|DO|1.0|1161.7|1161.7|1||31.95|0.0|1161.7|0.0|0.0|0.0|FOBOS     |2007-01-31 18:09:38|
1|358|D|SCANNER HP SCANJET G3010 4800X9600 DPI|6|603|3|33.0|SCANJET G3010||3|12582|3|18|1322|01/31/2007|DO|1.0|108.93|108.93|1||3.0|0.0|108.93|0.0|0.0|0.0|FOBOS     |2007-01-31 18:11:43|
1|359|S|ESTACION DE TRABAJO PARA VTAS.SANITARIOS|4|402|10|10.0|||3|12698|3|19|1340|02/12/2007|DO|1.0|465.0|465.0|1||3.88|0.0|180.7|0.0|0.0|0.0|E1MARYER  |2007-02-12 12:04:08|
1|360|V|AUTO CHEVROLET SPARK 5 PUERTAS 2007|7|701|5|20.0|SPARK 5P STD|B10S170D438KA2|3|12739|3|20|1093|02/14/2007|DO|1.0|7906.5|7906.5|1||131.78|0.0|7906.5|0.0|0.0|0.0|E1MARYER  |2007-02-14 17:03:52|
1|361|B|JEEP LAND ROVER DISCOVERY V6|7|701|5|20.0|DISCOVERY V6 5D|SALLAAA147A415471|3|13532|3|20|1403|05/03/2007|DO|1.0|72321.43|72321.43|||1205.36|0.0|0.0|0.0|0.0|0.0|E1MARYER  |2007-05-03 17:35:42|
1|362|D|COMPUTADOR INTEL CORE 2 2.13 GHZ C/DVD-W|6|601|3|33.0|PC-165R-C2-1G-3||3|13558|3|18|1407|05/07/2007|DO|1.0|853.0|853.0|1||23.46|0.0|853.0|0.0|0.0|0.0|ADMINUIO  |2007-05-07 11:32:49|
1|363|D|IMPRESORA LASER HP1022|6|602|3|33.0|HP 1022|Q5912A|3|13601|3|18|1322|05/09/2007|DO|1.0|185.0|185.0|1||5.09|0.0|185.0|0.0|0.0|0.0|ADMINUIO  |2007-05-09 10:40:14|
1|364|D|LICENCIA OFFICE 2007 PRO INGLES|6|606|3|33.0|||3|13819|3|18|1407|05/29/2007|DO|1.0|410.0|410.0|1||11.28|0.0|410.0|0.0|0.0|0.0|ADMINUIO  |2007-05-29 08:33:30|
1|365|B|ADICIONAL INSTALACIONES AV.DE LA PRENSA|3|304|10|10.0|||3||3|16|1096|06/06/2007|DO|1.0|14109.91|14109.91|1||117.58|0.0|0.0|0.0|0.0|0.0|E1MARYER  |2007-06-11 15:48:54|
1|366|D|COMPU.WIN/OFF DUAL CORE 3.2 GHZ HD-80GB|6|601|3|33.0|ATX P4 946GZIS||3|14360|3|18|1322|07/17/2007|DO|1.0|918.57|918.57|1||25.26|0.0|918.57|0.0|0.0|0.0|FOBOS     |2007-07-17 16:45:29|
1|367|D|IMPRESORA LASER HP1022 (DPTO.TEC)|6|602|3|33.0|HP 1022|VNB3N34492|3|14918|3|18|1322|09/21/2007|DO|1.0|183.68|183.68|1||5.05|0.0|183.68|0.0|0.0|0.0|FOBOS     |2007-09-20 11:49:15|
1|368|D|WORKSTATION MICROTORRE HP XW6400|6|601|3|33.0|RY827LA#ABA||3|14920|3|18|1224|09/21/2007|DO|1.0|5517.0|5517.0|1||151.72|0.0|5517.0|0.0|0.0|0.0|ADMINUIO  |2007-09-21 10:32:17|
1|369|D|IMPRESORA EPSON FX- 890 (DOS)|6|602|3|33.0|||3|15346|3|18|1322|11/01/2007|DO|1.0|676.1|676.1|1||18.59|0.0|676.1|0.0|0.0|0.0|ADMINUIO  |2007-11-01 17:35:39|
1|370|D|COMPUTADOR INTEL 1333 MHZ C/LICENCIA XP|6|601|3|33.0|INTEL CORE 2 DU||3|15369|3|18|1442|11/07/2007|DO|1.0|828.0|828.0|1||22.77|0.0|828.0|0.0|0.0|0.0|ADMINUIO  |2007-11-07 08:58:43|
1|371|D|IMPRESORA HO LASERJET 1022N C/CABLE USB|6|602|3|33.0|1022N||3|15696|3|18|1322|12/10/2007|DO|1.0|285.6|285.6|1||7.85|0.0|285.6|0.0|0.0|0.0|ADMINUIO  |2007-12-10 09:45:01|
1|372|S|INSTALACIONES LOCAL PRENSA|3|304|10|10.0|||3||3|16|198|06/30/2007|DO|1.0|14109.91|14109.91|1||117.58|0.0|4938.36|0.0|0.0|0.0|E1MARYER  |2008-01-07 16:09:06|
1|373|S|IMPRESORA EPSON FX- 890|6|602|3|33.0|E8BY317772||3|16346|3|18|1322|02/15/2008|DO|1.0|345.93|345.93|1||9.51|0.0|327.93|0.0|0.0|0.0|ADMINUIO  |2008-02-15 14:57:21|
1|374|S|IMPRESORA EPSON  FX 890|6|602|3|33.0|E8BY317786||3|16346|3|18|1322|02/15/2008|DO|1.0|345.93|345.93|1||9.51|0.0|327.93|0.0|0.0|0.0|ADMINUIO  |2008-02-15 14:58:31|
1|375|S|COMP.INTEL C2QUAD 2.40GHZ HD320 GB|6|601|3|33.0|||3|16345|3|18|1322|02/15/2008|DO|1.0|994.2|994.2|1||27.34|0.0|942.76|0.0|0.0|0.0|ADMINUIO  |2008-02-15 14:59:44|
1|376|S|COMPUTADOR CORE 2 2.33GHZ C/WINXP,OFFFIC|6|601|3|33.0|CORE DUO 2.33GH||3|16506|3|18|1322|03/03/2008|DO|1.0|1205.68|1205.68|1||33.16|0.0|1124.23|0.0|0.0|0.0|ADMINUIO  |2008-03-03 16:24:37|
1|377|S|IMPRESORA HP-1200 LASERJET|6|602|3|33.0|||3|16682|3|18|1442|03/18/2008|DO|1.0|178.0|178.0|1||4.9|0.0|163.75|0.0|0.0|0.0|ADMINUIO  |2008-03-18 15:22:31|
1|378|S|COMPUT. C2QUAD 2.4GHZ C/OFFICE,WIN_VISTA|6|601|3|33.0|||3|16768|3|18|1322|03/26/2008|DO|1.0|1270.23|1270.23|1||34.93|0.0|1158.32|0.0|0.0|0.0|ADMINUIO  |2008-03-26 16:51:49|
1|379|S|SWITCH DATOS 3COM|6|604|3|33.0|4500-26 PUERTOS|GW.OF.113.08|3|17176|3|18|582|04/29/2008|DO|1.0|694.0|694.0|1||19.09|0.0|611.52|0.0|0.0|0.0|ADMINUIO  |2008-04-29 15:34:44|
1|380|S|NOTEBOOK DELL C/WINDOWS Y OFFICE 2007|6|601|3|33.0|VOSTO 1400|6739186321|3|17491|3|18|1322|05/28/2008|DO|1.0|1247.0|1247.0|1||34.29|0.0|1066.31|0.0|0.0|0.0|ADMINUIO  |2008-05-28 16:59:18|
1|381|S|IMPRESORA FX-890 MATRICIAL|6|602|3|33.0|FX-890||3|17926|3|18|1442|06/30/2008|DO|1.0|365.0|365.0|1||10.04|0.0|301.2|0.0|0.0|0.0|ADMINUIO  |2008-06-30 15:08:06|
1|382|S|NOTBOOK HP 6720S C2D 2.1GHZ 2GB 160GB|6|601|3|33.0|HP6720S||3|18420|3|18|1570|08/11/2008|DO|1.0|1125.0|1125.0|1||30.94|0.0|886.28|0.0|0.0|0.0|E1EDWMUN  |2008-08-11 17:24:15|
1|383|S|SERVIDOR INTEL ENTRY SERVER BOARD S3000|6|601|3|33.0|S3000AHV MULTI ||3|18423|3|18|1442|08/12/2008|DO|1.0|1285.0|1285.0|1||35.34|0.0|1011.18|0.0|0.0|0.0|E1EDWMUN  |2008-08-12 09:01:35|
1|384|S|SILLON AERON CHAIRS|4|401|10|10.0|AERON CHAIRS||3|18510|3|19|1585|08/18/2008|DO|1.0|1248.0|1248.0|1||10.4|0.0|295.56|0.0|0.0|0.0|E1MARYER  |2008-08-18 15:06:38|
1|385|S|SCANNER HP 5590(ALTO RENDIMIENTO OFICINA|6|603|3|33.0|HP 5590||3|19032|3|18|1322|09/26/2008|DO|1.0|312.48|312.48|1||8.59|0.0|233.08|0.0|0.0|0.0|E1EDWMUN  |2008-09-26 17:16:15|
1|386|S|IMPRESORA EPSON FX-890 (2)|6|602|3|33.0|EPSON FX-890|E8BY354737, E8BY355488|3|19047|3|18|1570|09/29/2008|DO|1.0|640.0|640.0|1||17.6|0.0|475.79|0.0|0.0|0.0|E1EDWMUN  |2008-09-29 17:45:26|
1|387|S|SWITCH 3COM|6|603|3|33.0|4500 26 PORT|YECF9WMCEBC00|3|19290|3|18|1442|10/22/2008|DO|1.0|658.0|658.0|1||18.1|0.0|475.85|0.0|0.0|0.0|E1EDWMUN  |2008-10-22 10:39:25|
1|388|S|COMPUTADOR PORTATIL HP PAVILION DV7-1075|6|601|3|33.0|HP PAVILION DV7|CND83436SH|3|20464|3|18|885|01/29/2009|DO|1.0|1975.0|1975.0|1||54.31|0.0|1252.63|0.0|0.0|0.0|ADMINUIO  |2009-01-29 11:44:35|
1|389|S|IMPRESORA EPSON FX-890 MATRICIAL|6|602|3|33.0||E8BY359802|3|20683|3|18|1570|02/13/2009|DO|1.0|339.0|339.0|1||9.32|0.0|210.03|0.0|0.0|0.0|ADMINUIO  |2009-02-13 14:49:03|
1|390|S|COMPUTADOR CON LICENCIA Y LCD|6|601|3|33.0|||3|20751|3|18|1570|02/18/2009|DO|1.0|671.0|671.0|1||18.45|0.0|412.49|0.0|0.0|0.0|ADMINUIO  |2009-02-18 11:04:26|
1|391|S|COMPUTADOR CON MONITOR LCD|6|601|3|33.0|||3|20752|3|18|1570|02/18/2009|DO|1.0|444.0|444.0|1||12.21|0.0|272.98|0.0|0.0|0.0|ADMINUIO  |2009-02-18 11:24:36|
1|392|S|IMPRESORA HP LASERJET MULTIFUNCION|6|602|3|33.0|CB534A|SCND88DC1N2|3|21051|3|18|580|03/16/2009|DO|1.0|311.0|311.0|1||8.55|0.0|183.69|0.0|0.0|0.0|ADMINUIO  |2009-03-16 09:18:12|
1|393|S|SYMANTEC ANTIVIRUS 11.0|6|607|3|33.0|11.0|48 ENDPOINT Y 62 MULTI TI|3|21164|3|18|1691|03/23/2009|DO|1.0|4482.42|4482.42|||123.27|0.0|2620.48|0.0|0.0|0.0|ADMINUIO  |2009-03-23 13:57:34|
1|394|S|COMPUTADOR CON LICENCIAS WINDOWS Y OFFIC|6|601|3|33.0|||3|21471|3|18|1570|04/17/2009|DO|1.0|1044.8|1044.8|1||28.73|0.0|587.05|0.0|0.0|0.0|ADMINUIO  |2009-04-17 11:18:06|
1|395|S|MOTO GALARDI COLOR ROJO|7|706|5|20.0|GL250GY AO 200||3|21727|3|20|1715|05/11/2009|DO|1.0|1930.36|1930.36|1||32.17|0.0|631.98|0.0|0.0|0.0|ADMINUIO  |2009-05-11 11:53:25|
1|396|S|IMPRESORA LASERJET 2015DN|6|602|3|33.0|2015DN||3|21749|3|18|1442|05/13/2009|DO|1.0|435.0|435.0|1||11.96|0.0|234.18|0.0|0.0|0.0|ADMINUIO  |2009-05-13 11:15:57|
1|397|S|CONTROL DE RONDA DE GUARDIAS UIO|6|607|3|33.33|||3||3|18|1369|07/23/2009|DO|1.0|994.28|994.28|1||27.34|0.0|464.78|0.0|0.0|0.0|ADMINUIO  |2009-07-23 15:34:52|
1|398|S|IMPRESORAS EPSON FX-890 MAT. (CUATRO)|6|602|3|33.0|||3|22778|3|18|1570|07/29/2009|DO|1.0|1300.0|1300.0|1||35.75|0.0|610.06|0.0|0.0|0.0|ADMINUIO  |2009-07-29 11:40:05|
1|399|S|SUZUKI GRAND VITARA SZ 2.0L 4X2 2010|7|201|5|20.0|GRAND VITARA SZ|120A-681755|3|23217|3|20|1093|08/31/2009|DO|1.0|22223.21|22223.21|1||370.39|0.0|5926.24|0.0|0.0|0.0|E1MARYER  |2009-08-31 14:58:23|
1|400|S|IMPRESORA LASERJET COLOR|6|602|3|33.0|CP2025DB|PN:CB495A|3|23315|3|18|1570|09/07/2009|DO|1.0|395.0|395.0|1||10.86|0.0|171.23|0.0|0.0|0.0|ADMINUIO  |2009-09-07 10:10:38|
1|401|S|COMPUTADOR INTEL CORE 2 2.8GHZ|6|601|3|33.0|E7400 S775||3|23422|3|18|1570|09/15/2009|DO|1.0|456.9|456.9|1||12.56|0.0|194.68|0.0|0.0|0.0|ADMINUIO  |2009-09-15 15:39:01|
1|402|S|JEEP NISSAN X-TRAIL M/T|7|701|5|20.0|X-TRAIL M/T|QR25264432A|3|23617|3|20|1782|09/29/2009|DO|1.0|23000.0|23000.0|1||383.33|0.0|5762.73|0.0|0.0|0.0|E1MARYER  |2009-09-29 16:33:07|
1|403|S|CENTRAL TELEFONICA ALCATEL-LUCENT|4|405|10|10.0|||3|24880|3|19|1798|12/28/2009|DO|1.0|13021.76|13021.76|1||108.51|0.0|1312.62|0.0|0.0|0.0|ADMINUIO  |2009-12-28 14:35:39|
1|404|S|SILLON AERON BASE METALICA|4|401|10|10.0|||3|25433|3|19|1841|02/02/2010|DO|1.0|1450.0|1450.0|1||12.08|0.0|132.02|0.0|0.0|0.0|E1MARYER  |2010-02-02 09:59:58|
1|405|S|PORTATIL HP PAV C/LIC.W7 OFFICCE SB 2007|6|601|3|33.33|HP DV6 1360US|SCNF94434WZ|3|25511|3|18|1844|02/08/2010|DO|1.0|1516.45|1516.45|1||42.12|0.0|451.29|0.0|0.0|0.0|ADMINUIO  |2010-02-08 11:51:01|
1|406|A|WINDOWS 7 PROFESSIONAL ESPAOS 32 BITS|6|606|3|33.33|||3|26101|3|18|1844|03/12/2010|DO|1.0|167.92|167.92|1||4.66|0.0|0.0|0.0|0.0|0.0|ADMINUIO  |2010-03-12 14:30:09|
1|407|S|NISSAN X-TRAIL CLASSIC 4X4 2.5 M/T|7|701|5|20.0|TDBNLAFT30EHA-3|JN1TBNT30AW121889|3|26437|3|20|1880|04/01/2010|DO|1.0|26241.25|26241.25|1||437.35|0.0|3921.57|0.0|0.0|0.0|ADMINUIO  |2010-04-01 14:35:08|
1|408|S|TELEFONOS IP TOUCH 4018 (OCHO)|4|405|10|10.0|IP TOUCH 4018||3|27170|3|19|1798|05/19/2010|DO|1.0|2877.11|2877.11|1||23.98|0.0|177.14|0.0|0.0|0.0|ADMINUIO  |2010-05-19 14:40:57|
1|409|S|COMPUTADOR PORTATIL HP 4420S CORE I-3|6|601|3|33.33|HP 4420 S CORE||3|27592|3|18|1570|06/18/2010|DO|1.0|925.0|925.0|1||25.69|0.0|164.42|0.0|0.0|0.0|ADMINUIO  |2010-06-18 16:02:01|
1|410|S|BANCO DE ENSAMB.PARA BOMBA SUMERGIBLE SP|4|410|10|10.0|SP DINAMARCA|976620158, 97620191|3||3|19|1218|04/21/2010|DO|1.0|11273.76|11273.76|1||93.95|0.0|779.79|0.0|0.0|0.0|ADMINUIO  |2010-07-30 15:31:48|
1|411|S|CAMIONETA MAZDA 2011 PLOMO|7|701|5|20.0|BT-50CD 4X2 STD|F2866480|3|28497|3|20|1962|08/23/2010|DO|1.0|18741.07|18741.07|1||312.35|0.0|1330.01|0.0|0.0|0.0|E1MARYER  |2010-08-23 12:18:23|
1|412|S|COMPUTADOR HP WORKSTATION Z200|6|601|3|33.33|INTEL XEON PROC||3|30189|3|18|580|12/29/2010|DO|1.0|1894.0|1894.0|1||52.61|0.0|0.0|0.0|0.0|0.0|E1EDWMUN  |2010-12-29 15:31:27|
1|413|S|COMPUTADOR (3) CON LICENCIA WINDOWS 7|6|601|3|33.33|||3|31821|3|18|2093|04/28/2011|DO|1.0|2581.88|2581.88|1||71.71|0.0|0.0|0.0|0.0|0.0|E1CRIPAU  |2011-04-28 18:00:30|
1|414|S|MINI NOTEBOOK HP-110-3523LA|6|601|3|33.33|110-3523LA||3|32731|3|18|2131|06/27/2011|DO|1.0|436.0|436.0|1||12.11|0.0|0.0|0.0|0.0|0.0|E1CRIPAU  |2011-06-27 11:25:18|
1|415|S|HP PROBOOK 4320 CON LICENCIA WIN 7|6|601|3|33.33|LK641LT|CNF1130NBO|3|33171|3|18|2093|07/26/2011|DO|1.0|806.5|806.5|1||22.4|0.0|0.0|0.0|0.0|0.0|E1CRIPAU  |2011-07-26 16:56:48|
1|416|S|WORKSTATION HP Z800 XV085LA|6|601|3|33.33||XV085LA|3|33521|3|18|1322|08/19/2011|DO|1.0|2554.72|2554.72|1||70.96|0.0|0.0|0.0|0.0|0.0|E1CRIPAU  |2011-08-19 10:22:59|
1|417|S|GENERADOR DE LUZ DE 12500 WATTS 22HP|4|412|10|10.0|PM0601250|F17801837B|3|33523|4|19|1138|08/19/2011|DO|1.0|2758.4|2758.4|1||22.99|0.0|0.0|0.0|0.0|0.0|E1CRIPAU  |2011-08-19 11:01:28|
1|418|S|GALPON SUR|3|305|10|10.0|||3||3|16|198|05/02/2011|DO|1.0|96490.61|96490.61|1||80.41|0.0|0.0|0.0|0.0|0.0|E1CRIPAU  |2011-12-23 10:37:29|
1|419|S|PROYECTOR EPSON POWERLITE 1775W|6|603|3|33.33|MNWF170319L||3|35545|3|18|2093|12/29/2011|DO|1.0|1450.0|1450.0|1||40.27|0.0|0.0|0.0|0.0|0.0|E1CRIPAU  |2011-12-29 17:22:00|
1|420|S|CHASIS CABINADO DE 7.5 TONELADAS HINO|7|701|5|20.0|FC9JJSA|JO5ETC16580|3|35601|3|20|1194|01/05/2012|DO|1.0|39990.0|39990.0|1||666.5|0.0|0.0|0.0|0.0|0.0|E1MARYER  |2012-01-05 17:26:04|
1|421|S|PLATAF.MONTADO SOBRE CHASIS HINO 2012|7|701|5|20.0|C.S.1-6.20|FC|3|35644|3|20|1213|01/10/2012|DO|1.0|7787.9|7787.9|||129.8|0.0|0.0|0.0|0.0|0.0|E1MARYER  |2012-01-10 09:44:39|
1|422|S|PORTATIL HP PROBOOK 6360B|6|601|3|33.33|6360B|2CE1491599|3|35942|3|18|2093|01/24/2012|DO|1.0|970.0|970.0|1||26.94|0.0|0.0|0.0|0.0|0.0|E1CRIPAU  |2012-01-24 17:19:16|
1|423|S|PORTATIL DELL LATITUDE E6320|6|601|3|33.33|LATITUDE E6320|35223294241|3|36017|3|18|1278|01/27/2012|DO|1.0|1316.0|1316.0|1||36.55|0.0|0.0|0.0|0.0|0.0|E1CRIPAU  |2012-01-27 12:51:19|
1|424|S|CAMION CHASIS CABINADO MARCA CHEVROLET|7|701|5|20.0|NLR 55E CAMION|MOTOR 4JB1197240|3|36049|3|20|1857|01/30/2012|DO|1.0|24791.07|24791.07|1||413.18|0.0|0.0|0.0|0.0|0.0|E1MARYER  |2012-01-30 15:04:21|
1|425|S|PORTATIL DELL LATITUDE E6320 CI5|6|601|3|33.33|LATITUDE E6320||3|36070|3|18|1278|01/31/2012|DO|1.0|1316.0|1316.0|1||36.55|0.0|0.0|0.0|0.0|0.0|E1CRIPAU  |2012-01-31 15:05:32|
1|426|S|FURGON METALICO PARA CHEVROLET 2012|7|701|5|20.0|F.S.1.3.00|NLR|3|36132|3|20|1213|02/03/2012|DO|1.0|3285.0|3285.0|1||54.75|0.0|0.0|0.0|0.0|0.0|E1MARYER  |2012-02-03 17:03:23|
1|427|S|CLON SERVIDOR VILLA FLORA CORE I5 2.90|6|601|3|33.33|INTEL I5 CORE|2.90 HZ|3|36286|4|18|2093|02/14/2012|DO|1.0|778.2|778.2|1||21.61|0.0|0.0|0.0|0.0|0.0|E1CRIPAU  |2012-02-14 16:22:05|
1|428|S|SERVIDOR HP DL160 G6 XEON E5620|6|601|3|33.33|DL160 XEON E562|MXQ1370KVV|3|36514|3|18|2093|02/29/2012|DO|1.0|2090.0|2090.0|1||58.05|0.0|0.0|0.0|0.0|0.0|E1CRIPAU  |2012-02-29 17:29:05|
1|429|S|NOTEBOOK HP 4530 I5 2450 M 4G 500G|6|601|3|33.33|HP 4530 I5|A7K22LT|3|36647|3|18|580|03/08/2012|DO|1.0|892.0|892.0|1||24.78|0.0|0.0|0.0|0.0|0.0|E1CRIPAU  |2012-03-08 15:02:15|
1|430|S|PC CORE I5 2.90 GHZ 2GB RAM 500GB|6|601|3|33.00|CORE I5 2.90 GH|CORE I5 2.90 GHZ|3|38273|3|18|2093|06/21/2012|DO|1.0|540.0|540.0|1||15.0|0.0|0.0|0.0|0.0|0.0|E1CRIPAU  |2012-06-19 17:20:47|
1|431|S|PC CORE I5 2.90 GHZ 2GB RAM  500GB|6|601|3|33.00|CORE I5 2.90 GH||3|38273|3|18|2093|06/21/2012|DO|1.0|540.0|540.0|1||15.0|0.0|0.0|0.0|0.0|0.0|E1CRIPAU  |2012-06-19 17:23:44|
1|432|S|PORTATIL HP 4430 CORE I5 2450M 4GB|6|601|3|33.00|HP 4430 CORE I5|CNU2160PZ6|3|38274|3|18|2093|06/21/2012|DO|1.0|899.0|899.0|1||24.97|0.0|0.0|0.0|0.0|0.0|E1CRIPAU  |2012-06-21 09:53:33|
1|433|S|PORTATIL HP 4430 CORE I5 2450 M 4GB|6|601|3|33.00|HP 4430 CORE I5|CNU216206X|3|38274|3|18|2093|06/21/2012|DO|1.0|899.0|899.0|||24.97|0.0|0.0|0.0|0.0|0.0|E1CRIPAU  |2012-06-21 09:56:15|
1|434|S|TOYOTA FORTUNER TM 4X4 2013 PLATEADO|7|704|5|20.0|FORTUNER|MR1YX59G9D3105021|3|39820|3|20|1539|09/28/2012|DO|1.0|38830.36|38830.36|1||647.17|0.0|0.0|0.0|0.0|0.0|E1MARYER  |2012-09-28 15:58:42|
1|435|S|COMPUTADOR PERSONAL CON WIN 7|6|601|3|33.0|CORE I5 2.9GHZ||3|39849|3|18|1570|10/01/2012|DO|1.0|550.8|550.8|1||15.15|0.0|0.0|0.0|0.0|0.0|E1CRIPAU  |2012-10-01 15:57:49|
1|436|S|IMPRESORA MULTIFUNCION HO M525F|6|602|3|33.0|HP M525F|CF117A|3|40745|3|18|2093|11/23/2012|DO|1.0|2363.0|2363.0|1||64.98|0.0|0.0|0.0|0.0|0.0|E1CRIPAU  |2012-11-23 09:09:58|
1|437|S|PORTATIL HP 6470B CORE I5 2.5GHZ|6|601|3|33.0|HP 6470B|C9J27LT|3|41457|3|18|580|01/14/2013|DO|1.0|1030.0|1030.0|1||28.33|0.0|0.0|0.0|0.0|0.0|E1CRIPAU  |2013-01-14 13:44:52|
1|438|S|PORTATIL HP 6470B CORE I5 2.5GHZ 4GB RAM|6|601|3|33.0|HP 6470B|C9J27LT|3|41457|3|18|580|01/14/2013|DO|1.0|1030.0|1030.0|1||28.33|0.0|0.0|0.0|0.0|0.0|E1CRIPAU  |2013-01-14 13:47:02|
1|439|S|CAMION MITSUBISHI CANTER 5.5 TON.BLANCO|7|701|5|20.0|CANTER 5.5 TON|JL6BBE6H5CK015218|3|41502|3|20|1420|01/15/2013|DO|1.0|29455.36|29455.36|1||490.92|0.0|0.0|0.0|0.0|0.0|E1MARYER  |2013-01-15 16:03:31|
1|440|S|CAJON DE TRABAJO MODELO C.S.1-4.70|7|701|5|20.0|CAJON DE TRABAJ||3|41585|3|20|1213|01/21/2013|DO|1.0|4463.0|4463.0|1||74.38|0.0|0.0|0.0|0.0|0.0|E1MARYER  |2013-01-21 17:42:21|
