1|2|70|1|1|A|01/20/2003|AVILES CRISTINA|CDLA. LA SAIBA MZ.J V.7|70|CARLTORR|2003-01-20 13:03:59|
1|2|70|2|1|A|01/20/2003|AVILES CRISTINA|CDLA. LA SAIBA MZ.J V.7|70|CARLTORR|2003-01-20 13:05:40|
1|2|70|3|2|A|01/20/2003|MALTA LUIS|URB. EL RIO KM. 2.1/2 V.SAMBOR|70|LUISVERA|2003-01-20 14:44:49|
1|2|70|4|4|A|01/20/2003|ANCHUNDIA MARCELO|VIA PERIMETRAL|70|LUISVERA|2003-01-20 15:40:51|
1|2|70|5|5|A|01/20/2003|SILVA TERESA CHONG DE                   |ESCOBEDO 1503 Y AGUIRRE|70|RAQUIDRO|2003-01-20 16:16:58|
1|2|70|6|6|A|01/20/2003|DYNARQ C. LTDA.                         |AV. 9 DE OCTUBRE 2009 Y LOS RIOS PISO 4|70|RAQUIDRO|2003-01-20 16:22:08|
1|2|70|7|3|A|01/20/2003|MERA MARCOS|EL FORTIN|70|CARLTORR|2003-01-20 16:26:26|
1|2|70|8|7|A|01/20/2003|MALDONADO MARTHA|CDLA. BELLA AURORA MZ.C V.12|70|CARLTORR|2003-01-20 17:23:36|
1|2|70|9|8|A|01/21/2003|GUIM LOQUIO EMILIO ING.                 |CARCHI 1202 Y AGUIRRE|70|LUISVERA|2003-01-21 09:10:10|
1|2|70|10|10|A|01/21/2003|M.B.S. CIA. LTDA.                       |ELOY ALFARO 916-920 Y BRASIL|70|LUISVERA|2003-01-21 10:37:50|
1|2|70|11|15|A|01/21/2003|UNICENTRO TURISTICO JABUCAM             |AGUIRRE 411 E/ CHILE Y CHIMBORAZO OF.208|70|CARLTORR|2003-01-21 11:40:57|
1|2|79|1|1|A|01/21/2003|MAFNASA S.A.                            |LORENZO DE GARAICOA 2130 Y HUANCAVILCA|79|RAQUIDRO|2003-01-21 12:18:08|
1|2|70|12|17|A|01/21/2003|ORTIZ EDUARDO|AMBATO JUNIN Y VERDELOMA|70|RAQUIDRO|2003-01-21 12:26:42|
1|2|70|13|12|A|01/21/2003|SUPERINTENDENCIA DE BANCOS              |CHIMBORAZO 412 Y C. BALLEN|70|LUISVERA|2003-01-21 14:09:08|
1|2|70|14|19|A|01/21/2003|CARRILLO MANUEL|MIRAFLORES 7MA 306|70|LUISVERA|2003-01-21 14:26:35|
1|2|70|15|9|A|01/21/2003|CEDENO WILBER|COOP.LOS JARDINES S.4|70|CARLTORR|2003-01-21 15:05:29|
1|2|70|16|13|A|01/21/2003|UNICENTRO TURISTICO JABUCAM             |AGUIRRE 411 E/ CHILE Y CHIMBORAZO OF.208|70|CARLTORR|2003-01-21 15:08:50|
1|2|70|17|14|A|01/21/2003|TERESA VARGAS MORALES|CDLA. ENTRE RIOS MZ.1 V.22|70|CARLTORR|2003-01-21 15:11:16|
1|2|70|18|16|A|01/21/2003|ENRIQUEZ PIEDAD|CDLA. FAE MZ.29 V.3|70|CARLTORR|2003-01-21 15:15:16|
1|2|70|19|11|A|01/21/2003|QUEVEDO REYNALDO|33AVA. 1119 Y S.MARTIN|70|CARLTORR|2003-01-21 15:16:58|
1|2|70|20|18|A|01/21/2003|EQUAFERR|SUCRE 535 E/BOYACA Y CHIMBORAZO|70|CARLTORR|2003-01-21 15:18:37|
1|2|79|2|2|A|01/21/2003|FERRETERIA SAN JOSE                     |RUMICHACA 1230 Y C.BALLEN|79|LUISVERA|2003-01-21 15:47:28|
1|2|79|3|3|A|01/21/2003|PEREZ MASA GLEN|SAMANE#2 MZ221 V12|79|LUISVERA|2003-01-21 16:31:11|
1|2|70|21|20|A|01/21/2003|MERA MARCOS|EL FORTIN|70|LUISVERA|2003-01-21 17:25:42|
1|2|79|4|4|A|01/21/2003|UNICENTRO TURISTICO JABUCAM             |AGUIRRE 411 E/ CHILE Y CHIMBORAZO OF.208|79|CARLTORR|2003-01-21 17:34:33|
1|2|79|5|5|A|01/21/2003|CADENA LA GAVIOTA|BOYACA 1205 Y 9 DE OCTUBRE, 1ER.PISO|79|CARLTORR|2003-01-21 17:37:01|
1|2|70|22|24|A|01/22/2003|VALDIVIESO FAUSTO|ORELLANA 213 Y PANAMA|70|LUISVERA|2003-01-22 10:41:30|
1|2|70|23|23|A|01/22/2003|RICKY CENTRO                            |AV. OLMEDO 525 Y BOYACA|70|CARLTORR|2003-01-22 11:02:19|
1|2|70|24|25|A|01/22/2003|CHAUG MAURICIO                          |JUNIN 626 Y BOYACA|70|CARLTORR|2003-01-22 11:04:55|
1|2|70|25|28|A|01/22/2003|SIMON ISAIAS XAVIER                     |10 DE AGOSTO 6036 Y CHIMBORAZO ESQ.|70|CARLTORR|2003-01-22 12:19:21|
1|2|70|26|26|A|01/22/2003|DIMETAL                                 |LORENZO DE GARAICOA Y PADRE SOLANO|70|LUISVERA|2003-01-22 12:55:35|
1|2|70|27|29|A|01/22/2003|DIMETAL                                 |LORENZO DE GARAICOA Y PADRE SOLANO|70|LUISVERA|2003-01-22 13:09:29|
1|2|70|28|30|A|01/22/2003|SUMMA PROYECTOS C.A.                    |ED. EXECUTIVE CENTER, PISO 2|70|CARLTORR|2003-01-22 15:00:23|
1|2|79|6|6|A|01/22/2003|VERA SARMIENTO JAIME, ARQ.              |CDLA. LA SAIBA, MZ. O V.20|79|CARLTORR|2003-01-22 15:39:53|
1|2|79|7|7|A|01/22/2003|PLASTICOS DEL LITORAL PLASTILIT S.A.    |KM. 11.5 VIA A DAULE|79|LUISVERA|2003-01-22 15:58:05|
1|2|70|29|31|A|01/22/2003|CHAUG MAURICIO                          |JUNIN 626 Y BOYACA|70|CARLTORR|2003-01-22 16:08:56|
1|2|70|30|32|A|01/22/2003|HOTELCA/HOTEL RAMADA C.A.               |MALECON 606 Y MANUEL LUZARRAGA|70|LUISVERA|2003-01-22 17:09:49|
1|2|70|31|33|A|01/22/2003|INMOBILIARIA CALIDAD, INMOCALI S.A.     |AVDA. MIGEL ALCIVAR, ED. ARQUETIPO III|70|CARLTORR|2003-01-22 17:49:23|
1|2|70|32|34|A|01/23/2003|TORRES DE LA MERCED|CORDOVA 812 Y V.M.RENDON|70|LUISVERA|2003-01-23 09:43:27|
1|2|70|33|35|A|01/23/2003|MENDEZ CARLOS|DURAN PRIMAVERA#1 MZE4 V10|70|LUISVERA|2003-01-23 11:21:59|
1|2|70|34|36|A|01/23/2003|MENDEZ CARLOS|DURAN PRIMAVERA#1 MZE4 V10|70|LUISVERA|2003-01-23 11:33:39|
1|2|70|35|27|A|01/23/2003|RAMOS MOLINA ROBERTO, ARQ.              |MIGUEL ALCIVAR Y CALLE N, MZ. 31 SL. 2|70|CARLTORR|2003-01-23 12:06:00|
1|2|70|36|37|A|01/23/2003|REYVEN|AGUIRRE 914 Y STA. ELENA|70|CARLTORR|2003-01-23 13:09:28|
1|2|70|37|38|A|01/23/2003|REA MARIO|BOYACA 1711 Y 10 DE AGOSTO|70|LUISVERA|2003-01-23 14:29:25|
1|2|70|38|40|A|01/23/2003|SANCHEZ JUAN|ELOY ALFARO 326 Y OLMEDO|70|LUISVERA|2003-01-23 15:58:48|
1|2|70|39|39|A|01/23/2003|LOZANO LUIS|ARGENTINA 1800 Y J.MASCOTE|70|CARLTORR|2003-01-23 17:36:29|
1|2|70|40|41|A|01/23/2003|IND.INMOBILIARIA LIALTRIAL S.A.|9 DE OCBRE 127 Y PICHINCHA|70|CARLTORR|2003-01-23 17:39:37|
1|2|79|8|8|A|01/23/2003|CAMARONERA COLAS DE ORO                 |BOYACA 1615 Y 1O DE AGOSTO|79|LUISVERA|2003-01-23 17:43:41|
1|2|79|9|9|A|01/23/2003|COFERMA                                 |ELOY ALFARO 2224 Y G.GOYENA|79|LUISVERA|2003-01-23 17:51:33|
1|2|79|10|10|A|01/24/2003|RESIDENTE; ARQ. ALEJANDRO FLORES|URBANIZACION EL RIO|79|LUISVERA|2003-01-24 10:52:54|
1|2|79|11|11|A|01/24/2003|ARQ. ALEJANDRO FLORES-BANO 1-2-3-DACCACH|URBANIZACION EL RIO                                  |79|RAQUIDRO|2003-01-24 11:15:56|
1|2|79|12|10|A|01/24/2003|ARQ. FLORES-BANO MASTER-DACCACH|URBANIZACION EL RIO                                  |79|RAQUIDRO|2003-01-24 11:34:32|
1|2|79|13|12|A|01/24/2003|ARQ. FLORES-BANO PISCINA-DACCACH|URBANIZACION EL RIO                                  |79|RAQUIDRO|2003-01-24 11:49:45|
1|2|70|41|42|A|01/24/2003|RETIRA|ALMACEN CENTRO|70|LUISVERA|2003-01-24 11:53:45|
1|2|70|42|43|A|01/24/2003|RETIRAA  . .| ALMACEN CENTRO6|70|LUISVERA|2003-01-24 11:59:03|
1|2|79|14|14|A|01/24/2003|ARQ. FLORES-BANO SERVICIO-DACCACH|ARBANIZACION EL RIO                                  |79|RAQUIDRO|2003-01-24 12:09:28|
1|2|79|15|13|A|01/24/2003|ARQ. FLORES-BANO VISITA DACCACH|URBANIZACION EL RIO                                  |79|RAQUIDRO|2003-01-24 12:18:56|
1|2|79|16|15|A|01/24/2003|INMOBILIARIA CALIDAD, INMOCALI S.A.     |AVDA. MIGEL ALCIVAR, ED. ARQUETIPO III|79|RAQUIDRO|2003-01-24 12:25:14|
1|2|79|17|16|A|01/24/2003|ARQ. FLORES-AREAS EXTERIORES-DACCACH|URBANIZACION EL RIO                                  |79|RAQUIDRO|2003-01-24 12:30:58|
1|2|79|18|10|A|01/24/2003|ARQ. FLORES-BANO MASTER-DACCACH|URBANIZACION EL RIO                                  |79|RAQUIDRO|2003-01-24 12:54:52|
1|2|79|19|13|A|01/24/2003|INMOBILIARIA CALIDAD, INMOCALI S.A.     |AVDA. MIGEL ALCIVAR, ED. ARQUETIPO III|79|RAQUIDRO|2003-01-24 12:57:51|
1|2|70|43|44|A|01/24/2003|MENDEZ CARLOS|DURAN, PRIMAVERA 1  MZ.E  V.10|70|LUISVERA|2003-01-24 14:20:36|
1|2|70|44|45|A|01/24/2003|MAESTRO PEZO|ALMACEN CENTRO                                       |70|RAQUIDRO|2003-01-24 17:44:12|
1|2|79|20|19|A|01/24/2003|MAESTRO PEZO|RETIRA DE BOD. JUAN TANCA MARENGO                    |79|RAQUIDRO|2003-01-24 17:47:26|
1|2|79|21|17|A|01/24/2003|INMOBILIARIA CALIDAD, INMOCALI S.A.     |AVDA. MIGEL ALCIVAR, ED. ARQUETIPO III|79|RAQUIDRO|2003-01-24 17:57:26|
1|2|79|22|20|A|01/24/2003|ARQ. FLORES-OBRA KNEZEVIC-BANO MASTER|URBANIZACION PALMAR DEL RIO                          |79|RAQUIDRO|2003-01-24 19:14:51|
1|2|79|23|21|A|01/24/2003|ARQ. FLORES-OBRA KNEZEVIC-BANO   1.|URBANIZACION PALMAR DEL RIO                          |79|RAQUIDRO|2003-01-24 19:22:39|
1|2|79|24|22|A|01/24/2003|ARQ. FLORES-OBRA KNEZEVIC-BANO # 1.|URBANIZ. PALMAR DEL RIO                              |79|RAQUIDRO|2003-01-24 19:27:09|
1|2|70|45|47|A|01/27/2003|QUEVEDO REYNALDO|33AVA. 1519 Y S.MARTIN|70|CARLTORR|2003-01-27 09:29:14|
1|2|70|46|46|A|01/27/2003|BULGARIN NARANJO ANTONIO                |CDLA. LA CHALA, CALLEJON ALIANZA Y 13|70|CARLTORR|2003-01-27 09:30:49|
1|2|79|25|20|A|01/27/2003|BANO MASTER-OBRA KNEZEVIC|URBANIZACION PALMAR DEL RIO                          |79|RAQUIDRO|2003-01-27 10:17:50|
1|2|79|26|20|A|01/27/2003|BANO MASTER-OBRA KNEZEVIC|URBANIZACION PALMAR DEL RIO                          |79|RAQUIDRO|2003-01-27 10:31:44|
1|2|79|27|23|A|01/27/2003|BANO # 2 Y 3-OBRA KNEZEVIC|URBANIZACION PALMAR DEL RIO                          |79|RAQUIDRO|2003-01-27 10:42:26|
1|2|79|28|24|A|01/27/2003|BANO VISITA-OBRA KNEZEVIC|URBANIZACION PALMAR DEL RIO                          |79|RAQUIDRO|2003-01-27 10:45:41|
1|2|79|29|25|A|01/27/2003|BANO SERVICIO-OBRA KNEZEVIC|URBANIZACION PALMAR DEL RIO                          |79|RAQUIDRO|2003-01-27 10:49:55|
1|2|79|30|26|A|01/27/2003|COCINA-OBRA KNEZEVIC|URBANIZACION PALMAR DEL RIO                          |79|RAQUIDRO|2003-01-27 10:53:43|
1|2|70|47|48|A|01/27/2003|COCINA-OBRA KNEZEVIC|URBANIZACION PALMAR DEL RIO                          |70|RAQUIDRO|2003-01-27 10:56:26|
1|2|70|48|50|A|01/27/2003|CHAVARRIA CARLOS|LUQUE 323 Y CHIMBORAZO|70|CARLTORR|2003-01-27 11:29:49|
1|2|79|31|18|A|01/27/2003|SR. GUILLEN|ALMACEN CENTRO                                       |79|RAQUIDRO|2003-01-27 11:44:47|
1|2|79|32|27|A|01/27/2003|VARIOS: SERVIC.LAVAND.JARDIN-KNEZEVIC|URBANIZACION PALMAR DEL RIO                          |79|RAQUIDRO|2003-01-27 12:15:41|
1|2|70|49|51|A|01/27/2003|MEZA BAQUE MILTON                       |RUMICHACA 1820 Y BENALCAZAR|70|CARLTORR|2003-01-27 14:11:27|
1|2|70|50|52|A|01/27/2003|RETIRABORJA ALEX GERMAN| ALMACEN CENTRO|70|LUISVERA|2003-01-27 16:12:52|
1|2|70|51|53|A|01/27/2003|CORDOVA ASTUDILLO LUIS, ING.|ED. EXECUTIVE CENTER, PISO 2|70|RAQUIDRO|2003-01-27 16:25:56|
1|2|70|52|56|A|01/28/2003|CARRILLO MANUEL|RETIRA DE ALMACEN CENTRO                             |70|RAQUIDRO|2003-01-28 13:20:46|
1|2|79|33|28|A|01/28/2003|DIMETAL                                 |LORENZO DE GARAICOA Y PADRE SOLANO|79|LUISVERA|2003-01-28 14:02:12|
1|2|79|34|29|A|01/28/2003|GUALOTUNA ALFREDO                       |PORTETE 1126 Y GUARANDA|79|LUISVERA|2003-01-28 16:40:06|
1|2|70|53|58|A|01/28/2003|JORGE VILLAO|VERNAZA N. MZ. 10 V. 22|70|RAQUIDRO|2003-01-28 16:46:31|
1|2|70|54|57|A|01/28/2003|CARRERA ESTARELLAS FRANCISCO VICENTE|COLON 1418 ENTRE ANTEPARA Y MACHALA|70|CARLTORR|2003-01-28 17:05:09|
1|2|70|55|55|A|01/28/2003|ZAMBRANO RIOS XAVIER|MIRADOR DEL N. MZ.42 S.1|70|CARLTORR|2003-01-28 17:12:24|
1|2|70|56|59|A|01/28/2003| RETIRA PERSONAL| ALMACEN CENTRO     .|70|LUISVERA|2003-01-28 17:18:58|
1|2|70|57|61|A|01/29/2003| RETIRA PERSONAL| ALMACEN CENTRO|70|LUISVERA|2003-01-29 11:55:09|
1|2|79|35|30|A|01/29/2003|CLIENTE RETIRA EN JUAN TANCA|M. A. ALCIVAR, ED. ARQUETIPO III|79|CARLTORR|2003-01-29 13:06:15|
1|2|70|58|60|A|01/29/2003| ALFREDO ROMERO| ALMACEN CENTRO|70|LUISVERA|2003-01-29 14:03:10|
1|2|79|36|31|A|01/29/2003|SR. CESAR SERNA|TRANSPORTE LOS ANDES|79|RAQUIDRO|2003-01-29 15:34:25|
1|2|70|59|63|A|01/29/2003|COMERCIAL EDI-FER                       |RETIRA SR.FERNANDO PITA|70|CARLTORR|2003-01-29 15:46:24|
1|2|70|60|62|A|01/29/2003|AVILES CRISTINA MALDONADO DE|LA SAQIBA MZ. J V. 7|70|CARLTORR|2003-01-29 17:22:30|
1|2|70|61|64|A|01/29/2003|CHAVARRIA CARLOS|LUQUE 323 Y CHIMBORAZO|70|CARLTORR|2003-01-29 17:30:39|
1|2|79|37|25|A|01/29/2003|BANO SERVICIO-KNEZEVIC|RETIRA DE BOD. J.T. MARENGO-SR. SANDOYA|79|CARLTORR|2003-01-29 18:04:18|
1|2|79|38|32|A|01/30/2003|FERREIND                                |JOSE MASCOTE 206 Y MANUEL GALECIO|79|RAQUIDRO|2003-01-30 10:43:32|
1|2|70|62|21|A|01/30/2003|UNICENTRO TURISTICO JABUCAM             |AGUIRRE 411 E/ CHILE Y CHIMBORAZO OF.208|70|CARLTORR|2003-01-30 12:20:57|
1|2|70|63|65|A|01/30/2003|IMFERSA S.A.                            |RETIRAN|70|CARLTORR|2003-01-30 12:22:52|
1|2|79|39|33|A|01/30/2003|CECILIA LEON|ALMACEN CENTRO|79|RAQUIDRO|2003-01-30 13:23:59|
1|2|79|40|34|A|01/30/2003|ING. LUCIA ORTEGA|RETIRA SR. DAVID ORTEGA|79|CARLTORR|2003-01-30 14:49:20|
1|2|79|41|35|A|01/30/2003|O.COMP#26|TRANSPORTE SEMERIA.CUENCA|79|LUISVERA|2003-01-30 16:07:46|
1|2|70|64|68|A|01/30/2003|COCINA 4TO. PISO-UNICENTRO|ALMACEN CENTRO|70|LUISVERA|2003-01-30 17:18:23|
1|2|70|65|68|A|01/30/2003|COCINA 4TO. PISO-UNICENTRO|ALMACEN CENTRO|70|CARLTORR|2003-01-30 17:20:06|
1|2|79|42|17|A|01/30/2003|INMOBILIARIA CALIDAD, INMOCALI S.A.     |AVDA. MIGEL ALCIVAR, ED. ARQUETIPO III|79|RAQUIDRO|2003-01-30 17:54:41|
1|2|70|66|67|A|01/30/2003|CEPSA|RETIRAN|70|CARLTORR|2003-01-30 17:56:10|
1|2|70|67|66|A|01/30/2003|LINDEROS|ALMACEN CENTRO|70|CARLTORR|2003-01-30 17:57:54|
1|2|70|68|69|A|01/31/2003|RIBADENEIRA ORLANDO|RETIRA|70|LUISVERA|2003-01-31 15:36:43|
1|2|70|69|70|A|01/31/2003|V.6|RETIRA|70|CARLTORR|2003-01-31 17:56:32|
1|2|79|43|37|A|02/03/2003|O.COMP#26|TRANSPORTE SEMERIA|79|LUISVERA|2003-02-03 10:13:54|
1|2|70|70|72|A|02/03/2003|TEJADA ONOFRE JOSE|RETIRA|70|CARLTORR|2003-02-03 10:24:41|
1|2|70|71|73|A|02/03/2003|VELARDE VICTOR|RETIRA|70|CARLTORR|2003-02-03 10:49:38|
1|2|70|72|74|A|02/03/2003|.|RETIRA|70|CARLTORR|2003-02-03 10:50:58|
1|2|70|73|76|A|02/03/2003|CASA TORRES ROSELLO|RETIRA|70|LUISVERA|2003-02-03 13:16:27|
1|2|70|74|49|A|02/03/2003|COFERMA                                 |ELOY ALFARO 2224 Y G.GOYENA|70|LUISVERA|2003-02-03 14:45:29|
1|2|79|44|38|A|02/03/2003|J.GABRIEL MASSUH D.|ALMACEN CENTRO, RETIRA PABLO SALVADOR|79|CARLTORR|2003-02-03 15:39:48|
1|2|70|75|77|A|02/03/2003|NOBOA JORGE|ENTREGADO ALM CENTRO|70|LUISVERA|2003-02-03 16:48:34|
1|2|79|45|39|A|02/03/2003|O.COMP# 0640|CERRO DEL CARMEN CANAL 2 TV|79|LUISVERA|2003-02-03 16:50:35|
1|2|70|76|71|A|02/03/2003|YAGUAL MEDARDO|RETIRA|70|CARLTORR|2003-02-03 17:22:37|
1|2|70|77|75|A|02/03/2003|VASQUEZ BALDA FRANCISCO|RETIRA|70|CARLTORR|2003-02-03 17:24:27|
1|2|70|78|78|A|02/04/2003|ING. CHALEN|ALMACEN CENTRO|70|LUISVERA|2003-02-04 10:15:38|
1|2|70|79|79|A|02/04/2003|PILAY CHOEZ HOLGER|RETIRA|70|CARLTORR|2003-02-04 10:27:34|
1|2|79|46|40|A|02/04/2003|ULLAURI ANGEL|DESP.ALMACEN CENTRO|79|RAQUIDRO|2003-02-04 10:59:59|
1|2|70|80|80|A|02/05/2003|FLORES DEL PEZO ROSENDO|RETIRA ALM CENTRO|70|LUISVERA|2003-02-05 08:57:48|
1|2|70|81|84|A|02/05/2003|ORELLANA MOSCOSO MARIA INES             |CDLA. ALBORADA,DCMA. ETAPA MZ. 204 V.42|70|CARLTORR|2003-02-05 12:21:03|
1|2|70|82|83|A|02/05/2003|ORELLANA MOSCOSO MARLENE|ENTRE RIOS AV. 2DA.MZ. U-1 V.27|70|CARLTORR|2003-02-05 12:22:12|
1|2|70|83|81|A|02/05/2003|ROMERO MARISOL|RETIRA SR.MANUEL ANCHUNDIA|70|CARLTORR|2003-02-05 12:45:50|
1|2|79|47|41|A|02/05/2003|CARLOS CHILUISA 326020 EXT.21|RETIRA  -  O.C.#|79|RAQUIDRO|2003-02-05 13:13:34|
1|2|79|48|43|A|02/05/2003|DEPROFIC CIA. LTDA.                     |GENERAL GOMEZ 709 Y LORENZO DE GARAICOA|79|RAQUIDRO|2003-02-05 13:53:38|
1|2|70|84|85|A|02/05/2003|DEPROFIC CIA. LTDA.                     |GENERAL GOMEZ 709 Y LORENZO DE GARAICOA|70|LUISVERA|2003-02-05 13:55:39|
1|2|70|85|88|A|02/05/2003|VERA HENRY|RETIRA|70|CARLTORR|2003-02-05 16:09:48|
1|2|70|86|87|A|02/05/2003|VERA HENRY|RETIRA|70|CARLTORR|2003-02-05 16:11:31|
1|2|70|87|86|A|02/05/2003|VERA HENRY|RETITA|70|CARLTORR|2003-02-05 16:13:01|
1|2|70|88|90|A|02/05/2003|INMOBILIARIA CALIDAD, INMOCALI S.A.     |AVDA. MIGEL ALCIVAR, ED. ARQUETIPO III|70|CARLTORR|2003-02-05 16:46:32|
1|2|70|89|89|A|02/05/2003|PERGOLA-OBRA KNEZEVIC|RETIRA MANUEL SANDOYA|70|CARLTORR|2003-02-05 16:51:55|
1|2|79|49|42|A|02/05/2003|HUGO VILLAVICENCIO|ENTRE RIOS AV.2DA. MZ U-1 V-27|79|CARLTORR|2003-02-05 17:18:19|
1|2|70|90|91|A|02/06/2003|PATINO SANDINO|CIRCUNVALACION SUR 200 URDESA|70|CARLTORR|2003-02-06 09:08:57|
1|2|70|91|82|A|02/06/2003|HUGO VILLAVICENCIO|ENTRE RIOS AV.2DA. MZ U-1 V-27|70|CARLTORR|2003-02-06 09:13:44|
1|2|79|50|44|A|02/06/2003| MONSERRAT AYALA|LOS CEIBOS AV. 1ERA. # 421|62|RAQUIDRO|2003-02-06 13:44:38|
1|2|70|92|94|A|02/06/2003|URGILES FANNY|BUCAY|70|CARLTORR|2003-02-06 14:28:05|
1|2|70|93|93|A|02/06/2003|LUCANO C. JUAN CARLOS|RETIRA|70|CARLTORR|2003-02-06 14:31:18|
1|2|70|94|92|A|02/06/2003|HAID MARANON RODOLFO R.                 |RETIRA|70|CARLTORR|2003-02-06 14:57:45|
1|2|70|95|96|A|02/06/2003|CHALEN OLAYA GUSTAVO, ARQ.              |RETIRA|70|CARLTORR|2003-02-06 16:52:13|
1|2|79|51|45|A|02/06/2003|ORELLANA MOSCOSO MARLENE|ALMACEN DEL CENTRO|79|CARLTORR|2003-02-06 17:12:06|
1|2|79|52|46|A|02/06/2003|BANO # 2 Y 3-KNEZEVIC (CAMBIO)|BOD. JUAN TANCA -RET. MANUEL S.|79|CARLTORR|2003-02-06 17:15:02|
1|2|70|96|95|A|02/06/2003|CHANG DORA|RETIRA|70|CARLTORR|2003-02-06 17:17:42|
1|2|70|97|97|A|02/06/2003|ORELLANA MOSCOSO MARLENE|ALMACEN DEL CENTRO|70|CARLTORR|2003-02-06 17:18:46|
1|2|70|98|98|A|02/07/2003|MIRANDA MARIA DE                        |RETIRA|70|CARLTORR|2003-02-07 12:42:56|
1|2|79|53|47|A|02/07/2003|CARLOS CHALEN BANCHON|RETIRA DE B. JUAN T. MARENGO|79|RAQUIDRO|2003-02-07 14:09:02|
1|2|70|99|100|A|02/07/2003|O.COMP#12684|RETIRA ALM CENTRO|70|LUISVERA|2003-02-07 15:05:18|
1|2|70|100|102|A|02/07/2003|CARRION YCAZA ANDRES|RETIRA|70|CARLTORR|2003-02-07 15:23:19|
1|2|70|101|99|A|02/07/2003|FAJARDO MARIA BARRERA DE                |SAUCES 1 MZ. F14 V.31|70|CARLTORR|2003-02-07 15:33:01|
1|2|70|102|101|A|02/07/2003|LEON GUSTAVO|RETIRA|70|CARLTORR|2003-02-07 15:33:53|
1|2|70|103|103|A|02/07/2003|YAGUAL MEDARDO|RETIRA|70|CARLTORR|2003-02-07 16:45:20|
1|2|79|54|48|A|02/07/2003|BANO DE OFICINA|AVDA. MIGEL ALCIVAR, ED. ARQUETIPO III|79|CARLTORR|2003-02-07 17:09:18|
1|2|79|55|49|A|02/07/2003|BANO OFICINA|AVDA. MIGEL ALCIVAR, ED. ARQUETIPO III|79|CARLTORR|2003-02-07 17:11:29|
1|2|70|104|104|A|02/10/2003|SALVATIERRA MARTIN|RETIRA|70|CARLTORR|2003-02-10 16:46:31|
1|2|79|56|51|A|02/11/2003|JACINTO ENDARA|ENTREGAR EN BOD. JUAN T. MARENGO|62|RAQUIDRO|2003-02-11 09:57:12|
1|2|70|105|105|A|02/11/2003|INMOBILIARIA CALIDAD, INMOCALI S.A.     |ALMACEN CENTRO|70|CARLTORR|2003-02-11 10:08:15|
1|2|79|57|50|A|02/11/2003|FISHER MARIANA DE                       |PARROQUIA JESUS MARIA|62|CARLTORR|2003-02-11 10:10:53|
1|2|70|106|106|A|02/11/2003|MENDEZ CARLOS|RETIRA|70|CARLTORR|2003-02-11 11:29:00|
1|2|70|107|107|A|02/11/2003|O.COMP#21600|RETIRAN ALMC.CENTRO.|70|LUISVERA|2003-02-11 14:36:12|
1|2|70|108|108|A|02/11/2003|ZAMBRANO MANUEL|LOMAS DE URDESA AVILES 209|70|CARLTORR|2003-02-11 15:17:50|
1|2|70|109|111|A|02/11/2003|ROMERO MARISOL|RETIRA|70|CARLTORR|2003-02-11 17:01:43|
1|2|70|110|110|A|02/11/2003|ARTICULO INCOMPL. Y DESCONTINUA|RETIRA|70|CARLTORR|2003-02-11 17:02:39|
1|2|70|111|109|A|02/11/2003|IND. INMOBILIARIA LIALTRIAL S.A.|RETIRA SR. JESUS CASTRO|70|CARLTORR|2003-02-11 18:33:01|
1|2|70|112|112|A|02/11/2003|SALAZAR GLADYS|ALMACEN CENTRO|70|CARLTORR|2003-02-11 18:38:48|
1|2|70|113|113|A|02/13/2003|FLORES BERTHA|RETIRA|70|CARLTORR|2003-02-13 09:10:53|
1|2|79|58|52|A|02/13/2003|O.C.#68780 RECIBE SR.MORENO|ROSENDO AVILES Y BOGOTA|60|LUISVERA|2003-02-13 09:44:28|
1|2|79|59|53|A|02/13/2003|FERRETERIA SAN JAVIER                   |RETIRAN PERSONAL|64|LUISVERA|2003-02-13 10:36:51|
1|2|70|114|114|A|02/13/2003|JUNTA DE BENEFICENCIA DE GUAYAQUIL      |VELEZ 109 Y PEDRO CARBO|70|RAQUIDRO|2003-02-13 15:27:36|
1|2|70|115|116|A|02/13/2003|JACINTO ENDARA|J.T. MARENGO CON STOCK BOD. 70|70|CARLTORR|2003-02-13 16:47:07|
1|2|79|60|55|A|02/13/2003|O.COMPRA#903|RETIRAN PERSONAL|64|LUISVERA|2003-02-13 16:52:03|
1|2|79|61|56|A|02/13/2003|O.COMPRA#31366|ACERO QUITO RETIRA SR RAUL CARDENAS|60|LUISVERA|2003-02-13 16:54:00|
1|2|79|62|57|A|02/13/2003|ARQ. JOSE MENDOZA|B. J.T. MARENGO-ARQ. MENDOZA|62|RAQUIDRO|2003-02-13 17:31:04|
1|2|79|63|58|A|02/13/2003|ARQ. JOSE MENDOZA|J.T. MARENGO-ARQ. JOSE MENDOZA|62|RAQUIDRO|2003-02-13 17:32:02|
1|2|79|64|59|A|02/13/2003|O.COMPRA#31369|AV.JUANT.MARENGO KM 2.5|60|LUISVERA|2003-02-13 17:40:09|
1|2|70|116|118|A|02/14/2003|SELLAN MONTERO GISSEL|ALMACEN CENTRO|70|CARLTORR|2003-02-14 10:30:06|
1|2|70|117|117|A|02/14/2003|MONJE JULIO|ALMACEN CENTRO|70|CARLTORR|2003-02-14 10:30:58|
1|2|70|118|119|A|02/14/2003|CARLOS TORRES|ALMACEN CENRO|70|CARLTORR|2003-02-14 10:31:48|
1|2|70|119|120|A|02/14/2003|MELLER FABIOLA DE|.|70|CARLTORR|2003-02-14 10:55:17|
1|2|79|65|60|A|02/14/2003|DIMETAL                                 |LORENZO DE GARAICOA Y PADRE SOLANO|60|LUISVERA|2003-02-14 12:33:44|
1|2|79|66|61|A|02/14/2003|.|ALMACEN CENTRO|62|CARLTORR|2003-02-14 15:37:25|
1|2|70|120|122|A|02/14/2003|JOSE GUILLEN|ALMACEN CENTRO|70|CARLTORR|2003-02-14 16:35:08|
1|2|70|121|123|A|02/14/2003|SR. ZEA ARTURO|M|70|CARLTORR|2003-02-14 17:10:10|
1|2|70|122|124|A|02/17/2003|VERA VERA LUIS|ALMACEN CENTRO|70|CARLTORR|2003-02-17 10:23:06|
1|2|70|123|126|A|02/17/2003|VILLAGOMEZ GONZALO|M|70|CARLTORR|2003-02-17 10:47:12|
1|2|70|124|127|A|02/17/2003|TERESA VARGAS MORALES|RETIRA|70|CARLTORR|2003-02-17 11:00:49|
1|2|70|125|125|A|02/17/2003|ANGULO EUCLIDES SR.|M|70|LUISVERA|2003-02-17 11:17:53|
1|2|70|126|129|A|02/17/2003|SANCHEZ RODOLFO|M|70|CARLTORR|2003-02-17 12:36:46|
1|2|79|67|62|A|02/17/2003|ALESSMART-CODIART S.A.                  |AV. QUITO 806 Y AV. 9 DE OCTUBRE|60|LUISVERA|2003-02-17 12:40:42|
1|2|70|127|128|A|02/17/2003|ALESSMART-CODIART S.A.                  |AV. QUITO 806 Y AV. 9 DE OCTUBRE|70|LUISVERA|2003-02-17 12:41:56|
1|2|70|128|130|A|02/17/2003|ZOILA GRANDA DE NUQUES|M|70|CARLTORR|2003-02-17 14:37:49|
1|2|70|129|131|A|02/17/2003|GRANIZO JOSE|M|70|LUISVERA|2003-02-17 15:03:24|
1|2|70|130|132|A|02/17/2003|SOSA PATRICIO|M|70|CARLTORR|2003-02-17 16:07:40|
1|2|70|131|133|A|02/18/2003|RESTAURANTE ASIA|DR. GALO WONG|70|CARLTORR|2003-02-18 10:20:03|
1|2|79|68|63|A|02/18/2003|PULLAS URIBE MILTON|J.T.MARENGO SR MILTON PULLAS|60|RAQUIDRO|2003-02-18 12:28:07|
1|2|79|69|64|A|02/18/2003|O.COMPRA#21626|RETIRAN J.T.MARENGO|60|LUISVERA|2003-02-18 15:46:11|
1|2|70|132|134|A|02/18/2003|BALLAS GUSTAVO|M|70|CARLTORR|2003-02-18 16:06:26|
1|2|70|133|135|A|02/18/2003|APOLO LORENA DE|RETIRA|70|CARLTORR|2003-02-18 16:43:24|
1|2|79|70|70|A|02/18/2003|BANO SERVICIO-ESCANDON|STA. MARIA CASA GRANDE|62|CARLTORR|2003-02-18 17:16:27|
1|2|79|71|69|A|02/18/2003|BANO VISITA- ESCANDON|STA. MARIA CASA GRANDE|62|CARLTORR|2003-02-18 17:18:09|
1|2|79|72|68|A|02/18/2003|BANO HUESPEDES P.B. -ESCANDON|M. A. ALCIVAR, ED. ARQUETIPO III|62|CARLTORR|2003-02-18 17:19:26|
1|2|79|73|67|A|02/18/2003|BANO 2 -ESCANDON|STA. MARIA CASA GRANDE|62|CARLTORR|2003-02-18 17:20:50|
1|2|79|74|65|A|02/18/2003|BANO MASTER-ESCANDON|STA. MARIA CASA GRANDE|62|CARLTORR|2003-02-18 17:26:14|
1|2|79|75|66|A|02/18/2003|BANO 1-ESCANDON|STA. MARIA CASA GRANDE|62|CARLTORR|2003-02-18 17:28:45|
1|2|79|76|73|A|02/18/2003|COCINA|STA. MARIA CASA GRANDE-ESCANDON|62|CARLTORR|2003-02-18 17:33:22|
1|2|79|77|74|A|02/18/2003|GLORIETA-LAVAND.JARDIN|STA. MARIA CASA GRANDE-ESCANDON|62|CARLTORR|2003-02-18 17:34:49|
1|2|79|78|72|A|02/18/2003|BANO PISCINA-ESCANDON|STA. MARIA CASA GRANDE-ESCANDON|62|CARLTORR|2003-02-18 17:36:30|
1|2|79|79|71|A|02/18/2003|BANO SERVICIO - ESCANDON|STA. MARIA CASA GRANDE|62|CARLTORR|2003-02-18 17:38:20|
1|2|70|134|136|A|02/18/2003|NOVAPALELES|RETIRAN|70|CARLTORR|2003-02-18 17:44:56|
1|2|79|80|75|A|02/19/2003|VALERO RODRIGUEZ ALBERTO                |ALMACEN CENTRO|64|LUISVERA|2003-02-19 09:12:21|
1|2|70|135|137|A|02/19/2003|BIENS MARIA DE|M|70|CARLTORR|2003-02-19 11:47:06|
1|2|70|136|138|A|02/19/2003|MENDEZ CARLOS|M|70|CARLTORR|2003-02-19 12:04:09|
1|2|70|137|139|A|02/19/2003|LUCAS PABLO|M|70|LUISVERA|2003-02-19 12:29:38|
1|2|70|138|140|A|02/19/2003|RIVADENEIRA JORGE|M|70|CARLTORR|2003-02-19 13:16:51|
1|2|70|139|141|A|02/19/2003|SR. ANGEL LEON|M|70|LUISVERA|2003-02-19 13:54:01|
1|2|70|140|142|A|02/19/2003|ELLIS MARTIN|M|70|LUISVERA|2003-02-19 15:03:20|
1|2|70|141|144|A|02/20/2003|DEFAZ MERCHAN NELSON ARQ.               |PRADERA 2 MZ. D9 V.31|70|CARLTORR|2003-02-20 09:17:42|
1|2|70|142|145|A|02/20/2003|ARTEAGA JANETH|M|70|CARLTORR|2003-02-20 09:30:02|
1|2|70|143|143|A|02/20/2003|DR. GALO WONG|RESTAURANTE ASIA|70|CARLTORR|2003-02-20 09:33:20|
1|2|79|81|76|A|02/20/2003|O.C. # 11398.DOLORES CAMPANA|B. JUAN T. MARENGO-RET. MANUEL|62|CARLTORR|2003-02-20 09:56:58|
1|2|79|82|77|A|02/20/2003|FERRETERIA ECUATORIANA                  |COLON 1006 Y LA 8AVA|60|LUISVERA|2003-02-20 09:59:14|
1|2|79|83|78|A|02/20/2003|O.COMPRA#26080|ROBLES 301 Y CALLEJON CAMAL|64|LUISVERA|2003-02-20 13:24:58|
1|2|79|84|79|A|02/20/2003|O.COMPRA#911|RETIRA SR ANGEL GONZALEZ|64|LUISVERA|2003-02-20 15:10:26|
1|2|70|144|147|A|02/20/2003|SR. EDUARDO CHONQUI|.|70|CARLTORR|2003-02-20 15:58:20|
1|2|70|145|148|A|02/20/2003|DIMETAL                                 |ALM.CENTRO 10 DE AGOSTO|70|LUISVERA|2003-02-20 17:36:03|
1|2|70|146|149|A|02/20/2003|RICKY CENTRO                            |RETIRAN ALM. CENTRO|70|LUISVERA|2003-02-20 17:41:49|
1|2|70|147|146|A|02/21/2003|O.C.#0421|RETIRAN|70|CARLTORR|2003-02-21 10:01:06|
1|2|70|148|151|A|02/21/2003|.|ALMACEN CENTRO|70|CARLTORR|2003-02-21 13:08:13|
1|2|79|85|80|A|02/21/2003|SR. JUAN HEREDIA|ALMACEN CENTRO|62|RAQUIDRO|2003-02-21 13:08:14|
1|2|70|149|150|A|02/21/2003|PENAFIEL GRACIELA|M|70|LUISVERA|2003-02-21 14:07:18|
1|2|79|86|82|A|02/21/2003|0.COMPRA #31420|RETIRAN J.T.MARENGO|60|LUISVERA|2003-02-21 14:35:36|
1|2|79|87|83|A|02/21/2003|0.COMPRA #31419|RETIRAN J.T.MARENGO|60|LUISVERA|2003-02-21 14:38:07|
1|2|70|150|152|A|02/21/2003|PAZMINO BELLA|M|70|RAQUIDRO|2003-02-21 15:53:50|
1|2|70|151|153|A|02/21/2003|YEPEZ BORJA ALEX GERMAN                 |RETIRAN ALM. CENTRO|70|LUISVERA|2003-02-21 16:12:08|
1|2|70|152|154|A|02/21/2003|SUMINISTROS Y MATERIALES|VACAS GALINDO 334-338 YE.ALFARO|70|LUISVERA|2003-02-21 16:34:27|
1|2|70|153|155|A|02/21/2003|N.CDTO.#     Y COB.#|RETIRA|70|CARLTORR|2003-02-21 17:52:28|
1|2|79|88|81|A|02/24/2003|O.COMPRA #31421O|LA LLAVE QUITO|12|RAQUIDRO|2003-02-24 09:21:46|
1|2|70|154|156|A|02/24/2003|CABEZAS ANIBAL|.|70|LUISVERA|2003-02-24 12:39:14|
1|2|70|155|157|A|02/24/2003|ARREAGA WALTER|M|70|CARLTORR|2003-02-24 15:27:53|
1|2|70|156|159|A|02/24/2003|COFERMA                                 |RETIRA|70|CARLTORR|2003-02-24 16:39:29|
1|2|70|157|160|A|02/24/2003|SOSA PATRICIO|M|70|CARLTORR|2003-02-24 17:14:25|
1|2|79|89|84|A|02/25/2003|ARTICULO DESCONTINUADO|VILLAO CARMEN|64|CARLTORR|2003-02-25 10:31:04|
1|2|70|158|161|A|02/25/2003|ING.JORGE CALVACHE|M|70|CARLTORR|2003-02-25 12:08:13|
1|2|70|159|163|A|02/25/2003|ASPREN CHRISTIAM|M|70|CARLTORR|2003-02-25 16:08:43|
1|2|70|160|162|A|02/25/2003|SAMAN FATIMA|M|70|CARLTORR|2003-02-25 16:11:32|
1|2|79|90|85|A|02/25/2003|2 CUADRAS + ABAJO DE FCO.SEGURA|J.ILLINGWORTH 902 Y 6/MARZO|64|CARLTORR|2003-02-25 17:24:25|
1|2|70|161|164|A|02/26/2003|COFERMA                                 |ELOY ALFARO 2224 Y G.GOYENA|70|LUISVERA|2003-02-26 10:08:57|
1|2|70|162|165|A|02/26/2003|CALLE TORRES VICTOR DR.|RETIRA|70|CARLTORR|2003-02-26 10:20:27|
1|2|70|163|166|A|02/26/2003|DIMETAL                                 |LORENZO DE GARAICOA Y PADRE SOLANO|70|LUISVERA|2003-02-26 11:40:14|
1|2|70|164|167|A|02/26/2003|YAGUAL MEDARDO|RETIRA|70|CARLTORR|2003-02-26 11:47:46|
1|2|70|165|170|A|02/26/2003|BALLADARES CHIMBO MAURICIO|CDLA. LOS JARDINES, SANTA ROSA|70|CARLTORR|2003-02-26 14:27:27|
1|2|70|166|168|A|02/26/2003|LEON JURADO GENARO ARQ.                 |MALDONADO Y LA 19|70|CARLTORR|2003-02-26 14:28:17|
1|2|70|167|169|A|02/26/2003|CALLE FERNANDO SR|ALM CENTRO 10 DE AGOSTO|70|LUISVERA|2003-02-26 15:14:48|
1|2|70|168|172|A|02/26/2003|O.C.#0433|RETIRAN|70|CARLTORR|2003-02-26 16:42:15|
1|2|70|169|173|A|02/26/2003|SAMAN SALEM ANTONIO                     |RETIRA|70|CARLTORR|2003-02-26 16:43:12|
1|2|70|170|171|A|02/26/2003|HANNA LORENA DE|ALM CENTRO|70|CARLTORR|2003-02-26 16:44:07|
1|2|79|91|86|A|02/27/2003|O.COMPRA#914|RETIRAN J.T.MARENGO|64|LUISVERA|2003-02-27 11:28:25|
1|2|70|171|174|A|02/27/2003|VILLAFUERTE AMELIA DE|.|70|CARLTORR|2003-02-27 13:19:31|
1|2|70|172|176|A|02/27/2003|CHIFA PALACIO DORADO|M|70|CARLTORR|2003-02-27 14:46:38|
1|2|70|173|177|A|02/27/2003|LEON JURADO GENARO ARQ.                 |MALDONADO Y LA 19|70|RAQUIDRO|2003-02-27 14:50:51|
1|2|70|174|175|A|02/27/2003|LEON JURADO GENARO ARQ.                 |MALDONADO Y LA 19|70|CARLTORR|2003-02-27 14:58:13|
1|2|70|175|178|A|02/27/2003|NARANJO MANUEL|M|70|LUISVERA|2003-02-27 15:01:14|
1|2|79|92|87|A|02/27/2003|LEON JURADO GENARO ARQ.                 |MALDONADO Y LA 19|62|CARLTORR|2003-02-27 15:03:29|
1|2|70|176|179|A|02/27/2003|PLASTICOS INDUSTRIALES C.A.             |KM. 7.5 VIA A DAULE|70|CARLTORR|2003-02-27 16:38:04|
1|2|70|177|180|A|02/28/2003|HOTECEL BELLSAOTH|M|70|CARLTORR|2003-02-28 09:42:12|
1|2|70|178|181|A|02/28/2003|ARROYO LAMILLA CARLOS                   |AGUIRRE 411 Y CHIMBORAZO|70|RAQUIDRO|2003-02-28 10:29:18|
1|2|79|93|88|A|02/28/2003|MAFNASA S.A.                            |LORENZO DE GARAICOA 2130 Y HUANCAVILCA|64|LUISVERA|2003-02-28 10:58:20|
1|2|70|179|182|A|02/28/2003|SRA. FANNY DE ALBAN|M|70|CARLTORR|2003-02-28 11:35:17|
1|2|70|180|183|A|02/28/2003|FABRE MIGUEL|M|70|CARLTORR|2003-02-28 12:55:20|
1|2|70|181|186|A|02/28/2003|FERRETERIA SAN JAVIER                   |RUMICHACA 1238 Y C. BALLEN|70|CARLTORR|2003-02-28 16:18:43|
1|2|70|182|185|A|02/28/2003|CAMPI VALERO NESTOR ING.                |RETIRA SR.FRANCISCO CAMPI|70|CARLTORR|2003-02-28 16:23:51|
1|2|70|183|184|A|02/28/2003|GALASAN CIA. LTDA.|RETIRAN|70|CARLTORR|2003-02-28 16:24:34|
1|2|70|184|158|A|02/28/2003|ARTICULO DESCONTINUADO|VILLAO CARMEN|70|CARLTORR|2003-02-28 16:33:37|
1|2|70|185|187|A|02/28/2003|VILLAO CARMEN|RETIRA|70|CARLTORR|2003-02-28 16:51:50|
1|2|70|186|188|A|02/28/2003|AGUIRRE WALTER SR.|M|70|LUISVERA|2003-02-28 17:10:00|
1|2|70|187|189|A|03/05/2003|PINCAY VICTOR|RETIRA|70|CARLTORR|2003-03-05 15:06:27|
1|2|79|94|89|A|03/05/2003|FERREIND                                |JOSE MASCOTE 206 Y MANUEL GALECIO|60|LUISVERA|2003-03-05 16:08:34|
1|2|79|95|91|A|03/06/2003|DIRECCION GENERAL DEL MATERIAL          |BASE NAVAL SUR VIA A PUERTO MARITIMO|60|LUISVERA|2003-03-06 09:50:40|
1|2|79|96|92|A|03/06/2003|MEZA BAQUE MILTON                       |RUMICHACA 1820 Y BENALCAZAR|64|LUISVERA|2003-03-06 10:55:34|
1|2|79|97|93|A|03/06/2003|DISMATEL                                |ORIENTE   Y 34 AVA|64|LUISVERA|2003-03-06 11:05:08|
1|2|79|98|93|A|03/06/2003|DISMATEL                                |ORIENTE   Y 34 AVA|60|LUISVERA|2003-03-06 11:06:59|
1|2|79|99|94|A|03/06/2003|IMFERSA S.A.                            |RETIRAN PERSONAL|60|LUISVERA|2003-03-06 14:25:03|
1|2|70|188|190|A|03/06/2003|FERRETERIA CENTAURO                     |RETIRAN|70|CARLTORR|2003-03-06 14:28:25|
1|2|70|189|191|A|03/06/2003|FARMAYALA|ALM. CENTRO|70|CARLTORR|2003-03-06 15:01:49|
1|2|79|100|95|A|03/06/2003|O.COMPRA #3071|KM 11.5 VIA A DAULE|64|LUISVERA|2003-03-06 15:39:28|
1|2|70|190|192|A|03/06/2003|SOC. AGRICOLA E IND. SAN CARLOS S.A.    |RETIRA SR. HECTOR MONTALVAN|70|CARLTORR|2003-03-06 16:11:55|
1|2|70|191|193|A|03/06/2003|ALMACENES EL GLOBO|RETIRA|70|CARLTORR|2003-03-06 17:14:54|
1|2|79|101|96|A|03/07/2003|QUINTANA MOREIRA GINA, ARQ.             |ENTREGAR EN MERCADO JOCKEY CLUB BOLIVIA |62|RAQUIDRO|2003-03-07 09:37:58|
1|2|70|192|194|A|03/07/2003|POSLIGUA PEDRO|M|70|CARLTORR|2003-03-07 10:38:58|
1|2|70|193|196|A|03/07/2003|IMFERSA S.A.                            |GARCIA GOYENA 365 Y ELOY ALFARO|70|RAQUIDRO|2003-03-07 12:01:28|
1|2|70|194|195|A|03/07/2003|IMFERSA S.A.                            |GARCIA GOYENA 365 Y ELOY ALFARO|70|RAQUIDRO|2003-03-07 12:08:29|
1|2|70|195|197|A|03/07/2003|SIMON ISAIAS XAVIER                     |10 DE AGOSTO 6036 Y CHIMBORAZO ESQ.|70|LUISVERA|2003-03-07 14:29:46|
1|2|70|196|198|A|03/07/2003|GARRIDO ZAPA ANTONIO A.                 |ALMACEN CENTRO|70|LUISVERA|2003-03-07 15:12:26|
1|2|70|197|199|A|03/07/2003|ARTICULO EN OFERTA - COB#220|RETIRA   DE ALMACEN CENTRO                           |70|RAQUIDRO|2003-03-07 16:04:30|
1|2|79|102|90|A|03/07/2003|OBRA JARDINERITOS-KM. 14.5 VIA A LA COST|ENTREGAR EN BODEGA JUAN TANCA MARENGO                |62|RAQUIDRO|2003-03-07 16:20:50|
1|2|79|103|90|A|03/07/2003|OBRA JARDINERITOS-KM. 14.5 VIA A LA COST|ENTREGAR EN ALMACEN CENTRO                           |62|RAQUIDRO|2003-03-07 16:22:13|
1|2|79|104|97|A|03/10/2003|O.C. # 11437-KNEZEVIC-PALMAR DEL RIO|J.T. MARENGO RETIRA M. SANDOYA|62|CARLTORR|2003-03-10 12:01:49|
1|2|70|198|201|A|03/10/2003|MENENDEZ FELIX|RETIRA|70|CARLTORR|2003-03-10 14:53:54|
1|2|70|199|200|A|03/10/2003|COFERMA                                 |RETIRAN|70|CARLTORR|2003-03-10 14:56:11|
1|2|70|200|204|A|03/10/2003|.|RETIRA|70|CARLTORR|2003-03-10 15:21:36|
1|2|70|201|203|A|03/10/2003|FERNANDEZ BEATRIZ DE|M|70|CARLTORR|2003-03-10 15:22:30|
1|2|70|202|202|A|03/10/2003|AGUIRRE GRACIELA DE|RETIRA|70|CARLTORR|2003-03-10 15:23:15|
1|2|70|203|205|A|03/10/2003|BUCHELLI NELLY DE|RETIRA|70|CARLTORR|2003-03-10 16:34:03|
1|2|79|105|98|A|03/11/2003|O.COMP#916|RETIRAN PERSONAL|64|RAQUIDRO|2003-03-11 09:34:26|
1|2|70|204|206|A|03/11/2003|FERRETERIA SAN JAVIER                   |RETIRAN|70|CARLTORR|2003-03-11 13:04:52|
1|2|70|205|207|A|03/11/2003|GUALOTUNA QUISHPE LUIS ALFREDO          |RETIRA PERSONAL|70|LUISVERA|2003-03-11 13:22:15|
1|2|79|106|96|A|03/11/2003|QUINTANA MOREIRA GINA, ARQ.             |ENTREGAR EN MERCADO JOCKEY CLUB BOLIVIA Y ANTEPARA   |62|RAQUIDRO|2003-03-11 16:14:48|
1|2|79|107|99|A|03/12/2003|O.C.   00783|BOYACA Y 9 DE OCTUBRE-ATT. ING. RUILOVA              |62|RAQUIDRO|2003-03-12 08:54:50|
1|2|70|206|209|A|03/12/2003|PONG CHONG RUBEN|M|70|CARLTORR|2003-03-12 10:11:29|
1|2|70|207|208|A|03/12/2003|O.C.   00783|BOYACA Y 9 DE OCTUBRE-ATE. ING. RUILOVA|70|CARLTORR|2003-03-12 10:33:24|
1|2|70|208|211|A|03/12/2003|MARTINEZ ROSA|RETIRA|70|CARLTORR|2003-03-12 10:36:10|
1|2|70|209|210|A|03/12/2003|MARTINEZ ROSA|.|70|CARLTORR|2003-03-12 10:37:01|
1|2|70|210|212|A|03/12/2003|GUALOTUNA QUISHPE LUIS ALFREDO          |COOP. ANTONIO J. DE SUCRE MZ. A SL. 2|70|LUISVERA|2003-03-12 10:49:51|
1|2|70|211|213|A|03/12/2003|NAVARRETE MARGARITA DE|M|70|CARLTORR|2003-03-12 11:36:48|
1|2|70|212|215|A|03/12/2003|ZEA JOSE ING.|RETIRA|70|CARLTORR|2003-03-12 12:56:29|
1|2|70|213|214|A|03/12/2003|CASTRO SERGIO ING.|RETIRA|70|CARLTORR|2003-03-12 12:57:09|
1|2|70|214|216|A|03/12/2003|COFERMA                                 |RETIRAN|70|RAQUIDRO|2003-03-12 13:02:40|
1|2|79|108|100|A|03/12/2003|RICKY CENTRO                            |RETIRA BOD. JUAN TANCA MARENGO|64|RAQUIDRO|2003-03-12 13:55:21|
1|2|70|215|217|A|03/12/2003|PROANO HERRERA ELENA                    |ALMACEN CENTRO|70|RAQUIDRO|2003-03-12 15:36:31|
1|2|79|109|101|A|03/12/2003|FAJARDO MARIA BARRERA DE                |SAUCES 1 MZ. F14 V.31|64|CARLTORR|2003-03-12 15:52:28|
1|2|79|110|101|A|03/12/2003|FAJARDO MARIA BARRERA DE                |SAUCES 1 MZ. F14 V.31|62|CARLTORR|2003-03-12 15:53:34|
1|2|79|111|102|A|03/12/2003|ARTICULO DESCONTINUADO|RETIRA|62|CARLTORR|2003-03-12 16:58:48|
1|2|70|216|219|A|03/12/2003|SR. ORLANDO VALAREZO|M|70|CARLTORR|2003-03-12 17:01:23|
1|2|79|112|103|A|03/12/2003|O.COMP#363|RETIRAN PERSONAL|64|LUISVERA|2003-03-12 17:30:46|
1|2|70|217|221|A|03/13/2003|GUALOTUNA QUISHPE LUIS ALFREDO          |COOP. ANTONIO J. DE SUCRE MZ. A SL. 2|70|LUISVERA|2003-03-13 14:29:44|
1|2|70|218|220|A|03/14/2003|ING. CHALEN|.|70|CARLTORR|2003-03-14 10:22:40|
1|2|79|113|104|A|03/14/2003|O.COMPRA#31536|AV. JUAN TANCA MARENGO KM. 2.5|60|LUISVERA|2003-03-14 11:57:48|
1|2|79|114|104|A|03/14/2003|O.COMPRA#31536|AV. JUAN TANCA MARENGO KM. 2.5|64|LUISVERA|2003-03-14 12:00:11|
1|2|79|115|105|A|03/14/2003|FERREIND                                |JOSE MASCOTE 206 Y MANUEL GALECIO|60|RAQUIDRO|2003-03-14 12:18:29|
1|2|70|219|222|A|03/14/2003|FERRETERIA CENTAURO                     |AV. YUNEZ G. E CORTEZ 923|70|CARLTORR|2003-03-14 13:24:01|
1|2|70|220|223|A|03/14/2003|ARTICULO COLOR DESCONTINUADO|RETIRA ALMACEN CENTRO|70|RAQUIDRO|2003-03-14 13:46:40|
1|2|70|221|224|A|03/14/2003|YUNEZ MA. DEL PILAR DE|.|70|CARLTORR|2003-03-14 15:47:13|
1|2|70|222|218|A|03/14/2003|FAJARDO MARIA BARRERA DE                |SAUCES 1 MZ. F14 V.31|70|CARLTORR|2003-03-14 16:20:40|
1|2|70|223|225|A|03/17/2003|LUIS ASTUDILLO|ALM. CENTRO|70|CARLTORR|2003-03-17 10:10:36|
1|2|70|224|226|A|03/17/2003|TRONCOSO MERY|M|70|LUISVERA|2003-03-17 11:10:08|
1|2|70|225|227|A|03/17/2003|TRONCOSO MERY|M|70|LUISVERA|2003-03-17 11:11:52|
1|2|70|226|229|A|03/17/2003|CARRERA ESTARELLAS FRANCISCO VICENTE|RETIRAN|70|CARLTORR|2003-03-17 12:42:48|
1|2|70|227|230|A|03/17/2003|NAPOLEON VINTIMILLA|M|70|CARLTORR|2003-03-17 14:20:15|
1|2|70|228|232|A|03/17/2003|DIMETAL                                 |LORENZO DE GARAICOA Y PADRE SOLANO|70|RAQUIDRO|2003-03-17 14:35:23|
1|2|70|229|231|A|03/17/2003|ALMEIDA FRANCO MAX|RETIRAN ALM CENTRO|70|LUISVERA|2003-03-17 14:42:46|
1|2|70|230|233|A|03/17/2003|MIGUEL CINSUEGRA|M|70|CARLTORR|2003-03-17 17:32:08|
1|2|70|231|235|A|03/18/2003|CARLOS MALO|STA. CRUZ -GALAPAGOS|70|CARLTORR|2003-03-18 13:13:03|
1|2|70|232|236|A|03/18/2003|QUINTANA MOREIRA GINA, ARQ.             |SAUCES 8, MZ. 460 V. 24|70|RAQUIDRO|2003-03-18 13:55:44|
1|2|79|116|107|A|03/18/2003|QUINTANA MOREIRA GINA, ARQ.             |SAUCES 8, MZ. 460 V. 24|62|RAQUIDRO|2003-03-18 13:56:52|
1|2|70|233|234|A|03/18/2003|CENTRO DE SALUD GUASMO SUR|ALMACEN CENTRO|70|LUISVERA|2003-03-18 13:56:52|
1|2|70|234|237|A|03/18/2003|COMERCIAL LA CONSTRUCCION               |ALMACEN CENTRO|70|RAQUIDRO|2003-03-18 15:47:02|
1|2|70|235|238|A|03/19/2003|RODRIGUEZ MARCOS SR.|RETIRA ALM CENTRO|70|LUISVERA|2003-03-19 09:50:36|
1|2|79|117|108|A|03/19/2003|O.COMPRA#483|J.T.MARENGO|60|LUISVERA|2003-03-19 10:21:22|
1|2|70|236|239|A|03/19/2003|JOSE TEJADA|ALM. CENTRO|70|CARLTORR|2003-03-19 10:40:05|
1|2|79|118|109|A|03/19/2003|O.COMP#494|RETIRA J.T.MARENGO|60|LUISVERA|2003-03-19 11:50:52|
1|2|70|237|240|A|03/19/2003|COMERCIAL   R.B.C|RETIRA ALMACEN CENTRO|70|LUISVERA|2003-03-19 14:20:07|
1|2|70|238|241|A|03/20/2003|ULLAURI RIVERA ANGEL|RETIRA ALM CENTRO|70|LUISVERA|2003-03-20 11:58:51|
1|2|70|239|242|A|03/20/2003|BARQUET LIGIA|RETIRA|70|CARLTORR|2003-03-20 13:13:46|
1|2|70|240|243|A|03/20/2003|RIBADENEIRA ORLANDO|RETIRA ALM CENTRO|70|LUISVERA|2003-03-20 15:49:09|
1|2|70|241|244|A|03/21/2003|SR. ITURRALDE|.|70|CARLTORR|2003-03-21 11:56:36|
1|2|79|119|110|A|03/21/2003|O.C.  #  9475 Y 9476|ROBLES 505 Y FCO. SEGURA|62|RAQUIDRO|2003-03-21 14:39:08|
1|2|70|242|245|A|03/21/2003|FERRETERIA COMERCIAL                    |RETIRAN|70|CARLTORR|2003-03-21 17:33:52|
1|2|79|120|111|A|03/24/2003|FERRETERIA SAN JAVIER                   |RETIRAN|64|CARLTORR|2003-03-24 12:44:48|
1|2|79|121|112|A|03/24/2003|FAX 560144|ENTREGAR P.ICAZA 302 Y CORDOVA|60|LUISVERA|2003-03-24 14:13:05|
1|2|79|122|114|A|03/25/2003|FONO : 09-9987260|ALMACEN CENTRO|64|LUISVERA|2003-03-25 11:28:01|
1|2|70|243|246|A|03/25/2003|COLEGIO CRISTOBAL COLON                 |RETIRAN|70|CARLTORR|2003-03-25 11:47:08|
1|2|79|123|115|A|03/25/2003|O.C.# 11836-ZAVALA -LAGO SOL|URBAN. LAGO SOL-RESIDENTE EDUARDO LUCIO-BANO 1-2 Y 3 |62|RAQUIDRO|2003-03-25 17:21:16|
1|2|79|124|116|A|03/25/2003|O.C. # 11839-ZAVALA -LAGO SOL-B. VISITA|URBAN. LAGO SOL-RESIDENTE ARQ. EDUARDO LUICIO.BANO   VISITA                                               |62|RAQUIDRO|2003-03-25 17:37:41|
1|2|79|125|117|A|03/25/2003|O.C. # 1183-LAGO SOL-ZAVALA-B. GALERIA|URBAN. LAGO SOL-RESIDENTE ARQ. EDUARDO LUCIO-BANO    GALERIA                                              |62|RAQUIDRO|2003-03-25 17:41:13|
1|2|79|126|118|A|03/25/2003|O.C. # 11838-LAGO SOL-ZAVALA-B.SERVICIO|URBAN. LAGO SOL-RESIDENTE ARQ. EDUARDO LUCIO-BANO    SERVICIO                                             |62|RAQUIDRO|2003-03-25 17:49:41|
1|2|79|127|119|A|03/25/2003|O.C. # 11838-ZAVALA-LAGO SOL-B. SERVICIO|URBAN.LAGO SOL-RESIDENTE ARQ. EDUARDO LUCIO-BANO     SERVICIO                                             |62|RAQUIDRO|2003-03-25 17:51:09|
1|2|79|128|120|A|03/25/2003|O.C. # 11892-CASA ING. TOMAS ALVAREZ|BOD J. T. MARENGO -RETIRA MANUEL SANDOYA             |62|RAQUIDRO|2003-03-25 17:55:35|
1|2|79|129|121|A|03/25/2003|O.C. # 11840-ZAVALA-LAGO SOL-B- MASTER|URBAN. LAGO SOL-RESIDENTE-ARQ. EDUARDO LUCIO-BANO    MASTER                                               |62|RAQUIDRO|2003-03-25 17:57:52|
1|2|79|130|122|A|03/25/2003|O.C. # 11841-ZAVALA-LAGO SOL-COCINA|URBAN. LAGO SOL-RESIDENTE ARQ. EDUARDO LUCIO-COCINA  |62|RAQUIDRO|2003-03-25 17:59:55|
1|2|79|131|123|A|03/25/2003|O.C. # 11842-ZAVALA-LAGO SOL-JARDIN-LAVA|URBAN. LAGO SOL-RESIDENTE ARQ. EDUARDO               LUCIO-LAVANDERIA-JARDIN                              |62|RAQUIDRO|2003-03-25 18:02:55|
1|2|70|244|248|A|03/26/2003|PEDIDO POR SRTA. SUSANA AGUIRRE|UNICENTRO|70|RAQUIDRO|2003-03-26 11:22:12|
1|2|70|245|249|A|03/26/2003|VISTA CLUB|RETIRAN|70|CARLTORR|2003-03-26 11:55:25|
1|2|70|246|250|A|03/26/2003|MARGOTH PENA|ALMACEN CENTRO|70|CARLTORR|2003-03-26 12:39:46|
1|2|70|247|251|A|03/26/2003|O.C. # 1010-1011|RETIRA|70|RAQUIDRO|2003-03-26 12:46:47|
1|2|70|248|247|A|03/26/2003|LORENZO CHICHANDE|RETIRA, PRODUCTO DE OFERTA|70|RAQUIDRO|2003-03-26 14:01:00|
1|2|70|249|252|A|03/26/2003|VERA CARLOS|RETIRA|70|CARLTORR|2003-03-26 15:02:21|
1|2|70|250|253|A|03/27/2003|VISTA CLUB|M|70|CARLTORR|2003-03-27 14:58:53|
1|2|70|251|248|A|03/27/2003|PEDIDO POR SRTA. SUSANA AGUIRRE|UNICENTRO|70|RAQUIDRO|2003-03-27 16:17:28|
1|2|79|132|124|A|03/28/2003|OBRA ING. BITAR|KM. 9.5 VIA A DAULE|64|RAQUIDRO|2003-03-28 09:52:36|
1|2|79|133|113|A|03/28/2003|O.COMP#69|DESPACHAR A CUENCA|60|LUISVERA|2003-03-28 10:20:15|
1|2|70|252|254|A|03/28/2003|MARGOTH PENA|M|70|CARLTORR|2003-03-28 12:18:39|
1|2|79|134|106|A|03/28/2003|.|MACHALA Y C.DESTRUGE, COND.FORESTAL BLOQUE 3        ENTRAR POR MACHALA|62|CARLTORR|2003-03-28 15:03:47|
1|2|70|253|255|A|03/28/2003|TOALA TIENE EL CROQUIS|CDLA. STA. CECILIA C.9NA.|70|CARLTORR|2003-03-28 15:04:43|
1|2|79|135|125|A|03/28/2003|CAMPI VALERO NESTOR ING.                |MACHALA Y CAMILO DESTRUGE, COND.FORESTAL BL.#3      ENTREGAR JUNTO CON N.E.#134|62|CARLTORR|2003-03-28 15:14:03|
1|2|70|254|256|A|03/28/2003|JULIO MONJE|M|70|CARLTORR|2003-03-28 15:52:09|
1|2|70|255|257|A|03/28/2003|MOREIRA SANTOS|M|70|CARLTORR|2003-03-28 16:15:46|
1|2|70|256|258|A|03/28/2003|ALEXANDRA DE SERRANO|M|70|CARLTORR|2003-03-28 17:01:10|
1|2|79|136|126|A|03/31/2003|GONZA SARANGO URSULA|CDLA. UNCOVIA CALLE PALMERA S/N Y PUCAR|64|LUISVERA|2003-03-31 09:21:49|
1|2|70|257|260|A|03/31/2003|GONZA SARANGO URSULA|CDLA. UNCOVIA CALLE PALMERA S/N Y PUCAR|70|LUISVERA|2003-03-31 09:23:31|
1|2|79|137|127|A|03/31/2003| 10DEAGOSTO Y CHILE|RETIRAN ALMACEN CENTRO|60|LUISVERA|2003-03-31 11:28:59|
1|2|79|138|128|A|03/31/2003|OBRA SR. NUNEZ-BANO MASTER|GUAYAQUIL TENIS-RESIDENTE MARIO LARA|62|RAQUIDRO|2003-03-31 13:14:02|
1|2|79|139|129|A|03/31/2003|OBRA NUNEZ -BANO # 1|GUAYAQUIL TENIS-RESID. ARQ. MARIO LARA|62|RAQUIDRO|2003-03-31 13:22:37|
1|2|79|140|130|A|03/31/2003|OBRA NUNEZ-BANO 2|GUAYAQUIL TENIS-RESID. ARQ.|62|RAQUIDRO|2003-03-31 13:24:22|
1|2|79|141|131|A|03/31/2003|OBRA NUNEZ-BANO # 3|GUAYAQUIL TENIS -RESIDENTE ARQ. MARIO LARA           |62|RAQUIDRO|2003-03-31 13:27:06|
1|2|79|142|132|A|03/31/2003|OBRA NUNEZ-BANO VISITA|GUAYAQUIL TENIS-RESID. ARQ. MARIO LARA|62|RAQUIDRO|2003-03-31 13:29:46|
1|2|79|143|133|A|03/31/2003|OBRA NUNEZ-BANO PISCINA|GUAYAQUIL TENIS-RESID. ARQ. MARIO LARA|62|RAQUIDRO|2003-03-31 13:31:13|
1|2|79|144|134|A|03/31/2003|OBRA NUNEZ-BANO PISCINA|GUAYAQUIL TENIS- RESID. ARQ. MARIO LARA|62|RAQUIDRO|2003-03-31 13:32:51|
1|2|70|258|262|A|03/31/2003|IBADANGO PONCE OSCAR E.|RETIRA|70|CARLTORR|2003-03-31 14:14:41|
1|2|70|259|263|A|03/31/2003|YATE REYNA SILVIA|CONTADO|70|LUISVERA|2003-03-31 15:03:43|
1|2|79|145|136|A|03/31/2003|OBRA NUNEZ-BAR|GUAYAQUIL TENIS - RESIDENTE ARQ. MARIO LARA          |62|RAQUIDRO|2003-03-31 15:46:11|
1|2|79|146|137|A|03/31/2003|OBRA NUNEZ-JARDIN-LAVANDERIA|GUAYAQUIL TENIS -RESIDENTE ARQ. MARIO LARA           |62|RAQUIDRO|2003-03-31 15:47:23|
1|2|79|147|138|A|03/31/2003|OBRA NUNEZ -COCINA|GUAYAQUIL TENIS-RESIDENTE ARQ. MARIO LARA            |62|RAQUIDRO|2003-03-31 15:48:55|
1|2|79|148|115|A|03/31/2003|O.C.# 11836-ZAVALA -LAGO SOL|LAGO SOL-ARQ. EDUARDO LUCIO|62|RAQUIDRO|2003-03-31 15:50:04|
1|2|70|260|264|A|03/31/2003|MARIA DE GOMEZ|.|70|CARLTORR|2003-03-31 16:13:55|
1|2|70|261|265|A|03/31/2003|CARLOS VILLACIS|.|70|CARLTORR|2003-03-31 16:19:25|
1|2|70|262|266|A|04/01/2003|CLEMENCIA MORENO|ALMACEN CENTRO|70|CARLTORR|2003-04-01 09:15:13|
1|2|79|149|139|A|04/01/2003|FERROBRONCE                             |RUMICHACA 1725 Y FCO. CAMPOS|60|LUISVERA|2003-04-01 09:52:53|
1|2|70|263|267|A|04/01/2003|GUALOTUNA QUISHPE LUIS ALFREDO          |COOP. ANTONIO J. DE SUCRE MZ. A SL. 2|70|LUISVERA|2003-04-01 10:12:12|
1|2|70|264|268|A|04/01/2003|.|.|70|RAQUIDRO|2003-04-01 10:32:19|
1|2|70|265|259|A|04/01/2003|CHICHANDE LORENZO|M|70|CARLTORR|2003-04-01 10:54:53|
1|2|70|266|269|A|04/01/2003|BUSKARINA S.A.                          |RETIRA ALM CENTRO|70|LUISVERA|2003-04-01 14:15:23|
1|2|70|267|270|A|04/01/2003|ANGULO EUCLIDES|M|70|LUISVERA|2003-04-01 16:23:27|
1|2|70|268|272|A|04/01/2003|VIVAR MERCEDES DE|M|70|CARLTORR|2003-04-01 17:11:56|
1|2|79|150|140|A|04/01/2003|O.C. # 71856-PED. POR ING. CANSING|EN QUITO A SR. GREGORIO ANDRADE|15|RAQUIDRO|2003-04-01 17:14:15|
1|2|79|151|141|A|04/01/2003|PEDIDO POR SRTA. SUSANA|ENTREGAR EN KM- 9.5 VIA DAULE|62|RAQUIDRO|2003-04-01 17:57:02|
1|2|70|269|273|A|04/02/2003|O.COMP#21767|ELOY ALFARO 916-920 Y BRASIL|70|LUISVERA|2003-04-02 10:38:30|
1|2|70|270|275|A|04/02/2003|O.COMP#0000074|RETIRA ALM CENTRO|70|LUISVERA|2003-04-02 14:22:36|
1|2|70|271|274|A|04/02/2003|MARIA DOLORES ESTRADA SALVADOR|ALMACEN CENTRO|70|CARLTORR|2003-04-02 14:29:38|
1|2|70|272|277|A|04/02/2003|HERRERA IRMA|M|70|CARLTORR|2003-04-02 16:28:49|
1|2|70|273|276|A|04/02/2003|RECALDE RICARDO|.|70|CARLTORR|2003-04-02 16:29:42|
1|2|70|274|271|A|04/02/2003|VILLACIS BEJARANO CARLOS|.|70|CARLTORR|2003-04-02 16:30:35|
1|2|70|275|278|A|04/03/2003|EDUARDO MACIAS|M|70|CARLTORR|2003-04-03 09:50:46|
1|2|79|152|142|A|04/03/2003|O.C.#00526|RETIRAN|60|LUISVERA|2003-04-03 13:07:43|
1|2|79|153|143|A|04/03/2003|FERREIND                                |JOSE MASCOTE 206 Y MANUEL GALECIO|60|LUISVERA|2003-04-03 13:12:01|
1|2|70|276|279|A|04/03/2003|CEDENO WALTER|M|70|LUISVERA|2003-04-03 13:51:35|
1|2|70|277|281|A|04/03/2003|CASTRO BURGOS CLAUDINA|RETIRA|70|CARLTORR|2003-04-03 16:18:53|
1|2|70|278|280|A|04/03/2003|BRUZZONE RENZO|RETIRA|70|CARLTORR|2003-04-03 16:23:53|
1|2|70|279|282|A|04/03/2003|ERWIN PETTERS|M|70|CARLTORR|2003-04-03 17:06:08|
1|2|70|280|283|A|04/04/2003|JERONIMO SUAREZ|ALMACEN CENTRO|70|CARLTORR|2003-04-04 09:55:37|
1|2|79|154|144|A|04/04/2003|ARQ. MAGDALENA VICUNA| RETIRA                                              |62|RAQUIDRO|2003-04-04 10:22:46|
1|2|70|281|285|A|04/04/2003|O.C.#|RETIRA  SR. RODRIGO GOMEZ|70|LUISVERA|2003-04-04 11:34:37|
1|2|79|155|129|A|04/04/2003|OBRA NUNEZ -BANO # 1|GUAYAQUIL TENIS-RESID. ARQ. MARIO LARA|62|RAQUIDRO|2003-04-04 11:34:50|
1|2|79|156|131|A|04/04/2003|OBRA NUNEZ-BANO # 3|GUAYAQUIL TENIS|62|RAQUIDRO|2003-04-04 11:38:10|
1|2|79|157|132|A|04/04/2003|OBRA NUNEZ-BANO VISITA|GUAYAQUIL TENIS-RESID. ARQ. MARIO LARA|62|RAQUIDRO|2003-04-04 11:39:23|
1|2|79|158|133|A|04/04/2003|OBRA NUNEZ-BANO PISCINA|GUAYAQUIL TENIS-RESID. ARQ. MARIO LARA|62|RAQUIDRO|2003-04-04 11:41:00|
1|2|70|282|286|A|04/04/2003|ALTAMIRANO CISNEROS RAMIRO|CUENCA Y GUERRERO MARTINEZ|70|CARLTORR|2003-04-04 16:48:42|
1|2|79|159|145|A|04/04/2003|O.COMP#82|TRANSPORTE SEMERIA CARGA CUENCA|60|RAQUIDRO|2003-04-04 17:13:21|
1|2|70|283|287|A|04/07/2003|SR. MIGUEL MORA|ALMACEN CENTRO|70|CARLTORR|2003-04-07 09:22:35|
1|2|70|284|288|A|04/07/2003|BRUZZONE FIORITO RENZO ARQ.|RETIRA|70|CARLTORR|2003-04-07 11:44:33|
1|2|79|160|144|A|04/07/2003|O.C.#|RETIRAN|62|CARLTORR|2003-04-07 13:09:34|
1|2|70|285|289|A|04/07/2003|GUALOTUNA ALFREDO                       |RETIRAN|70|LUISVERA|2003-04-07 15:44:58|
1|2|79|161|146|A|04/07/2003|O.C. # 12138-OBRA NUNEZ-BANO # 1|RETIRA BOD. J.T. MARENGO|62|RAQUIDRO|2003-04-07 16:07:02|
1|2|79|162|147|A|04/07/2003|IMFERSA S.A.                            |RETIRAN|62|RAQUIDRO|2003-04-07 16:35:58|
1|2|79|163|147|A|04/07/2003|IMFERSA S.A.                            |RETIRAN|60|LUISVERA|2003-04-07 16:58:25|
1|2|79|164|145|A|04/08/2003|O.COMP#82|TRANSPORTE SEMERIA CARGA CUENCA|60|RAQUIDRO|2003-04-08 09:50:27|
1|2|79|165|148|A|04/08/2003|GUELFI S.A.|KM. 25 VIA PERIMETRAL|62|RAQUIDRO|2003-04-08 11:46:33|
1|2|79|166|149|A|04/08/2003|GUELFI S.A.|RETIRA|64|RAQUIDRO|2003-04-08 11:47:25|
1|2|70|286|292|A|04/08/2003|GUELFI S.A.|RETIRA|70|CARLTORR|2003-04-08 12:30:27|
1|2|70|287|290|A|04/08/2003|GUELFI S.A.|KM. 25 VIA PERIMETRAL|70|CARLTORR|2003-04-08 12:32:16|
1|2|70|288|291|A|04/08/2003|GUELFI S.A.|RETIRAN|70|CARLTORR|2003-04-08 12:34:15|
1|2|70|289|293|A|04/08/2003|GUELFI S.A.|KM. 25 VIA PERIMETRAL|70|CARLTORR|2003-04-08 12:35:25|
1|2|79|167|150|A|04/08/2003|O.C. # 12165-OBRA ACHI|RETIRA|62|CARLTORR|2003-04-08 14:40:20|
1|2|79|168|151|A|04/08/2003|OBRA LANDIVAR-BANO MASTER|ENTRE LAGOS-RESIDENTE RUBEN GUTIERREZ|62|RAQUIDRO|2003-04-08 15:39:42|
1|2|79|169|152|A|04/08/2003|OBRA LANDIVAR-BANO COMPARTIDO|ENTRE LAGOS-RESID. ARQ. RUBEN GUTIERREZ|62|RAQUIDRO|2003-04-08 15:57:08|
1|2|79|170|153|A|04/08/2003|OBRA LANDIVAR-BANO VISITA|ENTRE LAGOS-RESIDENTE ARQ. RUBEN GUTIERR|62|RAQUIDRO|2003-04-08 15:59:23|
1|2|79|171|154|A|04/08/2003|OBRA LANDIVAR-BANO SERVICIO|ENTRE LAGOS-RESIDENTE ARQ. RUBEN GUTIERR|62|RAQUIDRO|2003-04-08 16:00:43|
1|2|79|172|155|A|04/08/2003|OBRA LANDIVAR-BANO SERVICIO Y VARIOS|ENTRE LAGOS - RESID. ARQ. MARIO GUTIERRE|62|RAQUIDRO|2003-04-08 16:02:31|
1|2|79|173|156|A|04/08/2003|OBRA LANDIVAR-COCINA|ENTRE LAGOS-RESID. ARQ. RUBEN GUTIERREZ|62|RAQUIDRO|2003-04-08 16:05:38|
1|2|79|174|157|A|04/08/2003|OBRA LANDIVAR-BANO NINO|ENTRE LAGOS RESID. ARQ. RUBEN GUTIERREZ|62|RAQUIDRO|2003-04-08 16:17:52|
1|2|70|290|294|A|04/08/2003|BERTHA SAMANIEGO|ALM. CENTRO|70|CARLTORR|2003-04-08 16:29:02|
1|2|70|291|295|A|04/08/2003|OBRA LANDIVAR -BANO COMPARTIDO|ENTRE LAGOS-RESID. ARQ. RUBEN GUTIERREZ|70|RAQUIDRO|2003-04-08 16:36:50|
1|2|79|175|158|A|04/08/2003|O.C. 12174.OBRA DACCACH|RETIRA J.T. MARENGO|62|RAQUIDRO|2003-04-08 17:23:52|
1|2|70|292|297|A|04/09/2003|IMFERSA S.A.                            |RETIRA ALMACEN|70|RAQUIDRO|2003-04-09 12:45:32|
1|2|70|293|299|A|04/09/2003|BALON KLEBER|M|70|LUISVERA|2003-04-09 14:54:23|
1|2|70|294|298|A|04/09/2003|BALON KLEBER|RETIRA ALM CENTRO|70|LUISVERA|2003-04-09 14:55:27|
1|2|70|295|300|A|04/09/2003|GUALOTUNA QUISHPE LUIS ALFREDO          |COOP. ANTONIO J. DE SUCRE MZ. A SL. 2|70|LUISVERA|2003-04-09 15:48:15|
1|2|79|176|159|A|04/09/2003|OBRAN NUNEZ-BANO # 3|RETIRA BOD. J. T. MARENGO|62|RAQUIDRO|2003-04-09 16:31:13|
1|2|70|296|296|A|04/10/2003|COFERMA                                 |RETIRAN|70|CARLTORR|2003-04-10 09:39:59|
1|2|70|297|302|A|04/10/2003|ACERO COMERCIAL ECUATORIANO S.A.        |AV. J. TANCA MARENGO KM. 1.7|70|LUISVERA|2003-04-10 12:13:50|
1|2|70|298|303|A|04/10/2003|ARROYO LAMILLA CARLOS                   |AGUIRRE 411 Y CHIMBORAZO|70|RAQUIDRO|2003-04-10 13:35:59|
1|2|79|177|160|A|04/10/2003|GUIM LOQUIO EMILIO ING.                 |DESPACHAR ALM.CENTRO 10 DE AGOS|60|LUISVERA|2003-04-10 13:36:02|
1|2|70|299|305|A|04/10/2003|ALEJANDRO PERE|.|70|CARLTORR|2003-04-10 16:57:30|
1|2|70|300|304|A|04/10/2003|COLEGIO INTERNACIONAL SEK               |RETIRA|70|CARLTORR|2003-04-10 17:00:20|
1|2|70|301|306|A|04/10/2003|M.B.S. CIA. LTDA.                       |RETIRAN ALM CENTRO|70|RAQUIDRO|2003-04-10 17:21:08|
1|2|70|302|307|A|04/10/2003|O.COMP#21804|RETIRAN PERSONAL|70|LUISVERA|2003-04-10 17:25:13|
1|2|79|178|161|A|04/10/2003|O.COMP#21804|RETIRAN PERSONAL|60|LUISVERA|2003-04-10 17:29:07|
1|2|70|303|301|A|04/10/2003|FERRETERIA COMERCIAL                    |RETIRAN|70|CARLTORR|2003-04-10 17:41:36|
1|2|70|304|308|A|04/11/2003|FERRETERIA PRODIN                       |RETIRAN ALM CENTRO|70|LUISVERA|2003-04-11 11:26:59|
1|2|70|305|309|A|04/11/2003|EDUARDO JIMENEZ|RETIRA|70|CARLTORR|2003-04-11 11:49:07|
1|2|70|306|310|A|04/11/2003|.|RETIRA|70|CARLTORR|2003-04-11 11:58:07|
1|2|79|179|162|A|04/11/2003|O.COMPRA#546|RETIRAN PERSONAL J.TM.|64|LUISVERA|2003-04-11 13:36:22|
1|2|70|307|311|A|04/11/2003|BALON KLEBER|RETIRA ALM CENTRO|70|LUISVERA|2003-04-11 13:55:46|
1|2|79|180|163|A|04/11/2003|FERRETERIA SAN JAVIER                   |RETIRAN J.T.M.|64|LUISVERA|2003-04-11 14:46:53|
1|2|70|308|312|A|04/11/2003|LILY KOK CHI YIP|RETIRA|70|CARLTORR|2003-04-11 14:48:37|
1|2|70|309|313|A|04/11/2003|SERENTRESA|RETIRAN|70|RAQUIDRO|2003-04-11 15:51:26|
1|2|70|310|314|A|04/11/2003|VALDIVIESO FAUSTO|RETIRA|70|LUISVERA|2003-04-11 17:07:11|
1|2|70|311|315|A|04/11/2003|VALDIVIESO FAUSTO|RETIRA|70|LUISVERA|2003-04-11 17:08:16|
1|2|70|312|316|A|04/14/2003|CENTRO ALIMENTOS|RETIRAN|70|RAQUIDRO|2003-04-14 09:48:48|
1|2|79|181|165|A|04/14/2003|FERRETERIA SAN JAVIER                   |MEDARDO ANGEL SILVA 2623 Y 22AV|64|LUISVERA|2003-04-14 11:21:01|
1|2|79|182|164|A|04/14/2003|O.COMPRA#21808|RETIRAN J.T.M.|60|RAQUIDRO|2003-04-14 12:10:39|
1|2|70|313|317|A|04/14/2003|VELASCO VICTOR|RETIRA|70|CARLTORR|2003-04-14 14:54:18|
1|2|70|314|318|A|04/14/2003|GONZALEZ SANDRA DE|.|70|CARLTORR|2003-04-14 15:28:11|
1|2|70|315|319|A|04/14/2003|COFERMA                                 |RETIRAN|70|CARLTORR|2003-04-14 15:29:24|
1|2|70|316|320|A|04/15/2003|VISTA CLUB|RETIRAN|70|CARLTORR|2003-04-15 10:35:49|
1|2|70|317|322|A|04/15/2003|ORTEGA ELENA DE|RETIRA|70|CARLTORR|2003-04-15 11:13:43|
1|2|70|318|323|A|04/15/2003|YAGUAL MEDARDO|M|70|CARLTORR|2003-04-15 11:39:48|
1|2|70|319|324|A|04/15/2003|CENTRO DE CONVENCIONES SONWEI|RETIRA SR.MAURO ROSALES|70|CARLTORR|2003-04-15 15:28:14|
1|2|70|320|325|A|04/15/2003|IDROVO MANUEL ING.|.|70|CARLTORR|2003-04-15 15:29:33|
1|2|79|183|167|A|04/15/2003|BONILLA MERINO AZUCENA|CDLA. KENNEDY NORTE MZ. 402 V. 3|62|CARLTORR|2003-04-15 15:52:36|
1|2|70|321|327|A|04/15/2003|QUINTANA MERCEDES|.|70|CARLTORR|2003-04-15 15:56:14|
1|2|79|184|168|A|04/15/2003|DIMETAL                                 |LORENZO DE GARAICOA Y PADRE SOLANO|60|LUISVERA|2003-04-15 16:59:41|
1|2|70|322|328|A|04/15/2003|MERO JOSE|RETIRA|70|CARLTORR|2003-04-15 17:58:40|
1|2|70|323|321|A|04/16/2003|ABONA CON  N.CREDITO #16|RETIRA ALM.CENTRO|70|LUISVERA|2003-04-16 09:02:38|
1|2|79|185|166|A|04/16/2003|OBRA ZAVALA-BANO MASTER|RETIRAN|62|RAQUIDRO|2003-04-16 09:18:45|
1|2|70|324|329|A|04/16/2003|CHICHANDE LORENZO|RETIRA|70|CARLTORR|2003-04-16 12:33:11|
1|2|70|325|330|A|04/16/2003|CARLOS AMAGUAY|.|70|LUISVERA|2003-04-16 12:36:07|
1|2|70|326|331|A|04/16/2003|CARLOS AMAGUAY|ALM. CENTRO|70|RAQUIDRO|2003-04-16 13:15:27|
1|2|70|327|331|A|04/16/2003|CARLOS AMAGUAY|ALM. CENTRO|70|RAQUIDRO|2003-04-16 13:16:38|
1|2|79|186|166|A|04/16/2003|OBRA ZAVALA-BANO MASTER|RETIRAN|62|RAQUIDRO|2003-04-16 13:45:19|
1|2|79|187|169|A|04/16/2003|OBRA NUNEZ-BANO MASTER|RETIRAN J. T. MARENGO|62|RAQUIDRO|2003-04-16 13:55:18|
1|2|70|328|332|A|04/16/2003|RETIRA|BENALCAZAR 208 Y RUMICHACA|70|LUISVERA|2003-04-16 14:15:54|
1|2|79|188|170|A|04/16/2003|RETIRA|BENALCAZAR 208 Y RUMICHACA|64|LUISVERA|2003-04-16 14:18:16|
1|2|79|189|170|A|04/16/2003|RETIRA|BENALCAZAR 208 Y RUMICHACA|60|LUISVERA|2003-04-16 14:21:14|
1|2|70|329|333|A|04/16/2003|GARRIDO ZAPA ANTONIO A.                 |KM. 7,5 VIA A DAULE, COOP.GALLEGOS LARA|70|CARLTORR|2003-04-16 15:52:58|
1|2|70|330|326|A|04/16/2003|BONILLA MERINO AZUCENA|CDLA. KENNEDY NORTE MZ. 402 V. 3|70|CARLTORR|2003-04-16 15:55:08|
1|2|79|190|172|A|04/16/2003|DIENTRO PLANTA ALTA OF.19 ARTIC OFERTA|PUBLICIDAD,ARRIBA DE MARRIOT|62|CARLTORR|2003-04-16 16:10:56|
1|2|79|191|171|A|04/16/2003|DICENTRO OF.19 PLANTA ALTA ARTIC|PUBLICIDAD,ARRIBA DE MARRIOT|62|CARLTORR|2003-04-16 16:13:29|
1|2|79|192|173|A|04/16/2003|O.C. # 12272 -OBRA ELIZABETH VARAS|RETIRAN J.T. MARENGO|62|RAQUIDRO|2003-04-16 16:55:49|
1|2|79|193|174|A|04/16/2003|O.C. # 12272-OBRA ELIZABETH VARAS|ALM. J. T. MARENGO|62|RAQUIDRO|2003-04-16 16:56:33|
1|2|70|331|334|A|04/16/2003|ERAZO GUILLERMO|RETIRA|70|CARLTORR|2003-04-16 17:34:49|
1|2|70|332|335|A|04/17/2003|BANCO AMAZONAS|RETIRAN|70|CARLTORR|2003-04-17 09:40:36|
1|2|70|333|336|A|04/17/2003|EDUARDO GUERRERO|M|70|CARLTORR|2003-04-17 10:07:28|
1|2|70|334|337|A|04/17/2003|LOPEZ FLORES VIRGILIO|M|70|LUISVERA|2003-04-17 10:54:23|
1|2|79|194|175|A|04/17/2003|OBRA VERONICA ZAMBRANO- O.C. # 12275|RETIRAN J. T. MARENGO|62|CARLTORR|2003-04-17 12:41:50|
1|2|70|335|338|A|04/17/2003|GARZON LUCY DE|.|70|CARLTORR|2003-04-17 12:45:28|
1|2|70|336|339|A|04/17/2003|BULGARIN NARANJO ANTONIO                |CDLA. LA CHALA, CALLEJON ALIANZA Y 13|70|CARLTORR|2003-04-17 12:46:16|
1|2|70|337|340|A|04/17/2003|YAGUAL MEDARDO|RETIRA|70|CARLTORR|2003-04-17 13:16:15|
1|2|70|338|341|A|04/17/2003|VADIVIESO FAUSTO|RETIRA|70|LUISVERA|2003-04-17 13:54:30|
1|2|70|339|342|A|04/21/2003|PROCEL XAVIER|RETIRA|70|CARLTORR|2003-04-21 09:55:57|
1|2|70|340|343|A|04/21/2003|GUALOTUNA QUISHPE LUIS ALFREDO          |RETIRA ALMACEN CENTRO|70|LUISVERA|2003-04-21 10:20:43|
1|2|70|341|344|A|04/21/2003|O.C.#1053|RETIRAN|70|CARLTORR|2003-04-21 10:53:00|
1|2|79|195|176|A|04/21/2003|BARRERA QUINDE JULIO|RETIRA J.T.M.|60|LUISVERA|2003-04-21 11:17:45|
1|2|70|342|345|A|04/21/2003|IMPORTADORA CREDITOS QUEZADA CIA LTDA.  |RETIRAN|70|CARLTORR|2003-04-21 11:20:23|
1|2|70|343|347|A|04/21/2003|O.C.#004165|RETIRAN|70|CARLTORR|2003-04-21 11:56:49|
1|2|70|344|348|A|04/21/2003|LUEY LUIS|RETIRA|70|CARLTORR|2003-04-21 12:16:34|
1|2|70|345|349|A|04/21/2003| .|ALMACEN CENTRO|70|CARLTORR|2003-04-21 13:13:10|
1|2|70|346|350|A|04/21/2003|SR. DAVID MORA|M|70|CARLTORR|2003-04-21 14:31:55|
1|2|70|347|346|A|04/21/2003|FERREIND                                |RETIRAN J.T.M.|70|LUISVERA|2003-04-21 14:33:05|
1|2|70|348|351|A|04/21/2003|LOIZA WILSON|RETIRAN|70|CARLTORR|2003-04-21 15:56:55|
1|2|79|196|178|A|04/21/2003|O.COMP#106|ALM CENTRO|60|LUISVERA|2003-04-21 16:49:30|
1|2|70|349|352|A|04/21/2003|GARCIA ELENA AHMED DE, ING.             |RETIRA|70|CARLTORR|2003-04-21 17:10:12|
1|2|79|197|179|A|04/22/2003|SOLICITADO POR MAESTRO GARRIDO|ENTREGAR EN ALMACEN CENTRO|62|RAQUIDRO|2003-04-22 09:20:12|
1|2|70|350|22|A|04/22/2003|CADENA LA GAVIOTA|BOYACA 1205 Y 9 DE OCTUBRE, 1ER.PISO|70|CARLTORR|2003-04-22 09:51:13|
1|2|70|351|314|A|04/22/2003|VALDIVIESO FAUSTO|RETIRA|70|RAQUIDRO|2003-04-22 09:51:58|
1|2|70|352|115|A|04/22/2003|TERESA VARGAS MORALES|RETIRA|70|CARLTORR|2003-04-22 09:52:07|
1|2|70|353|284|A|04/22/2003|O.C.#|RETIRAN|70|CARLTORR|2003-04-22 09:53:29|
1|2|70|354|353|A|04/22/2003|SOLICITADO POR MAESTRO GARRIDO|ENTREGAR EN ALMACEN CENTRO|70|CARLTORR|2003-04-22 10:09:31|
1|2|79|198|177|A|04/22/2003|FERREIND                                |JOSE MASCOTE 206 ENTRE  M. GALECIO Y ALEJO LASCANO   |60|RAQUIDRO|2003-04-22 11:14:50|
1|2|70|355|354|A|04/22/2003|SR. MEDARDO YAGUAL|ALM. CENTRO|70|CARLTORR|2003-04-22 12:20:00|
1|2|79|199|180|A|04/22/2003|VILLACRESES MARIA  MERCEDES|RETIRA BOD. J. TANCA MARENGO|62|RAQUIDRO|2003-04-22 13:00:33|
1|2|70|356|355|A|04/22/2003|IMPORTADORA SANCHEZ|ALM.CENTRO|70|LUISVERA|2003-04-22 14:25:07|
1|2|79|200|181|A|04/22/2003|O.COMPRA3#559|BOD.J.T.MARENGO|60|LUISVERA|2003-04-22 15:05:51|
1|2|70|357|356|A|04/22/2003|O.COMPRA3#559|BOD.J.T.MARENGO|70|CARLTORR|2003-04-22 15:22:15|
1|2|70|358|357|A|04/22/2003|BASURTO SALAZAR MANUEL|RETIRA|70|CARLTORR|2003-04-22 16:01:00|
1|2|79|201|182|A|04/23/2003|O.COMP#101|TRANPORTE SEMERIA CARGA|60|LUISVERA|2003-04-23 11:36:23|
1|2|79|202|186|A|04/23/2003|ARQ. KARIN NURNBERG|ALMACEN CENTRO|64|RAQUIDRO|2003-04-23 13:05:10|
1|2|70|359|358|A|04/23/2003|MITE GABRIL|RETIRA ALM CENTRO|70|LUISVERA|2003-04-23 14:17:32|
1|2|79|203|188|A|04/23/2003|O.COMP#576|BOD.J.T.MARENGO|64|LUISVERA|2003-04-23 14:28:42|
1|2|79|204|187|A|04/23/2003|BANO DE SERVICIO -HIPATIA RAMON|ENTRE LAGOS|62|CARLTORR|2003-04-23 15:26:59|
1|2|79|205|185|A|04/23/2003|BANO SERVICIO-LAV-JARDIN-HIPATIA RAMON|ENTRE LAGOS|62|CARLTORR|2003-04-23 15:28:25|
1|2|79|206|183|A|04/23/2003|OBRA HIPATIA RAMON|ENTRE LAGOS|62|CARLTORR|2003-04-23 15:29:42|
1|2|79|207|184|A|04/23/2003|OBRA HIPATIA RAMON|ENTRE LAGOS|62|CARLTORR|2003-04-23 15:40:51|
1|2|70|360|359|A|04/23/2003|VALDIVIESO MALO FAUSTO|ORELLANA 213 Y PANAMA|70|LUISVERA|2003-04-23 16:50:07|
1|2|70|361|360|A|04/23/2003|ARTICULO DESCON. E INCOMPLETO|RETIRA|70|CARLTORR|2003-04-23 17:07:31|
1|2|70|362|361|A|04/23/2003|ARTICULO DESCOLORIDO|RETIRA|70|CARLTORR|2003-04-23 17:40:22|
1|2|79|208|189|A|04/23/2003|SILVIA DE ADUM|M|62|CARLTORR|2003-04-23 17:51:02|
1|2|70|363|364|A|04/24/2003|.|RETIRA|70|CARLTORR|2003-04-24 10:47:26|
1|2|70|364|363|A|04/24/2003|ASOCIACION SAN VICENTE DE PAUL|ALMACEN CENTRO|70|CARLTORR|2003-04-24 10:54:30|
1|2|70|365|362|A|04/24/2003|ASOCIACION SAN VICENTE DE PAUL|ALMACEN CENTRO|70|CARLTORR|2003-04-24 10:55:11|
1|2|70|366|365|A|04/24/2003|PLOMELEC|ALMACEN CENTRO|70|RAQUIDRO|2003-04-24 11:20:45|
1|2|70|367|365|A|04/24/2003|PLOMELEC|ALMACEN CENTRO|70|RAQUIDRO|2003-04-24 11:22:07|
1|2|70|368|366|A|04/24/2003|FERRETERIA CENTAURO                     |RETIRAN|70|CARLTORR|2003-04-24 15:03:24|
1|2|70|369|367|A|04/24/2003|PIEDAD DE AVALOS|M|70|CARLTORR|2003-04-24 16:19:06|
1|2|70|370|368|A|04/25/2003|.|RETIRA|70|CARLTORR|2003-04-25 09:21:24|
1|2|70|371|369|A|04/25/2003|CIRINO CHAGUAY|RETIRA|70|CARLTORR|2003-04-25 12:50:56|
1|2|70|372|371|A|04/25/2003|KARABU TURISMO                          |ALMACEN CENTRO|70|RAQUIDRO|2003-04-25 14:03:04|
1|2|70|373|374|A|04/25/2003|FAJARDO MARIA BARRERA DE                |SAUCES 1 MZ. F14 V.31|70|RAQUIDRO|2003-04-25 15:29:45|
1|2|70|374|375|A|04/25/2003|FAJARDO MARIA BARRERA DE                |SAUCES 1 MZ. F14 V.31|70|RAQUIDRO|2003-04-25 15:30:51|
1|2|70|375|375|A|04/25/2003|FAJARDO MARIA BARRERA DE                |SAUCES 1 MZ. F14 V.31|70|RAQUIDRO|2003-04-25 15:31:35|
1|2|70|376|376|A|04/25/2003|GARRIDO ZAPA ANTONIO A.                 |ALMACEN CENTRO|70|RAQUIDRO|2003-04-25 15:33:33|
1|2|70|377|373|A|04/25/2003|VARGAS ALEJANDRO|RETIRA - FONO.244577|70|CARLTORR|2003-04-25 15:53:40|
1|2|70|378|372|A|04/25/2003|COLEGIO INTERNACIONAL SEK               |RETIRAN|70|CARLTORR|2003-04-25 15:54:20|
1|2|70|379|377|A|04/25/2003|SAMAN SALEM ANTONIO                     |RETIRA|70|CARLTORR|2003-04-25 15:59:36|
1|2|79|209|152|A|04/28/2003|OBRA LANDIVAR-BANO COMPARTIDO|ENTRE LAGOS-RESID. ARQ. RUBEN GUTIERREZ|62|RAQUIDRO|2003-04-28 09:52:34|
1|2|79|210|153|A|04/28/2003|OBRA LANDIVAR-BANO VISITA|ENTRE LAGOS-RESIDENTE ARQ. RUBEN GUTIERR|62|RAQUIDRO|2003-04-28 09:54:02|
1|2|79|211|36|A|04/28/2003|SANDOVAL MARTHA                         |ALAMCEN CENTRO|62|RAQUIDRO|2003-04-28 11:12:21|
1|2|70|380|378|A|04/28/2003|FLORES PILAR|M|70|CARLTORR|2003-04-28 13:18:27|
1|2|79|212|190|A|04/28/2003|FERRETERIA ECUATORIANA                  |COLON 1006Y LA 8AVA|60|LUISVERA|2003-04-28 14:07:13|
1|2|70|381|379|A|04/28/2003|GARATE MARIA|RETIRA|70|CARLTORR|2003-04-28 15:09:18|
1|2|70|382|380|A|04/29/2003|GONZALO VILLAGOMEZ|RETIRA|70|CARLTORR|2003-04-29 10:45:54|
1|2|70|383|381|A|04/29/2003|GUALOTUNA QUISHPE LUIS ALFREDO          |COOP. ANTONIO J. DE SUCRE MZ. A SL. 2|70|LUISVERA|2003-04-29 11:54:40|
1|2|70|384|382|A|04/29/2003|FAJARDO MARIA BARRERA DE                |ALMACEN CENTRO|70|CARLTORR|2003-04-29 15:13:14|
1|2|70|385|384|A|04/30/2003|GUALOTUNA QUISHPE LUIS ALFREDO          |COOP. ANTONIO J. DE SUCRE MZ. A SL. 2|70|LUISVERA|2003-04-30 09:31:42|
1|2|79|213|192|A|04/30/2003|O.COMP#00589|RETIRA J.T.MARENGO|60|LUISVERA|2003-04-30 10:58:27|
1|2|70|386|385|A|04/30/2003|PATINO MARIA|RETIRA - FONO. 883461|70|CARLTORR|2003-04-30 11:25:46|
1|2|70|387|383|A|04/30/2003|GUERRERO  CORNEJO GONZALO|CONTRALORIA GRAL. DEL ESTADO|70|CARLTORR|2003-04-30 11:39:54|
1|2|79|214|193|A|04/30/2003|O. C. # 590|RETIRAN|62|CARLTORR|2003-04-30 11:42:36|
1|2|79|215|194|A|04/30/2003|AYALA V. MONSERRATT                     |CDLA. LOS CEIBOS AV. 1ERA. 421A|62|RAQUIDRO|2003-04-30 12:45:04|
1|2|79|216|191|A|04/30/2003|PEDIDO TELEFONICO|CDLA. LOS CEIBOS AV. 1ERA. # 421A                    |62|RAQUIDRO|2003-04-30 12:46:38|
1|2|70|388|386|A|04/30/2003|O. C. # 590|RETIRAN|70|CARLTORR|2003-04-30 13:19:44|
1|2|70|389|387|A|04/30/2003|FERREIND                                |RETIRA ALM CENTRO|70|LUISVERA|2003-04-30 14:30:38|
1|2|70|390|388|A|04/30/2003|LUCY DE GARZON|RETIRA|70|CARLTORR|2003-04-30 15:54:54|
1|2|70|391|389|A|04/30/2003|BALLESTER ROMERO IRMA|RETIRA|70|CARLTORR|2003-04-30 17:51:51|
1|2|70|392|390|A|04/30/2003|MARIA AVILA DE BAJAA|ALMACEN CENTRO|70|CARLTORR|2003-04-30 18:07:45|
1|2|70|393|391|A|05/02/2003|BAQUE CALDERON TEOFILO|BATALLON DEL SUBURBIO CALLE N Y LA 44|70|CARLTORR|2003-05-02 10:23:27|
1|2|70|394|392|A|05/02/2003|ARROYO LAMILLA CARLOS                   |AGUIRRE 411 Y CHIMBORAZO|70|RAQUIDRO|2003-05-02 11:02:48|
1|2|70|395|393|A|05/02/2003|SANTOS MOREIRA|M|70|CARLTORR|2003-05-02 16:51:14|
1|2|70|396|394|A|05/05/2003|ING. ORTIZ|M|70|CARLTORR|2003-05-05 11:25:46|
1|2|70|397|395|A|05/05/2003|UBILLA JULIO|RETIRA|70|CARLTORR|2003-05-05 11:32:47|
1|2|70|398|370|A|05/05/2003|MUNOZ HOLGUIN MANUEL|RETIRA|70|CARLTORR|2003-05-05 12:05:50|
1|2|70|399|396|A|05/05/2003|CLINICA GUAYAQUIL                       |PADRE AGUIRRE 401|70|LUISVERA|2003-05-05 14:11:16|
1|2|70|400|398|A|05/05/2003|CLINICA GUAYAQUIL                       |RETIRAR EN ALMACEN CENTRO|70|CARLTORR|2003-05-05 14:13:52|
1|2|70|401|397|A|05/05/2003|CLINICA GUAYAQUIL                       |RETIRA EN ALMACEN CENTRO|70|LUISVERA|2003-05-05 14:16:42|
1|2|70|402|399|A|05/05/2003|ECOVENTURA S.A.                         |RETIRA SR. SEGUNDO SOLORZANO|70|CARLTORR|2003-05-05 15:41:48|
1|2|79|217|196|A|05/05/2003|PEDIDO POR SRTA. SUSANA|RETIRA DEL ALM. CENTRO|62|CARLTORR|2003-05-05 15:56:31|
1|2|70|403|400|A|05/05/2003|PATRICIA DE SALGADO|RETIRA|70|CARLTORR|2003-05-05 16:59:20|
1|2|79|218|197|A|05/06/2003|VIEIRA NAVARRO LUIS|VER CROQUIS|64|LUISVERA|2003-05-06 10:07:15|
1|2|70|404|401|A|05/06/2003|VALDAN CARLOS ING.|RETIRA|70|RAQUIDRO|2003-05-06 10:44:19|
1|2|70|405|402|A|05/06/2003|MARTINEZ VICTORIA DE|RETIRA - FONO.433309|70|CARLTORR|2003-05-06 10:50:09|
1|2|70|406|403|A|05/06/2003|SRA. RIPALDA|RETIRA|70|CARLTORR|2003-05-06 11:15:57|
1|2|79|219|198|A|05/06/2003|INDUSTRIAL PESQUERA SANTA PRISCILA S.A. |RETIRAN J.T.M.|64|LUISVERA|2003-05-06 11:27:14|
1|2|79|220|199|A|05/06/2003|OBRA PIANA-PORTICO DEL RIO|RETIRA MANUEL SANDOYA BOD. J. T. MARENGO             |62|RAQUIDRO|2003-05-06 11:30:36|
1|2|79|221|200|A|05/06/2003|INMOBILIARIA CALIDAD, INMOCALI S.A.     |RETIRA MANUEL SANDOYA BOD. J. T. MARENGO             |62|RAQUIDRO|2003-05-06 11:31:43|
1|2|70|407|404|A|05/06/2003|GUZMAN JHON|RETIRA|70|CARLTORR|2003-05-06 14:36:14|
1|2|70|408|405|A|05/06/2003|MENDOZA JAVIER|RETIRA|70|CARLTORR|2003-05-06 14:37:05|
1|2|70|409|407|A|05/06/2003|RIBADENEIRA ORLANDO|M|70|LUISVERA|2003-05-06 15:46:18|
1|2|70|410|408|A|05/06/2003|RODRIGUEZ MOSQUERA PATRICIA|RETIRA|70|CARLTORR|2003-05-06 16:13:01|
1|2|70|411|410|A|05/06/2003|EDGAR MINO GUERRERO|M|70|LUISVERA|2003-05-06 16:21:41|
1|2|70|412|409|A|05/06/2003|INTRIAGO MANZABA NANCY                  |RETIRA|70|CARLTORR|2003-05-06 16:26:13|
1|2|79|222|151|A|05/06/2003|OBRA LANDIVAR-BANO MASTER|ENTRE LAGOS-RESIDENTE RUBEN GUTIERREZ|62|CARLTORR|2003-05-06 17:00:44|
1|2|79|223|201|A|05/06/2003|O.C. # 12607-OBRA  MARIA LUISA ALVAREZ|RETIRA|62|RAQUIDRO|2003-05-06 17:24:05|
1|2|79|224|202|A|05/06/2003|OBRA ENDARA BANO MASTER Y VISITA|ENTRE LAGOS|62|RAQUIDRO|2003-05-06 17:25:04|
1|2|79|225|203|A|05/06/2003|OBRA ENDARA-BANO DE NINA|ENTRE LAGOS|62|RAQUIDRO|2003-05-06 17:25:54|
1|2|79|226|204|A|05/06/2003|OBRA ENDARA-BANO NINO|ENTRE LAGOS|62|RAQUIDRO|2003-05-06 17:26:59|
1|2|79|227|205|A|05/06/2003|OBRA ENDARA-BANO SERVICIO|ENTRE LAGOS|62|RAQUIDRO|2003-05-06 17:27:59|
1|2|79|228|206|A|05/06/2003|OBRA ENDARA-VARIOS|ENTRE LAGOS|62|RAQUIDRO|2003-05-06 17:28:51|
1|2|79|229|207|A|05/06/2003|OBRA ENDARA-COCINA|ENTRE LAGOS|62|RAQUIDRO|2003-05-06 17:30:15|
1|2|70|413|414|A|05/07/2003|DIMETAL                                 |RETIRA ALM CENTRO|70|LUISVERA|2003-05-07 10:31:04|
1|2|70|414|415|A|05/07/2003|DIMETAL                                 |RETIRAN ALM CENTRO|70|LUISVERA|2003-05-07 10:32:32|
1|2|70|415|412|A|05/07/2003|OBRA ENDARA-BANO NINO|ENTRE LAGOS|70|CARLTORR|2003-05-07 10:59:02|
1|2|70|416|411|A|05/07/2003|OBRA ENDARA-BANO DE NINA|ENTRE LAGOS|70|CARLTORR|2003-05-07 10:59:51|
1|2|70|417|416|A|05/07/2003|GUALOTUNA QUISHPE LUIS ALFREDO          |ALM CENTRO|70|LUISVERA|2003-05-07 11:26:02|
1|2|70|418|417|A|05/07/2003|BAQUERIZO JOHNNY|RETIRA|70|CARLTORR|2003-05-07 13:48:42|
1|2|70|419|419|A|05/07/2003|HIDALGO & HIDALGO S.A.                  |RETIRA ALMACEN CENTRO|70|LUISVERA|2003-05-07 15:13:55|
1|2|70|420|413|A|05/07/2003|GUARDERIA NUESTRA SRA DE LA PAZ|ALM CENTRO|70|LUISVERA|2003-05-07 15:15:50|
1|2|79|230|211|A|05/07/2003|PARA BANOS PLASTICOS INDUSTRIALES|RETIRAN|62|RAQUIDRO|2003-05-07 15:55:56|
1|2|70|421|420|A|05/07/2003|PARA BANOS PLASTICOS INDUSTRIALES|RETIRAN|70|RAQUIDRO|2003-05-07 15:56:43|
1|2|70|422|421|A|05/07/2003|QIZHPI HUMBERTO|RETIRA ALM CENTRO|70|LUISVERA|2003-05-07 16:05:30|
1|2|79|231|212|A|05/08/2003|FERRETERIA SAN JAVIER                   |RETIRAN J.T.M.|64|LUISVERA|2003-05-08 09:11:22|
1|2|79|232|212|A|05/08/2003|FERRETERIA SAN JAVIER                   |RETIRAN J.T.M.|60|LUISVERA|2003-05-08 09:13:36|
1|2|70|423|423|A|05/08/2003|VALDIVIESO MALO FAUSTO|ORELLANA 213 Y PANAMA|70|LUISVERA|2003-05-08 10:44:42|
1|2|70|424|424|A|05/08/2003|PONCE FEDERICO|RETIRA|70|CARLTORR|2003-05-08 11:28:10|
1|2|70|425|422|A|05/08/2003| GUERRERO LILIANA|RETIRA ALM CENTRO|70|LUISVERA|2003-05-08 11:47:51|
1|2|79|233|209|A|05/08/2003|CLINICA GUAYAQUIL                       |PADRE AGUIRRE 401 FRENTE A PEUGOT                    |62|RAQUIDRO|2003-05-08 12:48:35|
1|2|79|234|210|A|05/08/2003|CLINICA GUAYAQUIL                       |PADRE AGUIRRE 401 -FRENTE A PEUGOT                   |62|RAQUIDRO|2003-05-08 12:50:52|
1|2|70|426|425|A|05/09/2003|SR. EDGAR ORTEGA|RETIRA|70|CARLTORR|2003-05-09 11:54:23|
1|2|79|235|213|A|05/09/2003|OBRA ENDARA- BANO DE NIA-B. VISITA|ENTRE LAGOS|62|RAQUIDRO|2003-05-09 13:27:25|
1|2|70|427|426|A|05/09/2003|GUALOTUNA QUISHPE LUIS ALFREDO          |COOP. ANTONIO J. DE SUCRE MZ. A SL. 2|70|LUISVERA|2003-05-09 17:31:22|
1|2|79|236|214|A|05/12/2003|LEONE DI VANNA VICTOR|RETIRA PERSONAL J.T.M.|60|LUISVERA|2003-05-12 10:00:55|
1|2|79|237|215|A|05/12/2003|CLINICA GUAYAQUIL                       |ALMACEN CENTRO|62|RAQUIDRO|2003-05-12 10:07:17|
1|2|79|238|215|A|05/12/2003|CLINICA GUAYAQUIL                       |ALMACEN CENTRO|64|RAQUIDRO|2003-05-12 10:42:02|
1|2|70|428|429|A|05/12/2003|LEON JURADO GENARO ARQ.                 |RETIRA|70|CARLTORR|2003-05-12 12:44:10|
1|2|70|429|427|A|05/12/2003|CLINICA GUAYAQUIL                       |ALMACEN CENTRO|70|LUISVERA|2003-05-12 14:01:12|
1|2|70|430|430|A|05/12/2003|CASA DR. HANSE|RETIRA FELIX ALVARADO|70|LUISVERA|2003-05-12 17:03:19|
1|2|70|431|431|A|05/12/2003|ALAVA MARTHA|ALM CENTRO|70|LUISVERA|2003-05-12 17:10:04|
1|2|70|432|432|A|05/13/2003|OBRA ANGEL VILLON|RETIRA|70|LUISVERA|2003-05-13 11:10:41|
1|2|70|433|433|A|05/13/2003|OBRA IZQUIERDO -COCINA|GUAYAQUIL TENNIS-ARQ. BYRON JIMENEZ|70|CARLTORR|2003-05-13 12:52:34|
1|2|70|434|434|A|05/13/2003|COFERMA                                 |ALMACEN CENTRO|70|RAQUIDRO|2003-05-13 14:25:12|
1|2|79|239|216|A|05/13/2003|FERRETERIA COMERCIAL                    |RETIRAN AV.J.T.M.|64|LUISVERA|2003-05-13 14:44:00|
1|2|70|435|436|A|05/13/2003|MARIA MERCEDES ONOFRE|RETIRA|70|CARLTORR|2003-05-13 15:23:36|
1|2|79|240|217|A|05/14/2003|OBRA IZQUIERDO-BANO MASTER|GUAYAQUIL TENNIS-ARQ. BYRON JIMENEZ|62|RAQUIDRO|2003-05-14 10:08:18|
1|2|79|241|218|A|05/14/2003|OBRA IZQUIERDO-BANO # 1|GUAYAQQUIL TENNIS-ARQ. BYRON JIMENEZ|62|RAQUIDRO|2003-05-14 10:09:40|
1|2|79|242|219|A|05/14/2003|OBRA IZQUIERDO-BANO # 2|GUAYAQUIL TENNIS-ARQ. BYRON JIMENEZ|62|RAQUIDRO|2003-05-14 10:12:16|
1|2|79|243|220|A|05/14/2003|OBRA IZQUIERDO-BANO DE VISITA|GUAYAQUIL TENIS-ARQ. BYRON JIMENEZ|62|RAQUIDRO|2003-05-14 10:13:16|
1|2|79|244|221|A|05/14/2003|OBRA IZQUIERDO-BANO DE SERVICIO|GUATAQUIL TENNIS-ARQ. BYRON JIMENEZ|62|RAQUIDRO|2003-05-14 10:14:11|
1|2|79|245|222|A|05/14/2003|O. IZQUIERDO-B. MASTER-SERV.LAVAND.-JARD|GUAYAQUIL TENNIS-ARQ. BYRON JIMENEZ|62|RAQUIDRO|2003-05-14 10:16:30|
1|2|70|436|438|A|05/14/2003|OBRA TOMAS ALVAREZ|ALMACEN CENTRO|70|CARLTORR|2003-05-14 11:26:37|
1|2|79|246|223|A|05/14/2003|CARRERA ESTARELLAS FRANCISCO VICENTE|RETIRA|62|CARLTORR|2003-05-14 12:03:36|
1|2|70|437|439|A|05/14/2003|AGUSTIN CEBALLOS|RETIRA|70|CARLTORR|2003-05-14 13:02:01|
1|2|79|247|151|A|05/14/2003|OBRA LANDIVAR-BANO MASTER|ENTRE LAGOS-RESIDENTE RUBEN GUTIERREZ|62|RAQUIDRO|2003-05-14 13:03:53|
1|2|70|438|437|A|05/14/2003|O. IZQUIERDO-B. MASTER-SERV.LAVAND.-JARD|GUAYAQUIL TENNIS-ARQ. BYRON JIMENEZ|70|CARLTORR|2003-05-14 16:34:13|
1|2|79|248|224|A|05/14/2003|OBRA LANDIVAR-BANO MASTER|RETIRA MANUEL SANDOYA|70|RAQUIDRO|2003-05-14 16:37:10|
1|2|79|249|225|A|05/15/2003|OBRA LANDIVAR BANO VISITA|JUAN TANCA MARENGO|62|RAQUIDRO|2003-05-15 09:59:57|
1|2|79|250|226|A|05/15/2003|OBRA UNIPOLLO|UNICENTRO SRTA. SUSANA|70|RAQUIDRO|2003-05-15 10:02:00|
1|2|79|251|227|A|05/15/2003|GUALOTUNA QUISHPE LUIS ALFREDO          |DESPACHAR ALM.CENTRO|60|LUISVERA|2003-05-15 10:29:36|
1|2|70|439|435|A|05/15/2003|CLINICA ALCIVAR|ALM CENTRO|70|LUISVERA|2003-05-15 11:09:51|
1|2|70|440|440|A|05/15/2003|O.COMP #21890|RETIRA ALM CENTRO|70|LUISVERA|2003-05-15 14:40:01|
1|2|70|441|441|A|05/16/2003|GABRIEL PENA|RETIRA|70|CARLTORR|2003-05-16 12:22:54|
1|2|70|442|442|A|05/16/2003|ARQ MORAN OSWALDO|ALM CENTRO|70|CARLTORR|2003-05-16 14:13:52|
1|2|70|443|444|A|05/16/2003|LEON JURADO GENARO ARQ.                 |MALDONADO Y LA 19|70|LUISVERA|2003-05-16 15:10:29|
1|2|70|444|445|A|05/16/2003|COLEGIO INTERNACIONAL SEK               |KM,5 VIA A SALINAS|70|CARLTORR|2003-05-16 15:41:35|
1|2|70|445|443|A|05/16/2003|RAMOS MOLINA ROBERTO, ARQ.              |RETIRA|70|CARLTORR|2003-05-16 16:14:09|
1|2|70|446|446|A|05/16/2003|ING. ALBERTO SUETT|RETIRA|70|CARLTORR|2003-05-16 17:18:51|
1|2|70|447|447|A|05/16/2003|GALO ZAVALA|M|70|CARLTORR|2003-05-16 17:47:25|
1|2|79|252|228|A|05/19/2003|AVILA ORTEGA EUGENIO ING.               |RETIRA|62|RAQUIDRO|2003-05-19 09:18:43|
1|2|79|253|229|A|05/19/2003|O.COMP#32529|AV J.T.M. KM. 2.5|64|LUISVERA|2003-05-19 09:26:04|
1|2|70|448|448|A|05/19/2003|RICKY CENTRO                            |ALMACEN CENTRO|70|CARLTORR|2003-05-19 12:13:19|
1|2|70|449|449|A|05/19/2003|GUALOTUNA QUISHPE LUIS ALFREDO          |RETIRA ALM CENTRO|70|LUISVERA|2003-05-19 12:28:07|
1|2|79|254|231|A|05/19/2003|O.C. # 32536-|EN LA LLAVE AV. J.T. MARENGO KM. 2.5 -DE 8 A 12.30   P.M. Y DE 14 A 17.30 P.M.                            |64|RAQUIDRO|2003-05-19 12:33:29|
1|2|70|450|450|A|05/19/2003|ING. MARIA MORAN|RETIRA|70|CARLTORR|2003-05-19 14:32:58|
1|2|79|255|233|A|05/19/2003|O.COMP#230424 PEDIDO SR ALCIVAR|PENDIENTE|64|LUISVERA|2003-05-19 15:29:52|
1|2|70|451|451|A|05/19/2003|INTRIAGO MANZABA NANCY                  |RETIRA|70|CARLTORR|2003-05-19 15:37:49|
1|2|79|256|230|A|05/20/2003|GUALOTUNA QUISHPE LUIS ALFREDO          |RETIRA ALM CENTRO|60|LUISVERA|2003-05-20 09:14:32|
1|2|70|452|452|A|05/20/2003|MORA JOFFRE|ALM CENTRO|70|LUISVERA|2003-05-20 10:23:33|
1|2|70|453|453|A|05/20/2003|PULLA CRISTIAN|RETIRA ALM CENTRO|70|LUISVERA|2003-05-20 10:25:13|
1|2|79|257|234|A|05/20/2003|FERREIND                                |RETIRAN AV.J.T.M.|60|LUISVERA|2003-05-20 11:13:24|
1|2|70|454|454|A|05/20/2003|MARIA DE REYES|RETIRA|70|CARLTORR|2003-05-20 11:32:05|
1|2|70|455|455|A|05/20/2003|SR. RICARDO LUZURIAGA S.|M|70|CARLTORR|2003-05-20 11:57:09|
1|2|70|456|456|A|05/20/2003|PROANO HERRERA ELENA                    |CDLA. FLORESTA 2 MZ. 138 V5|70|CARLTORR|2003-05-20 13:15:36|
1|2|70|457|457|A|05/20/2003|ING. VICTOR PLATON|M|70|CARLTORR|2003-05-20 14:45:44|
1|2|79|258|236|A|05/20/2003|VASCONEZ MARTINEZ CARLOS|CDLA. LOS ALMENDROS, PINZONES Y 5TA.PEAT|62|RAQUIDRO|2003-05-20 15:05:50|
1|2|70|458|458|A|05/20/2003|VASCONEZ MARTINEZ CARLOS|CDLA. LOS ALMENDROS, PINZONES Y 5TA.PEAT|70|RAQUIDRO|2003-05-20 15:07:08|
1|2|70|459|459|A|05/20/2003|OBRA KM. 9.5 - ING. BITAR|UNICENTRO PEDIDO POR SRTA. SUSANA|70|CARLTORR|2003-05-20 15:39:54|
1|2|79|259|237|A|05/20/2003|OBRA BANO # 10 1ER. PISO|PADRE AGUIRRE 401|62|RAQUIDRO|2003-05-20 16:16:50|
1|2|70|460|460|A|05/20/2003|PALACIOS DEIDAN JIMMY|RETIRA|70|CARLTORR|2003-05-20 16:32:37|
1|2|79|260|235|A|05/20/2003|SR. EDUARDO LOZA|ALMACEN CENTRO                                       |60|RAQUIDRO|2003-05-20 17:46:15|
1|2|70|461|461|A|05/21/2003|VALDIVIESO MALO FAUSTO|RETIRA ALM CENTRO|70|LUISVERA|2003-05-21 09:13:07|
1|2|70|462|462|A|05/21/2003|PROHOTESA S.A.                          |AGUIRRE 603 Y ESCOBEDO|70|LUISVERA|2003-05-21 10:34:05|
1|2|70|463|463|A|05/21/2003|MILTON SUAREZ|M|70|CARLTORR|2003-05-21 11:00:18|
1|2|70|464|466|A|05/21/2003|COLEGIO CRISTOBAL COLON                 |RETIRA|70|CARLTORR|2003-05-21 12:38:55|
1|2|70|465|467|A|05/21/2003|VASCONEZ MARTINEZ CARLOS|CDLA. LOS ALMENDROS, PINZONES Y 5TA.PEAT|70|RAQUIDRO|2003-05-21 12:48:20|
1|2|70|466|465|A|05/21/2003|O.COMP # 21911|RETIRAN ALM CENTRO|70|LUISVERA|2003-05-21 14:53:01|
1|2|70|467|464|A|05/21/2003|O.C.# 00637|RETIRAN|70|CARLTORR|2003-05-21 15:00:31|
1|2|70|468|469|A|05/21/2003|ARROYO LAMILLA CARLOS                   |RETIRA|70|RAQUIDRO|2003-05-21 15:12:28|
1|2|79|261|238|A|05/21/2003|CLINICA GUAYAQUIL                       |PADRE AGUIRRE # 401|60|RAQUIDRO|2003-05-21 15:15:14|
1|2|70|469|468|A|05/21/2003|VALDIVIESO MALO FAUSTO|RETIRA ALM CENTRO|70|LUISVERA|2003-05-21 15:22:31|
1|2|70|470|472|A|05/21/2003|ARQ. VIOLETA ORTEGA|RETIRA|70|CARLTORR|2003-05-21 16:08:57|
1|2|70|471|473|A|05/21/2003|SOCIEDAD DE BENEFICENCIA DE SEORAS DE G|ALM CENTRO|70|LUISVERA|2003-05-21 16:14:38|
1|2|79|262|241|A|05/21/2003|FERREIND                                |RETIRAN J.T.M.|60|LUISVERA|2003-05-21 16:15:53|
1|2|70|472|474|A|05/21/2003|MARTHA DE YUNEZ|RETIRA|70|CARLTORR|2003-05-21 16:43:21|
1|2|70|473|475|A|05/21/2003|PROHOTESA S.A.                          |RETIRA ALM CENTRO|70|LUISVERA|2003-05-21 17:19:42|
1|2|70|474|428|A|05/22/2003|CLINICA GUAYAQUIL                       |ALMACEN CENTRO|70|CARLTORR|2003-05-22 09:56:03|
1|2|70|475|418|A|05/22/2003|CLINICA GUAYAQUIL                       |PADRE AGUIRRE 401|70|CARLTORR|2003-05-22 09:57:11|
1|2|70|476|476|A|05/22/2003|EUGENIO CHONG SING|RETIRA|70|CARLTORR|2003-05-22 10:36:51|
1|2|70|477|470|A|05/22/2003|CLINICA GUAYAQUIL                       |PADRE AGUIRRE # 401-CLINICA GUAYAQUIL|70|CARLTORR|2003-05-22 10:53:23|
1|2|70|478|471|A|05/22/2003|CLINICA GUAYAQUIL                       |PADRE AGUIRRE 401-CLINICA GUAYAQUIL|70|CARLTORR|2003-05-22 10:54:06|
1|2|70|479|477|A|05/22/2003|DEFAZ MERCHAN NELSON ARQ.               |RETIRA|70|CARLTORR|2003-05-22 11:16:42|
1|2|70|480|478|A|05/22/2003|VALDIVIESO MALO FAUSTO|RETIRA PERSONAL ALM CENTRO|70|LUISVERA|2003-05-22 11:49:11|
1|2|79|263|243|A|05/22/2003|OBRA LANDIVAR-BANO DE NINOS|RETIRA|62|CARLTORR|2003-05-22 14:03:40|
1|2|70|481|479|A|05/22/2003|MARTHA DE YUNEZ|.|70|CARLTORR|2003-05-22 15:43:59|
1|2|70|482|480|A|05/22/2003|XIN RONG HONG|RETIRA|70|CARLTORR|2003-05-22 16:38:25|
1|2|70|483|481|A|05/22/2003|XIN RONG HONG|RETIRA|70|CARLTORR|2003-05-22 17:16:28|
1|2|79|264|245|A|05/23/2003|SELLAN BARZOLA OTILIA                   |SAUCES VI MZ. 335 V. 3|64|RAQUIDRO|2003-05-23 09:33:12|
1|2|79|265|246|A|05/23/2003|DISMATEL                                |RETIRA AV.J.T.M.|60|RAQUIDRO|2003-05-23 10:28:54|
1|2|70|484|483|A|05/23/2003|O.COMP#645|RETIRA ALM CENTRO|70|LUISVERA|2003-05-23 14:33:56|
1|2|70|485|484|A|05/23/2003|OBRA CASINO-BANO DE HOMBRES|AGUIRRE 411 E/ CHILE Y CHIMBORAZO OF.208|70|RAQUIDRO|2003-05-23 15:54:36|
1|2|70|486|485|A|05/23/2003|ARMANDO VILLACRESES|M|70|LUISVERA|2003-05-23 16:00:35|
1|2|79|266|247|A|05/23/2003|ESPIN PALACIOS EDWIN|MUELLE CARAGUAY|64|LUISVERA|2003-05-23 16:34:50|
1|2|70|487|486|A|05/23/2003|ALMACENES EL GLOBO|RETIRA|70|RAQUIDRO|2003-05-23 17:38:08|
1|2|70|488|487|A|05/26/2003|CEDENO MERY|RETIRA|70|CARLTORR|2003-05-26 09:45:05|
1|2|79|267|248|A|05/26/2003|O.C.#724|RETIRA  SR. FRANKLIN UVE|62|CARLTORR|2003-05-26 10:24:14|
1|2|70|489|489|A|05/26/2003|O.C.#724|RETIRAN|70|CARLTORR|2003-05-26 11:49:48|
1|2|79|268|242|A|05/26/2003|SR. EDUARDO LOZA|RETIRA|60|LUISVERA|2003-05-26 11:56:45|
1|2|70|490|488|A|05/26/2003|INTRIAGO MANZABA NANCY                  |RETIRA|70|CARLTORR|2003-05-26 12:11:41|
1|2|79|269|184|A|05/26/2003|OBRA HIPATIA RAMON|ENTRE LAGOS|70|RAQUIDRO|2003-05-26 12:59:57|
1|2|70|491|490|A|05/26/2003|CLINICA GUAYAQUIL                       |RETIRA ARQ. MEILIDA DE ROLDAN|70|RAQUIDRO|2003-05-26 16:49:58|
1|2|79|270|250|A|05/26/2003|CLINICA GUAYAQUIL                       |RETIRA ARQ. MELIDA ROLDAN|70|RAQUIDRO|2003-05-26 16:51:23|
1|2|79|271|251|A|05/26/2003|CLINICA GUAYAQUIL                       |ALMACEN CENTRO                                       |62|RAQUIDRO|2003-05-26 16:52:59|
1|2|70|492|406|A|05/26/2003|CARLOS TORRES CARREO|ALMACEN CENTRO|70|CARLTORR|2003-05-26 17:17:16|
1|2|79|272|248|A|05/26/2003|O.C.#724|RETIRAN|62|RAQUIDRO|2003-05-26 17:37:33|
1|2|79|273|249|A|05/26/2003|O.C.#725|RETIRA SR. FRANKLIN UVE|62|RAQUIDRO|2003-05-26 17:38:49|
1|2|70|493|482|A|05/26/2003|GONZALEZ MELIDA ROLDAN DE               |CDLA. LOS ALMENDROS, CALLE 2DA. MZ.N.V12|70|CARLTORR|2003-05-26 17:46:03|
1|2|70|494|491|A|05/27/2003|COELCA ECUATORIANA|M|70|CARLTORR|2003-05-27 09:59:34|
1|2|79|274|252|A|05/27/2003|INMOBILIARIA LOS PINOS                  |KM.13 VIA A DAULE,DISENSA CIPA -RECIBE SR. JUAN      QUIROZ PINCAY                                        |64|RAQUIDRO|2003-05-27 10:21:44|
1|2|79|275|253|A|05/27/2003|CORDOVA ASTUDILLO LUIS, ING.|RETIRA|62|RAQUIDRO|2003-05-27 11:02:19|
1|2|79|276|254|A|05/27/2003|SUMMA PROYECTOS C.A.-PED. SR. ENDARA|RETIRA|62|RAQUIDRO|2003-05-27 11:04:30|
1|2|79|277|254|A|05/27/2003|SUMMA PROYECTOS C.A. -PED. SR. ENDARA|RETIRA|60|RAQUIDRO|2003-05-27 11:05:15|
1|2|79|278|255|A|05/27/2003|PEDIDO POR SR. JACINTO ENDARA|RETIRA|62|RAQUIDRO|2003-05-27 11:10:28|
1|2|70|495|495|A|05/27/2003|IMFERSA S.A.                            |RETIRAN ALM CENTRO|70|LUISVERA|2003-05-27 12:36:35|
1|2|70|496|494|A|05/27/2003|OBRA CASINO BANO DE VARONES|RETIRAN|70|CARLTORR|2003-05-27 14:37:20|
1|2|70|497|496|A|05/27/2003|FERREIND                                |RETIRAN ALM CENTRO|70|LUISVERA|2003-05-27 16:38:15|
1|2|70|498|493|A|05/27/2003|GUALOTUNA ALFREDO                       |RETIRA|70|LUISVERA|2003-05-27 17:18:34|
1|2|70|499|497|A|05/28/2003|MIRANDA MARIA DE                        |RETIRA|70|CARLTORR|2003-05-28 09:08:44|
1|2|70|500|498|A|05/28/2003|EUGENIO CHONG|RETIRA|70|CARLTORR|2003-05-28 11:03:03|
1|2|79|279|256|A|05/28/2003|PEDIDO POR NSR. JACINTO ENDARA|RETIRA|62|RAQUIDRO|2003-05-28 11:43:11|
1|2|70|501|499|A|05/28/2003|SISTEMA CONTRA INCENDIOS S.A.|CDLA. FERROVIARIA, AV.3ERA. 407 Y DCMA.|70|LUISVERA|2003-05-28 12:21:11|
1|2|70|502|500|A|05/28/2003|AGUILAR CENTENO MARIA LORENA|RETIRAN|70|RAQUIDRO|2003-05-28 13:40:27|
1|2|79|280|257|A|05/28/2003|AGUILAR CENTENO MARIA LORENA|RETIRA|62|RAQUIDRO|2003-05-28 13:41:33|
1|2|70|503|501|A|05/28/2003|CONTINENTAL HOTEL                       |RETIRA ALM CENTRO|70|LUISVERA|2003-05-28 15:24:56|
1|2|70|504|502|A|05/28/2003|RUTH CAMPOS DE COBO|RETIRA|70|CARLTORR|2003-05-28 15:39:18|
1|2|79|281|258|A|05/28/2003|O.COMP#00650|RETIRAN AV.J.T.M.|60|RAQUIDRO|2003-05-28 16:23:12|
1|2|70|505|503|A|05/28/2003|EMILIO CARRIEL|RETIRA ALM CENTRO|70|LUISVERA|2003-05-28 17:30:09|
1|2|79|282|260|A|05/29/2003|FERREIND                                |RETIRAN AV J.T.MARENGO|60|LUISVERA|2003-05-29 10:01:23|
1|2|70|506|505|A|05/29/2003|LEOPOLDO GALARZA|RETIRA|70|CARLTORR|2003-05-29 10:04:59|
1|2|70|507|504|A|05/29/2003|INTRIAGO MANZABA NANCY                  |RETIRA|70|CARLTORR|2003-05-29 10:05:49|
1|2|79|283|259|A|05/29/2003|INTRIAGO MANZABA NANCY                  |RETIRA|64|CARLTORR|2003-05-29 10:09:02|
1|2|79|284|262|A|05/29/2003|COFERMA                                 |RETIRAN AV J.T.M.|60|LUISVERA|2003-05-29 10:58:03|
1|2|70|508|506|A|05/29/2003|RIBADENEIRA JORGE|RETIRA ALM CENTRO|70|LUISVERA|2003-05-29 14:28:42|
1|2|70|509|507|A|05/30/2003|MIRANDA MARIA DE                        |RETIRA|70|CARLTORR|2003-05-30 09:20:49|
1|2|79|285|263|A|05/30/2003|FERRETERIA SAN JAVIER                   |RUMICHACA 1238 Y C. BALLEN|60|LUISVERA|2003-05-30 09:49:30|
1|2|70|510|508|A|05/30/2003|COMERCIAL EDI-FER                       |RETIRA|70|CARLTORR|2003-05-30 10:59:44|
1|2|70|511|511|A|05/30/2003|CORDOVA ASTUDILLO LUIS, ING.|ED. EXECUTIVE CENTER, PISO 2|70|CARLTORR|2003-05-30 12:23:08|
1|2|79|286|264|A|05/30/2003|CLINICA GUAYAQUIL                       |ALMACEN CENTRO                                       |62|RAQUIDRO|2003-05-30 12:23:50|
1|2|70|512|510|A|05/30/2003|CLINICA GUAYAQUIL                       |PADRE AGUIRRE 401|70|CARLTORR|2003-05-30 12:24:26|
1|2|70|513|509|A|05/30/2003|CLINICA GUAYAQUIL                       |PADRE AGUIRRE 401|70|CARLTORR|2003-05-30 12:27:04|
1|2|79|287|265|A|05/30/2003|CORDOVA ASTUDILLO LUIS, ING.|ED. EXECUTIVE CENTER, PISO 2|62|RAQUIDRO|2003-05-30 13:03:54|
1|2|70|514|513|A|05/30/2003|DIMETAL                                 |RETIRA ALM CENTRO|70|LUISVERA|2003-05-30 13:47:34|
1|2|79|288|261|A|05/30/2003|FERREIND                                |RETIRAN AV J.T.M|60|LUISVERA|2003-05-30 13:59:39|
1|2|70|515|514|A|05/30/2003|CONSUELO DE SANCHEZ|RETIRA|70|CARLTORR|2003-05-30 14:19:24|
1|2|70|516|512|A|05/30/2003|TEJADA JOSE|M|70|CARLTORR|2003-05-30 14:23:22|
1|2|70|517|515|A|06/02/2003|SR. VIRGILIO LOPEZ|RETIRA|70|RAQUIDRO|2003-06-02 10:43:49|
1|2|79|289|266|A|06/02/2003|ATT: SR. JOHNNY ALARCON|RETIRAN|62|RAQUIDRO|2003-06-02 12:11:13|
1|2|70|518|492|A|06/02/2003|ARTICULO MUCHOS ANOS EN EXH.C/F|RETIRA ALMACEN CENTRO|70|RAQUIDRO|2003-06-02 12:22:15|
1|2|79|290|270|A|06/02/2003|INMOBILIARIA LOS PINOS                  |DISENSA, KM.3  VIA A DAULE|60|LUISVERA|2003-06-02 15:53:59|
1|2|79|291|271|A|06/02/2003|INMOBILIARIA LOS PINOS                  |DISENSA, KM. 3 VIA A DAULE|60|LUISVERA|2003-06-02 15:55:02|
1|2|79|292|268|A|06/02/2003|POTES SABANDO BLANCA|CALLEJON MALDONADO 5512 Y 37AVA|62|CARLTORR|2003-06-02 16:03:34|
1|2|79|293|267|A|06/02/2003|POTES SABANDO BLANCA|CALLEJON MALDONADO 5512 Y 37AVA|62|CARLTORR|2003-06-02 16:04:55|
1|2|70|519|519|A|06/02/2003|INMOBILIARIA XAGOMAR S.A.|RETIRA|70|CARLTORR|2003-06-02 16:55:29|
1|2|70|520|516|A|06/02/2003|POTES SABANDO BLANCA|CALLEJON MALDONADO 5512 Y 37AVA|70|CARLTORR|2003-06-02 17:01:10|
1|2|70|521|517|A|06/02/2003|POTES SABANDO BLANCA|CALLEJON MALDONADO 5512 Y 37AVA|70|CARLTORR|2003-06-02 17:02:02|
1|2|70|522|518|A|06/02/2003|POTES SABANDO BLANCA|CALLEJON MALDONADO 5512 Y 37AVA|70|CARLTORR|2003-06-02 17:02:45|
1|2|70|523|520|A|06/03/2003|DELITAC S.A.|RETIRA  ARQ. MELIDA DE ROLDAN|70|RAQUIDRO|2003-06-03 11:40:16|
1|2|79|294|272|A|06/03/2003|DELITAC S.A.|RETIRA  ARQ. MELIDA DE ROLDAN|60|RAQUIDRO|2003-06-03 11:42:50|
1|2|70|524|521|A|06/03/2003| SR MOLINA RICARDO|ALM CENTRO|70|LUISVERA|2003-06-03 11:49:50|
1|2|70|525|522|A|06/03/2003|CONSUMIDOR FINAL|M|70|CARLTORR|2003-06-03 14:35:07|
1|2|70|526|523|A|06/03/2003|ZAMBRANO GALVEZ LUIS|RETIRA ALM CENTRO|70|LUISVERA|2003-06-03 14:42:29|
1|2|79|295|273|A|06/03/2003|O. C. 13061/62/63/64/60-OBRA ACHI-EL RIO|URBANIZACION EL RIO VIA SAN BORONDON-OBRA ACHI       |62|RAQUIDRO|2003-06-03 16:23:53|
1|2|79|296|274|A|06/03/2003|O.C. # 13057-B.SERVICIO-CHOFER-OBRA ACHI|URBANIZACION EL RIO VIA SAN BORONDON-OBRA ACHI       ENTREGAR A ARQ. ALEJANDRO FLORES                     |62|RAQUIDRO|2003-06-03 16:26:57|
1|2|79|297|275|A|06/03/2003|O.C. # 13059-LAVANDERIA-CHOFER-SERVICIO|URB. EL RIO-OBRA ACHI -ENTREGAR A ARQ, ALEJANDRO     FLORES                                               |62|RAQUIDRO|2003-06-03 16:29:18|
1|2|79|298|276|A|06/03/2003|O.C. # 13058.COCINA-OBRA ACHI|URBAN. EL RIO OBRA ACHI -ENTREGAR A ARQ. ALEJANDRO   FLORES                                               |62|RAQUIDRO|2003-06-03 16:30:24|
1|2|79|299|277|A|06/03/2003|O.C. # 13089-BANO PISCINA OBRA ACHI|URBASN. EL RIO .OBRA ACHI -ENTREGAR A ARQ. ALENADRO  FLORES                                               |62|RAQUIDRO|2003-06-03 16:31:43|
1|2|70|527|524|A|06/03/2003|JORDAN CHAVEZ JENNY|6 DE MARZO 3104 Y PORTETE|70|CARLTORR|2003-06-03 17:27:23|
1|2|70|528|525|A|06/03/2003|INTRIAGO MANZABA NANCY                  |RETIRA|70|CARLTORR|2003-06-03 17:35:07|
1|2|70|529|526|A|06/04/2003|FERRETERIA COMERCIAL                    |RETIRA|70|CARLTORR|2003-06-04 09:16:01|
1|2|79|300|278|A|06/04/2003|JORDAN CHAVEZ JENNY|6 DE MARZO 3104 Y PORTETE  -ENTREGAR DESPUES DE LAS  3 P.M.                                               |62|RAQUIDRO|2003-06-04 09:28:34|
1|2|70|530|527|A|06/04/2003|CONSUMIDOR FINAL|ALM CENTRO|70|LUISVERA|2003-06-04 11:09:05|
1|2|70|531|529|A|06/04/2003|SR. VICTOR HUGO CHAVEZ|M|70|LUISVERA|2003-06-04 12:11:56|
1|2|79|301|279|A|06/04/2003|O.C.#732|RETIRA SR. FRANKLIN UVE|62|CARLTORR|2003-06-04 12:20:12|
1|2|70|532|530|A|06/04/2003|3ER. PISO-LAVANDERIA|RETIRA|70|RAQUIDRO|2003-06-04 12:45:38|
1|2|70|533|531|A|06/04/2003|BANO PATIO-PED. ARQ. DE ROLDAN|RETIRA MAESTRO SERVIO MEDINA|70|RAQUIDRO|2003-06-04 13:14:17|
1|2|79|302|280|A|06/04/2003|COFERMA                                 |RETIRAN AV.J.T.MARENGO|64|LUISVERA|2003-06-04 13:14:18|
1|2|70|534|531|A|06/04/2003|BANO PATIO-PED. ARQ. DE ROLDAN|RETIRA MAESTRO SERVIO MEDINA|70|RAQUIDRO|2003-06-04 13:14:44|
1|2|79|303|269|A|06/04/2003|POTES SABANDO BLANCA|CALLEJON MALDONADO 5512 Y 37AVA|62|CARLTORR|2003-06-04 14:32:52|
1|2|79|304|281|A|06/04/2003|JARAMILLO VARGAS ORLANDO|CDLA.MARTHA ROLDOS MZ.809 V.2|64|CARLTORR|2003-06-04 15:42:03|
1|2|70|535|528|A|06/04/2003|ING. VICTOR PROANO (ART.INCOMPL|RETIRA (DESAGUE INCOMPLETO)|70|CARLTORR|2003-06-04 16:38:14|
1|2|70|536|533|A|06/05/2003|FERREIND                                |ALM CENTRO|70|LUISVERA|2003-06-05 10:23:26|
1|2|70|537|534|A|06/05/2003|CANDO LEONARDO|RET.ALM CENTRO|70|LUISVERA|2003-06-05 11:02:25|
1|2|79|305|282|A|06/05/2003|O.C.#00232-G-2003|RETIRA SR. JOSE GRANIZO|62|CARLTORR|2003-06-05 12:32:37|
1|2|70|538|535|A|06/05/2003|SIMBOLOS GRAFICOS S.A.                  |RETIRAN ALM CENTRO|70|LUISVERA|2003-06-05 12:33:54|
1|2|79|306|283|A|06/05/2003|LEONARDO CANDO|RETIRAN|60|LUISVERA|2003-06-05 17:11:19|
1|2|70|539|536|A|06/06/2003|PEDIDO POR ARQ. DE ROLDAN|RETIRA DE ALMACEN CENTRO|70|LUISVERA|2003-06-06 10:13:56|
1|2|70|540|537|A|06/06/2003|PEDIDO POR ARQ. DE ROLDAN|CLINICA GUAYAQUIL|70|LUISVERA|2003-06-06 10:14:48|
1|2|70|541|538|A|06/06/2003|PEDIDO POR ARQ. DE ROLDAN|RETRIRA DE ALMACEN CENTRO|70|RAQUIDRO|2003-06-06 10:22:14|
1|2|70|542|538|A|06/06/2003|PEDIDO POR ARQ. DE ROLDAN|RETRIRA DE ALMACEN CENTRO|70|RAQUIDRO|2003-06-06 10:23:20|
1|2|70|543|540|A|06/06/2003|PAREDES FRANKLIN|RETIRA|70|CARLTORR|2003-06-06 13:15:21|
1|2|70|544|541|A|06/06/2003|COFERMA                                 |RETIRAN ALM CENTRO|70|LUISVERA|2003-06-06 13:18:01|
1|2|70|545|539|A|06/06/2003|COFERMA                                 |RETIRAN|70|CARLTORR|2003-06-06 13:21:40|
1|2|79|307|284|A|06/06/2003|VILLARREAL SALAS JUSTO|RETIRAN ALM CENTRO|60|LUISVERA|2003-06-06 14:38:29|
1|2|70|546|542|A|06/06/2003|SERRANO MARIA DE|RETIRA ALM. CENTRO|70|CARLTORR|2003-06-06 16:02:34|
1|2|79|308|286|A|06/06/2003|FECIM S.A.|RETIRAN|62|RAQUIDRO|2003-06-06 17:29:41|
1|2|79|309|285|A|06/06/2003|OBRA SR. ALFONSO QUIGUANGO|ALMACEN CENTRO|64|CARLTORR|2003-06-06 17:32:17|
1|2|70|547|544|A|06/09/2003|RIVADENEIRA VELASQUEZ ORLANDO|RETIRAN ALM CENTRO|70|LUISVERA|2003-06-09 11:01:43|
1|2|79|310|287|A|06/09/2003|O.COMP#145|QUISQUI 1_14 ENTRE XIMENAY RIOB|60|LUISVERA|2003-06-09 11:06:09|
1|2|70|548|545|A|06/09/2003|FEYESO|M|70|RAQUIDRO|2003-06-09 11:10:03|
1|2|70|549|546|A|06/09/2003|PROANO HERRERA ELENA                    |CDLA. FLORESTA 2 MZ. 138 V5|70|CARLTORR|2003-06-09 12:54:09|
1|2|79|311|288|A|06/09/2003|FERREIND                                |RETIRAN AV.J.T.MARENGO|60|LUISVERA|2003-06-09 16:14:06|
1|2|70|550|547|A|06/10/2003|JIMENEZ SOTO JOSE FRANCISCO|RETIRA EN ALMACEN CENTRO|70|LUISVERA|2003-06-10 10:29:44|
1|2|79|312|289|A|06/10/2003|FERRETERIA COMERCIAL                    |RETIRA|62|RAQUIDRO|2003-06-10 11:04:28|
1|2|70|551|549|A|06/10/2003|GUALOTUNA ALFREDO                       |PORTETE 1126 Y GUARANDA|70|LUISVERA|2003-06-10 11:30:26|
1|2|70|552|550|A|06/10/2003|NICOLAS CRESPO|ALM CENTRO|70|LUISVERA|2003-06-10 11:48:36|
1|2|70|553|551|A|06/10/2003|OBRA GINNACIO-PEDIDO POR SRTA. SUSANA|UNICENTRO|70|CARLTORR|2003-06-10 16:28:55|
1|2|70|554|552|A|06/10/2003|LA CASA DEL VAPOR                       |RETIRAN ALM CENTRO|70|LUISVERA|2003-06-10 17:05:13|
1|2|70|555|553|A|06/10/2003|MA. DEL CARMEN DE BUSTAMANTE|.|70|CARLTORR|2003-06-10 17:18:28|
1|2|70|556|554|A|06/11/2003|MARAGRO S.A.|JUNIN 114 Y PANAMA P.6 OF.4|70|RAQUIDRO|2003-06-11 10:04:54|
1|2|79|313|290|A|06/11/2003|RIVADENEIRA CAMPOZANO JORGE|RETIRAN AV J.T.MARENGO|60|LUISVERA|2003-06-11 10:39:17|
1|2|70|557|555|A|06/11/2003|FELIPE PINTO|M|70|CARLTORR|2003-06-11 11:07:47|
1|2|70|558|556|A|06/11/2003|PACHECO DIAZ MANUEL|RETIRA|70|CARLTORR|2003-06-11 11:33:05|
1|2|70|559|548|A|06/11/2003|O.COMP#682|ALM CENTRO|70|LUISVERA|2003-06-11 11:47:14|
1|2|79|314|274|A|06/11/2003|O.C. # 13057-B.SERVICIO-CHOFER-OBRA ACHI|RETIRA MANUEL SANDOYA                                |70|RAQUIDRO|2003-06-11 12:11:43|
1|2|70|560|557|A|06/11/2003|PROANO HERRERA ELENA                    |RETIRA|70|CARLTORR|2003-06-11 12:44:13|
1|2|79|315|292|A|06/11/2003|DESCUENTO AUTO. POR SRA. NANCY|ALMACEN CENTRO|62|CARLTORR|2003-06-11 12:57:22|
1|2|79|316|291|A|06/11/2003|PROANO HERRERA ELENA                    |RETIRA|62|CARLTORR|2003-06-11 12:58:19|
1|2|70|561|559|A|06/11/2003|ABG. JORGE NEIRA MENENDEZ|RETIRA|70|CARLTORR|2003-06-11 14:35:41|
1|2|70|562|560|A|06/11/2003|SANCHEZ GAETE LUIS|ALMACEN CENTRO|70|CARLTORR|2003-06-11 15:04:02|
1|2|70|563|561|A|06/11/2003|JAVIER LOZANO|RETIRA|70|CARLTORR|2003-06-11 15:05:02|
1|2|70|564|563|A|06/11/2003|BAHAMONDE MONCAYO MIRIAM|CORDOVA 525 Y TOMAS MARTINEZ|70|RAQUIDRO|2003-06-11 16:51:02|
1|2|70|565|564|A|06/11/2003|BAHAMONDE MONCAYO MIRIAM|CORDOVA 525 Y TOMAS MARTINEZ|70|RAQUIDRO|2003-06-11 16:51:40|
1|2|70|566|562|A|06/11/2003|FAJARDO MARIA BARRERA DE                |SAUCES 1 MZ. F14 V.31|70|RAQUIDRO|2003-06-11 16:52:52|
1|2|79|317|294|A|06/12/2003|O.COMP#150|TRANSPORTE SEMERIA A CUENCA|60|RAQUIDRO|2003-06-12 10:10:08|
1|2|79|318|293|A|06/12/2003|N.CDTO. Y COBRANZA|RETIRA|64|RAQUIDRO|2003-06-12 11:18:25|
1|2|79|319|293|A|06/12/2003|N.CDTO. Y COBRANZA|RETIRA|62|RAQUIDRO|2003-06-12 11:19:12|
1|2|79|320|295|A|06/12/2003|LA PARRILLA DEL NATO|AV. V.E.ESTRADA 1219 Y LAURELES|62|CARLTORR|2003-06-12 12:31:51|
1|2|70|567|565|A|06/12/2003|INGRID MAHUER|RETIRA|70|CARLTORR|2003-06-12 16:51:08|
1|2|70|568|568|A|06/12/2003|FAJARDO MARIA BARRERA DE                |SAUCES 1 MZ. F14 V.31|70|CARLTORR|2003-06-12 17:28:26|
1|2|70|569|569|A|06/13/2003|JIMENEZ SOTO JOSE FRANCISCO|COLON Y PIO MONTUFAR ESQUINA|70|LUISVERA|2003-06-13 09:15:05|
1|2|70|570|543|A|06/13/2003|OBRA SR. ALFONSO QUIGUANGO|ALMACEN CENTRO|70|CARLTORR|2003-06-13 10:39:38|
1|2|70|571|558|A|06/13/2003|UNICENTRO TURISTICO JABUCAM             |AGUIRRE 411 E/ CHILE Y CHIMBORAZO OF.208|70|CARLTORR|2003-06-13 10:40:10|
1|2|70|572|571|A|06/13/2003|PILAR DE MASSOUD|RETIRA|70|CARLTORR|2003-06-13 10:43:23|
1|2|79|321|296|A|06/13/2003|O.COMP#689|RETIRAN AV.J.T.M.|60|LUISVERA|2003-06-13 10:47:11|
1|2|79|322|298|A|06/13/2003|O.COMP#102|RETIRAN AV.J.T.M.|60|LUISVERA|2003-06-13 11:45:37|
1|2|79|323|299|A|06/13/2003|O.COMP#102|RETIRAN AV J.T.M.|60|LUISVERA|2003-06-13 11:46:48|
1|2|79|324|297|A|06/13/2003|CORP. CIVICA, CULTURAL Y DEP. ISLA SOL|VIA SAMBORONDON URB. ISLA SOL|64|LUISVERA|2003-06-13 11:51:22|
1|2|79|325|300|A|06/13/2003|FERROBRONCE                             |RUMICHACA 1725 Y FCO. CAMPOS|60|RAQUIDRO|2003-06-13 12:28:08|
1|2|70|573|567|A|06/13/2003|PEDIDO POR QRQ. ROLDAN|ALMACEN CENTRO|70|LUISVERA|2003-06-13 15:49:54|
1|2|70|574|575|A|06/13/2003|AVENDANO CARRION VICTOR H.              |RET.ALM CENTRO|70|LUISVERA|2003-06-13 16:35:35|
1|2|79|326|301|A|06/13/2003|GARRIDO ZAPA ANTONIO A.                 |KM. 7,5 VIA A DAULE, COOP.GALLEGOS LARA|64|RAQUIDRO|2003-06-13 16:39:24|
1|2|70|575|574|A|06/13/2003|CLINICA GUAYAQUIL                       |PADRE AGUIRRE 401|70|RAQUIDRO|2003-06-13 16:50:45|
1|2|70|576|574|A|06/13/2003|CLINICA GUAYAQUIL                       |PADRE AGUIRRE 401|70|LUISVERA|2003-06-13 16:53:26|
1|2|70|577|576|A|06/13/2003|ANA MA. DE GOMEZ|RETIRA|70|CARLTORR|2003-06-13 17:07:53|
1|2|70|578|577|A|06/16/2003|JIMENEZ SOTO JOSE FRANCISCO|COLON Y PIO MONTUFAR ESQUINA|70|LUISVERA|2003-06-16 10:18:02|
1|2|79|327|302|A|06/16/2003|DESCUENTO PROMOCION|RETIRAN AV.J.T.M.|60|RAQUIDRO|2003-06-16 10:21:28|
1|2|70|579|578|A|06/16/2003|ALBERTO URETA|RETIRA|70|CARLTORR|2003-06-16 10:27:31|
1|2|70|580|579|A|06/16/2003|SR LADD WUALTER|M|70|LUISVERA|2003-06-16 10:44:15|
1|2|70|581|581|A|06/16/2003|MONTES CARLOS|RETIRA ALM CENTRO|70|LUISVERA|2003-06-16 11:33:06|
1|2|70|582|580|A|06/16/2003|DELITAC S.A.|PADRE AGUIRRE 401 Y CORDOVA|70|LUISVERA|2003-06-16 11:34:29|
1|2|70|583|582|A|06/16/2003|DELITAC S.A.|PADRE AGUIRRE 401 Y CORDOVA|70|CARLTORR|2003-06-16 11:55:48|
1|2|79|328|303|A|06/16/2003|DELITAC S.A.|PADRE AGUIRRE 401 Y CORDOVA|62|RAQUIDRO|2003-06-16 11:56:09|
1|2|70|584|583|A|06/16/2003|COFERMA                                 |ELOY ALFARO 2224 Y G.GOYENA|70|LUISVERA|2003-06-16 12:27:20|
1|2|70|585|586|A|06/16/2003|SANDRA DE GONZALEZ|RETIRA|70|CARLTORR|2003-06-16 15:09:09|
1|2|70|586|585|A|06/16/2003|SR. JULIO CASTRO|RETIRA|70|CARLTORR|2003-06-16 15:15:30|
1|2|70|587|584|A|06/16/2003|SR. JULIO CASTRO|M|70|CARLTORR|2003-06-16 15:16:04|
1|2|79|329|304|A|06/16/2003|ERAZO VARGAS BYRON ING.                 |RETIRA AV J.T.M|64|LUISVERA|2003-06-16 16:06:21|
1|2|79|330|304|A|06/16/2003|ERAZO VARGAS BYRON ING.                 |RETIRA AV J.T.M|60|LUISVERA|2003-06-16 16:09:40|
1|2|70|588|587|A|06/16/2003|ALBERTO URETA|RETIRA|70|CARLTORR|2003-06-16 16:11:32|
1|2|70|589|588|A|06/16/2003|AYALA V. MONSERRATT                     |CDLA. LOS CEIBOS, AV. 1ERA. 421A Y CALLE|70|RAQUIDRO|2003-06-16 17:51:29|
1|2|79|331|305|A|06/16/2003|AYALA V. MONSERRATT                     |CDLA. LOS CEIBOS, AV. 1ERA. 421A Y CALLE|62|RAQUIDRO|2003-06-16 17:54:27|
1|2|70|590|589|A|06/16/2003|AYALA V. MONSERRATT                     |CDLA. LOS CEIBOS, AV. 1ERA. 421A Y CALLE|70|RAQUIDRO|2003-06-16 17:55:40|
1|2|79|332|306|A|06/17/2003|AYALA V. MONSERRATT                     |CDLA. LOS CEIBOS, AV. 1ERA. 421A Y CALLE|60|RAQUIDRO|2003-06-17 09:11:13|
1|2|79|333|306|A|06/17/2003|AYALA V. MONSERRATT                     |CDLA. LOS CEIBOS, AV. 1ERA. 421A Y CALLE|62|RAQUIDRO|2003-06-17 09:12:55|
1|2|70|591|590|A|06/17/2003|COFERMA                                 |RETIRA ALM CENTRO|70|RAQUIDRO|2003-06-17 09:18:56|
1|2|79|334|307|A|06/17/2003|O.C.#00700|RETIRAN|62|RAQUIDRO|2003-06-17 10:42:42|
1|2|70|592|591|A|06/17/2003|COMERCIAL CORNEJO|M|70|RAQUIDRO|2003-06-17 11:26:15|
1|2|79|335|308|A|06/17/2003|O.COMP#32758|AV.J.T.M. KM.2.5 LA LLAVE|64|LUISVERA|2003-06-17 11:56:07|
1|2|70|593|592|A|06/17/2003|GISELLA VARAS|RETIRA|70|CARLTORR|2003-06-17 12:18:17|
1|2|79|336|309|A|06/17/2003|O.C.#752|RETIRA SR. UBE|62|CARLTORR|2003-06-17 13:04:10|
1|2|79|337|308|A|06/17/2003|O.COMP#32758|AV.J.T.M. KM.2.5 LA LLAVE|64|LUISVERA|2003-06-17 16:36:32|
1|2|70|594|593|A|06/17/2003|JOSE ALCIVAR|RETIRA|70|CARLTORR|2003-06-17 16:55:41|
1|2|79|338|310|A|06/18/2003|ATT SR JAVIER GUTIERREZ|TRANSP SEMERIA CARGA|60|LUISVERA|2003-06-18 09:44:16|
1|2|79|339|311|A|06/18/2003|FERRETERIA SAN JAVIER                   |RETIRA AV J.T.M.|64|LUISVERA|2003-06-18 10:16:45|
1|2|70|595|594|A|06/18/2003|ELBA SANDOYA|M|70|CARLTORR|2003-06-18 10:36:19|
1|2|70|596|595|A|06/18/2003|PRECIO DE PROMOCION|RETIRA ALM CENTRO|70|LUISVERA|2003-06-18 10:40:54|
1|2|79|340|312|A|06/18/2003|ESPINOZA MURRIETA IVAN|AV.J.T.M.|60|LUISVERA|2003-06-18 11:47:53|
1|2|70|597|596|A|06/18/2003|SERTELEC                                |RETIRA|70|CARLTORR|2003-06-18 12:14:13|
