1|2|70|1|D|FA|1.0|01/20/2003|AVILES CRISTINA|CDLA. LA SAIBA MZ.J V.7|LOURBANC|2003-01-20 12:49:56|
1|2|70|2|D|FA|2.0|01/20/2003|MALTA LUIS|URB. EL RIO KM. 2.1/2 V.SAMBOR|LOURBANC|2003-01-20 14:35:28|
1|2|70|3|D|FA|3.0|01/20/2003|MERA MARCOS|EL FORTIN|LOURBANC|2003-01-20 14:50:25|
1|2|70|4|D|FA|4.0|01/20/2003|ANCHUNDIA MARCELO|VIA PERIMETRAL|LOURBANC|2003-01-20 15:11:37|
1|2|70|5|D|FA|5.0|01/20/2003|SILVA TERESA CHONG DE                   |ESCOBEDO 1503 Y AGUIRRE|LOURBANC|2003-01-20 16:11:15|
1|2|70|6|D|FA|6.0|01/20/2003|DYNARQ C. LTDA.                         |AV. 9 DE OCTUBRE 2009 Y LOS RIOS PISO 4|LOURBANC|2003-01-20 16:13:24|
1|2|70|7|D|FA|7.0|01/20/2003|MALDONADO MARTHA|CDLA. BELLA AURORA MZ.C V.12|LOURBANC|2003-01-20 17:15:16|
1|2|70|8|D|FA|8.0|01/20/2003|GUIM LOQUIO EMILIO ING.                 |CARCHI 1202 Y AGUIRRE|LOURBANC|2003-01-20 18:11:56|
1|2|70|9|D|FA|9.0|01/21/2003|CEDENO WILBER|COOP.LOS JARDINES S.4|LOURBANC|2003-01-21 09:35:16|
1|2|70|10|D|FA|10.0|01/21/2003|M.B.S. CIA. LTDA.                       |ELOY ALFARO 916-920 Y BRASIL|LOURBANC|2003-01-21 10:31:28|
1|2|70|11|D|FA|11.0|01/21/2003|QUEVEDO REYNALDO|33AVA. 1119 Y S.MARTIN|LOURBANC|2003-01-21 10:33:15|
1|2|70|12|D|FA|12.0|01/21/2003|SUPERINTENDENCIA DE BANCOS              |CHIMBORAZO 412 Y C. BALLEN|LOURBANC|2003-01-21 11:06:20|
1|2|70|13|D|FA|13.0|01/21/2003|UNICENTRO TURISTICO JABUCAM             |AGUIRRE 411 E/ CHILE Y CHIMBORAZO OF.208|LOURBANC|2003-01-21 11:09:45|
1|2|70|14|D|FA|14.0|01/21/2003|TERESA VARGAS MORALES|CDLA. ENTRE RIOS MZ.1 V.22|LOURBANC|2003-01-21 11:17:43|
1|2|70|15|D|FA|15.0|01/21/2003|UNICENTRO TURISTICO JABUCAM             |AGUIRRE 411 E/ CHILE Y CHIMBORAZO OF.208|LOURBANC|2003-01-21 11:19:59|
1|2|79|1|D|FA|16.0|01/21/2003|MAFNASA S.A.                            |LORENZO DE GARAICOA 2130 Y HUANCAVILCA|LOURBANC|2003-01-21 12:14:18|
1|2|70|16|D|FA|17.0|01/21/2003|ENRIQUEZ PIEDAD|CDLA. FAE MZ.29 V.3|LOURBANC|2003-01-21 12:21:55|
1|2|70|17|D|FA|18.0|01/21/2003|ORTIZ EDUARDO|AMBATO JUNIN Y VERDELOMA|LOURBANC|2003-01-21 12:24:54|
1|2|70|18|D|FA|19.0|01/21/2003|EQUAFERR|SUCRE 535 E/BOYACA Y CHIMBORAZO|LOURBANC|2003-01-21 13:34:09|
1|2|70|19|D|FA|20.0|01/21/2003|CARRILLO MANUEL|MIRAFLORES 7MA 306|LOURBANC|2003-01-21 14:23:43|
1|2|79|2|D|FA|21.0|01/21/2003|FERRETERIA SAN JOSE                     |RUMICHACA 1230 Y C.BALLEN|LOURBANC|2003-01-21 15:43:29|
1|2|79|3|D|FA|22.0|01/21/2003|PEREZ MASA GLEN|SAMANE#2 MZ221 V12|LOURBANC|2003-01-21 16:11:24|
1|2|70|20|D|FA|23.0|01/21/2003|MERA MARCOS|EL FORTIN|LOURBANC|2003-01-21 16:46:56|
1|2|70|21|D|FA|24.0|01/21/2003|UNICENTRO TURISTICO JABUCAM             |AGUIRRE 411 E/ CHILE Y CHIMBORAZO OF.208|LOURBANC|2003-01-21 17:23:56|
1|2|79|4|D|FA|24.0|01/21/2003|UNICENTRO TURISTICO JABUCAM             |AGUIRRE 411 E/ CHILE Y CHIMBORAZO OF.208|LOURBANC|2003-01-21 17:23:56|
1|2|70|22|D|FA|25.0|01/21/2003|CADENA LA GAVIOTA|BOYACA 1205 Y 9 DE OCTUBRE, 1ER.PISO|LOURBANC|2003-01-21 17:25:12|
1|2|79|5|D|FA|25.0|01/21/2003|CADENA LA GAVIOTA|BOYACA 1205 Y 9 DE OCTUBRE, 1ER.PISO|LOURBANC|2003-01-21 17:25:12|
1|2|70|23|D|FA|26.0|01/22/2003|RICKY CENTRO                            |AV. OLMEDO 525 Y BOYACA|LOURBANC|2003-01-22 10:10:45|
1|2|70|24|D|FA|27.0|01/22/2003|VALDIVIESO FAUSTO|ORELLANA 213 Y PANAMA|LOURBANC|2003-01-22 10:38:46|
1|2|70|25|D|FA|28.0|01/22/2003|CHAUG MAURICIO                          |JUNIN 626 Y BOYACA|LOURBANC|2003-01-22 10:42:55|
1|2|70|26|D|FA|29.0|01/22/2003|DIMETAL                                 |LORENZO DE GARAICOA Y PADRE SOLANO|LOURBANC|2003-01-22 10:45:07|
1|2|70|27|D|FA|30.0|01/22/2003|RAMOS MOLINA ROBERTO, ARQ.              |MIGUEL ALCIVAR Y CALLE N, MZ. 31 SL. 2|LOURBANC|2003-01-22 10:46:52|
1|2|70|28|D|FA|31.0|01/22/2003|SIMON ISAIAS XAVIER                     |10 DE AGOSTO 6036 Y CHIMBORAZO ESQ.|LOURBANC|2003-01-22 12:16:54|
1|2|70|29|D|FA|32.0|01/22/2003|DIMETAL                                 |LORENZO DE GARAICOA Y PADRE SOLANO|LOURBANC|2003-01-22 13:03:15|
1|2|70|30|D|FA|33.0|01/22/2003|SUMMA PROYECTOS C.A.                    |ED. EXECUTIVE CENTER, PISO 2|LOURBANC|2003-01-22 14:53:08|
1|2|79|6|D|FA|34.0|01/22/2003|VERA SARMIENTO JAIME, ARQ.              |CDLA. LA SAIBA, MZ. O V.20|LOURBANC|2003-01-22 15:34:34|
1|2|79|7|D|FA|35.0|01/22/2003|PLASTICOS DEL LITORAL PLASTILIT S.A.    |KM. 11.5 VIA A DAULE|LOURBANC|2003-01-22 15:52:05|
1|2|70|31|D|FA|36.0|01/22/2003|CHAUG MAURICIO                          |JUNIN 626 Y BOYACA|LOURBANC|2003-01-22 16:06:31|
1|2|70|32|D|FA|37.0|01/22/2003|HOTELCA/HOTEL RAMADA C.A.               |MALECON 606 Y MANUEL LUZARRAGA|LOURBANC|2003-01-22 17:05:39|
1|2|70|33|D|FA|38.0|01/22/2003|INMOBILIARIA CALIDAD, INMOCALI S.A.     |AVDA. MIGEL ALCIVAR, ED. ARQUETIPO III|LOURBANC|2003-01-22 17:21:48|
1|2|70|34|D|FA|39.0|01/23/2003|TORRES DE LA MERCED|CORDOVA 812 Y V.M.RENDON|LOURBANC|2003-01-23 09:14:09|
1|2|70|35|D|FA|40.0|01/23/2003|MENDEZ CARLOS|DURAN PRIMAVERA#1 MZE4 V10|LOURBANC|2003-01-23 11:14:59|
1|2|70|36|D|FA|41.0|01/23/2003|MENDEZ CARLOS|DURAN PRIMAVERA#1 MZE4 V10|LOURBANC|2003-01-23 11:32:38|
1|2|70|37|D|FA|42.0|01/23/2003|REYVEN|AGUIRRE 914 Y STA. ELENA|LOURBANC|2003-01-23 13:04:38|
1|2|70|38|D|FA|43.0|01/23/2003|REA MARIO|BOYACA 1711 Y 10 DE AGOSTO|LOURBANC|2003-01-23 14:27:36|
1|2|70|39|D|FA|44.0|01/23/2003|LOZANO LUIS|ARGENTINA 1800 Y J.MASCOTE|LOURBANC|2003-01-23 15:26:14|
1|2|70|40|D|FA|45.0|01/23/2003|SANCHEZ JUAN|ELOY ALFARO 326 Y OLMEDO|LOURBANC|2003-01-23 15:50:08|
1|2|70|41|D|FA|46.0|01/23/2003|IND.INMOBILIARIA LIALTRIAL S.A.|9 DE OCBRE 127 Y PICHINCHA|LOURBANC|2003-01-23 17:08:35|
1|2|70|42|D|FA|47.0|01/23/2003|COFERMA                                 |ELOY ALFARO 2224 Y G.GOYENA|LOURBANC|2003-01-23 17:11:34|
1|2|79|8|D|FA|48.0|01/23/2003|CAMARONERA COLAS DE ORO                 |BOYACA 1615 Y 1O DE AGOSTO|LOURBANC|2003-01-23 17:20:28|
1|2|79|9|D|FA|49.0|01/23/2003|COFERMA                                 |ELOY ALFARO 2224 Y G.GOYENA|LOURBANC|2003-01-23 17:37:56|
1|2|79|10|D|FA|50.0|01/23/2003|INMOBILIARIA CALIDAD, INMOCALI S.A.     |AVDA. MIGEL ALCIVAR, ED. ARQUETIPO III|LOURBANC|2003-01-23 18:31:37|
1|2|79|11|D|FA|51.0|01/23/2003|INMOBILIARIA CALIDAD, INMOCALI S.A.     |AVDA. MIGEL ALCIVAR, ED. ARQUETIPO III|LOURBANC|2003-01-23 18:33:33|
1|2|79|12|D|FA|52.0|01/23/2003|INMOBILIARIA CALIDAD, INMOCALI S.A.     |AVDA. MIGEL ALCIVAR, ED. ARQUETIPO III|LOURBANC|2003-01-23 18:36:07|
1|2|79|13|D|FA|53.0|01/23/2003|INMOBILIARIA CALIDAD, INMOCALI S.A.     |AVDA. MIGEL ALCIVAR, ED. ARQUETIPO III|LOURBANC|2003-01-23 18:37:17|
1|2|79|14|D|FA|54.0|01/23/2003|INMOBILIARIA CALIDAD, INMOCALI S.A.     |AVDA. MIGEL ALCIVAR, ED. ARQUETIPO III|LOURBANC|2003-01-23 18:38:15|
1|2|79|15|D|FA|55.0|01/23/2003|INMOBILIARIA CALIDAD, INMOCALI S.A.     |AVDA. MIGEL ALCIVAR, ED. ARQUETIPO III|LOURBANC|2003-01-23 18:40:13|
1|2|79|16|D|FA|56.0|01/23/2003|INMOBILIARIA CALIDAD, INMOCALI S.A.     |AVDA. MIGEL ALCIVAR, ED. ARQUETIPO III|LOURBANC|2003-01-23 18:41:35|
1|2|70|43|D|FA|57.0|01/24/2003|IMFERSA S.A.                            |GARCIA GOYENA 365 Y ELOY ALFARO|LOURBANC|2003-01-24 11:55:53|
1|2|70|44|D|FA|58.0|01/24/2003|MENDEZ CARLOS|DURAN, PRIMAVERA 1  MZ.E  V.10|LOURBANC|2003-01-24 14:12:57|
1|2|79|17|D|FA|59.0|01/24/2003|INMOBILIARIA CALIDAD, INMOCALI S.A.     |AVDA. MIGEL ALCIVAR, ED. ARQUETIPO III|LOURBANC|2003-01-24 16:11:53|
1|2|79|18|D|FA|60.0|01/24/2003|HOTELCA/HOTEL RAMADA C.A.               |MALECON 606 Y MANUEL LUZARRAGA|LOURBANC|2003-01-24 16:12:49|
1|2|70|45|D|FA|61.0|01/24/2003|PLASTICOS INDUSTRIALES C.A.             |KM. 7.5 VIA A DAULE|LOURBANC|2003-01-24 17:41:14|
1|2|79|19|D|FA|61.0|01/24/2003|PLASTICOS INDUSTRIALES C.A.             |KM. 7.5 VIA A DAULE|LOURBANC|2003-01-24 17:41:14|
1|2|70|46|D|FA|62.0|01/24/2003|BULGARIN NARANJO ANTONIO                |CDLA. LA CHALA, CALLEJON ALIANZA Y 13|LOURBANC|2003-01-24 18:22:15|
1|2|70|47|D|FA|63.0|01/24/2003|QUEVEDO REYNALDO|33AVA. 1519 Y S.MARTIN|LOURBANC|2003-01-24 18:41:34|
1|2|79|20|D|FA|64.0|01/24/2003|INMOBILIARIA CALIDAD, INMOCALI S.A.     |AVDA. MIGEL ALCIVAR, ED. ARQUETIPO III|LOURBANC|2003-01-24 18:59:16|
1|2|79|21|D|FA|65.0|01/24/2003|INMOBILIARIA CALIDAD, INMOCALI S.A.     |AVDA. MIGEL ALCIVAR, ED. ARQUETIPO III|LOURBANC|2003-01-24 19:00:24|
1|2|79|22|D|FA|66.0|01/24/2003|INMOBILIARIA CALIDAD, INMOCALI S.A.     |AVDA. MIGEL ALCIVAR, ED. ARQUETIPO III|LOURBANC|2003-01-24 19:01:13|
1|2|79|23|D|FA|67.0|01/24/2003|INMOBILIARIA CALIDAD, INMOCALI S.A.     |AVDA. MIGEL ALCIVAR, ED. ARQUETIPO III|LOURBANC|2003-01-24 19:02:14|
1|2|79|24|D|FA|68.0|01/24/2003|INMOBILIARIA CALIDAD, INMOCALI S.A.     |AVDA. MIGEL ALCIVAR, ED. ARQUETIPO III|LOURBANC|2003-01-24 19:10:27|
1|2|79|25|D|FA|69.0|01/24/2003|INMOBILIARIA CALIDAD, INMOCALI S.A.     |AVDA. MIGEL ALCIVAR, ED. ARQUETIPO III|LOURBANC|2003-01-24 19:13:45|
1|2|70|48|D|FA|70.0|01/24/2003|INMOBILIARIA CALIDAD, INMOCALI S.A.     |AVDA. MIGEL ALCIVAR, ED. ARQUETIPO III|LOURBANC|2003-01-24 19:15:51|
1|2|79|26|D|FA|70.0|01/24/2003|INMOBILIARIA CALIDAD, INMOCALI S.A.     |AVDA. MIGEL ALCIVAR, ED. ARQUETIPO III|LOURBANC|2003-01-24 19:15:51|
1|2|70|49|D|FA|71.0|01/27/2003|COFERMA                                 |ELOY ALFARO 2224 Y G.GOYENA|LOURBANC|2003-01-27 09:44:53|
1|2|70|50|D|FA|72.0|01/27/2003|CHAVARRIA CARLOS|LUQUE 323 Y CHIMBORAZO|LOURBANC|2003-01-27 11:28:05|
1|2|79|27|D|FA|73.0|01/27/2003|INMOBILIARIA CALIDAD, INMOCALI S.A.     |AVDA. MIGEL ALCIVAR, ED. ARQUETIPO III|LOURBANC|2003-01-27 12:10:25|
1|2|70|51|D|FA|74.0|01/27/2003|MEZA BAQUE MILTON                       |RUMICHACA 1820 Y BENALCAZAR|LOURBANC|2003-01-27 14:04:44|
1|2|70|52|D|FA|75.0|01/27/2003|YEPEZ BORJA ALEX GERMAN                 |FCO. SEGURA 1605-7 Y AV. DEL EJERCITO|LOURBANC|2003-01-27 16:07:14|
1|2|70|53|D|FA|76.0|01/27/2003|CORDOVA ASTUDILLO LUIS, ING.|ED. EXECUTIVE CENTER, PISO 2|LOURBANC|2003-01-27 16:24:13|
1|2|70|54|E|FA|77.0|01/27/2003|RAMOS MOLINA ROBERTO, ARQ.              |MIGUEL ALCIVAR Y CALLE N, MZ. 31 SL. 2|LOURBANC|2003-01-27 17:26:30|
1|2|70|55|D|FA|78.0|01/28/2003|ZAMBRANO RIOS XAVIER|MIRADOR DEL N. MZ.42 S.1|LOURBANC|2003-01-28 10:42:12|
1|2|70|56|D|FA|79.0|01/28/2003|CARRILLO MANUEL|MIRAFLORES CALLE 7MA. # 306|LOURBANC|2003-01-28 13:16:46|
1|2|79|28|D|FA|80.0|01/28/2003|DIMETAL                                 |LORENZO DE GARAICOA Y PADRE SOLANO|LOURBANC|2003-01-28 13:50:36|
1|2|70|57|D|FA|81.0|01/28/2003|CARRERA ESTARELLAS FRANCISCO VICENTE|COLON 1418 ENTRE ANTEPARA Y MACHALA|LOURBANC|2003-01-28 15:57:31|
1|2|79|29|D|FA|82.0|01/28/2003|GUALOTUNA ALFREDO                       |PORTETE 1126 Y GUARANDA|LOURBANC|2003-01-28 16:36:08|
1|2|70|58|D|FA|83.0|01/28/2003|JORGE VILLAO|VERNAZA N. MZ. 10 V. 22|LOURBANC|2003-01-28 16:41:45|
1|2|70|59|D|FA|84.0|01/28/2003|FERRETERIA ECUATORIANA                  |COLON 1006 Y LA 8AVA.|LOURBANC|2003-01-28 17:12:23|
1|2|70|60|D|FA|85.0|01/29/2003|RIVAS C. VICTOR                         |CDLA. COLINAS DEL SOL, CALLE 4TA. 303|LOURBANC|2003-01-29 11:08:39|
1|2|70|61|D|FA|86.0|01/29/2003|RIBADENEIRA JORGE|PORTETE 612 YCORONEL|LOURBANC|2003-01-29 11:50:34|
1|2|70|62|D|FA|87.0|01/29/2003|AVILES CRISTINA MALDONADO DE|LA SAQIBA MZ. J V. 7|LOURBANC|2003-01-29 12:17:33|
1|2|79|30|D|FA|88.0|01/29/2003|COSTAPROMO S.A.                         |M. A. ALCIVAR, ED. ARQUETIPO III|LOURBANC|2003-01-29 12:57:59|
1|2|70|63|D|FA|89.0|01/29/2003|COMERCIAL EDI-FER                       |RETIRA SR.FERNANDO PITA|LOURBANC|2003-01-29 14:12:30|
1|2|79|31|D|FA|90.0|01/29/2003|SR. CESAR SERNA|TRANSPORTE LOS ANDES|LOURBANC|2003-01-29 15:30:14|
1|2|70|64|D|FA|91.0|01/29/2003|CHAVARRIA CARLOS|LUQUE 323 Y CHIMBORAZO|LOURBANC|2003-01-29 17:24:55|
1|2|79|32|D|FA|92.0|01/30/2003|FERREIND                                |JOSE MASCOTE 206 Y MANUEL GALECIO|LOURBANC|2003-01-30 10:01:25|
1|2|70|65|D|FA|93.0|01/30/2003|IMFERSA S.A.                            |RETIRAN|LOURBANC|2003-01-30 10:43:20|
1|2|70|66|D|FA|94.0|01/30/2003|LINDEROS|ALMACEN CENTRO|LOURBANC|2003-01-30 13:12:24|
1|2|79|33|D|FA|94.0|01/30/2003|LINDEROS|ALMACEN CENTRO|LOURBANC|2003-01-30 13:12:24|
1|2|70|67|D|FA|95.0|01/30/2003|CEPSA|RETIRAN|LOURBANC|2003-01-30 13:26:40|
1|2|79|34|D|FA|96.0|01/30/2003|ING. LUCIA ORTEGA|RETIRA SR. DAVID ORTEGA|LOURBANC|2003-01-30 14:46:15|
1|2|79|35|D|FA|97.0|01/30/2003|O.COMP#26|TRANSPORTE SEMERIA.CUENCA|LOURBANC|2003-01-30 15:55:57|
1|2|70|68|D|FA|98.0|01/30/2003|COCINA 4TO. PISO-UNICENTRO|ALMACEN CENTRO|LOURBANC|2003-01-30 17:15:06|
1|2|79|36|D|FA|99.0|01/30/2003|SANDOVAL MARTHA                         |ALAMCEN CENTRO|LOURBANC|2003-01-30 18:16:22|
1|2|70|69|D|FA|100.0|01/31/2003|RIBADENEIRA ORLANDO|RETIRA|LOURBANC|2003-01-31 15:31:24|
1|2|70|70|D|FA|101.0|01/31/2003|V.6|RETIRA|LOURBANC|2003-01-31 17:52:07|
1|2|70|71|D|FA|102.0|02/03/2003|YAGUAL MEDARDO|RETIRA|LOURBANC|2003-02-03 09:25:27|
1|2|79|37|D|FA|103.0|02/03/2003|O.COMP#26|TRANSPORTE SEMERIA|LOURBANC|2003-02-03 10:09:47|
1|2|70|72|D|FA|104.0|02/03/2003|TEJADA ONOFRE JOSE|RETIRA|LOURBANC|2003-02-03 10:22:22|
1|2|70|73|D|FA|105.0|02/03/2003|VELARDE VICTOR|RETIRA|LOURBANC|2003-02-03 10:44:34|
1|2|70|74|D|FA|106.0|02/03/2003|.|RETIRA|LOURBANC|2003-02-03 10:48:00|
1|2|70|75|D|FA|107.0|02/03/2003|VASQUEZ BALDA FRANCISCO|RETIRA|LOURBANC|2003-02-03 13:11:27|
1|2|70|76|D|FA|108.0|02/03/2003|CASA TORRES ROSELLO|RETIRA|LOURBANC|2003-02-03 13:13:47|
1|2|79|38|D|FA|109.0|02/03/2003|J.GABRIEL MASSUH D.|RETIRA SR. JORGE LLAGUNO|LOURBANC|2003-02-03 15:34:41|
1|2|79|39|D|FA|110.0|02/03/2003|O.COMP# 0640|CERRO DEL CARMEN CANAL 2 TV|LOURBANC|2003-02-03 16:30:46|
1|2|70|77|D|FA|111.0|02/03/2003|NOBOA JORGE|ENTREGADO ALM CENTRO|LOURBANC|2003-02-03 16:37:12|
1|2|70|78|D|FA|112.0|02/04/2003|ING. CHALEN|ALMACEN CENTRO|LOURBANC|2003-02-04 09:28:46|
1|2|70|79|D|FA|113.0|02/04/2003|PILAY CHOEZ HOLGER|RETIRA|LOURBANC|2003-02-04 09:55:56|
1|2|79|40|D|FA|114.0|02/04/2003|ULLAURI ANGEL|DESP.ALMACEN CENTRO|LOURBANC|2003-02-04 10:50:47|
1|2|70|80|D|FA|115.0|02/04/2003|FLORES DEL PEZO ROSENDO|RETIRA ALM CENTRO|LOURBANC|2003-02-04 14:25:33|
1|2|79|41|D|FA|116.0|02/04/2003|CARLOS CHILUISA 326020 EXT.21|RETIRA  -  O.C.#|LOURBANC|2003-02-04 16:23:45|
1|2|70|81|D|FA|117.0|02/04/2003|ROMERO MARISOL|RETIRA SR.MANUEL ANCHUNDIA|LOURBANC|2003-02-04 17:00:44|
1|2|70|82|D|FA|118.0|02/05/2003|HUGO VILLAVICENCIO|ENTRE RIOS AV.2DA. MZ U-1 V-27|LOURBANC|2003-02-05 11:52:49|
1|2|79|42|D|FA|118.0|02/05/2003|HUGO VILLAVICENCIO|ENTRE RIOS AV.2DA. MZ U-1 V-27|LOURBANC|2003-02-05 11:52:49|
1|2|70|83|D|FA|119.0|02/05/2003|ORELLANA MOSCOSO MARLENE|ENTRE RIOS AV. 2DA.MZ. U-1 V.27|LOURBANC|2003-02-05 11:53:59|
1|2|70|84|D|FA|120.0|02/05/2003|ORELLANA MOSCOSO MARIA INES             |CDLA. ALBORADA,DCMA. ETAPA MZ. 204 V.42|LOURBANC|2003-02-05 12:03:03|
1|2|70|85|D|FA|121.0|02/05/2003|DEPROFIC CIA. LTDA.                     |GENERAL GOMEZ 709 Y LORENZO DE GARAICOA|LOURBANC|2003-02-05 13:46:33|
1|2|79|43|D|FA|121.0|02/05/2003|DEPROFIC CIA. LTDA.                     |GENERAL GOMEZ 709 Y LORENZO DE GARAICOA|LOURBANC|2003-02-05 13:46:33|
1|2|70|86|D|FA|122.0|02/05/2003|VERA HENRY|RETITA|LOURBANC|2003-02-05 14:12:04|
1|2|70|87|D|FA|123.0|02/05/2003|VERA HENRY|RETIRA|LOURBANC|2003-02-05 14:28:27|
1|2|70|88|D|FA|124.0|02/05/2003|VERA HENRY|RETIRA|LOURBANC|2003-02-05 15:59:22|
1|2|70|89|D|FA|125.0|02/05/2003|PERGOLA-OBRA KNEZEVIC|RETIRA MANUEL SANDOYA|LOURBANC|2003-02-05 16:40:45|
1|2|70|90|D|FA|126.0|02/05/2003|INMOBILIARIA CALIDAD, INMOCALI S.A.     |AVDA. MIGEL ALCIVAR, ED. ARQUETIPO III|LOURBANC|2003-02-05 16:41:22|
1|2|70|91|D|FA|127.0|02/06/2003|PATINO SANDINO|CIRCUNVALACION SUR 200 URDESA|LOURBANC|2003-02-06 09:04:56|
1|2|70|92|D|FA|128.0|02/06/2003|HAID MARANON RODOLFO R.                 |RETIRA|LOURBANC|2003-02-06 12:54:04|
1|2|79|44|D|FA|129.0|02/06/2003| MONSERRAT AYALA|LOS CEIBOS AV. 1ERA. # 421|LOURBANC|2003-02-06 13:32:17|
1|2|70|93|D|FA|130.0|02/06/2003|LUCANO C. JUAN CARLOS|RETIRA|LOURBANC|2003-02-06 13:47:15|
1|2|70|94|D|FA|131.0|02/06/2003|URGILES FANNY|BUCAY|LOURBANC|2003-02-06 14:25:46|
1|2|70|95|D|FA|132.0|02/06/2003|CHANG DORA|RETIRA|LOURBANC|2003-02-06 15:38:29|
1|2|70|96|D|FA|133.0|02/06/2003|CHALEN OLAYA GUSTAVO, ARQ.              |RETIRA|LOURBANC|2003-02-06 16:50:17|
1|2|70|97|D|FA|134.0|02/06/2003|ORELLANA MOSCOSO MARLENE|ALMACEN DEL CENTRO|LOURBANC|2003-02-06 16:51:42|
1|2|79|45|D|FA|134.0|02/06/2003|ORELLANA MOSCOSO MARLENE|ALMACEN DEL CENTRO|LOURBANC|2003-02-06 16:51:42|
1|2|79|46|D|FA|135.0|02/06/2003|BANO # 2 Y 3-KNEZEVIC (CAMBIO)|BOD. JUAN TANCA -RET. MANUEL S.|LOURBANC|2003-02-06 17:06:01|
1|2|70|98|D|FA|136.0|02/07/2003|MIRANDA MARIA DE                        |RETIRA|LOURBANC|2003-02-07 12:32:24|
1|2|70|99|D|FA|137.0|02/07/2003|FAJARDO MARIA BARRERA DE                |SAUCES 1 MZ. F14 V.31|LOURBANC|2003-02-07 13:22:57|
1|2|79|47|D|FA|138.0|02/07/2003|CARLOS CHALEN BANCHON|RETIRA DE B. JUAN T. MARENGO|LOURBANC|2003-02-07 14:00:42|
1|2|70|100|D|FA|139.0|02/07/2003|O.COMP#12684|RETIRA ALM CENTRO|LOURBANC|2003-02-07 14:50:29|
1|2|70|101|D|FA|140.0|02/07/2003|LEON GUSTAVO|RETIRA|LOURBANC|2003-02-07 15:12:25|
1|2|70|102|D|FA|141.0|02/07/2003|CARRION YCAZA ANDRES|RETIRA|LOURBANC|2003-02-07 15:20:24|
1|2|70|103|D|FA|142.0|02/07/2003|YAGUAL MEDARDO|RETIRA|LOURBANC|2003-02-07 16:23:13|
1|2|79|48|D|FA|143.0|02/07/2003|BANO DE OFICINA|AVDA. MIGEL ALCIVAR, ED. ARQUETIPO III|LOURBANC|2003-02-07 16:52:59|
1|2|79|49|D|FA|144.0|02/07/2003|BANO OFICINA|AVDA. MIGEL ALCIVAR, ED. ARQUETIPO III|LOURBANC|2003-02-07 16:54:00|
1|2|79|50|D|FA|145.0|02/10/2003|FISHER MARIANA DE                       |PARROQUIA JESUS MARIA|LOURBANC|2003-02-10 15:34:30|
1|2|70|104|D|FA|146.0|02/10/2003|SALVATIERRA MARTIN|RETIRA|LOURBANC|2003-02-10 16:41:25|
1|2|70|105|D|FA|147.0|02/10/2003|INMOBILIARIA CALIDAD, INMOCALI S.A.     |ALMACEN CENTRO|LOURBANC|2003-02-10 17:52:16|
1|2|79|51|D|FA|148.0|02/11/2003|JACINTO ENDARA|ENTREGAR EN BOD. JUAN T. MARENGO|LOURBANC|2003-02-11 09:40:25|
1|2|70|106|D|FA|149.0|02/11/2003|MENDEZ CARLOS|RETIRA|LOURBANC|2003-02-11 11:21:45|
1|2|70|107|D|FA|150.0|02/11/2003|O.COMP#21600|RETIRAN ALMC.CENTRO.|LOURBANC|2003-02-11 14:32:23|
1|2|70|108|D|FA|151.0|02/11/2003|ZAMBRANO MANUEL|LOMAS DE URDESA AVILES 209|LOURBANC|2003-02-11 14:56:30|
1|2|70|109|D|FA|152.0|02/11/2003|IND. INMOBILIARIA LIALTRIAL S.A.|RETIRA SR. JESUS CASTRO|LOURBANC|2003-02-11 15:46:29|
1|2|70|110|D|FA|153.0|02/11/2003|ARTICULO INCOMPL. Y DESCONTINUA|RETIRA|LOURBANC|2003-02-11 16:11:12|
1|2|70|111|D|FA|154.0|02/11/2003|ROMERO MARISOL|RETIRA|LOURBANC|2003-02-11 16:22:07|
1|2|70|112|D|FA|155.0|02/11/2003|SALAZAR GLADYS|ALMACEN CENTRO|LOURBANC|2003-02-11 18:36:36|
1|2|70|113|D|FA|156.0|02/12/2003|FLORES BERTHA|RETIRA|LOURBANC|2003-02-12 17:57:29|
1|2|79|52|D|FA|157.0|02/13/2003|O.C.#68780 RECIBE SR.MORENO|ROSENDO AVILES Y BOGOTA|LOURBANC|2003-02-13 09:32:39|
1|2|79|53|D|FA|158.0|02/13/2003|FERRETERIA SAN JAVIER                   |RETIRAN PERSONAL|LOURBANC|2003-02-13 10:35:26|
1|2|70|114|D|FA|159.0|02/13/2003|JUNTA DE BENEFICENCIA DE GUAYAQUIL      |VELEZ 109 Y PEDRO CARBO|LOURBANC|2003-02-13 15:19:29|
1|2|70|115|D|FA|160.0|02/13/2003|TERESA VARGAS MORALES|RETIRA|LOURBANC|2003-02-13 15:44:51|
1|2|70|116|D|FA|161.0|02/13/2003|JACINTO ENDARA|J.T. MARENGO CON STOCK BOD. 70|LOURBANC|2003-02-13 15:46:23|
1|2|79|54|E|FA|162.0|02/13/2003|O.COMPRA#31366|ACERO QUITO RETIRA RAUL CARDENAS|LOURBANC|2003-02-13 16:01:30|
1|2|79|55|D|FA|163.0|02/13/2003|O.COMPRA#903|RETIRAN PERSONAL|LOURBANC|2003-02-13 16:45:19|
1|2|79|56|D|FA|164.0|02/13/2003|O.COMPRA#31366|ACERO QUITO RETIRA SR RAUL CARDENAS|LOURBANC|2003-02-13 16:45:59|
1|2|79|57|D|FA|165.0|02/13/2003|ARQ. JOSE MENDOZA|B. J.T. MARENGO-ARQ. MENDOZA|LOURBANC|2003-02-13 17:28:31|
1|2|79|58|D|FA|166.0|02/13/2003|ARQ. JOSE MENDOZA|J.T. MARENGO-ARQ. JOSE MENDOZA|LOURBANC|2003-02-13 17:29:21|
1|2|79|59|D|FA|167.0|02/13/2003|O.COMPRA#31369|AV.JUANT.MARENGO KM 2.5|LOURBANC|2003-02-13 17:37:07|
1|2|70|117|D|FA|168.0|02/14/2003|MONJE JULIO|ALMACEN CENTRO|LOURBANC|2003-02-14 09:49:31|
1|2|70|118|D|FA|169.0|02/14/2003|SELLAN MONTERO GISSEL|ALMACEN CENTRO|LOURBANC|2003-02-14 09:58:09|
1|2|70|119|D|FA|170.0|02/14/2003|CARLOS TORRES|ALMACEN CENRO|LOURBANC|2003-02-14 10:24:59|
1|2|70|120|D|FA|171.0|02/14/2003|MELLER FABIOLA DE|.|LOURBANC|2003-02-14 10:50:01|
1|2|79|60|D|FA|172.0|02/14/2003|DIMETAL                                 |LORENZO DE GARAICOA Y PADRE SOLANO|LOURBANC|2003-02-14 12:28:22|
1|2|79|61|D|FA|173.0|02/14/2003|.|ALMACEN CENTRO|LOURBANC|2003-02-14 15:25:31|
1|2|70|121|E|FA|174.0|02/14/2003|SR. JOSE GUILLEN|ALMACEN CENTRO|LOURBANC|2003-02-14 16:28:30|
1|2|70|122|D|FA|175.0|02/14/2003|JOSE GUILLEN|ALMACEN CENTRO|LOURBANC|2003-02-14 16:33:08|
1|2|70|123|D|FA|176.0|02/14/2003|SR. ZEA ARTURO|M|LOURBANC|2003-02-14 17:08:14|
1|2|70|124|D|FA|177.0|02/17/2003|VERA VERA LUIS|ALMACEN CENTRO|LOURBANC|2003-02-17 10:18:32|
1|2|70|125|D|FA|178.0|02/17/2003|ANGULO EUCLIDES SR.|M|LOURBANC|2003-02-17 10:34:29|
1|2|70|126|D|FA|179.0|02/17/2003|VILLAGOMEZ GONZALO|M|LOURBANC|2003-02-17 10:42:01|
1|2|70|127|D|FA|180.0|02/17/2003|TERESA VARGAS MORALES|RETIRA|LOURBANC|2003-02-17 10:56:44|
1|2|70|128|D|FA|181.0|02/17/2003|ALESSMART-CODIART S.A.                  |AV. QUITO 806 Y AV. 9 DE OCTUBRE|LOURBANC|2003-02-17 11:31:15|
1|2|79|62|D|FA|181.0|02/17/2003|ALESSMART-CODIART S.A.                  |AV. QUITO 806 Y AV. 9 DE OCTUBRE|LOURBANC|2003-02-17 11:31:15|
1|2|70|129|D|FA|182.0|02/17/2003|SANCHEZ RODOLFO|M|LOURBANC|2003-02-17 12:34:45|
1|2|70|130|D|FA|183.0|02/17/2003|ZOILA GRANDA DE NUQUES|M|LOURBANC|2003-02-17 14:35:00|
1|2|70|131|D|FA|184.0|02/17/2003|GRANIZO JOSE|M|LOURBANC|2003-02-17 15:01:38|
1|2|70|132|D|FA|185.0|02/17/2003|SOSA PATRICIO|M|LOURBANC|2003-02-17 16:05:45|
1|2|70|133|D|FA|186.0|02/18/2003|RESTAURANTE ASIA|DR. GALO WONG|LOURBANC|2003-02-18 10:16:29|
1|2|79|63|D|FA|187.0|02/18/2003|PULLAS URIBE MILTON|J.T.MARENGO SR MILTON PULLAS|LOURBANC|2003-02-18 11:35:48|
1|2|79|64|D|FA|188.0|02/18/2003|O.COMPRA#21626|RETIRAN J.T.MARENGO|LOURBANC|2003-02-18 15:43:25|
1|2|70|134|D|FA|189.0|02/18/2003|BALLAS GUSTAVO|M|LOURBANC|2003-02-18 16:04:31|
1|2|70|135|D|FA|190.0|02/18/2003|APOLO LORENA DE|RETIRA|LOURBANC|2003-02-18 16:39:02|
1|2|79|65|D|FA|191.0|02/18/2003|BANO MASTER-ESCANDON|STA. MARIA CASA GRANDE|LOURBANC|2003-02-18 17:04:40|
1|2|79|66|D|FA|192.0|02/18/2003|BANO 1-ESCANDON|STA. MARIA CASA GRANDE|LOURBANC|2003-02-18 17:05:31|
1|2|79|67|D|FA|193.0|02/18/2003|BANO 2 -ESCANDON|STA. MARIA CASA GRANDE|LOURBANC|2003-02-18 17:06:47|
1|2|79|68|D|FA|194.0|02/18/2003|BANO HUESPEDES P.B. -ESCANDON|M. A. ALCIVAR, ED. ARQUETIPO III|LOURBANC|2003-02-18 17:07:41|
1|2|79|69|D|FA|195.0|02/18/2003|BANO VISITA- ESCANDON|STA. MARIA CASA GRANDE|LOURBANC|2003-02-18 17:08:32|
1|2|79|70|D|FA|196.0|02/18/2003|BANO SERVICIO-ESCANDON|STA. MARIA CASA GRANDE|LOURBANC|2003-02-18 17:09:34|
1|2|79|71|D|FA|197.0|02/18/2003|BANO SERVICIO - ESCANDON|STA. MARIA CASA GRANDE|LOURBANC|2003-02-18 17:12:06|
1|2|79|72|D|FA|198.0|02/18/2003|BANO PISCINA-ESCANDON|STA. MARIA CASA GRANDE-ESCANDON|LOURBANC|2003-02-18 17:13:22|
1|2|79|73|D|FA|199.0|02/18/2003|COCINA|STA. MARIA CASA GRANDE-ESCANDON|LOURBANC|2003-02-18 17:14:05|
1|2|79|74|D|FA|200.0|02/18/2003|GLORIETA-LAVAND.JARDIN|STA. MARIA CASA GRANDE-ESCANDON|LOURBANC|2003-02-18 17:14:43|
1|2|79|75|D|FA|201.0|02/18/2003|VALERO RODRIGUEZ ALBERTO                |ALMACEN CENTRO|LOURBANC|2003-02-18 17:17:47|
1|2|70|136|D|FA|202.0|02/18/2003|NOVAPALELES|RETIRAN|LOURBANC|2003-02-18 17:36:01|
1|2|70|137|D|FA|203.0|02/19/2003|BIENS MARIA DE|M|LOURBANC|2003-02-19 11:15:55|
1|2|70|138|D|FA|204.0|02/19/2003|MENDEZ CARLOS|M|LOURBANC|2003-02-19 12:01:22|
1|2|70|139|D|FA|205.0|02/19/2003|LUCAS PABLO|M|LOURBANC|2003-02-19 12:20:51|
1|2|70|140|D|FA|206.0|02/19/2003|RIVADENEIRA JORGE|M|LOURBANC|2003-02-19 13:13:50|
1|2|70|141|D|FA|207.0|02/19/2003|SR. ANGEL LEON|M|LOURBANC|2003-02-19 13:38:23|
1|2|70|142|D|FA|208.0|02/19/2003|ELLIS MARTIN|M|LOURBANC|2003-02-19 15:01:25|
1|2|70|143|D|FA|209.0|02/19/2003|DR. GALO WONG|RESTAURANTE ASIA|LOURBANC|2003-02-19 17:49:39|
1|2|70|144|D|FA|210.0|02/20/2003|DEFAZ MERCHAN NELSON ARQ.               |PRADERA 2 MZ. D9 V.31|LOURBANC|2003-02-20 09:01:36|
1|2|70|145|D|FA|211.0|02/20/2003|ARTEAGA JANETH|M|LOURBANC|2003-02-20 09:27:15|
1|2|79|76|D|FA|212.0|02/20/2003|O.C. # 11398.DOLORES CAMPANA|B. JUAN T. MARENGO-RET. MANUEL|LOURBANC|2003-02-20 09:51:57|
1|2|79|77|D|FA|213.0|02/20/2003|FERRETERIA ECUATORIANA                  |COLON 1006 Y LA 8AVA|LOURBANC|2003-02-20 09:52:33|
1|2|79|78|D|FA|214.0|02/20/2003|O.COMPRA#26080|ROBLES 301 Y CALLEJON CAMAL|LOURBANC|2003-02-20 13:19:45|
1|2|70|146|D|FA|215.0|02/20/2003|O.C.#0421|RETIRAN|LOURBANC|2003-02-20 13:20:39|
1|2|79|79|D|FA|216.0|02/20/2003|O.COMPRA#911|RETIRA SR ANGEL GONZALEZ|LOURBANC|2003-02-20 15:04:16|
1|2|70|147|D|FA|217.0|02/20/2003|SR. EDUARDO CHONQUI|.|LOURBANC|2003-02-20 15:52:09|
1|2|70|148|D|FA|218.0|02/20/2003|DIMETAL                                 |ALM.CENTRO 10 DE AGOSTO|LOURBANC|2003-02-20 17:33:47|
1|2|70|149|D|FA|219.0|02/20/2003|RICKY CENTRO                            |RETIRAN ALM. CENTRO|LOURBANC|2003-02-20 17:38:31|
1|2|70|150|D|FA|220.0|02/21/2003|PENAFIEL GRACIELA|M|LOURBANC|2003-02-21 12:50:36|
1|2|70|151|D|FA|221.0|02/21/2003|.|ALMACEN CENTRO|LOURBANC|2003-02-21 13:04:14|
1|2|79|80|D|FA|221.0|02/21/2003|.|ALMACEN CENTRO|LOURBANC|2003-02-21 13:04:14|
1|2|79|81|D|FA|222.0|02/21/2003|O.COMPRA #31421O|LA LLAVE QUITO|LOURBANC|2003-02-21 14:25:51|
1|2|79|82|D|FA|223.0|02/21/2003|0.COMPRA #31420|RETIRAN J.T.MARENGO|LOURBANC|2003-02-21 14:27:40|
1|2|79|83|D|FA|224.0|02/21/2003|0.COMPRA #31419|RETIRAN J.T.MARENGO|LOURBANC|2003-02-21 14:29:22|
1|2|70|152|D|FA|225.0|02/21/2003|PAZMINO BELLA|M|LOURBANC|2003-02-21 15:51:04|
1|2|70|153|D|FA|226.0|02/21/2003|YEPEZ BORJA ALEX GERMAN                 |RETIRAN ALM. CENTRO|LOURBANC|2003-02-21 16:01:07|
1|2|70|154|D|FA|227.0|02/21/2003|SUMINISTROS Y MATERIALES|VACAS GALINDO 334-338 YE.ALFARO|LOURBANC|2003-02-21 16:31:14|
1|2|70|155|D|FA|228.0|02/21/2003|N.CDTO.#     Y COB.#|RETIRA|LOURBANC|2003-02-21 17:17:45|
1|2|70|156|D|FA|229.0|02/24/2003|CABEZAS ANIBAL|.|LOURBANC|2003-02-24 12:36:08|
1|2|70|157|D|FA|230.0|02/24/2003|ARREAGA WALTER|M|LOURBANC|2003-02-24 13:45:46|
1|2|79|84|D|FA|231.0|02/24/2003|ARTICULO DESCONTINUADO|VILLAO CARMEN|LOURBANC|2003-02-24 15:37:32|
1|2|70|158|D|FA|232.0|02/24/2003|ARTICULO DESCONTINUADO|VILLAO CARMEN|LOURBANC|2003-02-24 15:38:23|
1|2|70|159|D|FA|233.0|02/24/2003|COFERMA                                 |RETIRA|LOURBANC|2003-02-24 16:36:51|
1|2|70|160|D|FA|234.0|02/24/2003|SOSA PATRICIO|M|LOURBANC|2003-02-24 17:12:09|
1|2|70|161|D|FA|235.0|02/25/2003|ING.JORGE CALVACHE|M|LOURBANC|2003-02-25 12:03:19|
1|2|70|162|D|FA|236.0|02/25/2003|SAMAN FATIMA|M|LOURBANC|2003-02-25 16:00:22|
1|2|70|163|D|FA|237.0|02/25/2003|ASPREN CHRISTIAM|M|LOURBANC|2003-02-25 16:06:51|
1|2|79|85|D|FA|238.0|02/25/2003|2 CUADRAS + ABAJO DE FCO.SEGURA|J.ILLINGWORTH 902 Y 6/MARZO|LOURBANC|2003-02-25 17:17:30|
1|2|70|164|D|FA|239.0|02/26/2003|COFERMA                                 |ELOY ALFARO 2224 Y G.GOYENA|LOURBANC|2003-02-26 10:06:58|
1|2|70|165|D|FA|240.0|02/26/2003|CALLE TORRES VICTOR DR.|RETIRA|LOURBANC|2003-02-26 10:17:47|
1|2|70|166|D|FA|241.0|02/26/2003|DIMETAL                                 |LORENZO DE GARAICOA Y PADRE SOLANO|LOURBANC|2003-02-26 11:33:51|
1|2|70|167|D|FA|242.0|02/26/2003|YAGUAL MEDARDO|RETIRA|LOURBANC|2003-02-26 11:41:09|
1|2|70|168|D|FA|243.0|02/26/2003|LEON JURADO GENARO ARQ.                 |MALDONADO Y LA 19|LOURBANC|2003-02-26 13:16:31|
1|2|70|169|D|FA|244.0|02/26/2003|CALLE FERNANDO SR|ALM CENTRO 10 DE AGOSTO|LOURBANC|2003-02-26 13:18:16|
1|2|70|170|D|FA|245.0|02/26/2003|BALLADARES CHIMBO MAURICIO|CDLA. LOS JARDINES, SANTA ROSA|LOURBANC|2003-02-26 13:47:06|
1|2|70|171|D|FA|246.0|02/26/2003|HANNA LORENA DE|ALM CENTRO|LOURBANC|2003-02-26 16:28:59|
1|2|70|172|D|FA|247.0|02/26/2003|O.C.#0433|RETIRAN|LOURBANC|2003-02-26 16:29:44|
1|2|70|173|D|FA|248.0|02/26/2003|SAMAN SALEM ANTONIO                     |RETIRA|LOURBANC|2003-02-26 16:30:53|
1|2|79|86|D|FA|249.0|02/27/2003|O.COMPRA#914|RETIRAN J.T.MARENGO|LOURBANC|2003-02-27 11:24:29|
1|2|70|174|D|FA|250.0|02/27/2003|VILLAFUERTE AMELIA DE|.|LOURBANC|2003-02-27 13:17:47|
1|2|70|175|D|FA|251.0|02/27/2003|LEON JURADO GENARO ARQ.                 |MALDONADO Y LA 19|LOURBANC|2003-02-27 14:40:03|
1|2|70|176|D|FA|252.0|02/27/2003|CHIFA PALACIO DORADO|M|LOURBANC|2003-02-27 14:42:52|
1|2|70|177|D|FA|253.0|02/27/2003|LEON JURADO GENARO ARQ.                 |MALDONADO Y LA 19|LOURBANC|2003-02-27 14:46:43|
1|2|70|178|D|FA|254.0|02/27/2003|NARANJO MANUEL|M|LOURBANC|2003-02-27 14:57:50|
1|2|79|87|D|FA|255.0|02/27/2003|LEON JURADO GENARO ARQ.                 |MALDONADO Y LA 19|LOURBANC|2003-02-27 15:01:42|
1|2|70|179|D|FA|256.0|02/27/2003|PLASTICOS INDUSTRIALES C.A.             |KM. 7.5 VIA A DAULE|LOURBANC|2003-02-27 16:29:30|
1|2|70|180|D|FA|257.0|02/28/2003|HOTECEL BELLSAOTH|M|LOURBANC|2003-02-28 09:14:37|
1|2|70|181|D|FA|258.0|02/28/2003|ARROYO LAMILLA CARLOS                   |AGUIRRE 411 Y CHIMBORAZO|LOURBANC|2003-02-28 10:27:21|
1|2|79|88|D|FA|259.0|02/28/2003|MAFNASA S.A.                            |LORENZO DE GARAICOA 2130 Y HUANCAVILCA|LOURBANC|2003-02-28 10:55:19|
1|2|70|182|D|FA|260.0|02/28/2003|SRA. FANNY DE ALBAN|M|LOURBANC|2003-02-28 11:33:07|
1|2|70|183|D|FA|261.0|02/28/2003|FABRE MIGUEL|M|LOURBANC|2003-02-28 12:51:54|
1|2|70|184|D|FA|262.0|02/28/2003|GALASAN CIA. LTDA.|RETIRAN|LOURBANC|2003-02-28 15:59:44|
1|2|70|185|D|FA|263.0|02/28/2003|CAMPI VALERO NESTOR ING.                |RETIRA SR.FRANCISCO CAMPI|LOURBANC|2003-02-28 16:14:30|
1|2|70|186|D|FA|264.0|02/28/2003|FERRETERIA SAN JAVIER                   |RUMICHACA 1238 Y C. BALLEN|LOURBANC|2003-02-28 16:17:05|
1|2|70|187|D|FA|265.0|02/28/2003|VILLAO CARMEN|RETIRA|LOURBANC|2003-02-28 16:35:09|
1|2|70|188|D|FA|266.0|02/28/2003|AGUIRRE WALTER SR.|M|LOURBANC|2003-02-28 17:04:42|
1|2|70|189|D|FA|267.0|03/05/2003|PINCAY VICTOR|RETIRA|LOURBANC|2003-03-05 15:02:40|
1|2|79|89|D|FA|268.0|03/05/2003|FERREIND                                |JOSE MASCOTE 206 Y MANUEL GALECIO|LOURBANC|2003-03-05 15:49:51|
1|2|79|90|D|FA|269.0|03/05/2003|OBRA JARDINERITOS-KM. 14.5 VIA A LA COST|PENDIENTE DIRECCION|LOURBANC|2003-03-05 17:42:57|
1|2|79|91|D|FA|270.0|03/06/2003|DIRECCION GENERAL DEL MATERIAL          |BASE NAVAL SUR VIA A PUERTO MARITIMO|LOURBANC|2003-03-06 09:47:11|
1|2|79|92|D|FA|271.0|03/06/2003|MEZA BAQUE MILTON                       |RUMICHACA 1820 Y BENALCAZAR|LOURBANC|2003-03-06 10:51:33|
1|2|79|93|D|FA|272.0|03/06/2003|DISMATEL                                |ORIENTE   Y 34 AVA|LOURBANC|2003-03-06 11:01:49|
1|2|79|94|D|FA|273.0|03/06/2003|IMFERSA S.A.                            |RETIRAN PERSONAL|LOURBANC|2003-03-06 14:10:16|
1|2|70|190|D|FA|274.0|03/06/2003|FERRETERIA CENTAURO                     |RETIRAN|LOURBANC|2003-03-06 14:25:01|
1|2|70|191|D|FA|275.0|03/06/2003|FARMAYALA|ALM. CENTRO|LOURBANC|2003-03-06 14:59:43|
1|2|79|95|D|FA|276.0|03/06/2003|O.COMPRA #3071|KM 11.5 VIA A DAULE|LOURBANC|2003-03-06 15:35:49|
1|2|70|192|D|FA|277.0|03/06/2003|SOC. AGRICOLA E IND. SAN CARLOS S.A.    |RETIRA SR. HECTOR MONTALVAN|LOURBANC|2003-03-06 16:05:02|
1|2|70|193|D|FA|278.0|03/06/2003|ALMACENES EL GLOBO|RETIRA|LOURBANC|2003-03-06 16:58:24|
1|2|79|96|D|FA|279.0|03/06/2003|QUINTANA MOREIRA GINA, ARQ.             |ENTREGAR EN MERCADO JOCKEY CLUB BOLIVIA |LOURBANC|2003-03-06 17:49:52|
1|2|70|194|D|FA|280.0|03/07/2003|POSLIGUA PEDRO|M|LOURBANC|2003-03-07 10:36:31|
1|2|70|195|D|FA|281.0|03/07/2003|IMFERSA S.A.                            |GARCIA GOYENA 365 Y ELOY ALFARO|LOURBANC|2003-03-07 11:55:14|
1|2|70|196|D|FA|282.0|03/07/2003|IMFERSA S.A.                            |GARCIA GOYENA 365 Y ELOY ALFARO|LOURBANC|2003-03-07 11:57:36|
1|2|70|197|D|FA|283.0|03/07/2003|SIMON ISAIAS XAVIER                     |10 DE AGOSTO 6036 Y CHIMBORAZO ESQ.|LOURBANC|2003-03-07 14:27:49|
1|2|70|198|D|FA|284.0|03/07/2003|GARRIDO ZAPA ANTONIO A.                 |ALMACEN CENTRO|LOURBANC|2003-03-07 15:09:40|
1|2|70|199|D|FA|285.0|03/07/2003|ARTICULO EN OFERTA - COB#220|RETIRA|LOURBANC|2003-03-07 15:58:08|
1|2|79|97|D|FA|286.0|03/10/2003|O.C. # 11437-KNEZEVIC-PALMAR DEL RIO|J.T. MARENGO RETIRA M. SANDOYA|LOURBANC|2003-03-10 11:49:23|
1|2|70|200|D|FA|287.0|03/10/2003|COFERMA                                 |RETIRAN|LOURBANC|2003-03-10 14:45:37|
1|2|70|201|D|FA|288.0|03/10/2003|MENENDEZ FELIX|RETIRA|LOURBANC|2003-03-10 14:51:39|
1|2|70|202|D|FA|289.0|03/10/2003|AGUIRRE GRACIELA DE|RETIRA|LOURBANC|2003-03-10 15:12:11|
1|2|70|203|D|FA|290.0|03/10/2003|FERNANDEZ BEATRIZ DE|M|LOURBANC|2003-03-10 15:13:07|
1|2|70|204|D|FA|291.0|03/10/2003|.|RETIRA|LOURBANC|2003-03-10 15:13:53|
1|2|70|205|D|FA|292.0|03/10/2003|BUCHELLI NELLY DE|RETIRA|LOURBANC|2003-03-10 16:31:35|
1|2|70|206|D|FA|293.0|03/11/2003|FERRETERIA SAN JAVIER                   |RETIRAN|LOURBANC|2003-03-11 09:09:40|
1|2|79|98|D|FA|294.0|03/11/2003|O.COMP#916|RETIRAN PERSONAL|LOURBANC|2003-03-11 09:30:39|
1|2|70|207|D|FA|295.0|03/11/2003|GUALOTUNA QUISHPE LUIS ALFREDO          |RETIRA PERSONAL|LOURBANC|2003-03-11 13:18:11|
1|2|70|208|D|FA|296.0|03/11/2003|O.C.   00783|BOYACA Y 9 DE OCTUBRE-ATE. ING. RUILOVA|LOURBANC|2003-03-11 17:59:41|
1|2|79|99|D|FA|296.0|03/11/2003|O.C.   00783|BOYACA Y 9 DE OCTUBRE-ATE. ING. RUILOVA|LOURBANC|2003-03-11 17:59:41|
1|2|70|209|D|FA|297.0|03/12/2003|PONG CHONG RUBEN|M|LOURBANC|2003-03-12 09:24:45|
1|2|70|210|D|FA|298.0|03/12/2003|MARTINEZ ROSA|.|LOURBANC|2003-03-12 10:31:15|
1|2|70|211|D|FA|299.0|03/12/2003|MARTINEZ ROSA|RETIRA|LOURBANC|2003-03-12 10:31:57|
1|2|70|212|D|FA|300.0|03/12/2003|GUALOTUNA QUISHPE LUIS ALFREDO          |COOP. ANTONIO J. DE SUCRE MZ. A SL. 2|LOURBANC|2003-03-12 10:47:42|
1|2|70|213|D|FA|301.0|03/12/2003|NAVARRETE MARGARITA DE|M|LOURBANC|2003-03-12 11:33:40|
1|2|70|214|D|FA|302.0|03/12/2003|CASTRO SERGIO ING.|RETIRA|LOURBANC|2003-03-12 11:47:28|
1|2|70|215|D|FA|303.0|03/12/2003|ZEA JOSE ING.|RETIRA|LOURBANC|2003-03-12 12:43:28|
1|2|70|216|D|FA|304.0|03/12/2003|COFERMA                                 |RETIRAN|LOURBANC|2003-03-12 12:58:41|
1|2|79|100|D|FA|305.0|03/12/2003|RICKY CENTRO                            |RETIRA BOD. JUAN TANCA MARENGO|LOURBANC|2003-03-12 13:54:05|
1|2|70|217|D|FA|306.0|03/12/2003|PROANO HERRERA ELENA                    |ALMACEN CENTRO|LOURBANC|2003-03-12 15:35:08|
1|2|70|218|D|FA|307.0|03/12/2003|FAJARDO MARIA BARRERA DE                |SAUCES 1 MZ. F14 V.31|LOURBANC|2003-03-12 15:35:41|
1|2|79|101|D|FA|307.0|03/12/2003|FAJARDO MARIA BARRERA DE                |SAUCES 1 MZ. F14 V.31|LOURBANC|2003-03-12 15:35:41|
1|2|79|102|D|FA|308.0|03/12/2003|ARTICULO DESCONTINUADO|RETIRA|LOURBANC|2003-03-12 16:53:51|
1|2|70|219|D|FA|309.0|03/12/2003|SR. ORLANDO VALAREZO|M|LOURBANC|2003-03-12 16:56:25|
1|2|79|103|D|FA|310.0|03/12/2003|O.COMP#363|RETIRAN PERSONAL|LOURBANC|2003-03-12 17:23:52|
1|2|70|220|D|FA|311.0|03/13/2003|ING. CHALEN|.|LOURBANC|2003-03-13 12:39:13|
1|2|70|221|D|FA|312.0|03/13/2003|GUALOTUNA QUISHPE LUIS ALFREDO          |COOP. ANTONIO J. DE SUCRE MZ. A SL. 2|LOURBANC|2003-03-13 14:28:19|
1|2|79|104|D|FA|313.0|03/14/2003|O.COMPRA#31536|AV. JUAN TANCA MARENGO KM. 2.5|LOURBANC|2003-03-14 11:54:07|
1|2|79|105|D|FA|314.0|03/14/2003|FERREIND                                |JOSE MASCOTE 206 Y MANUEL GALECIO|LOURBANC|2003-03-14 12:17:28|
1|2|70|222|D|FA|315.0|03/14/2003|FERRETERIA CENTAURO                     |AV. YUNEZ G. E CORTEZ 923|LOURBANC|2003-03-14 13:20:32|
1|2|70|223|D|FA|316.0|03/14/2003|ARTICULO COLOR DESCONTINUADO|RETIRA ALMACEN CENTRO|LOURBANC|2003-03-14 13:45:32|
1|2|70|224|D|FA|317.0|03/14/2003|YUNEZ MA. DEL PILAR DE|.|LOURBANC|2003-03-14 15:37:56|
1|2|70|225|D|FA|318.0|03/17/2003|LUIS ASTUDILLO|ALM. CENTRO|LOURBANC|2003-03-17 10:02:08|
1|2|70|226|D|FA|319.0|03/17/2003|TRONCOSO MERY|M|LOURBANC|2003-03-17 10:44:36|
1|2|70|227|D|FA|320.0|03/17/2003|TRONCOSO MERY|M|LOURBANC|2003-03-17 10:57:01|
1|2|70|228|E|FA|321.0|03/17/2003|CARRERA ESTARELLAS FRANCISCO VICENTE|RETIRAN|LOURBANC|2003-03-17 12:31:18|
1|2|70|229|D|FA|322.0|03/17/2003|CARRERA ESTARELLAS FRANCISCO VICENTE|RETIRAN|LOURBANC|2003-03-17 12:40:57|
1|2|70|230|D|FA|323.0|03/17/2003|NAPOLEON VINTIMILLA|M|LOURBANC|2003-03-17 13:46:12|
1|2|70|231|D|FA|324.0|03/17/2003|ALMEIDA FRANCO MAX|RETIRAN ALM CENTRO|LOURBANC|2003-03-17 14:25:07|
1|2|70|232|D|FA|325.0|03/17/2003|DIMETAL                                 |LORENZO DE GARAICOA Y PADRE SOLANO|LOURBANC|2003-03-17 14:31:40|
1|2|70|233|D|FA|326.0|03/17/2003|MIGUEL CINSUEGRA|M|LOURBANC|2003-03-17 17:30:16|
1|2|79|106|D|FA|327.0|03/17/2003|PEDIR A FABRICA|MACHALA Y C.DESTRUGE, COND.FORE|LOURBANC|2003-03-17 17:39:41|
1|2|70|234|D|FA|328.0|03/18/2003|CENTRO DE SALUD GUASMO SUR|ALMACEN CENTRO|LOURBANC|2003-03-18 12:22:34|
1|2|70|235|D|FA|329.0|03/18/2003|CARLOS MALO|STA. CRUZ -GALAPAGOS|LOURBANC|2003-03-18 13:08:19|
1|2|70|236|D|FA|330.0|03/18/2003|QUINTANA MOREIRA GINA, ARQ.             |SAUCES 8, MZ. 460 V. 24|LOURBANC|2003-03-18 13:52:44|
1|2|79|107|D|FA|330.0|03/18/2003|QUINTANA MOREIRA GINA, ARQ.             |SAUCES 8, MZ. 460 V. 24|LOURBANC|2003-03-18 13:52:44|
1|2|79|108|D|FA|331.0|03/18/2003|O.COMPRA#483|J.T.MARENGO|LOURBANC|2003-03-18 14:10:41|
1|2|70|237|D|FA|332.0|03/18/2003|COMERCIAL LA CONSTRUCCION               |ALMACEN CENTRO|LOURBANC|2003-03-18 15:31:45|
1|2|70|238|D|FA|333.0|03/19/2003|RODRIGUEZ MARCOS SR.|RETIRA ALM CENTRO|LOURBANC|2003-03-19 09:46:22|
1|2|70|239|D|FA|334.0|03/19/2003|JOSE TEJADA|ALM. CENTRO|LOURBANC|2003-03-19 10:37:12|
1|2|79|109|D|FA|335.0|03/19/2003|O.COMP#494|RETIRA J.T.MARENGO|LOURBANC|2003-03-19 11:47:43|
1|2|70|240|D|FA|336.0|03/19/2003|COMERCIAL   R.B.C|RETIRA ALMACEN CENTRO|LOURBANC|2003-03-19 14:18:21|
1|2|70|241|D|FA|337.0|03/20/2003|ULLAURI RIVERA ANGEL|RETIRA ALM CENTRO|LOURBANC|2003-03-20 11:57:03|
1|2|70|242|D|FA|338.0|03/20/2003|BARQUET LIGIA|RETIRA|LOURBANC|2003-03-20 13:10:02|
1|2|70|243|D|FA|339.0|03/20/2003|RIBADENEIRA ORLANDO|RETIRA ALM CENTRO|LOURBANC|2003-03-20 15:45:49|
1|2|70|244|D|FA|340.0|03/21/2003|SR. ITURRALDE|.|LOURBANC|2003-03-21 10:16:23|
1|2|79|110|D|FA|341.0|03/21/2003|O.C.  #  9475 Y 9476|ROBLES 505 Y FCO. SEGURA|LOURBANC|2003-03-21 12:13:41|
1|2|70|245|D|FA|342.0|03/21/2003|FERRETERIA COMERCIAL                    |RETIRAN|LOURBANC|2003-03-21 16:33:21|
1|2|79|111|D|FA|343.0|03/24/2003|FERRETERIA SAN JAVIER                   |RETIRAN|LOURBANC|2003-03-24 12:42:17|
1|2|79|112|D|FA|344.0|03/24/2003|FAX 560144|ENTREGAR P.ICAZA 302 Y CORDOVA|LOURBANC|2003-03-24 14:09:09|
1|2|79|113|D|FA|345.0|03/25/2003|O.COMP#69|DESPACHAR A CUENCA|LOURBANC|2003-03-25 10:33:26|
1|2|79|114|D|FA|346.0|03/25/2003|FONO : 09-9987260|ALMACEN CENTRO|LOURBANC|2003-03-25 11:19:22|
1|2|70|246|D|FA|347.0|03/25/2003|COLEGIO CRISTOBAL COLON                 |RETIRAN|LOURBANC|2003-03-25 11:43:36|
1|2|70|247|D|FA|348.0|03/25/2003|LORENZO CHICHANDE|RETIRA, PRODUCTO DE OFERTA|LOURBANC|2003-03-25 16:12:21|
1|2|79|115|D|FA|349.0|03/25/2003|O.C.# 11836-ZAVALA -LAGO SOL|LAGO SOL-ARQ. EDUARDO LUCIO|LOURBANC|2003-03-25 16:58:18|
1|2|79|116|D|FA|350.0|03/25/2003|O.C. # 11839-ZAVALA -LAGO SOL-B. VISITA|LAGO SOL-ARQ. EDUARDO LUCIO|LOURBANC|2003-03-25 16:59:04|
1|2|79|117|D|FA|351.0|03/25/2003|O.C. # 1183-LAGO SOL-ZAVALA-B. GALERIA|LAGO SOL-ARQ.EDUARDO LUCIO|LOURBANC|2003-03-25 16:59:43|
1|2|79|118|D|FA|352.0|03/25/2003|O.C. # 11838-LAGO SOL-ZAVALA-B.SERVICIO|LAGO SOL-ARQ. EDUARDO LUCIO|LOURBANC|2003-03-25 17:00:24|
1|2|79|119|D|FA|353.0|03/25/2003|O.C. # 11838-ZAVALA-LAGO SOL-B. SERVICIO|LAGO SOL-ARQ. EDUARDO LUCIO|LOURBANC|2003-03-25 17:07:18|
1|2|79|120|D|FA|354.0|03/25/2003|O.C. # 11892-CASA ING. TOMAS ALVAREZ|BOD J. T. MARENGO|LOURBANC|2003-03-25 17:08:15|
1|2|79|121|D|FA|355.0|03/25/2003|O.C. # 11840-ZAVALA-LAGO SOL-B- MASTER|LAGO SOL-ARQ. EDUARDO LUCIO|LOURBANC|2003-03-25 17:09:10|
1|2|79|122|D|FA|356.0|03/25/2003|O.C. # 11841-ZAVALA-LAGO SOL-COCINA|LAGO SOL-ARQ. EDUARDO LUCIO|LOURBANC|2003-03-25 17:09:47|
1|2|79|123|D|FA|357.0|03/25/2003|O.C. # 11842-ZAVALA-LAGO SOL-JARDIN-LAVA|LAGO SOL -ARQ. EDUARDO LUCIO|LOURBANC|2003-03-25 17:10:23|
1|2|70|248|D|FA|358.0|03/26/2003|PEDIDO POR SRTA. SUSANA AGUIRRE|UNICENTRO|LOURBANC|2003-03-26 11:15:52|
1|2|70|249|D|FA|359.0|03/26/2003|VISTA CLUB|RETIRAN|LOURBANC|2003-03-26 11:49:34|
1|2|70|250|D|FA|360.0|03/26/2003|MARGOTH PENA|ALMACEN CENTRO|LOURBANC|2003-03-26 12:37:26|
1|2|70|251|D|FA|361.0|03/26/2003|O.C. # 1010-1011|RETIRA|LOURBANC|2003-03-26 12:43:42|
1|2|70|252|D|FA|362.0|03/26/2003|VERA CARLOS|RETIRA|LOURBANC|2003-03-26 13:19:27|
1|2|70|253|D|FA|363.0|03/27/2003|VISTA CLUB|M|LOURBANC|2003-03-27 14:53:35|
1|2|79|124|D|FA|364.0|03/28/2003|OBRA ING. BITAR|KM. 9.5 VIA A DAULE|LOURBANC|2003-03-28 09:10:18|
1|2|70|254|D|FA|365.0|03/28/2003|MARGOTH PENA|M|LOURBANC|2003-03-28 12:12:49|
1|2|70|255|D|FA|366.0|03/28/2003|TOALA TIENE EL CROQUIS|CDLA. STA. CECILIA C.9NA.|LOURBANC|2003-03-28 14:50:22|
1|2|79|125|D|FA|367.0|03/28/2003|CAMPI VALERO NESTOR ING.                |MACHALA Y CAMILO DESTRUGE|LOURBANC|2003-03-28 14:51:19|
1|2|70|256|D|FA|368.0|03/28/2003|JULIO MONJE|M|LOURBANC|2003-03-28 15:50:31|
1|2|70|257|D|FA|369.0|03/28/2003|MOREIRA SANTOS|M|LOURBANC|2003-03-28 16:13:20|
1|2|70|258|D|FA|370.0|03/28/2003|ALEXANDRA DE SERRANO|M|LOURBANC|2003-03-28 16:50:11|
1|2|70|259|D|FA|371.0|03/28/2003|CHICHANDE LORENZO|M|LOURBANC|2003-03-28 17:00:16|
1|2|70|260|D|FA|372.0|03/31/2003|GONZA SARANGO URSULA|CDLA. UNCOVIA CALLE PALMERA S/N Y PUCAR|LOURBANC|2003-03-31 09:13:39|
1|2|79|126|D|FA|372.0|03/31/2003|GONZA SARANGO URSULA|CDLA. UNCOVIA CALLE PALMERA S/N Y PUCAR|LOURBANC|2003-03-31 09:13:39|
1|2|79|127|D|FA|373.0|03/31/2003|COFERMA                                 |RETIRAN ALMACEN CENTRO|LOURBANC|2003-03-31 11:20:04|
1|2|70|261|E|FA|374.0|03/31/2003|MA. DE LOURDES ESTRADA SALVADOR|LA PUNTILLA -VISTA AL RIO|LOURBANC|2003-03-31 12:19:15|
1|2|79|128|D|FA|375.0|03/31/2003|OBRA SR. NUNEZ-BANO MASTER|GUAYAQUIL TENIS-RESIDENTE MARIO LARA|LOURBANC|2003-03-31 12:51:09|
1|2|79|129|D|FA|376.0|03/31/2003|OBRA NUNEZ -BANO # 1|GUAYAQUIL TENIS-RESID. ARQ. MARIO LARA|LOURBANC|2003-03-31 12:53:39|
1|2|79|130|D|FA|377.0|03/31/2003|OBRA NUNEZ-BANO 2|GUAYAQUIL TENIS-RESID. ARQ.|LOURBANC|2003-03-31 12:55:14|
1|2|79|131|D|FA|378.0|03/31/2003|OBRA NUNEZ-BANO # 3|GUAYAQUIL TENIS|LOURBANC|2003-03-31 12:58:53|
1|2|79|132|D|FA|379.0|03/31/2003|OBRA NUNEZ-BANO VISITA|GUAYAQUIL TENIS-RESID. ARQ. MARIO LARA|LOURBANC|2003-03-31 13:00:01|
1|2|79|133|D|FA|380.0|03/31/2003|OBRA NUNEZ-BANO PISCINA|GUAYAQUIL TENIS-RESID. ARQ. MARIO LARA|LOURBANC|2003-03-31 13:01:59|
1|2|79|134|D|FA|381.0|03/31/2003|OBRA NUNEZ-BANO PISCINA|GUAYAQUIL TENIS- RESID. ARQ. MARIO LARA|LOURBANC|2003-03-31 13:02:52|
1|2|79|135|E|FA|382.0|03/31/2003|OBRA NUNEZ-COCINA|GUAYAQUIL TENIS|LOURBANC|2003-03-31 13:03:42|
1|2|79|136|D|FA|383.0|03/31/2003|OBRA NUNEZ-BAR|GUAYAQUIL TENIS|LOURBANC|2003-03-31 13:04:42|
1|2|79|137|D|FA|384.0|03/31/2003|OBRA NUNEZ-JARDIN-LAVANDERIA|GUAYAQUIL TENIS|LOURBANC|2003-03-31 13:06:12|
1|2|70|262|D|FA|385.0|03/31/2003|IBADANGO PONCE OSCAR E.|RETIRA|LOURBANC|2003-03-31 14:10:06|
1|2|70|263|D|FA|386.0|03/31/2003|YATE REYNA SILVIA|CONTADO|LOURBANC|2003-03-31 15:02:09|
1|2|70|264|D|FA|387.0|03/31/2003|MARIA DE GOMEZ|.|LOURBANC|2003-03-31 15:28:22|
1|2|70|265|D|FA|388.0|03/31/2003|CARLOS VILLACIS|.|LOURBANC|2003-03-31 15:36:35|
1|2|79|138|D|FA|389.0|03/31/2003|OBRA NUNEZ -COCINA|GUAYAQUIL TENIS-RESIDENTE ARQ. MARIO LAR|LOURBANC|2003-03-31 15:45:30|
1|2|70|266|D|FA|390.0|03/31/2003|CLEMENCIA MORENO|ALMACEN CENTRO|LOURBANC|2003-03-31 17:22:54|
1|2|79|139|D|FA|391.0|04/01/2003|FERROBRONCE                             |RUMICHACA 1725 Y FCO. CAMPOS|LOURBANC|2003-04-01 09:50:54|
1|2|70|267|D|FA|392.0|04/01/2003|GUALOTUNA QUISHPE LUIS ALFREDO          |COOP. ANTONIO J. DE SUCRE MZ. A SL. 2|LOURBANC|2003-04-01 10:10:45|
1|2|70|268|D|FA|393.0|04/01/2003|.|.|LOURBANC|2003-04-01 10:29:30|
1|2|70|269|D|FA|394.0|04/01/2003|BUSKARINA S.A.                          |RETIRA ALM CENTRO|LOURBANC|2003-04-01 13:20:09|
1|2|70|270|D|FA|395.0|04/01/2003|ANGULO EUCLIDES|M|LOURBANC|2003-04-01 16:21:23|
1|2|70|271|D|FA|396.0|04/01/2003|VILLACIS BEJARANO CARLOS|.|LOURBANC|2003-04-01 16:36:46|
1|2|70|272|D|FA|397.0|04/01/2003|VIVAR MERCEDES DE|M|LOURBANC|2003-04-01 16:37:20|
1|2|70|273|D|FA|398.0|04/01/2003|O.COMP#21767|ELOY ALFARO 916-920 Y BRASIL|LOURBANC|2003-04-01 17:01:43|
1|2|79|140|D|FA|399.0|04/01/2003|O.C. # 71856-PED. POR ING. CANSING|EN QUITO A SR. GREGORIO ANDRADE|LOURBANC|2003-04-01 17:07:17|
1|2|79|141|D|FA|400.0|04/01/2003|PEDIDO POR SRTA. SUSANA|ENTREGAR EN KM- 9.5 VIA DAULE|LOURBANC|2003-04-01 17:53:36|
1|2|70|274|D|FA|401.0|04/02/2003|MARIA DOLORES ESTRADA SALVADOR|ALMACEN CENTRO|LOURBANC|2003-04-02 11:57:09|
1|2|70|275|D|FA|402.0|04/02/2003|O.COMP#0000074|RETIRA ALM CENTRO|LOURBANC|2003-04-02 14:20:23|
1|2|70|276|D|FA|403.0|04/02/2003|RECALDE RICARDO|.|LOURBANC|2003-04-02 15:43:27|
1|2|70|277|D|FA|404.0|04/02/2003|HERRERA IRMA|M|LOURBANC|2003-04-02 16:24:41|
1|2|70|278|D|FA|405.0|04/02/2003|EDUARDO MACIAS|M|LOURBANC|2003-04-02 16:56:02|
1|2|79|142|D|FA|406.0|04/03/2003|O.C.#00526|RETIRAN|LOURBANC|2003-04-03 13:04:34|
1|2|79|143|D|FA|407.0|04/03/2003|FERREIND                                |JOSE MASCOTE 206 Y MANUEL GALECIO|LOURBANC|2003-04-03 13:06:43|
1|2|70|279|D|FA|408.0|04/03/2003|CEDENO WALTER|M|LOURBANC|2003-04-03 13:49:24|
1|2|70|280|D|FA|409.0|04/03/2003|BRUZZONE RENZO|RETIRA|LOURBANC|2003-04-03 16:09:06|
1|2|70|281|D|FA|410.0|04/03/2003|CASTRO BURGOS CLAUDINA|RETIRA|LOURBANC|2003-04-03 16:16:05|
1|2|70|282|D|FA|411.0|04/03/2003|ERWIN PETTERS|M|LOURBANC|2003-04-03 17:03:51|
1|2|70|283|D|FA|412.0|04/04/2003|JERONIMO SUAREZ|ALMACEN CENTRO|LOURBANC|2003-04-04 09:52:36|
1|2|70|284|D|FA|413.0|04/04/2003|O.C.#|RETIRAN|LOURBANC|2003-04-04 10:10:24|
1|2|79|144|D|FA|413.0|04/04/2003|O.C.#|RETIRAN|LOURBANC|2003-04-04 10:10:24|
1|2|70|285|D|FA|414.0|04/04/2003|O.C.#|RETIRA  SR. RODRIGO GOMEZ|LOURBANC|2003-04-04 11:30:36|
1|2|79|145|D|FA|415.0|04/04/2003|O.COMP#82|TRANSPORTE SEMERIA CARGA CUENCA|LOURBANC|2003-04-04 12:05:54|
1|2|70|286|D|FA|416.0|04/04/2003|ALTAMIRANO CISNEROS RAMIRO|CUENCA Y GUERRERO MARTINEZ|LOURBANC|2003-04-04 15:16:39|
1|2|70|287|D|FA|417.0|04/07/2003|SR. MIGUEL MORA|ALMACEN CENTRO|LOURBANC|2003-04-07 09:20:34|
1|2|70|288|D|FA|418.0|04/07/2003|BRUZZONE FIORITO RENZO ARQ.|RETIRA|LOURBANC|2003-04-07 11:37:25|
1|2|70|289|D|FA|419.0|04/07/2003|GUALOTUNA ALFREDO                       |RETIRAN|LOURBANC|2003-04-07 15:41:38|
1|2|79|146|D|FA|420.0|04/07/2003|O.C. # 12138-OBRA NUNEZ-BANO # 1|RETIRA BOD. J.T. MARENGO|LOURBANC|2003-04-07 15:50:59|
1|2|79|147|D|FA|421.0|04/07/2003|IMFERSA S.A.                            |RETIRAN|LOURBANC|2003-04-07 16:21:35|
1|2|70|290|D|FA|422.0|04/08/2003|GUELFI S.A.|KM. 25 VIA PERIMETRAL|LOURBANC|2003-04-08 11:30:59|
1|2|79|148|D|FA|422.0|04/08/2003|GUELFI S.A.|KM. 25 VIA PERIMETRAL|LOURBANC|2003-04-08 11:30:59|
1|2|70|291|D|FA|423.0|04/08/2003|GUELFI S.A.|RETIRAN|LOURBANC|2003-04-08 11:31:37|
1|2|70|292|D|FA|424.0|04/08/2003|GUELFI S.A.|RETIRA|LOURBANC|2003-04-08 11:32:30|
1|2|79|149|D|FA|425.0|04/08/2003|GUELFI S.A.|RETIRA|LOURBANC|2003-04-08 11:32:53|
1|2|70|293|D|FA|426.0|04/08/2003|GUELFI S.A.|KM. 25 VIA PERIMETRAL|LOURBANC|2003-04-08 11:45:08|
1|2|79|150|D|FA|427.0|04/08/2003|O.C. # 12165-OBRA ACHI|RETIRA|LOURBANC|2003-04-08 14:35:25|
1|2|79|151|D|FA|428.0|04/08/2003|OBRA LANDIVAR-BANO MASTER|ENTRE LAGOS-RESIDENTE RUBEN GUTIERREZ|LOURBANC|2003-04-08 15:35:35|
1|2|79|152|D|FA|429.0|04/08/2003|OBRA LANDIVAR-BANO COMPARTIDO|ENTRE LAGOS-RESID. ARQ. RUBEN GUTIERREZ|LOURBANC|2003-04-08 15:36:05|
1|2|79|153|D|FA|430.0|04/08/2003|OBRA LANDIVAR-BANO VISITA|ENTRE LAGOS-RESIDENTE ARQ. RUBEN GUTIERR|LOURBANC|2003-04-08 15:36:32|
1|2|79|154|D|FA|431.0|04/08/2003|OBRA LANDIVAR-BANO SERVICIO|ENTRE LAGOS-RESIDENTE ARQ. RUBEN GUTIERR|LOURBANC|2003-04-08 15:37:27|
1|2|79|155|D|FA|432.0|04/08/2003|OBRA LANDIVAR-BANO SERVICIO Y VARIOS|ENTRE LAGOS - RESID. ARQ. MARIO GUTIERRE|LOURBANC|2003-04-08 15:39:25|
1|2|79|156|D|FA|433.0|04/08/2003|OBRA LANDIVAR-COCINA|ENTRE LAGOS-RESID. ARQ. RUBEN GUTIERREZ|LOURBANC|2003-04-08 15:39:52|
1|2|79|157|D|FA|434.0|04/08/2003|OBRA LANDIVAR-BANO NINO|ENTRE LAGOS RESID. ARQ. RUBEN GUTIERREZ|LOURBANC|2003-04-08 15:40:19|
1|2|70|294|D|FA|435.0|04/08/2003|BERTHA SAMANIEGO|ALM. CENTRO|LOURBANC|2003-04-08 16:27:04|
1|2|70|295|D|FA|436.0|04/08/2003|OBRA LANDIVAR -BANO COMPARTIDO|ENTRE LAGOS-RESID. ARQ. RUBEN GUTIERREZ|LOURBANC|2003-04-08 16:29:05|
1|2|79|158|D|FA|437.0|04/08/2003|O.C. 12174.OBRA DACCACH|RETIRA J.T. MARENGO|LOURBANC|2003-04-08 17:22:35|
1|2|70|296|D|FA|438.0|04/09/2003|COFERMA                                 |RETIRAN|LOURBANC|2003-04-09 10:37:25|
1|2|70|297|D|FA|439.0|04/09/2003|IMFERSA S.A.                            |RETIRA ALMACEN|LOURBANC|2003-04-09 12:31:54|
1|2|70|298|D|FA|440.0|04/09/2003|BALON KLEBER|RETIRA ALM CENTRO|LOURBANC|2003-04-09 14:51:05|
1|2|70|299|D|FA|441.0|04/09/2003|BALON KLEBER|M|LOURBANC|2003-04-09 14:52:12|
1|2|70|300|D|FA|442.0|04/09/2003|GUALOTUNA QUISHPE LUIS ALFREDO          |COOP. ANTONIO J. DE SUCRE MZ. A SL. 2|LOURBANC|2003-04-09 15:46:27|
1|2|79|159|D|FA|443.0|04/09/2003|OBRAN NUNEZ-BANO # 3|RETIRA BOD. J. T. MARENGO|LOURBANC|2003-04-09 16:28:55|
1|2|70|301|D|FA|444.0|04/10/2003|FERRETERIA COMERCIAL                    |RETIRAN|LOURBANC|2003-04-10 09:16:16|
1|2|79|160|D|FA|445.0|04/10/2003|GUIM LOQUIO EMILIO ING.                 |DESPACHAR ALM.CENTRO 10 DE AGOS|LOURBANC|2003-04-10 11:58:20|
1|2|70|302|D|FA|446.0|04/10/2003|ACERO COMERCIAL ECUATORIANO S.A.        |AV. J. TANCA MARENGO KM. 1.7|LOURBANC|2003-04-10 12:02:19|
1|2|70|303|D|FA|447.0|04/10/2003|ARROYO LAMILLA CARLOS                   |AGUIRRE 411 Y CHIMBORAZO|LOURBANC|2003-04-10 12:52:45|
1|2|70|304|D|FA|448.0|04/10/2003|COLEGIO INTERNACIONAL SEK               |RETIRA|LOURBANC|2003-04-10 14:18:49|
1|2|70|305|D|FA|449.0|04/10/2003|ALEJANDRO PERE|.|LOURBANC|2003-04-10 16:50:17|
1|2|70|306|D|FA|450.0|04/10/2003|M.B.S. CIA. LTDA.                       |RETIRAN ALM CENTRO|LOURBANC|2003-04-10 17:15:12|
1|2|70|307|D|FA|451.0|04/10/2003|O.COMP#21804|RETIRAN PERSONAL|LOURBANC|2003-04-10 17:21:05|
1|2|79|161|D|FA|451.0|04/10/2003|O.COMP#21804|RETIRAN PERSONAL|LOURBANC|2003-04-10 17:21:05|
1|2|70|308|D|FA|452.0|04/10/2003|FERRETERIA PRODIN                       |RETIRAN ALM CENTRO|LOURBANC|2003-04-10 17:51:36|
1|2|70|309|D|FA|453.0|04/11/2003|EDUARDO JIMENEZ|RETIRA|LOURBANC|2003-04-11 11:47:35|
1|2|70|310|D|FA|454.0|04/11/2003|.|RETIRA|LOURBANC|2003-04-11 11:55:10|
1|2|79|162|D|FA|455.0|04/11/2003|O.COMPRA#546|RETIRAN PERSONAL J.TM.|LOURBANC|2003-04-11 13:32:44|
1|2|70|311|D|FA|456.0|04/11/2003|BALON KLEBER|RETIRA ALM CENTRO|LOURBANC|2003-04-11 13:53:50|
1|2|70|312|D|FA|457.0|04/11/2003|LILY KOK CHI YIP|RETIRA|LOURBANC|2003-04-11 14:34:34|
1|2|79|163|D|FA|458.0|04/11/2003|FERRETERIA SAN JAVIER                   |RETIRAN J.T.M.|LOURBANC|2003-04-11 14:41:36|
1|2|70|313|D|FA|459.0|04/11/2003|SERENTRESA|RETIRAN|LOURBANC|2003-04-11 15:50:40|
1|2|79|164|D|FA|460.0|04/11/2003|O.COMPRA#21808|RETIRAN J.T.M.|LOURBANC|2003-04-11 16:43:17|
1|2|70|314|D|FA|461.0|04/11/2003|VALDIVIESO FAUSTO|RETIRA|LOURBANC|2003-04-11 17:02:03|
1|2|70|315|D|FA|462.0|04/11/2003|VALDIVIESO FAUSTO|RETIRA|LOURBANC|2003-04-11 17:03:04|
1|2|70|316|D|FA|463.0|04/14/2003|CENTRO ALIMENTOS|RETIRAN|LOURBANC|2003-04-14 09:46:52|
1|2|79|165|D|FA|464.0|04/14/2003|FERRETERIA SAN JAVIER                   |MEDARDO ANGEL SILVA 2623 Y 22AV|LOURBANC|2003-04-14 11:17:53|
1|2|70|317|D|FA|465.0|04/14/2003|VELASCO VICTOR|RETIRA|LOURBANC|2003-04-14 13:47:44|
1|2|70|318|D|FA|466.0|04/14/2003|GONZALEZ SANDRA DE|.|LOURBANC|2003-04-14 15:19:56|
1|2|70|319|D|FA|467.0|04/14/2003|COFERMA                                 |RETIRAN|LOURBANC|2003-04-14 15:27:32|
1|2|70|320|D|FA|468.0|04/15/2003|VISTA CLUB|RETIRAN|LOURBANC|2003-04-15 10:33:37|
1|2|70|321|D|FA|469.0|04/15/2003|ABONA CON  N.CREDITO #16|RETIRA ALM.CENTRO|LOURBANC|2003-04-15 10:40:35|
1|2|70|322|D|FA|470.0|04/15/2003|ORTEGA ELENA DE|RETIRA|LOURBANC|2003-04-15 11:04:45|
1|2|70|323|D|FA|471.0|04/15/2003|YAGUAL MEDARDO|M|LOURBANC|2003-04-15 11:37:36|
1|2|79|166|D|FA|472.0|04/15/2003|OBRA ZAVALA-BANO MASTER|RETIRAN|LOURBANC|2003-04-15 12:17:42|
1|2|70|324|D|FA|473.0|04/15/2003|CENTRO DE CONVENCIONES SONWEI|RETIRA SR.MAURO ROSALES|LOURBANC|2003-04-15 15:24:52|
1|2|70|325|D|FA|474.0|04/15/2003|IDROVO MANUEL ING.|.|LOURBANC|2003-04-15 15:27:52|
1|2|70|326|D|FA|475.0|04/15/2003|BONILLA MERINO AZUCENA|CDLA. KENNEDY NORTE MZ. 402 V. 3|LOURBANC|2003-04-15 15:49:41|
1|2|79|167|D|FA|475.0|04/15/2003|BONILLA MERINO AZUCENA|CDLA. KENNEDY NORTE MZ. 402 V. 3|LOURBANC|2003-04-15 15:49:41|
1|2|70|327|D|FA|476.0|04/15/2003|QUINTANA MERCEDES|.|LOURBANC|2003-04-15 15:53:40|
1|2|79|168|D|FA|477.0|04/15/2003|DIMETAL                                 |LORENZO DE GARAICOA Y PADRE SOLANO|LOURBANC|2003-04-15 16:57:08|
1|2|70|328|D|FA|478.0|04/15/2003|MERO JOSE|RETIRA|LOURBANC|2003-04-15 17:55:11|
1|2|70|329|D|FA|479.0|04/16/2003|CHICHANDE LORENZO|RETIRA|LOURBANC|2003-04-16 12:26:31|
1|2|70|330|D|FA|480.0|04/16/2003|CARLOS AMAGUAY|.|LOURBANC|2003-04-16 12:33:31|
1|2|70|331|D|FA|481.0|04/16/2003|CARLOS AMAGUAY|ALM. CENTRO|LOURBANC|2003-04-16 13:12:57|
1|2|79|169|D|FA|482.0|04/16/2003|OBRA NUNEZ-BANO MASTER|RETIRAN J. T. MARENGO|LOURBANC|2003-04-16 13:54:08|
1|2|70|332|D|FA|483.0|04/16/2003|RETIRA|BENALCAZAR 208 Y RUMICHACA|LOURBANC|2003-04-16 14:11:46|
1|2|79|170|D|FA|483.0|04/16/2003|RETIRA|BENALCAZAR 208 Y RUMICHACA|LOURBANC|2003-04-16 14:11:46|
1|2|70|333|D|FA|484.0|04/16/2003|GARRIDO ZAPA ANTONIO A.                 |KM. 7,5 VIA A DAULE, COOP.GALLEGOS LARA|LOURBANC|2003-04-16 14:15:24|
1|2|79|171|D|FA|485.0|04/16/2003|DICENTRO OF.19 PLANTA ALTA ARTI|PUBLICIDAD,ARRIBA DE MARRIOT|LOURBANC|2003-04-16 16:05:59|
1|2|79|172|D|FA|486.0|04/16/2003|DIENTRO PLANTA ALTA OF.19 ARTIC OFERTA|PUBLICIDAD,ARRIBA DE MARRIOT|LOURBANC|2003-04-16 16:07:24|
1|2|79|173|D|FA|487.0|04/16/2003|O.C. # 12272 -OBRA ELIZABETH VARAS|RETIRAN J.T. MARENGO|LOURBANC|2003-04-16 16:52:06|
1|2|79|174|D|FA|488.0|04/16/2003|O.C. # 12272-OBRA ELIZABETH VARAS|ALM. J. T. MARENGO|LOURBANC|2003-04-16 16:52:34|
1|2|70|334|D|FA|489.0|04/16/2003|ERAZO GUILLERMO|RETIRA|LOURBANC|2003-04-16 17:32:14|
1|2|70|335|D|FA|490.0|04/17/2003|BANCO AMAZONAS|RETIRAN|LOURBANC|2003-04-17 09:38:35|
1|2|70|336|D|FA|491.0|04/17/2003|EDUARDO GUERRERO|M|LOURBANC|2003-04-17 10:06:12|
1|2|70|337|D|FA|492.0|04/17/2003|LOPEZ FLORES VIRGILIO|M|LOURBANC|2003-04-17 10:51:16|
1|2|79|175|D|FA|493.0|04/17/2003|OBRA VERONICA ZAMBRANO- O.C. # 12275|RETIRAN J. T. MARENGO|LOURBANC|2003-04-17 12:04:36|
1|2|70|338|D|FA|494.0|04/17/2003|GARZON LUCY DE|.|LOURBANC|2003-04-17 12:38:15|
1|2|70|339|D|FA|495.0|04/17/2003|BULGARIN NARANJO ANTONIO                |CDLA. LA CHALA, CALLEJON ALIANZA Y 13|LOURBANC|2003-04-17 12:38:55|
1|2|70|340|D|FA|496.0|04/17/2003|YAGUAL MEDARDO|RETIRA|LOURBANC|2003-04-17 13:08:44|
1|2|70|341|D|FA|497.0|04/17/2003|VADIVIESO FAUSTO|RETIRA|LOURBANC|2003-04-17 13:49:34|
1|2|70|342|D|FA|498.0|04/21/2003|PROCEL XAVIER|RETIRA|LOURBANC|2003-04-21 09:19:48|
1|2|70|343|D|FA|499.0|04/21/2003|GUALOTUNA QUISHPE LUIS ALFREDO          |RETIRA ALMACEN CENTRO|LOURBANC|2003-04-21 10:18:52|
1|2|70|344|D|FA|500.0|04/21/2003|O.C.#1053|RETIRAN|LOURBANC|2003-04-21 10:51:14|
1|2|79|176|D|FA|501.0|04/21/2003|BARRERA QUINDE JULIO|RETIRA J.T.M.|LOURBANC|2003-04-21 11:16:02|
1|2|70|345|D|FA|502.0|04/21/2003|IMPORTADORA CREDITOS QUEZADA CIA LTDA.  |RETIRAN|LOURBANC|2003-04-21 11:18:00|
1|2|70|346|D|FA|503.0|04/21/2003|FERREIND                                |RETIRAN J.T.M.|LOURBANC|2003-04-21 11:49:38|
1|2|79|177|D|FA|503.0|04/21/2003|FERREIND                                |RETIRAN J.T.M.|LOURBANC|2003-04-21 11:49:38|
1|2|70|347|D|FA|504.0|04/21/2003|O.C.#004165|RETIRAN|LOURBANC|2003-04-21 11:54:16|
1|2|70|348|D|FA|505.0|04/21/2003|LUEY LUIS|RETIRA|LOURBANC|2003-04-21 12:13:55|
1|2|70|349|D|FA|506.0|04/21/2003| .|ALMACEN CENTRO|LOURBANC|2003-04-21 12:33:56|
1|2|70|350|D|FA|507.0|04/21/2003|SR. DAVID MORA|M|LOURBANC|2003-04-21 13:53:25|
1|2|70|351|D|FA|508.0|04/21/2003|LOIZA WILSON|RETIRAN|LOURBANC|2003-04-21 15:52:24|
1|2|79|178|D|FA|509.0|04/21/2003|O.COMP#106|ALM CENTRO|LOURBANC|2003-04-21 16:46:08|
1|2|70|352|D|FA|510.0|04/21/2003|GARCIA ELENA AHMED DE, ING.             |RETIRA|LOURBANC|2003-04-21 16:46:49|
1|2|70|353|D|FA|511.0|04/22/2003|SOLICITADO POR MAESTRO GARRIDO|ENTREGAR EN ALMACEN CENTRO|LOURBANC|2003-04-22 09:17:32|
1|2|79|179|D|FA|511.0|04/22/2003|SOLICITADO POR MAESTRO GARRIDO|ENTREGAR EN ALMACEN CENTRO|LOURBANC|2003-04-22 09:17:32|
1|2|70|354|D|FA|512.0|04/22/2003|SR. MEDARDO YAGUAL|ALM. CENTRO|LOURBANC|2003-04-22 12:14:07|
1|2|79|180|D|FA|513.0|04/22/2003|VILLACRESES MARIA  MERCEDES|RETIRA BOD. J. TANCA MARENGO|LOURBANC|2003-04-22 12:59:14|
1|2|70|355|D|FA|514.0|04/22/2003|IMPORTADORA SANCHEZ|ALM.CENTRO|LOURBANC|2003-04-22 14:20:42|
1|2|70|356|D|FA|515.0|04/22/2003|O.COMPRA3#559|BOD.J.T.MARENGO|LOURBANC|2003-04-22 14:53:13|
1|2|79|181|D|FA|515.0|04/22/2003|O.COMPRA3#559|BOD.J.T.MARENGO|LOURBANC|2003-04-22 14:53:13|
1|2|70|357|D|FA|516.0|04/22/2003|BASURTO SALAZAR MANUEL|RETIRA|LOURBANC|2003-04-22 15:58:22|
1|2|79|182|D|FA|517.0|04/23/2003|O.COMP#101|TRANPORTE SEMERIA CARGA|LOURBANC|2003-04-23 11:31:29|
1|2|79|183|D|FA|518.0|04/23/2003|OBRA HIPATIA RAMON|ENTRE LAGOS|LOURBANC|2003-04-23 12:55:27|
1|2|79|184|D|FA|519.0|04/23/2003|OBRA HIPATIA RAMON|ENTRE LAGOS|LOURBANC|2003-04-23 12:55:56|
1|2|79|185|D|FA|520.0|04/23/2003|BANO SERVICIO-LAV-JARDIN-HIPATIA RAMON|ENTRE LAGOS|LOURBANC|2003-04-23 12:56:20|
1|2|79|186|D|FA|521.0|04/23/2003|ARQ. KARIN NURNBERG|ALMACEN CENTRO|LOURBANC|2003-04-23 13:03:08|
1|2|79|187|D|FA|522.0|04/23/2003|BANO DE SERVICIO -HIPATIA RAMON|ENTRE LAGOS|LOURBANC|2003-04-23 13:06:10|
1|2|70|358|D|FA|523.0|04/23/2003|MITE GABRIL|RETIRA ALM CENTRO|LOURBANC|2003-04-23 13:31:47|
1|2|79|188|D|FA|524.0|04/23/2003|O.COMP#576|BOD.J.T.MARENGO|LOURBANC|2003-04-23 14:23:21|
1|2|70|359|D|FA|525.0|04/23/2003|VALDIVIESO MALO FAUSTO|ORELLANA 213 Y PANAMA|LOURBANC|2003-04-23 16:19:47|
1|2|70|360|D|FA|526.0|04/23/2003|ARTICULO DESCON. E INCOMPLETO|RETIRA|LOURBANC|2003-04-23 16:58:30|
1|2|70|361|D|FA|527.0|04/23/2003|ARTICULO DESCOLORIDO|RETIRA|LOURBANC|2003-04-23 17:35:38|
1|2|79|189|D|FA|528.0|04/23/2003|SILVIA DE ADUM|M|LOURBANC|2003-04-23 17:48:04|
1|2|70|362|D|FA|529.0|04/24/2003|ASOCIACION SAN VICENTE DE PAUL|ALMACEN CENTRO|LOURBANC|2003-04-24 10:25:48|
1|2|70|363|D|FA|530.0|04/24/2003|ASOCIACION SAN VICENTE DE PAUL|ALMACEN CENTRO|LOURBANC|2003-04-24 10:26:22|
1|2|70|364|D|FA|531.0|04/24/2003|.|RETIRA|LOURBANC|2003-04-24 10:43:03|
1|2|70|365|D|FA|532.0|04/24/2003|PLOMELEC|ALMACEN CENTRO|LOURBANC|2003-04-24 11:19:05|
1|2|70|366|D|FA|533.0|04/24/2003|FERRETERIA CENTAURO                     |RETIRAN|LOURBANC|2003-04-24 15:01:42|
1|2|70|367|D|FA|534.0|04/24/2003|PIEDAD DE AVALOS|M|LOURBANC|2003-04-24 16:17:24|
1|2|70|368|D|FA|535.0|04/25/2003|.|RETIRA|LOURBANC|2003-04-25 09:19:38|
1|2|70|369|D|FA|536.0|04/25/2003|CIRINO CHAGUAY|RETIRA|LOURBANC|2003-04-25 12:48:29|
1|2|70|370|D|FA|537.0|04/25/2003|MUNOZ HOLGUIN MANUEL|RETIRA|LOURBANC|2003-04-25 12:51:32|
1|2|70|371|D|FA|538.0|04/25/2003|KARABU TURISMO                          |ALMACEN CENTRO|LOURBANC|2003-04-25 14:01:38|
1|2|70|372|D|FA|539.0|04/25/2003|COLEGIO INTERNACIONAL SEK               |RETIRAN|LOURBANC|2003-04-25 15:21:19|
1|2|70|373|D|FA|540.0|04/25/2003|VARGAS ALEJANDRO|RETIRA - FONO.244577|LOURBANC|2003-04-25 15:22:51|
1|2|70|374|D|FA|541.0|04/25/2003|FAJARDO MARIA BARRERA DE                |SAUCES 1 MZ. F14 V.31|LOURBANC|2003-04-25 15:27:51|
1|2|70|375|D|FA|542.0|04/25/2003|FAJARDO MARIA BARRERA DE                |SAUCES 1 MZ. F14 V.31|LOURBANC|2003-04-25 15:28:09|
1|2|70|376|D|FA|543.0|04/25/2003|GARRIDO ZAPA ANTONIO A.                 |ALMACEN CENTRO|LOURBANC|2003-04-25 15:28:30|
1|2|70|377|D|FA|544.0|04/25/2003|SAMAN SALEM ANTONIO                     |RETIRA|LOURBANC|2003-04-25 15:57:23|
1|2|70|378|D|FA|545.0|04/28/2003|FLORES PILAR|M|LOURBANC|2003-04-28 13:16:19|
1|2|79|190|D|FA|546.0|04/28/2003|FERRETERIA ECUATORIANA                  |COLON 1006Y LA 8AVA|LOURBANC|2003-04-28 14:03:31|
1|2|70|379|D|FA|547.0|04/28/2003|GARATE MARIA|RETIRA|LOURBANC|2003-04-28 15:05:52|
1|2|70|380|D|FA|548.0|04/29/2003|GONZALO VILLAGOMEZ|RETIRA|LOURBANC|2003-04-29 10:44:05|
1|2|70|381|D|FA|549.0|04/29/2003|GUALOTUNA QUISHPE LUIS ALFREDO          |COOP. ANTONIO J. DE SUCRE MZ. A SL. 2|LOURBANC|2003-04-29 11:52:27|
1|2|70|382|D|FA|550.0|04/29/2003|FAJARDO MARIA BARRERA DE                |ALMACEN CENTRO|LOURBANC|2003-04-29 15:10:45|
1|2|70|383|D|FA|551.0|04/29/2003|GUERRERO  CORNEJO GONZALO|CONTRALORIA GRAL. DEL ESTADO|LOURBANC|2003-04-29 17:36:18|
1|2|79|191|D|FA|552.0|04/29/2003|PEDIDO TELEFONICO|CDLS . LOD CEIBOS AV. 1ERA. 421A|LOURBANC|2003-04-29 17:43:39|
1|2|70|384|D|FA|553.0|04/30/2003|GUALOTUNA QUISHPE LUIS ALFREDO          |COOP. ANTONIO J. DE SUCRE MZ. A SL. 2|LOURBANC|2003-04-30 09:28:36|
1|2|79|192|D|FA|554.0|04/30/2003|O.COMP#00589|RETIRA J.T.MARENGO|LOURBANC|2003-04-30 10:55:44|
1|2|70|385|D|FA|555.0|04/30/2003|PATINO MARIA|RETIRA - FONO. 883461|LOURBANC|2003-04-30 11:23:54|
1|2|70|386|D|FA|556.0|04/30/2003|O. C. # 590|RETIRAN|LOURBANC|2003-04-30 11:40:06|
1|2|79|193|D|FA|556.0|04/30/2003|O. C. # 590|RETIRAN|LOURBANC|2003-04-30 11:40:06|
1|2|79|194|D|FA|557.0|04/30/2003|AYALA V. MONSERRATT                     |CDLA. LOS CEIBOS AV. 1ERA. 421A|LOURBANC|2003-04-30 12:43:20|
1|2|70|387|D|FA|558.0|04/30/2003|FERREIND                                |RETIRA ALM CENTRO|LOURBANC|2003-04-30 13:11:03|
1|2|70|388|D|FA|559.0|04/30/2003|LUCY DE GARZON|RETIRA|LOURBANC|2003-04-30 15:20:45|
1|2|70|389|D|FA|560.0|04/30/2003|BALLESTER ROMERO IRMA|RETIRA|LOURBANC|2003-04-30 17:38:32|
1|2|70|390|D|FA|561.0|04/30/2003|MARIA AVILA DE BAJAA|ALMACEN CENTRO|LOURBANC|2003-04-30 18:05:07|
1|2|70|391|D|FA|562.0|05/02/2003|BAQUE CALDERON TEOFILO|BATALLON DEL SUBURBIO CALLE N Y LA 44|LOURBANC|2003-05-02 10:18:31|
1|2|70|392|D|FA|563.0|05/02/2003|ARROYO LAMILLA CARLOS                   |AGUIRRE 411 Y CHIMBORAZO|LOURBANC|2003-05-02 11:01:19|
1|2|79|195|E|FA|564.0|05/02/2003|NOBLECILLA BORJA ERICK ANTONIO|ENTREGAR TRANSPORTE EL ORO|LOURBANC|2003-05-02 15:51:38|
1|2|70|393|D|FA|565.0|05/02/2003|SANTOS MOREIRA|M|LOURBANC|2003-05-02 16:48:44|
1|2|70|394|D|FA|566.0|05/05/2003|ING. ORTIZ|M|LOURBANC|2003-05-05 11:23:12|
1|2|70|395|D|FA|567.0|05/05/2003|UBILLA JULIO|RETIRA|LOURBANC|2003-05-05 11:30:42|
1|2|70|396|D|FA|568.0|05/05/2003|CLINICA GUAYAQUIL                       |PADRE AGUIRRE 401|LOURBANC|2003-05-05 14:07:14|
1|2|70|397|D|FA|569.0|05/05/2003|CLINICA GUAYAQUIL                       |RETIRA EN ALMACEN CENTRO|LOURBANC|2003-05-05 14:07:39|
1|2|70|398|D|FA|570.0|05/05/2003|CLINICA GUAYAQUIL                       |RETIRAR EN ALMACEN CENTRO|LOURBANC|2003-05-05 14:08:05|
1|2|70|399|D|FA|571.0|05/05/2003|ECOVENTURA S.A.                         |RETIRA SR. SEGUNDO SOLORZANO|LOURBANC|2003-05-05 15:38:35|
1|2|79|196|D|FA|572.0|05/05/2003|PEDIDO POR SRTA. SUSANA|RETIRA DEL ALM. CENTRO|LOURBANC|2003-05-05 15:54:44|
1|2|70|400|D|FA|573.0|05/05/2003|PATRICIA DE SALGADO|RETIRA|LOURBANC|2003-05-05 16:54:15|
1|2|79|197|D|FA|574.0|05/06/2003|VIEIRA NAVARRO LUIS|VER CROQUIS|LOURBANC|2003-05-06 09:44:55|
1|2|70|401|D|FA|575.0|05/06/2003|VALDAN CARLOS ING.|RETIRA|LOURBANC|2003-05-06 10:41:21|
1|2|70|402|D|FA|576.0|05/06/2003|MARTINEZ VICTORIA DE|RETIRA - FONO.433309|LOURBANC|2003-05-06 10:48:40|
1|2|70|403|D|FA|577.0|05/06/2003|SRA. RIPALDA|RETIRA|LOURBANC|2003-05-06 11:13:45|
1|2|79|198|D|FA|578.0|05/06/2003|INDUSTRIAL PESQUERA SANTA PRISCILA S.A. |RETIRAN J.T.M.|LOURBANC|2003-05-06 11:25:15|
1|2|79|199|D|FA|579.0|05/06/2003|OBRA PIANA-PORTICO DEL RIO|AVDA. MIGEL ALCIVAR, ED. ARQUETIPO III|LOURBANC|2003-05-06 11:28:04|
1|2|79|200|D|FA|580.0|05/06/2003|INMOBILIARIA CALIDAD, INMOCALI S.A.     |AVDA. MIGEL ALCIVAR, ED. ARQUETIPO III|LOURBANC|2003-05-06 11:28:28|
1|2|70|404|D|FA|581.0|05/06/2003|GUZMAN JHON|RETIRA|LOURBANC|2003-05-06 13:42:12|
1|2|70|405|D|FA|582.0|05/06/2003|MENDOZA JAVIER|RETIRA|LOURBANC|2003-05-06 14:32:22|
1|2|70|406|D|FA|583.0|05/06/2003|CARLOS TORRES CARREO|ALMACEN CENTRO|LOURBANC|2003-05-06 15:06:38|
1|2|70|407|D|FA|584.0|05/06/2003|RIBADENEIRA ORLANDO|M|LOURBANC|2003-05-06 15:44:22|
1|2|70|408|D|FA|585.0|05/06/2003|RODRIGUEZ MOSQUERA PATRICIA|RETIRA|LOURBANC|2003-05-06 16:10:30|
1|2|70|409|D|FA|586.0|05/06/2003|INTRIAGO MANZABA NANCY                  |RETIRA|LOURBANC|2003-05-06 16:18:12|
1|2|70|410|D|FA|587.0|05/06/2003|EDGAR MINO GUERRERO|M|LOURBANC|2003-05-06 16:18:48|
1|2|79|201|D|FA|588.0|05/06/2003|O.C. # 12607-OBRA  MARIA LUISA ALVAREZ|RETIRA|LOURBANC|2003-05-06 17:12:46|
1|2|79|202|D|FA|589.0|05/06/2003|OBRA ENDARA BANO MASTER Y VISITA|ENTRE LAGOS|LOURBANC|2003-05-06 17:19:52|
1|2|70|411|D|FA|590.0|05/06/2003|OBRA ENDARA-BANO DE NINA|ENTRE LAGOS|LOURBANC|2003-05-06 17:20:14|
1|2|79|203|D|FA|590.0|05/06/2003|OBRA ENDARA-BANO DE NINA|ENTRE LAGOS|LOURBANC|2003-05-06 17:20:14|
1|2|70|412|D|FA|591.0|05/06/2003|OBRA ENDARA-BANO NINO|ENTRE LAGOS|LOURBANC|2003-05-06 17:20:56|
1|2|79|204|D|FA|591.0|05/06/2003|OBRA ENDARA-BANO NINO|ENTRE LAGOS|LOURBANC|2003-05-06 17:20:56|
1|2|79|205|D|FA|592.0|05/06/2003|OBRA ENDARA-BANO SERVICIO|ENTRE LAGOS|LOURBANC|2003-05-06 17:21:25|
1|2|79|206|D|FA|593.0|05/06/2003|OBRA ENDARA-VARIOS|ENTRE LAGOS|LOURBANC|2003-05-06 17:21:59|
1|2|79|207|D|FA|594.0|05/06/2003|OBRA ENDARA-COCINA|ENTRE LAGOS|LOURBANC|2003-05-06 17:22:25|
1|2|70|413|D|FA|595.0|05/07/2003|GUARDERIA NUESTRA SRA DE LA PAZ|ALM CENTRO|LOURBANC|2003-05-07 09:07:15|
1|2|70|414|D|FA|596.0|05/07/2003|DIMETAL                                 |RETIRA ALM CENTRO|LOURBANC|2003-05-07 09:37:57|
1|2|70|415|D|FA|597.0|05/07/2003|DIMETAL                                 |RETIRAN ALM CENTRO|LOURBANC|2003-05-07 10:30:56|
1|2|70|416|D|FA|598.0|05/07/2003|GUALOTUNA QUISHPE LUIS ALFREDO          |ALM CENTRO|LOURBANC|2003-05-07 11:23:34|
1|2|79|208|E|FA|599.0|05/07/2003|CLINICA GUAYAQUIL                       |PADRE AGUIRRE 401|LOURBANC|2003-05-07 11:38:43|
1|2|79|209|D|FA|600.0|05/07/2003|CLINICA GUAYAQUIL                       |PADRE AGUIRRE 401|LOURBANC|2003-05-07 11:39:03|
1|2|79|210|D|FA|601.0|05/07/2003|CLINICA GUAYAQUIL                       |PADRE AGUIRRE 401|LOURBANC|2003-05-07 12:26:11|
1|2|70|417|D|FA|602.0|05/07/2003|BAQUERIZO JOHNNY|RETIRA|LOURBANC|2003-05-07 13:45:10|
1|2|70|418|D|FA|603.0|05/07/2003|CLINICA GUAYAQUIL                       |PADRE AGUIRRE 401|LOURBANC|2003-05-07 13:45:33|
1|2|70|419|D|FA|604.0|05/07/2003|HIDALGO & HIDALGO S.A.                  |RETIRA ALMACEN CENTRO|LOURBANC|2003-05-07 15:10:12|
1|2|70|420|D|FA|605.0|05/07/2003|PARA BANOS PLASTICOS INDUSTRIALES|RETIRAN|LOURBANC|2003-05-07 15:50:33|
1|2|79|211|D|FA|605.0|05/07/2003|PARA BANOS PLASTICOS INDUSTRIALES|RETIRAN|LOURBANC|2003-05-07 15:50:33|
1|2|70|421|D|FA|606.0|05/07/2003|QIZHPI HUMBERTO|RETIRA ALM CENTRO|LOURBANC|2003-05-07 16:01:48|
1|2|70|422|D|FA|607.0|05/07/2003|CONSUMIDOR FINAL|RETIRA ALM CENTRO|LOURBANC|2003-05-07 16:58:59|
1|2|79|212|D|FA|608.0|05/08/2003|FERRETERIA SAN JAVIER                   |RETIRAN J.T.M.|LOURBANC|2003-05-08 09:08:58|
1|2|70|423|D|FA|609.0|05/08/2003|VALDIVIESO MALO FAUSTO|ORELLANA 213 Y PANAMA|LOURBANC|2003-05-08 10:41:59|
1|2|70|424|D|FA|610.0|05/08/2003|PONCE FEDERICO|RETIRA|LOURBANC|2003-05-08 11:25:01|
1|2|70|425|D|FA|611.0|05/09/2003|SR. EDGAR ORTEGA|RETIRA|LOURBANC|2003-05-09 11:46:49|
1|2|79|213|D|FA|612.0|05/09/2003|OBRA ENDARA- BANO DE NIA-B. VISITA|ENTRE LAGOS|LOURBANC|2003-05-09 13:17:22|
1|2|70|426|D|FA|613.0|05/09/2003|GUALOTUNA QUISHPE LUIS ALFREDO          |COOP. ANTONIO J. DE SUCRE MZ. A SL. 2|LOURBANC|2003-05-09 17:20:34|
1|2|70|427|D|FA|614.0|05/12/2003|CLINICA GUAYAQUIL                       |ALMACEN CENTRO|LOURBANC|2003-05-12 09:41:58|
1|2|79|214|D|FA|615.0|05/12/2003|LEONE DI VANNA VICTOR|RETIRA PERSONAL J.T.M.|LOURBANC|2003-05-12 09:58:07|
1|2|70|428|D|FA|616.0|05/12/2003|CLINICA GUAYAQUIL                       |ALMACEN CENTRO|LOURBANC|2003-05-12 10:02:39|
1|2|79|215|D|FA|616.0|05/12/2003|CLINICA GUAYAQUIL                       |ALMACEN CENTRO|LOURBANC|2003-05-12 10:02:39|
1|2|70|429|D|FA|617.0|05/12/2003|LEON JURADO GENARO ARQ.                 |RETIRA|LOURBANC|2003-05-12 12:41:29|
1|2|70|430|D|FA|618.0|05/12/2003|CASA DR. HANSE|RETIRA FELIX ALVARADO|LOURBANC|2003-05-12 17:01:18|
1|2|70|431|D|FA|619.0|05/12/2003|ALAVA MARTHA|ALM CENTRO|LOURBANC|2003-05-12 17:05:38|
1|2|70|432|D|FA|620.0|05/13/2003|OBRA ANGEL VILLON|RETIRA|LOURBANC|2003-05-13 11:04:20|
1|2|70|433|D|FA|621.0|05/13/2003|OBRA IZQUIERDO -COCINA|GUAYAQUIL TENNIS-ARQ. BYRON JIMENEZ|LOURBANC|2003-05-13 12:49:02|
1|2|70|434|D|FA|622.0|05/13/2003|COFERMA                                 |ALMACEN CENTRO|LOURBANC|2003-05-13 14:14:00|
1|2|79|216|D|FA|623.0|05/13/2003|FERRETERIA COMERCIAL                    |RETIRAN AV.J.T.M.|LOURBANC|2003-05-13 14:41:50|
1|2|70|435|D|FA|624.0|05/13/2003|CLINICA ALCIVAR|ALM CENTRO|LOURBANC|2003-05-13 15:02:30|
1|2|70|436|D|FA|625.0|05/13/2003|MARIA MERCEDES ONOFRE|RETIRA|LOURBANC|2003-05-13 15:22:04|
1|2|79|217|D|FA|626.0|05/14/2003|OBRA IZQUIERDO-BANO MASTER|GUAYAQUIL TENNIS-ARQ. BYRON JIMENEZ|LOURBANC|2003-05-14 10:01:49|
1|2|79|218|D|FA|627.0|05/14/2003|OBRA IZQUIERDO-BANO # 1|GUAYAQQUIL TENNIS-ARQ. BYRON JIMENEZ|LOURBANC|2003-05-14 10:02:15|
1|2|79|219|D|FA|628.0|05/14/2003|OBRA IZQUIERDO-BANO # 2|GUAYAQUIL TENNIS-ARQ. BYRON JIMENEZ|LOURBANC|2003-05-14 10:02:46|
1|2|79|220|D|FA|629.0|05/14/2003|OBRA IZQUIERDO-BANO DE VISITA|GUAYAQUIL TENIS-ARQ. BYRON JIMENEZ|LOURBANC|2003-05-14 10:03:14|
1|2|79|221|D|FA|630.0|05/14/2003|OBRA IZQUIERDO-BANO DE SERVICIO|GUATAQUIL TENNIS-ARQ. BYRON JIMENEZ|LOURBANC|2003-05-14 10:04:15|
1|2|70|437|D|FA|631.0|05/14/2003|O. IZQUIERDO-B. MASTER-SERV.LAVAND.-JARD|GUAYAQUIL TENNIS-ARQ. BYRON JIMENEZ|LOURBANC|2003-05-14 10:04:39|
1|2|79|222|D|FA|631.0|05/14/2003|O. IZQUIERDO-B. MASTER-SERV.LAVAND.-JARD|GUAYAQUIL TENNIS-ARQ. BYRON JIMENEZ|LOURBANC|2003-05-14 10:04:39|
1|2|70|438|D|FA|632.0|05/14/2003|OBRA TOMAS ALVAREZ|ALMACEN CENTRO|LOURBANC|2003-05-14 10:41:30|
1|2|79|223|D|FA|633.0|05/14/2003|CARRERA ESTARELLAS FRANCISCO VICENTE|RETIRA|LOURBANC|2003-05-14 12:01:18|
1|2|79|224|D|FA|634.0|05/14/2003|OBRA LANDIVAR-BANO MASTER|RETIRA MANUEL SANDOYA|LOURBANC|2003-05-14 12:29:10|
1|2|70|439|D|FA|635.0|05/14/2003|AGUSTIN CEBALLOS|RETIRA|LOURBANC|2003-05-14 13:00:01|
1|2|79|225|D|FA|636.0|05/15/2003|OBRA LANDIVAR BANO VISITA|JUAN TANCA MARENGO|LOURBANC|2003-05-15 09:56:39|
1|2|79|226|D|FA|637.0|05/15/2003|OBRA UNIPOLLO|UNICENTRO SRTA. SUSANA|LOURBANC|2003-05-15 09:57:26|
1|2|79|227|D|FA|638.0|05/15/2003|GUALOTUNA QUISHPE LUIS ALFREDO          |DESPACHAR ALM.CENTRO|LOURBANC|2003-05-15 10:27:30|
1|2|70|440|D|FA|639.0|05/15/2003|O.COMP #21890|RETIRA ALM CENTRO|LOURBANC|2003-05-15 10:54:11|
1|2|70|441|D|FA|640.0|05/16/2003|GABRIEL PENA|RETIRA|LOURBANC|2003-05-16 12:21:08|
1|2|70|442|D|FA|641.0|05/16/2003|ARQ MORAN OSWALDO|ALM CENTRO|LOURBANC|2003-05-16 14:10:40|
1|2|70|443|D|FA|642.0|05/16/2003|RAMOS MOLINA ROBERTO, ARQ.              |RETIRA|LOURBANC|2003-05-16 15:07:52|
1|2|70|444|D|FA|643.0|05/16/2003|LEON JURADO GENARO ARQ.                 |MALDONADO Y LA 19|LOURBANC|2003-05-16 15:08:39|
1|2|70|445|D|FA|644.0|05/16/2003|COLEGIO INTERNACIONAL SEK               |KM,5 VIA A SALINAS|LOURBANC|2003-05-16 15:39:48|
1|2|70|446|D|FA|645.0|05/16/2003|ING. ALBERTO SUETT|RETIRA|LOURBANC|2003-05-16 16:34:00|
1|2|70|447|D|FA|646.0|05/16/2003|GALO ZAVALA|M|LOURBANC|2003-05-16 17:37:18|
1|2|79|228|D|FA|647.0|05/19/2003|AVILA ORTEGA EUGENIO ING.               |RETIRA|LOURBANC|2003-05-19 09:17:15|
1|2|79|229|D|FA|648.0|05/19/2003|O.COMP#32529|AV J.T.M. KM.|LOURBANC|2003-05-19 09:20:22|
1|2|70|448|D|FA|649.0|05/19/2003|RICKY CENTRO                            |ALMACEN CENTRO|LOURBANC|2003-05-19 10:44:01|
1|2|70|449|D|FA|650.0|05/19/2003|GUALOTUNA QUISHPE LUIS ALFREDO          |RETIRA ALM CENTRO|LOURBANC|2003-05-19 12:20:19|
1|2|79|230|D|FA|650.0|05/19/2003|GUALOTUNA QUISHPE LUIS ALFREDO          |RETIRA ALM CENTRO|LOURBANC|2003-05-19 12:20:19|
1|2|79|231|D|FA|651.0|05/19/2003|O.C. # 32536-|LA LLAVE-AVDA. J. T. MARENGO KM. 2.5|LOURBANC|2003-05-19 12:22:59|
1|2|70|450|D|FA|652.0|05/19/2003|ING. MARIA MORAN|RETIRA|LOURBANC|2003-05-19 14:31:17|
1|2|79|232|E|FA|653.0|05/19/2003|O.COMPRA#230424|PENDIENTE|LOURBANC|2003-05-19 14:34:22|
1|2|70|451|D|FA|654.0|05/19/2003|INTRIAGO MANZABA NANCY                  |RETIRA|LOURBANC|2003-05-19 15:14:07|
1|2|79|233|D|FA|655.0|05/19/2003|O.COMP#230424 PEDIDO SR ALCIVAR|PENDIENTE|LOURBANC|2003-05-19 15:23:12|
1|2|70|452|D|FA|656.0|05/20/2003|MORA JOFFRE|ALM CENTRO|LOURBANC|2003-05-20 10:20:33|
1|2|70|453|D|FA|657.0|05/20/2003|PULLA CRISTIAN|RETIRA ALM CENTRO|LOURBANC|2003-05-20 10:22:16|
1|2|79|234|D|FA|658.0|05/20/2003|FERREIND                                |RETIRAN AV.J.T.M.|LOURBANC|2003-05-20 11:08:13|
1|2|70|454|D|FA|659.0|05/20/2003|MARIA DE REYES|RETIRA|LOURBANC|2003-05-20 11:30:31|
1|2|70|455|D|FA|660.0|05/20/2003|SR. RICARDO LUZURIAGA S.|M|LOURBANC|2003-05-20 11:54:56|
1|2|70|456|D|FA|661.0|05/20/2003|PROANO HERRERA ELENA                    |CDLA. FLORESTA 2 MZ. 138 V5|LOURBANC|2003-05-20 13:12:48|
1|2|79|235|D|FA|662.0|05/20/2003|SR. EDUARDO LOZA|M|LOURBANC|2003-05-20 14:00:51|
1|2|70|457|D|FA|663.0|05/20/2003|ING. VICTOR PLATON|M|LOURBANC|2003-05-20 14:43:33|
1|2|70|458|D|FA|664.0|05/20/2003|VASCONEZ MARTINEZ CARLOS|CDLA. LOS ALMENDROS, PINZONES Y 5TA.PEAT|LOURBANC|2003-05-20 15:02:38|
1|2|79|236|D|FA|664.0|05/20/2003|VASCONEZ MARTINEZ CARLOS|CDLA. LOS ALMENDROS, PINZONES Y 5TA.PEAT|LOURBANC|2003-05-20 15:02:38|
1|2|70|459|D|FA|665.0|05/20/2003|OBRA KM. 9.5 - ING. BITAR|UNICENTRO PEDIDO POR SRTA. SUSANA|LOURBANC|2003-05-20 15:33:24|
1|2|79|237|D|FA|666.0|05/20/2003|OBRA BANO # 10 1ER. PISO|PADRE AGUIRRE 401|LOURBANC|2003-05-20 16:14:04|
1|2|70|460|D|FA|667.0|05/20/2003|PALACIOS DEIDAN JIMMY|RETIRA|LOURBANC|2003-05-20 16:29:23|
1|2|70|461|D|FA|668.0|05/20/2003|VALDIVIESO MALO FAUSTO|RETIRA ALM CENTRO|LOURBANC|2003-05-20 17:09:01|
1|2|70|462|D|FA|669.0|05/21/2003|PROHOTESA S.A.                          |AGUIRRE 603 Y ESCOBEDO|LOURBANC|2003-05-21 10:31:21|
1|2|70|463|D|FA|670.0|05/21/2003|MILTON SUAREZ|M|LOURBANC|2003-05-21 10:54:37|
1|2|70|464|D|FA|671.0|05/21/2003|O.C.# 00637|RETIRAN|LOURBANC|2003-05-21 11:45:13|
1|2|70|465|D|FA|672.0|05/21/2003|O.COMP # 21911|RETIRAN ALM CENTRO|LOURBANC|2003-05-21 11:47:00|
1|2|70|466|D|FA|673.0|05/21/2003|COLEGIO CRISTOBAL COLON                 |RETIRA|LOURBANC|2003-05-21 12:36:56|
1|2|70|467|D|FA|674.0|05/21/2003|VASCONEZ MARTINEZ CARLOS|CDLA. LOS ALMENDROS, PINZONES Y 5TA.PEAT|LOURBANC|2003-05-21 12:44:51|
1|2|70|468|D|FA|675.0|05/21/2003|VALDIVIESO MALO FAUSTO|RETIRA ALM CENTRO|LOURBANC|2003-05-21 13:18:25|
1|2|79|238|D|FA|676.0|05/21/2003|CLINICA GUAYAQUIL                       |PADRE AGUIRRE # 401|LOURBANC|2003-05-21 15:06:35|
1|2|70|469|D|FA|677.0|05/21/2003|ARROYO LAMILLA CARLOS                   |RETIRA|LOURBANC|2003-05-21 15:11:55|
1|2|70|470|D|FA|678.0|05/21/2003|CLINICA GUAYAQUIL                       |PADRE AGUIRRE # 401-CLINICA GUAYAQUIL|LOURBANC|2003-05-21 15:12:48|
1|2|79|239|D|FA|678.0|05/21/2003|CLINICA GUAYAQUIL                       |PADRE AGUIRRE # 401-CLINICA GUAYAQUIL|LOURBANC|2003-05-21 15:12:48|
1|2|70|471|D|FA|679.0|05/21/2003|CLINICA GUAYAQUIL                       |PADRE AGUIRRE 401-CLINICA GUAYAQUIL|LOURBANC|2003-05-21 15:13:15|
1|2|70|472|D|FA|680.0|05/21/2003|ARQ. VIOLETA ORTEGA|RETIRA|LOURBANC|2003-05-21 16:05:53|
1|2|79|240|E|FA|681.0|05/21/2003|SR. EDUARDO LOZA|RETIRA|LOURBANC|2003-05-21 16:06:45|
1|2|70|473|D|FA|682.0|05/21/2003|SOCIEDAD DE BENEFICENCIA DE SEORAS DE G|ALM CENTRO|LOURBANC|2003-05-21 16:12:14|
1|2|79|241|D|FA|683.0|05/21/2003|FERREIND                                |RETIRAN J.T.M.|LOURBANC|2003-05-21 16:12:34|
1|2|79|242|D|FA|684.0|05/21/2003|SR. EDUARDO LOZA|RETIRA|LOURBANC|2003-05-21 16:15:17|
1|2|70|474|D|FA|685.0|05/21/2003|MARTHA DE YUNEZ|RETIRA|LOURBANC|2003-05-21 16:35:41|
1|2|70|475|D|FA|686.0|05/21/2003|PROHOTESA S.A.                          |RETIRA ALM CENTRO|LOURBANC|2003-05-21 17:16:43|
1|2|70|476|D|FA|687.0|05/22/2003|EUGENIO CHONG SING|RETIRA|LOURBANC|2003-05-22 10:34:24|
1|2|70|477|D|FA|688.0|05/22/2003|DEFAZ MERCHAN NELSON ARQ.               |RETIRA|LOURBANC|2003-05-22 11:13:53|
1|2|70|478|D|FA|689.0|05/22/2003|VALDIVIESO MALO FAUSTO|RETIRA PERSONAL ALM CENTRO|LOURBANC|2003-05-22 11:46:31|
1|2|79|243|D|FA|690.0|05/22/2003|OBRA LANDIVAR-BANO DE NINOS|RETIRA|LOURBANC|2003-05-22 14:01:25|
1|2|70|479|D|FA|691.0|05/22/2003|MARTHA DE YUNEZ|.|LOURBANC|2003-05-22 15:41:32|
1|2|70|480|D|FA|692.0|05/22/2003|XIN RONG HONG|RETIRA|LOURBANC|2003-05-22 16:31:50|
1|2|79|244|E|FA|692.0|05/22/2003|XIN RONG HONG|RETIRA|LOURBANC|2003-05-22 16:31:50|
1|2|70|481|D|FA|693.0|05/22/2003|XIN RONG HONG|RETIRA|LOURBANC|2003-05-22 17:14:46|
1|2|79|245|D|FA|694.0|05/23/2003|SELLAN BARZOLA OTILIA                   |SAUCES VI MZ. 335 V. 3|LOURBANC|2003-05-23 09:32:19|
1|2|79|246|D|FA|695.0|05/23/2003|DISMATEL                                |RETIRA AV.J.T.M.|LOURBANC|2003-05-23 10:27:49|
1|2|70|482|D|FA|696.0|05/23/2003|GONZALEZ MELIDA ROLDAN DE               |CDLA. LOS ALMENDROS, CALLE 2DA. MZ.N.V12|LOURBANC|2003-05-23 11:16:42|
1|2|70|483|D|FA|697.0|05/23/2003|O.COMP#645|RETIRA ALM CENTRO|LOURBANC|2003-05-23 14:31:12|
1|2|70|484|D|FA|698.0|05/23/2003|OBRA CASINO-BANO DE HOMBRES|AGUIRRE 411 E/ CHILE Y CHIMBORAZO OF.208|LOURBANC|2003-05-23 15:53:06|
1|2|70|485|D|FA|699.0|05/23/2003|ARMANDO VILLACRESES|M|LOURBANC|2003-05-23 15:57:13|
1|2|79|247|D|FA|700.0|05/23/2003|ESPIN PALACIOS EDWIN|MUELLE CARAGUAY|LOURBANC|2003-05-23 16:32:03|
1|2|70|486|D|FA|701.0|05/23/2003|ALMACENES EL GLOBO|RETIRA|LOURBANC|2003-05-23 17:37:01|
1|2|70|487|D|FA|702.0|05/26/2003|CEDENO MERY|RETIRA|LOURBANC|2003-05-26 09:43:26|
1|2|70|488|D|FA|703.0|05/26/2003|INTRIAGO MANZABA NANCY                  |RETIRA|LOURBANC|2003-05-26 09:53:15|
1|2|70|489|D|FA|704.0|05/26/2003|O.C.#724|RETIRAN|LOURBANC|2003-05-26 10:11:38|
1|2|79|248|D|FA|704.0|05/26/2003|O.C.#724|RETIRAN|LOURBANC|2003-05-26 10:11:38|
1|2|79|249|D|FA|705.0|05/26/2003|O.C.#725|RETIRA SR. FRANKLIN UVE|LOURBANC|2003-05-26 13:57:37|
1|2|79|250|D|FA|706.0|05/26/2003|CLINICA GUAYAQUIL                       |RETIRA ARQ. MELIDA ROLDAN|LOURBANC|2003-05-26 16:36:05|
1|2|70|490|D|FA|707.0|05/26/2003|CLINICA GUAYAQUIL                       |RETIRA ARQ. MEILIDA DE ROLDAN|LOURBANC|2003-05-26 16:36:33|
1|2|79|251|D|FA|707.0|05/26/2003|CLINICA GUAYAQUIL                       |RETIRA ARQ. MEILIDA DE ROLDAN|LOURBANC|2003-05-26 16:36:33|
1|2|70|491|D|FA|708.0|05/27/2003|COELCA ECUATORIANA|M|LOURBANC|2003-05-27 09:57:46|
1|2|79|252|D|FA|709.0|05/27/2003|INMOBILIARIA LOS PINOS                  |KM.13 VIA A DAULE,DISENSA CIPA|LOURBANC|2003-05-27 10:06:18|
1|2|70|492|D|FA|710.0|05/27/2003|ARTICULO MUCHOS ANOS EN EXH.C/F|RETIRA ALMACEN CENTRO|LOURBANC|2003-05-27 10:54:32|
1|2|79|253|D|FA|711.0|05/27/2003|CORDOVA ASTUDILLO LUIS, ING.|RETIRA|LOURBANC|2003-05-27 10:59:23|
1|2|79|254|D|FA|712.0|05/27/2003|SUMMA PROYECTOS C.A.                    |RETIRA|LOURBANC|2003-05-27 10:59:59|
1|2|79|255|D|FA|713.0|05/27/2003|PEDIDO POR SR. JACINTO ENDARA|RETIRA|LOURBANC|2003-05-27 11:09:11|
1|2|70|493|D|FA|714.0|05/27/2003|GUALOTUNA ALFREDO                       |RETIRA|LOURBANC|2003-05-27 11:49:49|
1|2|70|494|D|FA|715.0|05/27/2003|OBRA CASINO BANO DE VARONES|RETIRAN|LOURBANC|2003-05-27 12:06:42|
1|2|70|495|D|FA|716.0|05/27/2003|IMFERSA S.A.                            |RETIRAN ALM CENTRO|LOURBANC|2003-05-27 12:34:35|
1|2|70|496|D|FA|717.0|05/27/2003|FERREIND                                |RETIRAN ALM CENTRO|LOURBANC|2003-05-27 16:33:13|
1|2|70|497|D|FA|718.0|05/28/2003|MIRANDA MARIA DE                        |RETIRA|LOURBANC|2003-05-28 09:05:53|
1|2|70|498|D|FA|719.0|05/28/2003|EUGENIO CHONG|RETIRA|LOURBANC|2003-05-28 10:58:31|
1|2|70|499|D|FA|720.0|05/28/2003|SISTEMA CONTRA INCENDIOS S.A.|CDLA. FERROVIARIA, AV.3ERA. 407 Y DCMA.|LOURBANC|2003-05-28 11:40:19|
1|2|79|256|D|FA|721.0|05/28/2003|PEDIDO POR NSR. JACINTO ENDARA|RETIRA|LOURBANC|2003-05-28 11:40:40|
1|2|70|500|D|FA|722.0|05/28/2003|AGUILAR CENTENO MARIA LORENA|RETIRAN|LOURBANC|2003-05-28 13:31:02|
1|2|79|257|D|FA|723.0|05/28/2003|AGUILAR CENTENO MARIA LORENA|RETIRA|LOURBANC|2003-05-28 13:38:21|
1|2|70|501|D|FA|724.0|05/28/2003|CONTINENTAL HOTEL                       |RETIRA ALM CENTRO|LOURBANC|2003-05-28 15:15:27|
1|2|70|502|D|FA|725.0|05/28/2003|RUTH CAMPOS DE COBO|RETIRA|LOURBANC|2003-05-28 15:35:56|
1|2|79|258|D|FA|726.0|05/28/2003|O.COMP#00650|RETIRAN AV.J.T.M.|LOURBANC|2003-05-28 16:03:29|
1|2|70|503|D|FA|727.0|05/28/2003|EMILIO CARRIEL|RETIRA ALM CENTRO|LOURBANC|2003-05-28 17:28:07|
1|2|70|504|D|FA|728.0|05/29/2003|INTRIAGO MANZABA NANCY                  |RETIRA|LOURBANC|2003-05-29 09:51:08|
1|2|79|259|D|FA|728.0|05/29/2003|INTRIAGO MANZABA NANCY                  |RETIRA|LOURBANC|2003-05-29 09:51:08|
1|2|79|260|D|FA|729.0|05/29/2003|FERREIND                                |RETIRAN AV J.T.MARENGO|LOURBANC|2003-05-29 09:52:57|
1|2|70|505|D|FA|730.0|05/29/2003|LEOPOLDO GALARZA|RETIRA|LOURBANC|2003-05-29 09:59:25|
1|2|79|261|D|FA|731.0|05/29/2003|FERREIND                                |RETIRAN AV J.T.M|LOURBANC|2003-05-29 10:49:43|
1|2|79|262|D|FA|732.0|05/29/2003|COFERMA                                 |RETIRAN AV J.T.M.|LOURBANC|2003-05-29 10:50:09|
1|2|70|506|D|FA|733.0|05/29/2003|RIBADENEIRA JORGE|RETIRA ALM CENTRO|LOURBANC|2003-05-29 14:27:04|
1|2|70|507|D|FA|734.0|05/30/2003|MIRANDA MARIA DE                        |RETIRA|LOURBANC|2003-05-30 09:15:14|
1|2|79|263|D|FA|735.0|05/30/2003|FERRETERIA SAN JAVIER                   |RUMICHACA 1238 Y C. BALLEN|LOURBANC|2003-05-30 09:47:11|
1|2|70|508|D|FA|736.0|05/30/2003|COMERCIAL EDI-FER                       |RETIRA|LOURBANC|2003-05-30 10:56:57|
1|2|70|509|D|FA|737.0|05/30/2003|CLINICA GUAYAQUIL                       |PADRE AGUIRRE 401|LOURBANC|2003-05-30 11:16:53|
1|2|70|510|D|FA|738.0|05/30/2003|CLINICA GUAYAQUIL                       |PADRE AGUIRRE 401|LOURBANC|2003-05-30 11:21:57|
1|2|79|264|D|FA|738.0|05/30/2003|CLINICA GUAYAQUIL                       |PADRE AGUIRRE 401|LOURBANC|2003-05-30 11:21:57|
1|2|70|511|D|FA|739.0|05/30/2003|CORDOVA ASTUDILLO LUIS, ING.|ED. EXECUTIVE CENTER, PISO 2|LOURBANC|2003-05-30 12:07:40|
1|2|79|265|D|FA|740.0|05/30/2003|CORDOVA ASTUDILLO LUIS, ING.|ED. EXECUTIVE CENTER, PISO 2|LOURBANC|2003-05-30 12:55:56|
1|2|70|512|D|FA|741.0|05/30/2003|TEJADA JOSE|M|LOURBANC|2003-05-30 13:34:59|
1|2|70|513|D|FA|742.0|05/30/2003|DIMETAL                                 |RETIRA ALM CENTRO|LOURBANC|2003-05-30 13:45:30|
1|2|70|514|D|FA|743.0|05/30/2003|CONSUELO DE SANCHEZ|RETIRA|LOURBANC|2003-05-30 14:16:54|
1|2|70|515|D|FA|744.0|06/02/2003|SR. VIRGILIO LOPEZ|RETIRA|LOURBANC|2003-06-02 10:41:12|
1|2|79|266|D|FA|745.0|06/02/2003|ATT: SR. JOHNNY ALARCON|RETIRAN|LOURBANC|2003-06-02 11:55:07|
1|2|70|516|D|FA|746.0|06/02/2003|POTES SABANDO BLANCA|CALLEJON MALDONADO 5512 Y 37AVA|LOURBANC|2003-06-02 15:33:21|
1|2|79|267|D|FA|746.0|06/02/2003|POTES SABANDO BLANCA|CALLEJON MALDONADO 5512 Y 37AVA|LOURBANC|2003-06-02 15:33:21|
1|2|70|517|D|FA|747.0|06/02/2003|POTES SABANDO BLANCA|CALLEJON MALDONADO 5512 Y 37AVA|LOURBANC|2003-06-02 15:34:29|
1|2|79|268|D|FA|747.0|06/02/2003|POTES SABANDO BLANCA|CALLEJON MALDONADO 5512 Y 37AVA|LOURBANC|2003-06-02 15:34:29|
1|2|70|518|D|FA|748.0|06/02/2003|POTES SABANDO BLANCA|CALLEJON MALDONADO 5512 Y 37AVA|LOURBANC|2003-06-02 15:36:53|
1|2|79|269|D|FA|748.0|06/02/2003|POTES SABANDO BLANCA|CALLEJON MALDONADO 5512 Y 37AVA|LOURBANC|2003-06-02 15:36:53|
1|2|79|270|D|FA|749.0|06/02/2003|INMOBILIARIA LOS PINOS                  |DISENSA, KM.3  VIA A DAULE|LOURBANC|2003-06-02 15:45:35|
1|2|79|271|D|FA|750.0|06/02/2003|INMOBILIARIA LOS PINOS                  |DISENSA, KM. 3 VIA A DAULE|LOURBANC|2003-06-02 15:48:16|
1|2|70|519|D|FA|751.0|06/02/2003|INMOBILIARIA XAGOMAR S.A.|RETIRA|LOURBANC|2003-06-02 16:53:22|
1|2|70|520|D|FA|752.0|06/03/2003|DELITAC S.A.|RETIRA  ARQ. MELIDA DE ROLDAN|LOURBANC|2003-06-03 11:24:42|
1|2|79|272|D|FA|752.0|06/03/2003|DELITAC S.A.|RETIRA  ARQ. MELIDA DE ROLDAN|LOURBANC|2003-06-03 11:24:42|
1|2|70|521|D|FA|753.0|06/03/2003| SR MOLINA RICARDO|ALM CENTRO|LOURBANC|2003-06-03 11:46:55|
1|2|70|522|D|FA|754.0|06/03/2003|CONSUMIDOR FINAL|M|LOURBANC|2003-06-03 14:32:58|
1|2|70|523|D|FA|755.0|06/03/2003|ZAMBRANO GALVEZ LUIS|RETIRA ALM CENTRO|LOURBANC|2003-06-03 14:38:01|
1|2|79|273|D|FA|756.0|06/03/2003|O. C. 13061/62/63/64/60-OBRA ACHI-EL RIO|URBANIZ  URBAN. EL RIO OBRA ACHI|LOURBANC|2003-06-03 16:13:54|
1|2|79|274|D|FA|757.0|06/03/2003|O.C. # 13057-B.SERVICIO-CHOFER-OBRA ACHI|URB. EL RIO-OBRA ACHI|LOURBANC|2003-06-03 16:14:19|
1|2|79|275|D|FA|758.0|06/03/2003|O.C. # 13059-LAVANDERIA-CHOFER-SERVICIO|URB. EL RIO-OBRA ACHI|LOURBANC|2003-06-03 16:14:44|
1|2|79|276|D|FA|759.0|06/03/2003|O.C. # 13058.COCINA-OBRA ACHI|URBAN. EL RIO OBRA ACHI|LOURBANC|2003-06-03 16:15:16|
1|2|79|277|D|FA|760.0|06/03/2003|O.C. # 13089-BANO PISCINA OBRA ACHI|URBASN. EL RIO .OBRA ACHI|LOURBANC|2003-06-03 16:15:51|
1|2|70|524|D|FA|761.0|06/03/2003|JORDAN CHAVEZ JENNY|6 DE MARZO 3104 Y PORTETE|LOURBANC|2003-06-03 17:22:04|
1|2|79|278|D|FA|761.0|06/03/2003|JORDAN CHAVEZ JENNY|6 DE MARZO 3104 Y PORTETE|LOURBANC|2003-06-03 17:22:04|
1|2|70|525|D|FA|762.0|06/03/2003|INTRIAGO MANZABA NANCY                  |RETIRA|LOURBANC|2003-06-03 17:30:23|
1|2|70|526|D|FA|763.0|06/04/2003|FERRETERIA COMERCIAL                    |RETIRA|LOURBANC|2003-06-04 09:14:14|
1|2|70|527|D|FA|764.0|06/04/2003|CONSUMIDOR FINAL|ALM CENTRO|LOURBANC|2003-06-04 11:06:56|
1|2|70|528|D|FA|765.0|06/04/2003|ING. VICTOR PROANO (ART.INCOMPL|RETIRA (DESAGUE INCOMPLETO)|LOURBANC|2003-06-04 11:39:09|
1|2|70|529|D|FA|766.0|06/04/2003|SR. VICTOR HUGO CHAVEZ|M|LOURBANC|2003-06-04 12:10:08|
1|2|79|279|D|FA|767.0|06/04/2003|O.C.#732|RETIRA SR. FRANKLIN UVE|LOURBANC|2003-06-04 12:17:05|
1|2|70|530|D|FA|768.0|06/04/2003|3ER. PISO-LAVANDERIA|RETIRA|LOURBANC|2003-06-04 12:44:29|
1|2|70|531|D|FA|769.0|06/04/2003|BANO PATIO-PED. ARQ. DE ROLDAN|RETIRA MAESTRO SERVIO MEDINA|LOURBANC|2003-06-04 12:44:49|
1|2|79|280|D|FA|770.0|06/04/2003|COFERMA                                 |RETIRAN AV.J.T.MARENGO|LOURBANC|2003-06-04 13:05:24|
1|2|79|281|D|FA|771.0|06/04/2003|JARAMILLO VARGAS ORLANDO|CDLA.MARTHA ROLDOS MZ.809 V.2|LOURBANC|2003-06-04 15:30:30|
1|2|70|532|D|FA|772.0|06/04/2003|PEDIDO POR ARQ. DE ROLDAN|RETIRA|LOURBANC|2003-06-04 16:42:41|
1|2|70|533|D|FA|773.0|06/04/2003|FERREIND                                |ALM CENTRO|LOURBANC|2003-06-04 16:57:57|
1|2|70|534|D|FA|774.0|06/05/2003|CANDO LEONARDO|RET.ALM CENTRO|LOURBANC|2003-06-05 10:52:40|
1|2|79|282|D|FA|775.0|06/05/2003|O.C.#00232-G-2003|RETIRA SR. JOSE GRANIZO|LOURBANC|2003-06-05 12:30:27|
1|2|70|535|D|FA|776.0|06/05/2003|SIMBOLOS GRAFICOS S.A.                  |RETIRAN ALM CENTRO|LOURBANC|2003-06-05 12:32:01|
1|2|79|283|D|FA|777.0|06/05/2003|LEONARDO CANDO|RETIRAN|LOURBANC|2003-06-05 17:07:45|
1|2|70|536|D|FA|778.0|06/06/2003|PEDIDO POR ARQ. DE ROLDAN|RETIRA DE ALMACEN CENTRO|LOURBANC|2003-06-06 09:14:31|
1|2|70|537|D|FA|779.0|06/06/2003|PEDIDO POR ARQ. DE ROLDAN|CLINICA GUAYAQUIL|LOURBANC|2003-06-06 10:04:23|
1|2|70|538|D|FA|780.0|06/06/2003|PEDIDO POR ARQ. DE ROLDAN|RETRIRA DE ALMACEN CENTRO|LOURBANC|2003-06-06 10:17:25|
1|2|70|539|D|FA|781.0|06/06/2003|COFERMA                                 |RETIRAN|LOURBANC|2003-06-06 13:10:07|
1|2|70|540|D|FA|782.0|06/06/2003|PAREDES FRANKLIN|RETIRA|LOURBANC|2003-06-06 13:12:37|
1|2|70|541|D|FA|783.0|06/06/2003|COFERMA                                 |RETIRAN ALM CENTRO|LOURBANC|2003-06-06 13:16:27|
1|2|79|284|D|FA|784.0|06/06/2003|VILLARREAL SALAS JUSTO|RETIRAN ALM CENTRO|LOURBANC|2003-06-06 14:36:54|
1|2|70|542|D|FA|785.0|06/06/2003|SERRANO MARIA DE|RETIRA ALM. CENTRO|LOURBANC|2003-06-06 15:48:09|
1|2|70|543|D|FA|786.0|06/06/2003|OBRA SR. ALFONSO QUIGUANGO|ALMACEN CENTRO|LOURBANC|2003-06-06 16:53:09|
1|2|79|285|D|FA|786.0|06/06/2003|OBRA SR. ALFONSO QUIGUANGO|ALMACEN CENTRO|LOURBANC|2003-06-06 16:53:09|
1|2|79|286|D|FA|787.0|06/06/2003|FECIM S.A.|RETIRAN|LOURBANC|2003-06-06 17:28:06|
1|2|70|544|D|FA|788.0|06/09/2003|RIVADENEIRA VELASQUEZ ORLANDO|RETIRAN ALM CENTRO|LOURBANC|2003-06-09 10:59:16|
1|2|79|287|D|FA|789.0|06/09/2003|O.COMP#145|QUISQUI 1_14 ENTRE XIMENAY RIOB|LOURBANC|2003-06-09 11:01:44|
1|2|70|545|D|FA|790.0|06/09/2003|FEYESO|M|LOURBANC|2003-06-09 11:08:52|
1|2|70|546|D|FA|791.0|06/09/2003|PROANO HERRERA ELENA                    |CDLA. FLORESTA 2 MZ. 138 V5|LOURBANC|2003-06-09 12:52:55|
1|2|79|288|D|FA|792.0|06/09/2003|FERREIND                                |RETIRAN AV.J.T.MARENGO|LOURBANC|2003-06-09 16:12:44|
1|2|70|547|D|FA|793.0|06/10/2003|JIMENEZ SOTO JOSE FRANCISCO|RETIRA EN ALMACEN CENTRO|LOURBANC|2003-06-10 10:26:56|
1|2|70|548|D|FA|794.0|06/10/2003|O.COMP#682|ALM CENTRO|LOURBANC|2003-06-10 10:51:07|
1|2|79|289|D|FA|795.0|06/10/2003|FERRETERIA COMERCIAL                    |RETIRA|LOURBANC|2003-06-10 11:02:45|
1|2|70|549|D|FA|796.0|06/10/2003|GUALOTUNA ALFREDO                       |PORTETE 1126 Y GUARANDA|LOURBANC|2003-06-10 11:27:22|
1|2|70|550|D|FA|797.0|06/10/2003|NICOLAS CRESPO|ALM CENTRO|LOURBANC|2003-06-10 11:46:53|
1|2|70|551|D|FA|798.0|06/10/2003|OBRA GINNACIO-PEDIDO POR SRTA. SUSANA|UNICENTRO|LOURBANC|2003-06-10 14:54:26|
1|2|70|552|D|FA|799.0|06/10/2003|LA CASA DEL VAPOR                       |RETIRAN ALM CENTRO|LOURBANC|2003-06-10 17:02:31|
1|2|70|553|D|FA|800.0|06/10/2003|MA. DEL CARMEN DE BUSTAMANTE|.|LOURBANC|2003-06-10 17:15:26|
1|2|70|554|D|FA|801.0|06/10/2003|MARAGRO S.A.|JUNIN 114 Y PANAMA P.6 OF.4|LOURBANC|2003-06-10 17:26:37|
1|2|79|290|D|FA|802.0|06/11/2003|RIVADENEIRA CAMPOZANO JORGE|RETIRAN AV J.T.MARENGO|LOURBANC|2003-06-11 10:34:56|
1|2|70|555|D|FA|803.0|06/11/2003|FELIPE PINTO|M|LOURBANC|2003-06-11 10:41:06|
1|2|70|556|D|FA|804.0|06/11/2003|PACHECO DIAZ MANUEL|RETIRA|LOURBANC|2003-06-11 11:31:34|
1|2|70|557|D|FA|805.0|06/11/2003|PROANO HERRERA ELENA                    |RETIRA|LOURBANC|2003-06-11 11:55:04|
1|2|79|291|D|FA|805.0|06/11/2003|PROANO HERRERA ELENA                    |RETIRA|LOURBANC|2003-06-11 11:55:04|
1|2|70|558|D|FA|806.0|06/11/2003|UNICENTRO TURISTICO JABUCAM             |AGUIRRE 411 E/ CHILE Y CHIMBORAZO OF.208|LOURBANC|2003-06-11 12:17:49|
1|2|79|292|D|FA|807.0|06/11/2003|DESCUENTO AUTO. POR SRA. NANCY|ALMACEN CENTRO|LOURBANC|2003-06-11 12:54:06|
1|2|70|559|D|FA|808.0|06/11/2003|ABG. JORGE NEIRA MENENDEZ|RETIRA|LOURBANC|2003-06-11 14:33:59|
1|2|70|560|D|FA|809.0|06/11/2003|SANCHEZ GAETE LUIS|ALMACEN CENTRO|LOURBANC|2003-06-11 15:01:29|
1|2|70|561|D|FA|810.0|06/11/2003|JAVIER LOZANO|RETIRA|LOURBANC|2003-06-11 15:03:20|
1|2|70|562|D|FA|811.0|06/11/2003|FAJARDO MARIA BARRERA DE                |SAUCES 1 MZ. F14 V.31|LOURBANC|2003-06-11 16:48:25|
1|2|70|563|D|FA|812.0|06/11/2003|BAHAMONDE MONCAYO MIRIAM|CORDOVA 525 Y TOMAS MARTINEZ|LOURBANC|2003-06-11 16:49:31|
1|2|70|564|D|FA|813.0|06/11/2003|BAHAMONDE MONCAYO MIRIAM|CORDOVA 525 Y TOMAS MARTINEZ|LOURBANC|2003-06-11 16:50:24|
1|2|79|293|D|FA|814.0|06/12/2003|N.CDTO. Y COBRANZA|RETIRA|LOURBANC|2003-06-12 10:02:42|
1|2|79|294|D|FA|815.0|06/12/2003|O.COMP#150|TRANSPORTE SEMERIA A CUENCA|LOURBANC|2003-06-12 10:09:27|
1|2|79|295|D|FA|816.0|06/12/2003|LA PARRILLA DEL NATO|AV. V.E.ESTRADA 1219 Y LAURELES|LOURBANC|2003-06-12 12:27:10|
1|2|79|296|D|FA|817.0|06/12/2003|O.COMP#689|RETIRAN AV.J.T.M.|LOURBANC|2003-06-12 15:01:52|
1|2|70|565|D|FA|818.0|06/12/2003|INGRID MAHUER|RETIRA|LOURBANC|2003-06-12 15:43:01|
1|2|70|566|E|FA|819.0|06/12/2003|GONZALEZ MELIDA ROLDAN DE               |CDLA. LOS ALMENDROS, CALLE 2DA. MZ.N.V12|LOURBANC|2003-06-12 16:43:24|
1|2|70|567|D|FA|820.0|06/12/2003|PEDIDO POR QRQ. ROLDAN|ALMACEN CENTRO|LOURBANC|2003-06-12 16:43:45|
1|2|70|568|D|FA|821.0|06/12/2003|FAJARDO MARIA BARRERA DE                |SAUCES 1 MZ. F14 V.31|LOURBANC|2003-06-12 17:26:27|
1|2|70|569|D|FA|822.0|06/13/2003|JIMENEZ SOTO JOSE FRANCISCO|COLON Y PIO MONTUFAR ESQUINA|LOURBANC|2003-06-13 09:12:37|
1|2|70|570|D|FA|823.0|06/13/2003|CLINICA GUAYAQUIL                       |RETIRA ARQ. ROLDAN|LOURBANC|2003-06-13 10:15:00|
1|2|70|571|D|FA|824.0|06/13/2003|PILAR DE MASSOUD|RETIRA|LOURBANC|2003-06-13 10:29:17|
1|2|70|572|D|FA|825.0|06/13/2003|UNICENTRO TURISTICO JABUCAM             |RERIRA|LOURBANC|2003-06-13 10:42:20|
1|2|79|297|D|FA|826.0|06/13/2003|CORP. CIVICA, CULTURAL Y DEP. ISLA SOL|VIA SAMBORONDON URB. ISLA SOL|LOURBANC|2003-06-13 11:15:46|
1|2|79|298|D|FA|827.0|06/13/2003|O.COMP#102|RETIRAN AV.J.T.M.|LOURBANC|2003-06-13 11:41:09|
1|2|79|299|D|FA|828.0|06/13/2003|O.COMP#102|RETIRAN AV J.T.M.|LOURBANC|2003-06-13 11:42:33|
1|2|79|300|D|FA|829.0|06/13/2003|FERROBRONCE                             |RUMICHACA 1725 Y FCO. CAMPOS|LOURBANC|2003-06-13 12:27:04|
1|2|70|573|D|FA|830.0|06/13/2003|CABRERA GUERRERO JOSE                   |RETIRA|LOURBANC|2003-06-13 12:51:10|
1|2|70|574|D|FA|831.0|06/13/2003|CLINICA GUAYAQUIL                       |PADRE AGUIRRE 401|LOURBANC|2003-06-13 16:25:39|
1|2|70|575|D|FA|832.0|06/13/2003|AVENDANO CARRION VICTOR H.              |RET.ALM CENTRO|LOURBANC|2003-06-13 16:32:55|
1|2|79|301|D|FA|833.0|06/13/2003|GARRIDO ZAPA ANTONIO A.                 |KM. 7,5 VIA A DAULE, COOP.GALLEGOS LARA|LOURBANC|2003-06-13 16:34:41|
1|2|70|576|D|FA|834.0|06/13/2003|ANA MA. DE GOMEZ|RETIRA|LOURBANC|2003-06-13 17:00:13|
1|2|79|302|D|FA|835.0|06/16/2003|DESCUENTO PROMOCION|RETIRAN AV.J.T.M.|LOURBANC|2003-06-16 10:08:41|
1|2|70|577|D|FA|836.0|06/16/2003|JIMENEZ SOTO JOSE FRANCISCO|COLON Y PIO MONTUFAR ESQUINA|LOURBANC|2003-06-16 10:13:54|
1|2|70|578|D|FA|837.0|06/16/2003|ALBERTO URETA|RETIRA|LOURBANC|2003-06-16 10:24:30|
1|2|70|579|D|FA|838.0|06/16/2003|SR LADD WUALTER|M|LOURBANC|2003-06-16 10:42:27|
1|2|70|580|D|FA|839.0|06/16/2003|DELITAC S.A.|PADRE AGUIRRE 401 Y CORDOVA|LOURBANC|2003-06-16 11:22:27|
1|2|70|581|D|FA|840.0|06/16/2003|MONTES CARLOS|RETIRA ALM CENTRO|LOURBANC|2003-06-16 11:24:58|
1|2|70|582|D|FA|841.0|06/16/2003|DELITAC S.A.|PADRE AGUIRRE 401 Y CORDOVA|LOURBANC|2003-06-16 11:51:19|
1|2|79|303|D|FA|841.0|06/16/2003|DELITAC S.A.|PADRE AGUIRRE 401 Y CORDOVA|LOURBANC|2003-06-16 11:51:19|
1|2|70|583|D|FA|842.0|06/16/2003|COFERMA                                 |ELOY ALFARO 2224 Y G.GOYENA|LOURBANC|2003-06-16 12:24:53|
1|2|70|584|D|FA|843.0|06/16/2003|SR. JULIO CASTRO|M|LOURBANC|2003-06-16 13:14:50|
1|2|70|585|D|FA|844.0|06/16/2003|SR. JULIO CASTRO|RETIRA|LOURBANC|2003-06-16 13:19:22|
1|2|70|586|D|FA|845.0|06/16/2003|SANDRA DE GONZALEZ|RETIRA|LOURBANC|2003-06-16 15:02:24|
1|2|79|304|D|FA|846.0|06/16/2003|ERAZO VARGAS BYRON ING.                 |RETIRA AV J.T.M|LOURBANC|2003-06-16 16:02:52|
1|2|70|587|D|FA|847.0|06/16/2003|ALBERTO URETA|RETIRA|LOURBANC|2003-06-16 16:08:57|
1|2|70|588|D|FA|848.0|06/16/2003|AYALA V. MONSERRATT                     |CDLA. LOS CEIBOS, AV. 1ERA. 421A Y CALLE|LOURBANC|2003-06-16 17:47:23|
1|2|79|305|D|FA|848.0|06/16/2003|AYALA V. MONSERRATT                     |CDLA. LOS CEIBOS, AV. 1ERA. 421A Y CALLE|LOURBANC|2003-06-16 17:47:23|
1|2|70|589|D|FA|849.0|06/16/2003|AYALA V. MONSERRATT                     |CDLA. LOS CEIBOS, AV. 1ERA. 421A Y CALLE|LOURBANC|2003-06-16 17:47:59|
1|2|79|306|D|FA|849.0|06/16/2003|AYALA V. MONSERRATT                     |CDLA. LOS CEIBOS, AV. 1ERA. 421A Y CALLE|LOURBANC|2003-06-16 17:47:59|
1|2|70|590|D|FA|850.0|06/17/2003|COFERMA                                 |RETIRA ALM CENTRO|LOURBANC|2003-06-17 09:17:34|
1|2|79|307|D|FA|851.0|06/17/2003|O.C.#00700|RETIRAN|LOURBANC|2003-06-17 10:41:32|
1|2|79|308|D|FA|852.0|06/17/2003|O.COMP#32758|AV.J.T.M. KM.2.5 LA LLAVE|LOURBANC|2003-06-17 11:08:30|
1|2|70|591|D|FA|853.0|06/17/2003|COMERCIAL CORNEJO|M|LOURBANC|2003-06-17 11:23:20|
1|2|70|592|D|FA|854.0|06/17/2003|GISELLA VARAS|RETIRA|LOURBANC|2003-06-17 11:30:23|
1|2|79|309|D|FA|855.0|06/17/2003|O.C.#752|RETIRA SR. UBE|LOURBANC|2003-06-17 12:59:47|
1|2|70|593|D|FA|856.0|06/17/2003|JOSE ALCIVAR|RETIRA|LOURBANC|2003-06-17 16:54:27|
1|2|79|310|D|FA|857.0|06/18/2003|ATT SR JAVIER GUTIERREZ|TRANSP SEMERIA CARGA|LOURBANC|2003-06-18 09:42:44|
1|2|79|311|D|FA|858.0|06/18/2003|FERRETERIA SAN JAVIER                   |RETIRA AV J.T.M.|LOURBANC|2003-06-18 10:14:34|
1|2|70|594|D|FA|859.0|06/18/2003|ELBA SANDOYA|M|LOURBANC|2003-06-18 10:34:13|
1|2|70|595|D|FA|860.0|06/18/2003|PRECIO DE PROMOCION|RETIRA ALM CENTRO|LOURBANC|2003-06-18 10:36:31|
1|2|79|312|D|FA|861.0|06/18/2003|ESPINOZA MURRIETA IVAN|AV.J.T.M.|LOURBANC|2003-06-18 11:42:51|
1|2|70|596|D|FA|862.0|06/18/2003|SERTELEC                                |RETIRA|LOURBANC|2003-06-18 12:09:39|
1|2|70|597|D|FA|863.0|06/18/2003|HOTELCA/HOTEL RAMADA C.A.               |MALECON 606 Y MANUEL LUZARRAGA|LOURBANC|2003-06-18 13:28:38|
1|2|70|598|D|FA|864.0|06/18/2003|CLINICA GUAYAQUIL                       |PADRE AGUIRRE 401|LOURBANC|2003-06-18 13:38:01|
1|2|70|599|D|FA|865.0|06/18/2003|JORDAN CHAVEZ JENNY|RETIRA ALM CENTRO|LOURBANC|2003-06-18 14:25:25|
1|2|70|600|D|FA|866.0|06/18/2003|O.COMP#117 PRECIOS DE PROMOCION|AV.J.T.M.|LOURBANC|2003-06-18 15:12:35|
1|2|79|313|D|FA|866.0|06/18/2003|O.COMP#117 PRECIOS DE PROMOCION|AV.J.T.M.|LOURBANC|2003-06-18 15:12:35|
1|2|70|601|D|FA|867.0|06/18/2003|RAQUEL IDROVO QUITO|RETIRA|LOURBANC|2003-06-18 16:48:11|
1|2|79|314|D|FA|868.0|06/19/2003|O.COMP#123|RETIRAN AV.J.T.M.|LOURBANC|2003-06-19 09:49:54|
1|2|70|602|D|FA|869.0|06/19/2003|ASOCIACION FUNDEMER|9 DE OCTUBRE S/N. Y TARQUI|LOURBANC|2003-06-19 11:14:00|
1|2|79|315|D|FA|870.0|06/19/2003|ANA MATHEUS V. - FONO.513699|RETIRA|LOURBANC|2003-06-19 11:30:14|
1|2|70|603|D|FA|871.0|06/19/2003|PEDIDO POR ARQ. JOSE MURILLO|RETIRA|LOURBANC|2003-06-19 12:13:24|
1|2|70|604|D|FA|872.0|06/19/2003|CEPSA|M|LOURBANC|2003-06-19 14:25:24|
1|2|79|316|D|FA|873.0|06/19/2003|PRECIOS DE PROMOCION|RETIRAN AV.J.T.M.|LOURBANC|2003-06-19 14:27:28|
1|2|70|605|D|FA|874.0|06/19/2003|ELBA SANDOYA|RETIRA|LOURBANC|2003-06-19 14:44:23|
1|2|70|606|D|FA|875.0|06/19/2003|GUALOTUNA QUISHPE LUIS ALFREDO          |COOP. ANTONIO J. DE SUCRE MZ. A SL. 2|LOURBANC|2003-06-19 14:46:02|
1|2|70|607|D|FA|876.0|06/19/2003|LUIS GARCIA|RETIRA|LOURBANC|2003-06-19 16:37:32|
1|2|70|608|D|FA|877.0|06/19/2003|ATT: ING. ALBERTO SUETT|RETIRA|LOURBANC|2003-06-19 17:56:27|
1|2|70|609|D|FA|878.0|06/19/2003|VILLACIS RAMIREZ OMAR ING.|RETIRA|LOURBANC|2003-06-19 18:02:21|
1|2|79|317|D|FA|878.0|06/19/2003|VILLACIS RAMIREZ OMAR ING.|RETIRA|LOURBANC|2003-06-19 18:02:21|
1|2|70|610|D|FA|879.0|06/20/2003|GEA DEL ECUADOR|AV. 9 DE OCTUBRE 100 Y MALECON|LOURBANC|2003-06-20 09:33:12|
1|2|79|318|D|FA|880.0|06/20/2003|SR ROHODEN ERNESTO|RETIRA AV.J.T.M.|LOURBANC|2003-06-20 09:55:31|
1|2|70|611|D|FA|881.0|06/20/2003|OBRA SRA. ELSA DE VALDIVIEZO|RETIRA ARQ. MELIDA DE ROLDAN|LOURBANC|2003-06-20 11:45:25|
1|2|70|612|D|FA|882.0|06/20/2003|OBRA SRA. ELSA DE VALDIVIEZO|RETIRA SRA. MELIDA DE ROLDAN|LOURBANC|2003-06-20 11:46:22|
1|2|70|613|D|FA|883.0|06/20/2003|GONZALEZ MELIDA ROLDAN DE               |RETIRA ARQ. DE ROLDAN|LOURBANC|2003-06-20 11:47:48|
1|2|70|614|D|FA|884.0|06/20/2003|COLEGIO INTERNACIONAL SEK               |RETIRA|LOURBANC|2003-06-20 12:33:44|
1|2|70|615|D|FA|885.0|06/20/2003|GARRIDO ZAPA ANTONIO A.                 |KM. 7,5 VIA A DAULE, COOP.GALLEGOS LARA|LOURBANC|2003-06-20 14:30:35|
1|2|70|616|D|FA|886.0|06/20/2003|BAHAMONDE MONCAYO MIRIAM|RETIRA|LOURBANC|2003-06-20 15:30:05|
1|2|70|617|D|FA|887.0|06/20/2003|BELLSOUTH|RETIRA|LOURBANC|2003-06-20 15:46:05|
1|2|70|618|D|FA|888.0|06/20/2003|OBRA MAMA|RETIRA ARQ. DE ROLDAN|LOURBANC|2003-06-20 17:10:03|
1|2|79|319|D|FA|889.0|06/20/2003|O.COMP#22013 PRECIOS DE PROMOCI|RETIRA ALM CENTRO|LOURBANC|2003-06-20 17:15:16|
1|2|79|320|D|FA|890.0|06/20/2003|O.COMP#22014|AV.J.TM.|LOURBANC|2003-06-20 17:15:36|
1|2|70|619|D|FA|891.0|06/23/2003|OBRA SR. ALFONSO QUIGUANGO|RETIRA|LOURBANC|2003-06-23 11:03:44|
1|2|70|620|D|FA|892.0|06/23/2003|ELIAS CHEDRAHUI|RETIRA|LOURBANC|2003-06-23 11:51:01|
